0	nexus 4 will not charge through laptop on low power	android : pop3-only email clients without mandatory smtp settings ?
1	how to turn off voice command for blind and low vision	how to turn off talkback feature on galaxy s2 ics 4.03
0	how to use pc 's internet on android phone	galaxy gear not locking note 3
1	android sms path	where on the file system are sms messages stored ?
0	what to check when buying a used device	galaxy s3 requesting " key password"
0	can i purchase apps from the amazon app store without an android device ?	customizing lock screen notifications on 2.2
0	does froyo fix samsung galaxy s i9000 's gps problem ?	list of special android sd card folders ?
0	bluetooth hands-free profile	how can i root my lenovo thinkpad tablet ?
0	how can i remove apps from my " cloud " ?	google maps shows wrong location on android 2.2
0	android engineering mode	touchscreen falsly registering multiple taps on single tap
0	frequently changing battery from mobile	delete a spreadsheet cell in google drive for android
0	how to restrict uploading the benchmark tool result to their server ?	changing ( forcing ) screen resolution on ouya
0	can not seem to get rid of applications even after formating/restocking/flashing . help ?	using google voice with android phone and a sip appliance ( obi )
0	zte blade/san francisco memory cards that work	connector allowing charger and usb computer connection as same time ?
0	how can i get the android tablet to show new york time zone when that time zone is not an option	ssh internet through connect bot
0	do i have to charge my phone before i use it the first time ?	how do i find the kernel config for my rom ?
0	updating to 4.4.3	update market application to google play market application
0	samsung galaxy ace not detected at all on windows 8 pro	is there a way to download the files stored on google drive to an android device ?
1	how do i update an old samsung vibrant 's os to something higher than 2.1 ?	how do i update android on my device ?
0	smart e machine tablet stuck on " boot into recovery . . . " screen	how to remove installed viber sticker ?
0	hiding/locking bottom bar on android 3.2	lg nexus 4 's internal storage dilemma & its apparent lack of support for usb otg connectivity ?
1	how to remove app images from gallery	unwanted folders showing up in gallery . can they be removed ?
0	can the trebuchet launcher be installed on the stock rom ?	why does not my galaxy s2 see my keyboard/mouse ?
1	battery savers with the android 4.0	what can i do to increase battery life on my android device ?
1	code/program java on kindle fire	how can i do development on my android device ?
0	how do i record all my phone calls ?	is there a way to fix the sms notification in galaxy s2 , ics
0	what is the difference between an aosp rom and a stock rom ?	is there an empty/clean version of android for tablets ?
0	a music listening app that lets me delete song from it is interface	trying to restore photos from a broken s4 ( at&t ) , how do i go about it ?
0	touchpal keyboard keeps disabling itself on htc desire	how to read comments to app of another country ?
0	problems after updating my galaxy s3 to 4.1.1: display randomly comes on for a few seconds	galaxy s4 bluetooth voice commands
0	galaxy nexus ics does't remember wifi passwords - ics 4.2.2	will my alarm still go off ?
0	what is the purpose of the 3rd on-screen button on a button-less phone ?	how can i unlock my samsung galaxy ace ?
1	locked out with wifi off	can not unlock my android device as have no internet connection ?
0	how to make incoming sip calls work on android 4 . x ?	set default app for file type not recognised
0	what is in nova 's google folder ?	google apps settings deleted
0	android phone as a samsung smart tv remote	getting files using adb shell
0	no network after installing cm7 on xperia arc	google play market hangs
0	how to permamently change partition attributes ?	what if i do not want my music on the cloud ?
0	how can i choose the right sbf for stock recovery to avoid signature verification error ? ( milestone 2 )	sd card unpartitioning
0	calculate which app use more internal space among my link2sd moved apps	android music player that displays bpm id3tags while playing songs .
1	disappearance of pics from whatsapp	whatsapp friends profile image not showing
0	why is my galaxy nexus always force quit every apps or page i am currently on ?	selectively restrict sync for some applications to wifi only
0	how to change mobile connections 's dns on android kitkat ?	how to customize the notification bar ?
0	does flashing a custom rom require root access ?	how do i stop the 3g/4g radio from turning off ?
0	remove rom manager from boot	can i mount external sd card read-only ?
0	can i adjust the output volume anymore in liquidsmooth rom ?	why does text disappear after browser page load on a htc mytouch 4g ?
0	android browser brightness setting	how to connect android device to projector ?
0	cyanogenmod " assert failed " error after deleting system apps	installing applications with larger size on s duos
1	installing ics or jellybeans on sony xperia u	where can i find stock or custom roms for my android device ?
1	android usb reverse tethering : how to fool the apps	how to make programs be aware of network connection provided by usb tethering
0	default permissions for new files and default umask	do android apps work on a smart tv ?
0	can i view the html source of an email sent to an gmail address from an android device ?	adding email account to samsung galaxy
0	generate different thumbnails for videos in gallery	how does ' android lost ' application work ?
1	unknown error code during skype application install	unknown error code during application install "-24"
0	switch between accounts in android 4.2	verizon activation setup galaxy s3
0	galaxy y ( young ) gt s5360 with no sound	what is the correct format/resolutoin for videos on an htc wildfire ?
1	can i install android on my non-android device ?	installing android on htc touch 2
1	notification of new label e-mails	can gmail notifications be customized by label ?
0	download and install ( aka sideload ) facebook home apk	authenticator app is not working
0	play music from android to airplay receiver	xperia x8 flashtool error : err_dynamic="sin header verification failed"
0	offline spanish voice recognition : " no connection for speech input ( e4 ) "	how to install froyo on htc bravo
0	launcher without home screen ?	i am trying to factory reset my phone but . . . ?
0	can dual-sim phone use one sim for voice\sms and second solely for internet access ?	android to google calendar sync problems
0	how to install/root vegan-tab gingeredition on viewsonic gtablet	whatsapp : same cell number + new rom => new whatsapp account ? i ?
1	can an android text message set off an alarm ?	how be woken up by receiving a text message with an android phone ?
0	is is possible to configure the ' listen to ' voice action to pull up amazon mp3 player ( or other player ) rather than youtube search ?	does using utorrent for android wear out the phone memory ?
0	how do i restore a contact i deleted on my android phone , but not in gmail contacts ?	disable ' end call ' tone ?
0	why does android download pause , and only continue after restart ?	emulator takes forever to shutdown !
1	how to salvage a broken android phone ?	can not unlock my android device as have no internet connection ?
0	removing item from download list	how to root but not root samsung galaxy player 5.0
0	how does battery calibration work ?	switch keyboards quickly
1	installing different language on phone	how do i add a new language ?
0	power button will not hold on lg optimus f3	stream sound from ubuntu to android
0	zte blade/san francisco memory cards that work	how to keep two versions of an app installed ?
0	when i plug in samsung skyrocket & moto atrix to windows 7 my usb ports stop working	unable to upgrade rom [ status 7 ] and failed to verify whole-life package
0	micromax a88 too many pattern attempts issue ?	how to compose plain text email
0	how do i better organize my contacts on galaxy nexus ?	access company directory on samsung s3
0	need to enable icmp ping response from phone	mails not marked as read when imap seen flag is set
0	temporary root for htc desire hd	can i recall a command to reset a lost phone ?
0	some application require ' root access ' , what is it , what is the risks , and how can we make it available ?	recover photos from vaulty app after a hard reset
0	undesired screen dimming	nexus 7 rooting false device not responding
1	how do you remove locked apps without rooting ? with android sdk ?	how can i uninstall applications that are locked by phone vendor ?
0	factory reset generic android device	how to share internet among 2 android devices ?
0	install application in sd card by default using linux	extreme lag with sony ericsson wt19i after update to 4.0.4
0	how do i recover my photos	explain the ondemand cpufreq governor parameters in samsung galaxy s4 ?
0	problem opening docx file in hcl me tablet running ics	lock screen when proximity sensor is covered
0	how to stop " cell info display " in htc desire x duos	boot from sd card
0	gmail stuck on " waiting for sync"	rom/mod for pure android experience
0	moto x rooting - rom does not boot , but have safestrap	my samsung spica can not detect the sd card anymore
0	4.3 jelly update problem-random screenshots	how to play youtube or any audio from my desktop linux and send the audio playback to android ?
0	tethering with locked boot loader	browser 's default search engine
0	after adding icon to home screen , the icon in the apps screen remains	how to get to your settings without a home screen app ?
0	wipe data on wrong password inputs	lockscreen wallpaper
1	google play uses wrong account for in-app purchases	change gmail account which will make in-app purchase ?
0	turn phone on with adb or fastboot ?	how do i upload photos from android phone to google plus without sharing ?
0	can i have notification sounds repeat every few minutes ?	where is the options button in rockplayer ?
1	are there any custom rom 's for the pantech crossover ?	where can i find stock or custom roms for my android device ?
0	why does my htc desire browser crash on startup after update ?	custom boot animation is not working in android jelly bean
0	clear android market search history ?	can physical keyboards really only be used with specific devices ?
0	why can not i access the /data directory with adb on my samsung vibrant ?	kiosk app - auto-update
0	help controlling the cursor in swype ?	offline voice search on ics ?
1	unlocking samsung ace duos	can not unlock my android device as have no internet connection ?
0	can i emulate a bluetooth keyboard with my android device ?	uninstalling voice commands was apparently a terrible idea ?
0	using a tablet as live pdf previewer	how do i clear out some information recorded in google accounts ?
0	how to restore/edit build . prop after rebooting ( and phone stuck in reboot loop ) ?	on rooting desire hd
1	are android usb plug-in chargers interchangeable ?	is my phone liable to explode if i charge it with a charger that came with a different phone ?
0	is it possible to change the text bubbles on the s3 ?	favourite contacts widget - call default number
1	tablet with android 4.0 update to the latest android os ? ( currently 4.4 )	when will my device get the android 4.4 update ( kitkat ) ?
0	how do i connect a my samsung to pc without sd card ?	how do i remove a data restriction ?
0	why does not android report accurate netflix data usage ?	android backup and restore
1	how can i recover a deleted file on android ?	how do i undelete or recover deleted files on android ?
0	is it possible to clear the " notifications " on facebook for android ?	what happens when using a cellphone when charging ?
0	receive/make calls on my pc via my android phone	can i disable usb debugging on android smartpones from windows via adb . exe ?
0	list of all devices connected to my network	exchange scheduler assistant equivalent on android ?
0	how can i transfer my injustice from android to ipad	what are the steps for rooting an android device , in general ?
0	recovery mode does not find internal nor external storage	is there a difference between the cyanogenmod 11s rom ( for oneplus one ) and regular cyanogenmod ?
0	optimally using an sd card	install usb host drivers on android ics
0	what is the application space limit on galaxy nexus ?	android apps from old tablet to new tablet
1	my phone is sending messages to international number	determine app sending sms premium messages
0	find lost device without gmail account configured and without sim card	wifi disconnects during sleep
0	what are the ip addresses used by proxy browser for android app ?	how can i prevent an app being uninstalled from the play store ?
0	my contacts are linked to google+ multiple times	is there a search app for android with no-tracking privacy policy ?
0	locale powersave plugin & power control widget	when should i start charging my lithium battery ?
0	is there a an app for recording voice notes that syncs to cloud storage ?	save sms to phone directly
1	how to save or back-up whole sms threads on sim	how do i backup and restore sms messages ?
0	cannot connect samsung galaxy s2 to computer in storage mode via usb	how can i download files if there is no sd card ?
0	how to view pictures from samsung galaxy mini on sony bravia tv ?	beats audio on htc phones
0	nexus 4 red light flashing , unresponsive	contact organizer
0	can we use an android phone as a wi-fi repeater ?	are there any side effects of uninstalling apps
1	samsung galaxy s3 lcd and screen gone need contacts	how do i backup data ( sms/contacts ) from a device with a broken screen ?
1	how to shut down skype	how can i stop applications and services from running ?
0	how to change the order of the users on the lock screen ?	how to configure vpn using pcf profile and custom certificate
0	not able to access the service menu on my galaxy s3	pendrive was working well on tablet , before formating . . but now not showing data
0	what does this button do in the twitter app ?	''insufficient space on the device'' â€“ but my sd card has plenty space ?
0	how to find release date for google play apps ?	how do i retrieve timestamps from my firefox download history ?
0	galaxy s2 on android 4.0.4 will not vibrate	do i need internet/3g to use gps ?
0	lg g2 native sip client ( where is it ? )	what is rooting ?
1	android tethering	can we use an android phone as a wi-fi repeater ?
0	custom rom for android tablet	can not find low battery threshold setting ( samsung galaxy s3 )
0	want my bluetooth keyboard on galaxy tab10.1 to default to english android keyboard ( not to samsung japanese keypad )	do i have/how do i fix the black screen of death on my galaxys4 active ?
0	url link in android calendar description	( almost ) every time i unplug my headphone , the voice command app opens . how to make it stop ?
0	how can i recover data from my android tablet ?	how do i restore a clockworkmod backup with a busted power button or through adb ?
0	route standard headphone output into android audio jack ?	rooted htc one m8 tries to install ota even though the ota is already on the system
0	"remount : not found " error	does android resolution matter for other than clarity ?
0	wondershare mobilego connect from pc behind nat	default dialer on samsung galaxy s3
0	how can i restore the display of the battery status on the lockscreen ?	having s planner write to a local calendar and a sync'ed calendar at the same time
0	how can i syncronize android time with machine via adb	how can i stream pc desktop , 1:1 pixel ratio , to android device ?
0	backup files from an application for which i forgot unlock pattern	link2sd gives " mount script error"
0	weird beeping when using the screen ( galaxy s3 )	after firmware update keeps rebooting my galaxy s4
0	is it ok to flash stock rom from other country ?	can google voice search be configured to confirm name before calling ?
0	automating " stay awake"	inaccurate location history
0	trigger sync of calendar/addressbook remotely	why will not my photos load back onto my mytouch4g after a data factory reset ?
1	why my s3 device sounds when magnetic card is put on its back ?	why does my galaxy s3 make a noise when i put it down ?
0	need custom recovery that supports kit kat for samsung galaxy tab 2 7"	how to change privacy level of a facebook post ?
1	can i install android on my non-android device ?	( how ) can i install android on an iphone 4 ?
0	invalid imei on htc one x after factory reset	adb shell : change ime method gives error " unknown id : null"
0	how can i receive phone calls through wi-fi on an android phone ?	install app without touchscreen or adb ?
1	installing android on nokia n96 need help	can i install android on my non-android device ?
0	can not move apps to sd card on moto e	is it possible to be connected to two different bluetooth devices at the same time ?
0	why has speech-to-text stopped working on my phone ?	factory reset : prestigio multipad 7.0 ultra plus tablet pc pmp 36 70b
0	what is the storage constraint for micro sd cards on the lg optimus l7 ii	run native executable in android
0	are there " end of life " plans for android ?	samsung kies restore a backup from another pc
0	android marketplace with paypal support	is it possible to share data across multiple accounts ?
0	record android screen	i want to password lock my " applications " settings , but no other settings
0	why i have problem downloading iso file in android ?	lost 3x4 keypad after upgraded to 4.3 jelybean
0	how to give root access to apps that do not request it ?	set font size in opera
0	flashed picuntu now stuck in boot loop	galaxy s2 is recognised by computer but does not charge
0	which older version of youtube for htc hero ?	kiosk app - auto-update
0	usb driver for samsung galaxy gio s5660	android shows missed calls even after open
0	transferring messages to android from a sqlite db on my laptop	how can i make wifi automatically go on when my g1 boots up
0	still prompted to sign in after google account removal	repeating email notifications
0	wifi is disabled when i enable wifi direct	htc one x does not charge or turn on
0	how to open android backup file ( with . backup extension ) on pc ?	how can i avoid the battery charging when connected via usb ?
1	force install of custom rom on unsupported device ( mt6575 )	where can i find stock or custom roms for my android device ?
0	mountiscript error	why is there such a difference in the amount of internal memory ?
0	stream music/video from phone to apple tv	connect microsd card with your pc folder via wi-fi only
1	how to change os from nokia lumia 710 with wp 7.5 to any os android	can i install android on my non-android device ?
0	inkpad notepad failing to install	how do i have my galaxy s3 automatically switch into driving mode when i am moving in a car ?
0	looking for a way to shrink the size of mp3 files	can i install a custom rom with sim lock enabled ?
0	google books crashes on loading - workaround ? ( htc desire z 2.3 )	android phones hangs while playing game
0	android g1 latest installable version ?	why chrome shows video in android device , but opera does not ?
0	ring only for favorites ?	change input method without unlocking the phone ?
0	waiting for device superoot galaxy nexus	andless . flac " decoder error"
0	formating and reinstaling os on galaxy s4	toogle 3g , bluetooth , and wifi with android linux or adb commands
0	android will not boot after accidentally uninstalling a system app	samsung i5700 restarting
0	easy question : how do i search for apps on my s3 ?	gt-i9001 ( galaxy s plus ) not recognized in windows 8.1
0	how can i quickly remove all of my data from my device and then get it back again ?	xbmc hangs on video loading
0	android ptpp vpn session stalling after precisely 30-31 minutes	samsung galaxy s3 keeps losing network connection and need to restart phone to reconnect
0	what is the list of commands to dictate punctuation , capitalization and line breaks ?	is there a " clean " android i can reinstall on my galaxy s4 ?
0	google talk android device sign is not shown by sony xperia ray while logged in google talk in it what can i do about it ?	looking for an mp3 player with playlist
0	best rated apps ? any list of them ?	nexus i9250 - got stuck with updating android 4.3 update
0	is there a way to make a link to a specific page of a pdf file *on the desktop* ?	does deleting content on my phone affect content on google+ auto backup ?
0	more than 50 android devices on same username/password	disable pin unlock with certificates and wpa2 enterprise
0	what exactly is superuser . apk and su ?	i installed another sms application , now i get notified twice
0	beginner 's questions on tweaking non-branded android phone ( rooting , update recovery , update rom )	my nexus 4 crashes after every app start
0	google drive crashes on start	gt-i9100g screen replacement
0	android 2.3 keyboard on se x8 running 2.1	how to find only sd card movable applications on the market ?
1	has android 4.1.2 jelly bean officially released for the samsung galaxy siii ?	when will my device get the android 4.1 update ( jelly bean ) ?
1	how come my free ram keeps getting less and less ?	0 ram free on ics
0	android jelly bean - download and install download manager without a pc	battery drain with in no time in samsung galaxy ace
0	problem reading pdfs downloaded from imac to my nexus 7	controller for sgs3 mini
1	update xperia mini pro ( sk17i ) to jelly bean	when will my device get the android 4.2 update ( jelly bean ) ?
0	cannot connect to the real [website.com]	can not install skype on android 2.2
0	how to change font for one alphabet [ or language ] only ?	how to assign my home button function to a custom launcher ?
0	sennheiser lavalier mic connected to to android	recover voicemail from sd card
0	droid x : what are the pros/cons of upgrading to gingerbread 2.3 ?	google play music will not use wi-fi
1	samsung tablet update	when will my device get the android 4.3 update ( jelly bean ) ?
0	what are . patch files in android	how does startup manager block startup apps ?
1	download google play apps from computer ?	how can i download an apk file from the play store ?
1	how do i backup my nexus 7 and then do a hard reset	full backup of non-rooted devices
0	how can i schedule tasks ?	what would it take to turn my android phone into a full-fledged tv gaming console ?
1	xperia u and jelly bean	when will my device get the android 4.1 update ( jelly bean ) ?
0	can i restrict application updates to only happen over wifi ?	my s3 does not have auto screen off/on option
0	what is the name of the manufacturer of my really cheap chinese tablet ?	how can i recover my photos from the vault app when the phone is lost ?
1	setting custom permissions per-application	is it possible to install an app and exclude some of its requested permissions ?
0	how to prevent apps running in background	w/gav2 exception sending hit : httphostconnectexception
0	force closing of apps automatically	htc wildfire s digitizer replacement
0	samsung tab p7500 . how to upgrade to ice cream sandwich ?	every time i plug in my phone via usb it automatically mounts the sd card ( xperia arc version )
0	does a carrier know i am tethering via wifi hotspot ?	htc sense keeps crashing even after factory reset
1	how can i get old android softwares ?	where can find older versions of apps ?
0	child-proofing an android phone ?	getting rid of my sd card
0	can i change the menus on the default browser ?	phone unlocking ideas
0	how do one know what is the reasons why an android apps exit with exceptions ?	is it possible to pack data/data/files in apk ( using apktool or other program )
1	install your own software	how can i install an app given only its apk file ?
0	android and google contact sync : " starred in android"	is it 100% safe to install custom roms
0	how do you determine if you are using wi-fi or lte ?	upload an apk to a non-rooted galaxy s4 mini
0	search play store history for an app ?	persistent lines on screen
0	how do i just charge ( i.e. . not mount for data transfer ) a galaxy nexus when connected via usb to a pc ?	do i really need to install a task manager ?
0	multilanguage keyboard with android	how to change the home dock icons on touchwiz ?
0	override detected wifi parameters	samsung galaxy s blaze 4g boot loop
0	is cyanogenmod rooting the phone ?	list of banned market apps
0	htc rhyme keeps shutting down full cache on start	how can i install official android 2.2 froyo in samsung galaxy s which runs android 2.1 eclair ?
0	j2me emulator that works for ics ?	remove " folder open " " folder closed " announcements without disabling accessiblity
0	upgrading to 4.4 on rooted nexus 4 , custom recovery , custom kernel without losing data	how to add/remove an individual song from device in may 2013 update google play music app ?
0	export contacts/text messages in a readable format	how to force the mobile data ( 3g/4g ) connection on a single app like google voice recognition ?
0	sometimes data ( 2g ) hang in my xperia mini pro with custom os cm9.1	how to migrate twlauncher customization to another launcher
1	where can i find stock or custom roms for my android device ?	where to find an original android image ?
0	gmail not being retrieved automatically	what happens when an sdcard is inserted ?
1	how to update software of micromax a50 with windows 8 32-bit	how do i update android on my device ?
0	mystery duplicated sim contacts	can i have different default phone numbers for different actions ?
0	recieved an sms that deleted all my sms	camera on galaxy note 3 is sideways !
0	android emulator reports 0x501 error while using gpu emulation with opengl es	how do i remove htc desire pre-installed android applications ?
1	error : unknown error when installing the application "-24"	unknown error code -24
