1	an app that can give a clear overview of what exactly is eating up my phone space ?	what can i do to manage my phone 's internal storage ?
1	how to explain rooting , recovery and custom roms to a beginner ?	what is the meaning of " flashing a custom rom " ?
0	what is the difference between usb on-the-go ( otg ) and usb host mode ?	issue syncing exchange 2003 account email after ics update
0	quick key problem htc g2	sprint galaxy nexus stuck in boot-loop
1	how to unlock a samung galaxy s5 locked with a pattern on a broken screen	my screen got broken , how to see on the computer what i am doing in my device ?
0	get original xperia play content back on device after removing it	built-in alarm clock on g2 ?
0	when the gps is enabled but not in use , does it drain battery ?	android default calling app do not suggest other calling apps even after reseting defaults
1	how can i uninstall applications that are locked by phone vendor ?	how do i remove htc desire pre-installed android applications ?
1	pdf on a https server can not be downloaded with chrome	unable to download from an authenticated webserver
0	how old is the datalog when just starting " logcat " ?	does froyo include full hebrew support for all devices ?
0	is it possible to have the same apps from the same amazon account on 2 different devices ?	how do i delete an email in gmail from the notification screen ?
0	snapchat story upload	does official gmail app use a secure connection ?
0	can not hear caller after updated from 4.3 to kitkat 4.4.2 on moto g	why is my android phone unable to detect some wireless access points ?
0	can i get google now reminders to be sent via email or popup on desktop gmail as well ?	connect samsung galaxy tab 2 p3100 to a gps dongle/ receiver
0	how to make 3g video calls ?	downloading videos from phone to yahoo and facebook
1	is the class rating of my microsd card relevant ?	is a class 10 microsd overkill or is a class 6 adequate ?
0	what happens when a country changes its dst schedule ?	remove/replace heartbleed vulnerability on 4.1.1 rooted ?
0	how to get rid of ads popup ?	how to install stock app on custom rom ?
0	download of something bad	video player to play all files ?
1	how can i determine my galaxy nexus model variant ?	how to find out the variant of my galaxy nexus ?
0	run any user apps in safemode ?	how to sync my contacts with their gmail account ?
1	can i install additional languages on android ?	how do i add a new language ?
0	how can i see what exactly an application does ?	what is causing my phone to freeze ?
1	-24 google play error on installing ebay	unknown error code -24
0	do apps that claim to increase sd card performance really work ? strain on card ?	android lost , gmail password changed . can gmail still be viewed ?
0	need to install gtalk on my hcl x1 tab and also skype	how to move applications from phone to sd card ?
0	why is the android emulator not updating it is graphics memory ?	where does android 4.4+ temporarily copy video files to when playing them over usb in windows directly ?
0	printing data from android phones to the printer via computer	decrease icon size on nexus 4
1	updating 4.1.2 ( jelly bean ) to 4.4.1 ( kitkat ) on micromax canvas hd a116i	when will my device get the android 4.4 update ( kitkat ) ?
0	how to change android 's primary google account	superoneclick freezes when i try to root my sony xperia tipo dual
0	does my phone need an internet connection to install apps from google play ?	why does better battery stats say my galaxy s4 is awake 100% of the time ?
0	galaxy nexus will not charge , will immediately reboot if turned off	how can you set a default calendar to use for new events on a lg android 2.2.1 phone ?
0	why chrome shows video in android device , but opera does not ?	my external sd card keeps losing files
0	if i delete a game that i have downloaded from google play , can i still install it later ?	how to install recovery and rom on blank samsung i9000
0	will factory resetting my device remove the android upgrade ?	is there a way to activate in-app purchasing on words with friends for the kindle fire ?
0	how do i root my kyocera echo ?	android , typing czech-specific characters on samsung galaxy tab 2
1	how to stop killed apps appearing again ?	how can i stop applications and services from running ?
1	how to revert to stock rom kitkat 4.4 from pacman ?	install kitkat factory image on nexus-4
0	galaxy nexus i9250 stuck on x logo after updating yakju to takju	technical problems with nexus 7
1	are there earphones with support for buttons similar to the oem earphones ?	how to make volume buttons on earphones/headphones work with android ?
0	nexus 7 is stuck in reboot loop after full discharge	will rooting my phone improve its battery life ?
0	how to stop usb charging ?	birthday duplicates after removing google account and adding it again
1	need fonts of a different language to show up on android or atleast instapaper	how to make an android device to display complex rendering of indic characters ?
0	mobile detecting laptop as " charger " instead of " usb connected " ?	how can i install official android 2.2 froyo in samsung galaxy s which runs android 2.1 eclair ?
0	problem playing large mp4 ( 500 mb ) video files in android 2.1	how to take a backup of my calender events in galaxy ace duos
0	wifi problems for samsung gt-i860	chromecast beta google i/o 2014
0	home screen always goes to 1st page ?	does chromecast with plex require users to " cast " videos/media ?
0	what are the differences between : launcherpro " keep in memory " and " lock home in memory . "	how do i arrange the icons manually in the app menu ?
0	how to get root access on android 2.2 with htc magic ?	add functionality to home button ?
1	my screen lock problem	can not unlock my android device as have no internet connection ?
0	i keep getting error code 919 , but i am on my own network	can i install android on my divice
0	lighter anti-virus app for android devices	google calendar gone nuts since dst has ended
0	google now reminders . . . view/edit/create on desktop ?	how do i separate ringtone and system volume on jb ?
0	is there a screen capture app for android which captures a video ?	droid2 fastboot
0	how to backup contacts if the touchscreen is not working ?	what is a2sd+ and how to use it ?
1	how to extract smses from a non rooted device with a broken touchscreen ?	how do i backup data ( sms/contacts ) from a device with a broken screen ?
0	how to enable certificate revocation check ?	how can i make my samsung galaxy nexus volume go louder than what stock allows ?
0	watch and download youtube video simultanously	how can i make my phone not show " other contacts " from my gmail account ?
0	can an android app circumvent its stated permissions ?	titanium backup - sync via windows file sharing ( smb ) after backing up ?
0	turning off just email notification sound	cant add exchange account 4.1.2
0	android 4.0 ics in samsung galaxy r	galaxy s3 backup contacts google play
0	how can i pass bootloader ( huawei y200 stuck logo/ boot-loop )	is there a palm os-style launcher ( placing apps in categories ) ?
0	should i be worried about applications with weird looking permissions ?	how to resolve instagram force close for cm9
0	how to set default apps on samsung galaxy s ii + android 4.0 ( ics )	apps crash too slow
0	make gmail default for new contact instead of at&t address book	heimdall errors
0	why is nexus 5 fail to connect google service ?	how to enable audible alarms while making phone calls ?
0	why has not my galaxy nexus received the latest ota update ?	lg p880 screen stays awake whilst charging
1	when will my phone get the android 2.2 update ( froyo ) ?	android 2.2 ( froyo ) update available or not for mytouch slide ?
0	how whatsapp send audio files or video clips instantly ?	how does youtube 's android app handle playback ?
0	use different lock-screens on htc sensation	how do i fully charge my emulator battery ?
0	deleting contacts in bulk - ice cream sandwich	htc text photos
0	samsung account not showing	need to reinstall " calendar storage"
0	where exactly does android get its contact suggestions from ?	atrocious battery life with cyanogenmod 10.2 on galaxy s4 mini
0	backup stock htc desire rom with unrevoked	apps are not running in the background in certain networks
1	free wi-fi network : how to autoaccept ( robotic click ) wifi policy web page ?	can i automatically log in to open wifi that requires web login/password ?
1	changing google play from french to english	how can i circumvent regional restrictions in google 's play store ?
0	is it better to detach a charger when my android device gets fully charged ?	unknown error code during skype application install
0	i cant root s4 gt-i9515	where can i find a comparison of android devices ?
1	can i update my nexus tablets to include other languages ?	how do i add a new language ?
1	firewall application	block apps from accessing the internet on android device
0	new contact besides google contact	how to install new recovery image from . img file
0	is microsoft charging for its patent from each android device sold ?	mount external sd-card for the secondary user
1	can i install android on my non-android device ?	can android run on an ipad ?
0	calendar entries that live in exchange 2010 cannot be edited	google maps offline
0	why does my device shows a resolution other than that advertised ?	my htc desire hd crashes when picking up a call . any ideas how to resolve the problem ?
1	how to change gmail account on google play but keep applications	how to change the account for android market ?
0	can i customize " select an action for text " menu ?	how can i install cwm recovery on my galaxy note ?
0	copy calender data to google calender	manually updating your os ?
0	turn off volume button notification sound in galaxy s2	can i drive a usb webcam with my android touchpad ?
1	where to get samsung galaxy y android version	where can i find stock or custom roms for my android device ?
0	why does jelly bean no longer support flash ?	htc cha cha - wont start
1	how to ban a incoming number on android 2.3	how can i reliably screen or block callers on a number-by-number basis ?
0	android/htc one screen anomaly ?	is there a " temporary root " for samsung phones ?
0	mark gmail as read when archiving from notification	factory reset upon unlocking
0	unable to register my samsung s duos mobile into samsung site	has google actually synched my contacts ?
0	why are dialer , cell standby , and phone idle killing my battery ?	how to access bricked phone /system folder ? fix corrupted file
1	unable to install google play service ' incompatible with other application ( s ) using the same shared user id'	"incompatible with other applications ( s ) using the same shared user id " when installing google play service ?
0	automatically install new applications on sd card	app to modify settings by application
0	how to configure show owner info on lock screen on galaxy s2 / android 4.0.3 ?	facebook messenger not displaying profile pictures
1	access to android usb port from chroot linux ?	android chroot ubuntu - is it possible to get ubuntu to recognise usb devices
0	what are the options for streaming music from pc to phone ?	android wifi repeater programatically ?
0	is an antivirus really needed for android ?	toggle between 2 gmail calendars ?
0	samsung apps for galaxy s4 with cyanogenmod	"save image " does not work
0	install russian input method on android	reinstalling android 2.3 on my qmobile a2 lite
0	revive a dead phone ?	samsung s duos restart problem
0	where can i download the " samsung galaxy pro pc suite " ?	personalize text wallpaper
0	samsung galaxy s2 stuck on boot screen after an ota upgrade	htc desire s on android marketplace - " the requested item could not be found"
0	can not update android 4.4 to 4.4.2 on nexus 7 2012	what does the message : 550 invalid name or chroot violation mean ?
0	android phone or small device with qwerty physical keyboard with ctrl and alt keys ?	wcdma only option in jelly bean devices
0	how to clear all applications data in android ?	nexus i9250 - got stuck with updating android 4.3 update
0	bluez-a2dp as sink	new e-mail notifications and user-side filters
0	why is screen sometimes unresponsive when receiving calls	lg g2 will not dial using google voice
0	how do i clear out some information recorded in google accounts ?	wiped data , flashed rom , restored data and phone not turns on , keeps restart
0	how to disable duplicate calendar notifications ?	reduce time it takes for device to power on when pressing power button ?
1	the application google services framework ( process com . google . process . gapps ) has stopped unexpectedly	"application has stopped unexpectedly " error when starting play store or browser . how to fix ?
0	ics ( android 4.0.3 ) , samsung galaxy s2 , exchange email	video recording distorts vertical lines
1	google services hogging data - how to stop it ?	why has my samsung galaxy s2 become a data hog ?
0	google navigation , screen does not rotate when in walking mode ?	diagnosing angry birds crash
0	something causes my phone to hang and reboot	what am i left with after rooting ?
0	does it make any sense to use a firmware with htc sense or is better to go for plain 2.3 firmware ?	change mcc and mnc in the apn settings
1	closing applications	what is the right way to close apps in android ?
0	android mail client using exchange web services ?	why does not android report accurate netflix data usage ?
0	can swype be downloaded from a pc and transfered to the phone by a usb cable ?	what are the differences between different versions of angry birds space ?
0	samsung galaxy sgh-i897 with slimbean will not connect to at&t	installing latest possible firmware and android on htc desire hd
0	usb tethering problem	how can i update my samsung galaxy s2 ( gt-i9100 ) from android 2.3.3 to a newer version ?
0	sd card homescreen shortcuts dont appear after re-boot , galaxy advance , jelly bean	sd card formatted to ext4 and permissions
0	how to sync only some specific picasa albums in gallery app ?	sound distortion robotic sound
0	selected mobile carrier unavailable , do i need to install a multi csc ? if so , how ?	song playback from/to specific point in the track
0	how can i add group to new text in android 4.4	phone rebooting when screen turns off
0	icmp requests working but http requests are timing out	how can i add extra memory in my ram android ?
0	upgrading chinese tablet from ics to jelly bean	how can i forward texts to my tablet and reply back ?
0	how to root lg optimus slider vm701 ?	samsung s3 makes " plugged in " noises while charging
0	how to avoid looping the album/playlist automatic ?	what does it mean if my htc incredible 's notification light flashes between green and amber ?
0	usb on-the-go midi keyboard with nexus 7	looking for a lightweight replacement for stock deskclock . apk ?
0	has google actually synched my contacts ?	os 2.2 on the samsung moment
0	how to save a new contact to a microsoft account ?	galaxy y gps chipset model
0	how to root htc amaze ?	note 10.1 stuck in restart loop
1	how to make cell phone using gprs/3g a wifi-hotspot	can we use an android phone as a wi-fi repeater ?
1	how can i install viber and whatsapp on my gsm tablet with ics 4.0.1	how to circumvent the market compatibility check ?
0	where can i find the media downloaded from whatsapp installed on a virtual device ?	what options do i have to purchase a play store app for another account ?
0	how can i customize what notifications show up on my notifications bar ( razr maxx running ics ) ?	how to filter my google contacts ?
0	port forwarding during usb tethering	open messages to a contact at bottom of list
0	why do some of my apps show " update " and some show " update ( manual ) " ?	how to find android apps occupies ram memory space ?
1	how can i receive phone calls through wi-fi on an android phone ?	is it possible to have a phone without a voice plan ?
0	what is " composite " in the android composite adb interface ?	how to sync facebook calendar in my android phone calendar ?
0	grooveshark app on android	word processor/text editor apps ?
0	android os on old nokia phone	deleted files causing my phone to function incorrectly ?
0	charging from power outlet or computer ? to save battery lifetime	prevent upgrade to 4.3 on rooted 4.2.2 . device
1	using the same apps for a second user in nexus 7	how to migrate applications to other user account without downloading the applications again ?
0	google play store does not open	can not find low battery threshold setting ( samsung galaxy s3 )
0	htc cha cha - wont start	faster cpu means higher battery consumption ?
0	google now data privacy	how to place replies in the same folder as the original message on the imap email app ?
0	sorry ! the process com . android . phone has stopped unexpectedly . please try again . force close	root for hisense sero 7 lite
0	convenient way to retain accounts/settings/icons/logins between installs ?	not able to " clear " notifications from astrid tasks ( an app ) ?
0	how to root teac tc-7120	lock system settings in android
0	how can i test my epub files in android emulator ?	android g2 touchscreen is left-right reversed
0	periodic nexus 7 touch responsiveness issue	autovoice and tasker : speak recognized variable says " percent varname"
0	how to access android apks without rooting	can not access recovery menu milestone a853
0	how to save a text file from the browser ?	odex file : does every app has one and if yes where are they stored ?
1	i checked ' use as default ' when choosing the default launcher , but now i can not start adw . launcher any more	how do i reset the launcher app ?
0	can i share my google play " cloud " music with a family member ?	my phone has automatically called *44* twice now , does anybody know what this means ?
1	how to post a link to an android market app ?	how do you link to applications in the android market ?
0	is there any way to control the stereo balance of the audio playback	faulty battery status indication
0	what is a good way to approach a developer about supporting my device ?	at&t nexus s : is this sold sim locked / boot-loader locked ?
1	lg optimus logic - moving apps to sd	can i install an app directly to my sd card ?
0	no google play store in craig 4.0.3 android tablet	hidden sms message sent at every startup
0	is it possible to disable the system update notification ?	must a usb otg adapter be used to connect a dac/amp to an android or can i use a micro usb to micro usb cable ?
0	decrypt my micro sd card	opening pdf drawings with comments
0	batch convert contacts from gmail type to local type	is it normal for android system to be the top battery user ?
1	why does my screen still turn off while charging ?	where is " stay awake " option in ice cream sandwich on the galaxy s3 ?
0	virtual sd-card will not transfer	how can i interface a 23 inch touch screen to a beagleboard ?
0	how can i configure my phone for mms ?	build image for emulator
0	installing command line apps	android 2.2 - extending phone storage to sd
0	tagging photos when importing them from my galaxy note	can not get rid of icons with green locks on them
0	is it possible to charge phone faster ?	reboot device without ask for the pin again
0	need help in unbricking soft bricked lg g2 ls980	htc-desire-hd calls go to answer phone if emails / data is updating
1	how do i fix the imei problem my phone dispays invalid imei	how to fix " invalid imei " after factory reset ?
0	does google audit all apps that enter the market place ?	android 2.3 for htc wild fire
1	is it possible to change how froyo hyphenates phone numbers ?	is it somehow possible to change the format of a telephone number being displayed ?
0	how to have second language setting in asus memo pad ?	why does google wallet depend not only on the phone but the carrier as well ?
0	why are there so many partitions in /dev/block/mmcblk0	jar of beans android emulator
1	built-in alarm , calendar suddenly talking to me . how can i shut them up ?	galaxy s3 providing audible voicemail notifications and alarm reads the time out loud
0	device almost unusable after google password change	reset only the settings for htc one
0	use android device as a barcode reader for pc	how to do backups and updates properly with full device encryption ?
1	retrieve deleted file android droid 2	how can i recover a deleted file on android ?
0	how do i associate a file type such as . js or . html with an editor app such as emacs ?	install android on pc
0	what limitations does rooting and/or installing a rom put on my phone ?	htc one message notification problem
0	how can i wipe data with no display ( e.g. magnet ) ?	android remote desktop thru wifi only
0	different album art for songs in the same album	how can i easily edit / add contacts to my phone book without them showing on google ?
0	where can i get the latest gapps ( google services framework ) ?	phone interrupted during update
1	why is an android rom device specific ?	why must my device be compatible with a certain rom before i flash it to my device ?
0	how to get full root on a samsung s-3	does the sd-ext partition get wiped out after flashing a different rom ?
0	access the real /sdcard	disabling smiley key on keyboards with the stock messaging app in ics
0	cm7: how to enable passwordless ssh login on same network ?	can the default browser be upgraded without upgrading the whole os ?
0	should i run a factory reset on my phone to speed it up ?	wi-fi connects but can not browse
0	data packet automatically activated on gingerbread 2.3.6	cannot make calls in microsoft lync 2010 app
0	edit my rom 's default " title bar"	is there a reliable way to tell if my call is blocked by the call recipient ?
0	is it possible to disable the " activate google now " reminder every time you use " google search widget " ?	how to control the file system on android from win7 file explorer ?
0	replacing systemui . apk and dependencies	samsung gt-s5830m keeps restarting even after factory reset
0	locking sdhc memory card on samsung galaxy 2	how to re-download in-app purchase
0	where to copy wallpapers ?	sd card unpartitioning
0	where in my files can i find the stock browser 's favourites stored ?	galaxy nexus will not connect via usb
0	what is this status icon ?	gmail app on lg optimus u does not get email anymore
0	low disk space notification , but heaps of space free	cannot remove folder from internal storage
0	why do not most of the phone manufacturers include root access in their phones by default ?	xbox smartglass does not install for another user
0	how can i set the sound profile to silent for a given contact ?	sms/phone validation of whatsapp/viber not working on cyanogenmod 7.2
0	which music players support search by " album artist " ?	how do i factory reset my htc desire ?
1	is it possible to send and receive faxes over an android phone ?	send fax directly to or from phone without going through a web-based service ?
0	remotedroid connection problem	what is the most effective way to disable ads in an android app ?
1	how do i unlock my icraig jelly bean netbook	can not unlock my android device as have no internet connection ?
1	can i stop installed apps adding their icon to my homescreen ?	how can i disable shortcuts from being created after install from google play ?
0	reasons for mms to fail while sending ?	wifi and google play access after factory reset for off contract sprint htc evo 4g
0	how can i determine usb host controller type	htc desire low on internal storage , i am clueless -- any help ?
0	where did wikipedia pro app disappear to ?	default launcher crashing at reboot , access only to status bar and settings
0	font rendering problem in ics 4.0.4	htc amaze 4g ( videotron ) - is there a way to install android 4.0 ?
0	is it possible to root a kindle fire running software version 10.2.6 ?	how to enable developer settings nexus 7 4.4.2 kit kat
0	make a calll to genymotion emulator	how do i remove double notifications ? galaxy s 2
1	how do i get the camera of the lenovo thinkpad to stop making a sound when i take a picture ?	how do i disable the ' click ' sound on the camera app ?
0	how to disable duplicate calendar notifications ?	how do i root my nook hd ?
0	use keyboard emoticons from jelly bean at kitkat	reinstalling samsung home on samsung galaxy y duos
0	is it possible to install android on a pc ?	what is the applypatch tool and how does one use it ?
0	chrome to phone error " device not registered for user"	phone restarting over and over after rooting samsung galaxy ace s5830i
0	how do you install samsung kies to an alternative hard drive ?	google+ app does not launch live video hangout
0	why my google now on my motorola razr d3 will not reply with voice ?	does android jelly bean 4.1 support microphone audio input from mini usb headset ?
0	remove calendar	is my phone 's gps limited by us regulations ?
0	disable camera 's lockscreen shortcut	why is the com . android . browser process draining my battery ?
0	nexus 5: different home screen with lockscreen enabled vs disabled ? huh ?	what limitations does rooting and/or installing a rom put on my phone ?
1	find out which app is pushing ads in my notification bar ?	how can i find out which app is putting ads in my notification bar ?
0	android images backup to the cloud	instantly transfer a picture taken to pc
0	where are the hidden videos and pictures from camfiler 's vs and/or ps apps ?	can i root my nexus 5 without a custom image ?
0	how to get 2012 chevy equinox to recognize my evo 3d ?	saving a place on google maps account
1	how to call record in micromax unite 2 a106 , android version 4.4.2 ?	is there a way to easily record a phone conversation in-progress ?
0	tasker ( switch off mobile data automatically ) causing trouble under cyanogenmod	how do i use a pattern to unlock the phone screen ?
