0	do your items ever get destroyed in combat ?	what is a lagrangian point , and how can i get a bird into one ?
0	how do i get the treasure in the waterways secret section of aquan ruins ( 3-7 ) ?	civilization " does not want anything to do with me right now " ?
0	how does mission xp / credit work in borderlands during online multiplayer ?	what is the max level in steam version ?
1	what is this gen system in multiplayer and how does it work ?	what are the numbers next to player names ?
0	how to go about getting clay in wurm online ?	do any of the dead rising 2 books help combo weapons ?
0	how to decide later when a ship is captured but the dock is full ?	are there actual consequences for being defeated ?
0	how can i activate buttons or open and close things without reloading ?	aztec ua culture bonus count into increasing city border ?
0	what is inside the jail ?	how to pass the jellyfish ?
1	how does one capture gameplay video on pc ?	how can i record demos of my gameplay ?
0	castlevania lords of shadow mirror of fate hd : black screen / nvidia	does the assassin 's creed 2 opening cinematic change based on how much of the game you have completed ?
0	what is the difference between the daredevil and hot rod hoverboards ?	will continuous flying damage the aircraft ?
1	are there different bioshock infinite endings depending on choices ? do choices make any difference ?	can you change the outcome of the game 's ending ?
0	what weapon does the red specter before old dragonslayer use ( ng+ ) ?	what is the difference between " damage health " and " ravage health " ?
0	does " big stinker " count as " bad medicine ? "	is the ' impossible ' room possible ?
1	absolute best race for mage ?	in skyrim , what race is best suited for a mage , a juggernaught ( warrior ) , and a thief ?
1	dumping a unconscious enemy to the water , counts as a kill ?	do unconcious people who fall in water die ?
0	no such item with id xxxx open blocks xp drain	remove weapon effect
0	how do i survive the developper 's garden ?	pulse elite headset & xbox 360
0	how can i tell what secrets are before triggering them ?	are level > 60 items dropped in inferno whimsyshire ?
0	does the other person know that you have blocked them in xbox live ?	attack speed and its interaction with various skills
0	how do you beat the grandmaster galaxy in smg2 ?	how do i roller-skate ?
1	rare monster with a strange ability and a skull icon on top of it	what do the skull and crossbones icons over the heads mean ?
0	will a normal electric guitar work with rock band 3 ?	when do units say their annoyed quotes ?
0	does a lake count as a coast ?	what actions earn xp in the guild 2 ?
0	counter siege tank mass with certain build ?	what are the three gates at the left side of the historia crux ?
1	singleplayercommands	how to install mods for the new minecraft launcher
0	where to enter fifa 13 online pass code	can all enemies be suppressed ?
1	lost follower on skyrim	i lost my follower ?
1	what happend to my follower , lydia , with all my stuff ?	how do i find my follower if and when they leave me ?
0	where are the 13 standing stones ?	how do i de-lock away from enemies ?
0	special moves on iphone for street fighter 2	how to use setblock command for placing stone button on the left side of the command block
0	how to prevent character model from leaning in front of inventory	why do terran players bring scvs with their main army so often ?
0	how to get chickens from trading post to one of my empty pastures ?	does " tribute " passive count twice if spell is aoe ?
0	where does shaitan the broodmother spawn ?	how well does onlive work ?
0	how do i defeat early poptropica on poptropica.com?	tiny death star game state lost when phone battery runs out : any way to retrieve game ?
1	how do i get showcases ?	how do i unlock the showcase ?
0	underground vs . overground bases	is there any maximum numbers of gems that a team can buy ?
0	is there any way to get dark side items besides the vendor on the fleet and random drops ?	how and when do i recruit tali ?
0	can you disable automatic memories ?	how do i get this body armour located in tomb of ramses iii ?
0	how to change map in starcraft 2 custom game from 1v1 map	how do i play chess in watch dogs ?
1	dawnguard vampire lord and companions werewolf question	how often can i change my mind about vampirism or lycanthropy ?
0	does spell-vamp work with smite ? and is it useful on ap champs ?	help me make sense of the starcraft 2 ending
0	minecraft went small	can i transfer saved game data from one windows phone to another ?
0	how can i keep cows from running away ?	where are my world files ?
1	how can i throttle steam ?	is it possible to limit the download bandwidth used by steam ?
0	is aram champion select truly random ?	what champions are worst at lasthitting under a turret ?
0	increasing chances of breeding a rare dragon	where can i farm pages/tomes of crafting ?
0	why do people get dropped in starcraft ii ?	what is the purpose of putting ad/support top ?
1	how do " stats changes if equipped " work in diablo 3 ?	how is the weapon damage on this weapon calculated ?
0	how to find the sugar bomb	am i the goat hero ?
0	how does cover work ?	why can not i block until i am attacked ?
1	how does attack speed stack ? is there a point of diminishing returns ?	how are all diminishing returns calculated in league of legends ?
0	is there any reason to install the demo while i am downloading the game ?	what is a skyshard ? what is a sky crystal ?
0	how do i play monaco with friends ?	using xbox360 with led monitor and speakers
0	how many different kid icarus ar cards are there ?	age of empires online skirmish strategy
0	what are the locations of the dragon priests ?	can black/white 2 interact with pokemon mystery dungeon : explorers of darkness ?
0	small problem with psvita with data	is the scene it ? big button pad compatible with you do not know jack ?
0	is bad piggies nondeterministic ?	problems connecting to a friend 's server in team fortress 2
0	how to position in team fights as ad carry	config file location for civlization v on linux
1	how can i get more bottles ?	where are all the bottles ?
0	is herobrine real ?	is the gamepad support in the witcher 2: enhanced edition the same as in the xbox 360 version ?
1	can you just say the order of the letter for the squirrels second question	what is the solution to the squirrel sequence of letters question ?
1	where can i find a transcript of portal 2 dialogue ?	how can i extract the full audio or get subtitles of glados 's sentences in portal 2 ?
0	character moving slowly without carry weight being exceeded .	battlefield 3 all stats lost
0	severe error when trying to launch voltz server	do i need to claim my playstation plus instant game collection ?
0	can i assassinate my queen ?	what is the best strategy on playing defensive roman on travian 4 ?
1	borderlands 2 seraph crystals	how do i get a seraph crystal ?
0	why are armor penetration runes considered much stronger than atk speed runes ?	can not secure the paediatric ward ?
0	how is attack strength calculated ?	how do i finish the room with many useless doors ( mausoleum ) ?
1	why do i get sick when i am lost ( in a game ) ?	how can i prevent gaming sickness ?
0	can not purchase house in wildhelm or advance the quest in skyrim	how do i create a pitboss game ?
0	sacred 1: change game difficulty	if multiple systems have an available trade route , which one gets the route ?
0	how to counter juggernaut as technician	point of curly 's panties
0	how to get the pokeflute in pokemon x and y ?	how is ranged damage calculated ?
0	mgs peace walker boss : peace walker type ii	random character in tbogt massionet9 not found
0	how does damage scale with distance fired ?	what are the divisions in cod ghosts clan wars ?
0	should i sponsor an organization which aims to get more women into technology ?	how do you build soul meter ?
1	can not find my waypoints in rei 's minimap ?	where does rei 's minimap store your waypoints ?
1	where to find a dog in fallout 3	where can i find the pet dog in fallout 3 ?
0	any way to track a player on the map ?	in a party with more than one monk , how do mantras work together ?
0	why do my units created pre-optics not get embarkment ?	how do you play civilization 4 by e-mail ?
0	does akarat 's champion death-preventing effect actually work or is it bugged ?	are there different voices ?
0	using a ps3 controller in the pc version of far cry 3	how many items can the supply convoy hold ?
0	do quest items have weight ?	what determines what races a slaver can provide ?
0	what is the best way to handle rogue waves ?	devil beast ( tales of xillia )
0	is there a way to reset time for next quest/life regeneration ?	can i ever get magic paint as a reward from solving a puzzle box ?
0	how to change active character in dungeon siege 3 ?	can i activate a retail copy of simcity on origin ?
0	how can i get started in wvw ?	how do i unlock the onion knight job ?
0	what is the difference between a defense drone and a combat drone	getting excalibur as a neutral human
1	i am new to minecraft servers , and i need help with pvp	what are effective pvp strategies in minecraft ?
1	how do i wrangle animals ?	any way to round up animals in minecraft ?
0	where is the waypoint in the warehouses area ?	i got an ' f ' -- how can i improve my grade ?
0	i am looking for web codes for these skylanders	what is the best way to get the x blitz achievements ?
0	why does the connection time out when connecting to a server ?	naruto shippūden ultimate ninja storm 2: tilting
0	should i continue one of my mass effect playthroughs in mass effect 2 or start afresh ?	can you create a new ea account with a second hand game ?
0	what are the precise differences between " playable " and " optimal " ?	how do i control which npcs live where ?
0	how can i make my legendary crossbowdwarf stand down ?	what is the source of the term use map settings ?
1	can i generate a new nether in minecraft ?	i do not like hell , can i go somewhere else ?
0	what does +x% dmg do in diablo ?	i cant get minecraft 1.6.4
0	is there an easy way to view my steam friends ' screenshots ?	transferring skyrim saved games from one machine to another
0	nba2k11 wii - right stick passing	i can not connect to my friends servers and my friend can not connect to my servers ?
0	what drives the cost to retrofit a fleet ?	what are the highest living rating uncolonized territories in victoria ii ?
0	why does everybody ask me whether i am sick in skyrim ?	how big does cho'gath get with lulu 's ultimate ?
1	wow : post-cataclysm zone levels ?	horde progression through the new azeroth
0	how can i increase poison burst damage ?	turning the sound off ?
0	how can i see who owns a particular xbox game ?	is it possible to get access to the locked bookcases and display case in the arcaneum ?
1	do returned cards go to the back of the deck ?	when you discard cards in the beginning of the game , where do they go ?
1	how do you join two xbox live accounts ?	is there a way to merge user profiles on xbox360 ?
0	enemy units spawn nearby on immortal ?	how do i get mew in pokemon fire red ?
0	is it possible to sense the depth of a well ?	who are all the squad members in mass effect 3 ?
0	how do i become a veteran in bad company 2 ?	can i permanently give another player a weapon in grand theft auto 5 ?
0	how to add prisoners at prison architect ?	when you fire do bushes become invisible for your allies ?
0	how much health does a health potion restore ?	where is gwendolyn ?
0	what is the best defense when playing against miami online ?	where can i find the soundtracks to the left 4 dead games ?
0	do different birds effect game play ?	what is the calculation behind attack , defense and spellpower ?
0	what happened to immortal item of dota 2 's sixth compendium goal ?	can i win a science victory after i win a cultural victory ?
0	does manually arresting criminals cause a drop in respect of their family ?	should i unwrap the cat ?
0	how do i disable tanks with the at rifle ?	is there a way to protect yourself against naga siren 's ultimate ?
0	mass effect 3 tech combo timings	unable to log into a jp server on ffxiv:arr ?
1	where 's my horse ?	how can i find or recall my horse ?
0	defeating copperhead in arkham origins	what moveset should my skitty have to be useful ?
0	are any of the skills actually useless ?	what build is best for jax
1	how do i kill a dragon critically ?	what are dragons most vulnerable to ?
0	do plants respawn after a certain amount of time ?	what is honor for ?
0	what exactly is elo and how does my play style affect it ?	how do i fly an " excellent mission " ?
0	bejeweled blitz hypercube matching	how to spec a shaman for leveling and instancing in wow ?
0	is it possible to win castle of the winds without the teleport spell ?	do slow detectives lose points ?
0	how does the " soul harvest " skill work ?	how to find jelly 's share safe combination ?
0	how do you get to new game + in fez ?	what does " you feel stupid . you feel clumsy . " mean ?
0	how to build a base in dayz ?	does sneak attack count power attack ?
0	what is the fastest way to farm mimics in terraria ?	what is a good build order for the first month or two on classic difficulty ?
0	what is the best way to earn " demolition man " trophy ?	buildcraft filler with saplings
1	how do i know what levels enemy monsters are at ?	how do i determine the level and xp reward of mobs in diablo iii ?
0	are there any fast ways to get my sons wow account to a higher level if he does not qualify to sor ?	ping level in league of legends
1	how can i tell how long ( more or less ) it will take me to complete a game ?	length of single player campaign in the assassin 's creed series ?
0	what is the most powerful sword in chrono trigger ds ?	are shadowrun stats saved on a server ?
0	is anyone having the " cannot copy steamnew . exe to steam . exe " problem on steam ?	did my companion steal my gold ?
0	make map where user enters text	can i own multiple properties ?
0	where is the p2 laboratory in ' pokemon black 2' ?	what are the differences in ingress portal shield types ?
0	fastest place to farm gold	portal 2 authoring tools
0	aftershock ( radiant ) quest - how does the staff of magnus fit in ? does it have a special function in this quest ?	why did you have to blow into an nes cartridge to make it work ?
0	does the number of elements in the queue affect resistance ?	minecraft log in troubles
1	what damage does red buff deals ?	what effect do neutral buffs have in league of legends ?
0	how do i fail the train mission ?	can i break my apiarist 's chest without my bees spilling ?
0	how to calculate dps of your pet ?	macro to interact with target ?
0	spell tomes and enchanting	do unlocked things stay unlocked after paid time expires ?
0	how much xp exactly is earned per enchanting action ?	earned cards never show up in my deck
0	how close do you have to be to your party members to gain xp when they get a kill ?	how to defend in fifa 12 ?
1	do i need to restart my world inorder to receive new game content ?	will new minecraft features appear in existing worlds ?
0	why will not my researchers advance further in sandbox mode ?	use joystick in linux-native valve games ( tf2 , css , . . . )
0	i cannot download all minecraft files	how do i equip a bottle , and re-equip 2nd & 3rd bottle ?
0	why can not i do anything any more ?	how long does corn take to grow ?
1	is it possible to get steam to continue downloading a game while i am playing ?	how do i continue downloading a game in steam while playing ?
0	what is a high damage infiltrator setup ?	can a squad sight sniper use mindfray on an enemy outside their line of sight ?
0	any way to extract music from nintendo wii games ?	what are the advantages and disadvantages of becoming a werewolf ?
1	how to quit battlefield 3 without getting any " quit " stats ?	how to exit a battlefield 3 server after a match has finished ?
0	managing multiple specs in world of warcraft	what is visual strobing and how can i reduce it ?
0	blocking friendly minions	how do i use the proxy bypass in uplink ?
0	what does being a marshal entail ?	what is the lowest price for a ship that one can talk stan down to in the secret of monkey island ?
0	can you reset your portal 2 coop progress ?	how does fork work with powercharge-on-crit work ?
0	matchmaking in dawn of war ii	can you create a new ea account with a second hand game ?
0	godus , building abodes with wheat ?	where 's the " paris streets " soundtrack in deus ex 's folder ?
0	can walls stop mobs from entering my town ?	sonar vision smiley face on art works
0	how do i go about heading down the independent road ?	mouse cursor will not display in full screen games
0	where do i put the files when i download adventure maps ?	what beer is the beekeeper seeking ?
0	how do i get more tickets ?	what effects do the sword enchantments have ?
0	in terraria , is there an order in npc appearance in addition to the minimum requirements for each one ?	what is the best arrangement of gem dragons in their habitats ?
0	frogs fell from the sky . now what ?	how do lesters missions affect bawsaq ?
1	i still do not get when i win or lose at caravan	what are the rules of caravan ?
0	how do you display framerate in fallout new vegas ?	can the query . port setting be the same as the minecraft server port ?
0	police cars will not spawn in watch dogs ?	how can i teach new spells to a follower ?
1	strange nether portal bug	why will not my nether portal bring me back where i left ?
1	can you play with friends in different regions ?	buying diablo 3 in a different region
0	are there permanent consequences for decisions in the campaign ?	can npcs or non/semi-aquatic creatures ( no ' water breathing ' ability ) drown ?
0	can you dodge the blue shell ?	how can you give a player fireworks ?
0	psn website my lists feature does not work	what is the minimum cost for alpha access ?
0	where do i find dragons breath ?	will the airport 's x-ray scanner damage my xbox 360 ?
0	can i transfer items between two of my runescape accounts ?	how can i be more athletic ?
0	why did not humanity end ?	does sion 's shield absorb both physical and magic damage ?
1	i could not get the mega stone upgrade	why is my mega stone not in the location it should be ?
1	which rifle does the highest dps with only headshots ?	mid-range weapon balance
0	how do i force re-download ?	how can i skip skinning/looting animations in far cry 3 ?
0	how to connect f710 wireless gamepad to xbox 360 ?	where are the slaughter arenas ?
0	can i use a wireless t-mobile broadband connection to create an xbox live account and play online with it ?	what is " shine " ?
0	bonus points ( specifically ) and how to get them	how to make peace after i have what i want
1	unusual gem in skyrim	how do i bring the unusual gem to an appraiser ?
1	how do i beat level 10 in the tutorial ?	how do i complete challenge 1-10 ?
0	why do i keep immediately failing the shooting contest ?	civ 5 - how do i enable world wrap on a fractal or pangea map ( not world builder )
0	can i get the " saints flow " effect outside of the dlc mission it appears in ?	can anything good happen in a drunken stupor ?
1	how do i take a snapshot with a laptop on 1.5.2 in minecraft ? f2 makes it dimmer	how do i use f3 to get my coordinates when my laptop makes f3 a special key ?
0	microphone does not work in any source engine game . fix ?	are class-specific weapons better than other weapon ?
1	how can i get my enemies on my level in borderlands 2	what can i do if my single player enemies are too low level for me ?
0	how to add commentator in winning eleven 9 ?	how to disable auto-pause in secret of monkey island : se ?
0	whoa ! how did the water not go flowing everywhere ?	daily challenges post times
0	what keyboard macros are useful ?	when a portal is burned out , is it burned out for everyone ?
0	where are the wooden crates in each map ?	how do i unlock beast tribes quests
0	multiple users and households in sims 3	is there a benefit to buying landmarks ?
0	is good performance/high score rewarded somehow ?	do breeding times match hatching times for dragons ?
0	command and conquer : connection time out due to network issue	what does the old starship do ?
0	how much should we spend on wards ?	from what dlc should i start ?
0	what are the golden apples in happy jump ?	where can i change my pokemon 's nickname ?
0	how can i move things across dimensions ?	how do you get npc 's to go inside their houses ?
1	does matter to match furniture built with the same kind of wood ?	does the kind of wood matter to build furnitures ?
1	do companions use up their enchantments ?	does my follower 's enchanted weapon need to be refilled ?
0	where can i find paz ?	stealing items in morrowind
0	where can i get a pretty dress ?	how do i use spells in hunted : the demon 's forge ?
0	is there a directory for public servers ?	how can i increase skyrim 's volume ?
0	do adrenaline skills have separate adrenaline bars ?	what are the differences when playing as luigi ?
0	how do i keep skeletons from jumping in my xp farm ?	how to get to attack and defeat alani ( for the mount )
1	how to avoid being invaded by enemy in my ship ?	is there a way to stop enemies from boarding ?
1	is it possible to play cooperatively ?	how to play " together " in sims 3 ?
0	does blizzard from multiple wizards stack ?	turtle beach xl1 & pc connectivity
0	how does the silent hill hd collection compare to the original silent hill 2 and silent hill 3 ?	is there a post-credits scene ?
1	is there a cost of using the follower ?	do i earn less experience or items if i have a follower ?
0	does cold blooded affect all players ?	lord harkon disappears
0	can i play on the south asia servers with a north american copy of starcraft ii ?	how has dark age of camelot changed since shrouded isles ?
0	how to properly configure autolabor in df hack	do proc rates affect on-crit effects
1	how do i collect redstone ore in minecraft pe ?	how can i mine redstone ore ?
0	can i install minecraft : pocket edition on multiple devices ?	how do i get to this point of interest in the plains of ashford ?
1	when i break a block it reappears and when i place one it disappears ?	why can not i destroy or place blocks ?
1	can not break any block in survival in minecraft	why can not i destroy or place blocks ?
0	what skills are required for a dreadnought ?	xbox360 slim cables . cant connect hdmi and audio at the same time
1	civ 5 wonder tracking	is there any way to see progress towards achievements in civ 5 ?
0	resource rate of victory points ?	using a standard dynamic microphone ( 3.5mm male mini jack ) + a 3.5=> 2.5 adapter with an xbox 360
0	how can i see my ranked 5v5 team 's elo even though it is not ranked ?	does the juggernaut 's health increase progressively in survival ?
0	what happens to leah after act iii ?	what information is available on epm to apm comparisons ?
0	is it possible to play multiplayer game modes with bots ?	how did i win without killing my opponent ?
0	how do i unlock recon armor in halo 3 ?	about heroes and chance packs in blr
0	how do i find out what items belong in which groups ?	what is causing my low framerate in prototype 2 ?
0	who is the voice of dj atomika in burnout paradise ?	do mac steam keys work for pc ?
0	how does wood compare to coal in terms of home heating efficiency ?	can i see individual achievement progress for half life 2 episode 2 ?
0	why do i now have 1 autosave in a mission instead of 3 ?	does time pass when no one is present ?
0	what is this object in the water ?	topdown maps of moonview highway ?
0	is it possible to relocate a building expansion after it has been placed ?	are sheep permanently dyed ?
0	why i can not get the advanced soldier rig ?	what is the shortcut key for detonate traps ?
0	will ashely/kaiden rejoin my squad after becoming a spectre ?	are the forever stages randomly generated ?
0	how can i get the computers to stop pestering me ?	is there a way to make the forge categories remembered ?
0	how do chrono trigger 's snes and ds versions differ ?	do tf2 purchases make me eligible for steam trading ?
0	how to lightning-proof a structure ?	where are the sockets for the power sources ?
0	swtor character transfer & legacy level	if i stock a floor and then remove the worker from that floor , does the item continue to sell ?
0	cannot enter safe mode on otherwise working fat ps3 with 4.53	what are the odds of winning on the slot machines ?
0	gta5 online transfer from xbox to ps3	do claws have any special effects ?
0	how do i change what controller is used in mk8 ?	how can i beat the level " square " ?
1	how do i " spray " an image properly ?	how do you use sprays in team fortress 2 ?
0	where and what are the " unusual crystal formations " on alderaan ?	when does a monster spawner activate in minecraft ?
0	what is the meaning of circles near allied portraits in lol	when does janna 's extra ad from her shield take effect ?
0	when is it okay to steal ?	what is this gameboy-like handheld from my childhood ?
0	how do you build a load out for modern warfare	does anyone know of any other hidden abilities of civilization leaders ?
0	can i bind a key to enable a certain power ?	which melee ( monk/barbarian ) skills can not be dodged ?
1	do asteroid hits increase my shield operator 's experience	what triggers crew experience increases ?
0	how to solo pyrocaustic pete the invincible ?	spoiler : how do i get this coin on deep dark galaxy ?
0	does evolution affect ev training ?	which is the best choice : health , attack , shield or magic ?
0	does magic find in diablo iii work the same way as it did in the previous installment ?	plus signs in diablo 3 for ps4
0	minecraft offline	how do i unjam the signal during the battle with bane ?
0	how do i achieve the replicant challenge ?	how can i play yobi 's basic spelling tricks on 64-bit windows 7 ?
