0	cs:go - how to join competitive servers ?	are there any alternatives to livestream and justin . tv when it comes to streaming games ?
0	how do i kill vincon traut and the other conspirators ?	what effects does the weather have in simcity 2000 ?
0	what is the difference between aion the tower of eternity and assault on balaurea ?	how to whitelist people without restarting the server ?
1	which ( if any ) mission changes are predetermined ?	are objective change random ?
0	what do the sub-weapon categories like " spirit " and " dream " mean ?	are there significant differences between the platform versions of mass effect 3 ?
0	how do i pre-generate a minecraft world ?	how do i check chronoboost usage , and whether or not it is being saved when scouting protoss ?
0	do the enemies levels scale in kingdoms of amalur : reckoning ?	can i do anything with my spare swedish nose ?
0	how to kill dozers effectively ?	how do they know i changed time in settings in sworcery ?
0	most effective class in dragon age origins	in dragon age , how can you get morrigan to come with you with isabela in the pearl ?
0	do event pokémon have ev points ?	what are effective tactics against leveled magic anomalies in skyrim
1	my follower is gone and i can not recruit a new one	skyrim " you already have a follower " issue
0	what is the point of an enchanted book ?	i got an extra key in key cavern
1	is it possible to lock the action bar ?	is there a way to lock my skills ?
0	can not pick up ammo	optimal way to increase heavy armor skill ?
0	does " time played " include the time when i was browsing in-game menus ?	is there any reason not to use silenced firearms whenever the option is available ?
1	what is this red cross next to my weapon ?	how do i mark an inventory item as trash ?
0	how to download minecraft for linux without an internet connection on that linux computer ?	can my drones be destroyed in x-rebirth ?
1	do i have time to cruise around the galaxy ?	are there time-limited objectives in the game ?
0	what is the difference between armor , barrier , and shields ?	good tactic to maintain a good food supply in banished
1	why has the draugr deathlord in valthume stolen my sword and my shield ?	draugr wight lord disarmed me , can not find my weapon
1	how to find the xyz location of objects in minecraft ?	how can i find the location of a given item by looking at the world data ?
0	what labor is used to pit/pond large animals ?	how do followers ' attributes increase from item bonuses ?
0	what does " verify integrity of game cache " do ?	is there any point to collecting paintings ?
1	what is the most efficient way to light a plane to prevent hostile mobs spawning ?	how far should i place torches in a planar huge room ?
0	does weapon weight effect how fast you move/run ?	how do i find out what version my skyrim is patched to ?
0	how do i order an attack on friends ?	farming is not effective ?
0	how much damage does a backstab do ?	how do i get team fortress 2 to span multiple monitors ?
0	what are the differences between the races in multiplayer ?	using microsoft kinect on a pc
0	transferring apps/games from one 3ds to another	is double tapping or bursting more effective ?
0	how do we save a multi-player game ?	what happens if i use the travel system to access dlc content before i unlock the travel system in the plot ?
1	where can you find the yeti zombie ?	when does the yeti zombie appear in plants vs zombies ?
0	better information on defense damage clash of clans	what determines whether an ufo lands or gets intercepted ?
0	batman arkham asylum goty .netframework error	detailed instructions for iphone version of c&c - red alert ?
0	can not drop an airport	how can i see my item-specific progress on the daedric walker achievement ?
0	what is more likely to boost my gaming performance : a new gpu or more ram ?	are blackheart 's cannons random ?
0	can non-giant figures from skylanders : giants be used on skylanders : swap force ?	how to copy save game data of kenny 's adventure into another computer ?
0	what are the best regions to farm karthite ?	does the " procurer " and " retriever " mining barges have the same yield ?
0	how does the pokemon heartgold / soulsilver safari zone work ?	i keep dying when i am mining obsidian on minecraft . why ?
0	what is the significance of these obelisks ?	pokemon attack powers
1	what is this gen system in multiplayer and how does it work ?	what are the numbers next to player names ?
0	how do i get this body armour located in tomb of ramses iii ?	how do i finish the puzzle in just a little bit shy ?
0	where in ' lizardo dungeon ' are the four ' lian clamps ' ?	how to do a plunging attack ?
0	how much ncr infamy do i gain from arming archimedes ?	what does p2w mean ?
0	what is the maximum gold find that can be obtained from each type of follower ?	why can not i absorb a dragon soul ?
1	minecraft xbox differences with pc	what features differ between the xbla and pc versions of minecraft ?
1	change the weather on vanilla smp ?	is there an smp server command to change weather conditions ?
0	can not raze a captured city in civilization 4	how do i change my steam username ?
1	what are some tips for mastering redstone circuits ?	how do redstone torches ( circuits ) work in minecraft ?
0	does extra damage chance improve lifesteal output ?	efficient hellevator design
0	how much damage does each piece of armor absorb ?	how do i achieve the top score playing drums ( solo ) in rock band 2 ?
0	kairos dragon froze in one location on screen	what items can be sold on steam marketplace ?
0	what determines the final direction of sima zhao 's ex attack ?	how can i de-spawn mobs in minecraft multiplayer ?
1	is there a way to " turn off " creepers in minecraft ?	removing some hostile creatures in minecraft
1	stoping the crimson/hallow	how can i defend my home against hallow/corruption in hard mode ?
0	can you get experience for indirect kills ?	is damage over time affected by crits ?
0	how do i figure out which ? bitizen i am seeing ?	how do items effect melee and ranged champs ?
0	what does the parchment paper on the level up page in social breeding mean ?	how do i complete " supply and demand " if i cleared cragslane cavern before starting the quest ?
0	where can i find each type of ultra rare cargo ?	what is included in the f.e.a.r. perseus mandate and extraction point boxes ?
1	give away duplicate steam game	what happens if i buy a game i already own through steam a second time ?
1	just downloaded minecraft no bin folder or minecraft . jar	lost my bin folder and my minecraft binary files , what do i do ?
0	when do elite mobs reset to full hp ?	how can i disable battle cycling of other civs in civilization 5 ?
0	is there a cap level for sorcery ?	what endorsements benefit the tank 's jet engine gun in monday night combat ?
1	where 's the mega stones in pokemon y	why is my mega stone not in the location it should be ?
0	are these commands considered legal or cheats ?	is it possible to satisfy both jack and serenity at the same time ?
0	level required for co-op mode in spice bandits	max points in castle of dr . brain
1	what happened to my companion ?	how do i find my follower if and when they leave me ?
0	how do you get the " bi-winning " achievement ?	fort suddently died , looking for explanantion
0	does a road have to be on the surface ?	gta v escape paparazzi
0	minecraft minecart quirks	does world of warcraft cataclysm collector 's edition have a separate key for the exclusive in-game pet ?
1	how to easily get gold coins ?	how do i get rich quick ?
1	what is the limit on dropped candies ?	why throw candy on the ground ?
1	how can i save the game ?	when is the game saved , and how ?
0	easily copy all saved data to playstation plus ?	gta v and gta v ifruit app
0	do ammo capacity bonuses stack ?	are xbox 360 game prices displayed pre-tax ?
1	can i obtain a lightball in x/y ?	where can i find a light ball for pikachu ?
0	is there a way to get an npc 's refid in game ?	how to test weapons in battlefield 3 without affecting accuracy score ?
0	is there any way to recover a lost arkham city save ?	what are some good heroes for a beginner ?
0	do spectral blades - healing blades get a bonus penalty in inferno ?	what is the 3 minute countdown for after defeating the beast fights ?
0	is branch mining effective ?	why is my coal power plant not receiving coal ?
0	how to download minecraft for linux without an internet connection on that linux computer ?	how do i change tile entities ?
0	how to manage loot when doing missions in fleet ?	is there any trick to win the " within one hundredth " trophy ?
0	why can not i play co-op ?	where do i go after finishing the fourth dungeon ( the forest temple ) ?
1	is there any application that can help limit my gaming time ?	how do i limit my gaming ?
0	can not connect to lan server on minecraft	if nidalee uses takedown ( q ) in cougar form , can she turn human and use it with her ranged auto attack ?
1	how can i convert a classic . lvl file into a modern minecraft format	converting minecraft . lvl to . dat
0	what exactly does the spread mean for a gatling tower ?	should i add + minimum damage stats for my followers
0	does magic find affect tome of secrets drops ?	how has dark age of camelot changed since shrouded isles ?
0	how do i find the ip address of the server i am currently on ?	what are the differences between the free version and the ' pay ' one ?
0	how do i achieve " smash tv " ?	change starcraft 2 level editor language
1	minecraft crashed with this report ?	is there a list of error codes for minecraft ?
0	upgrading the greater totem ward trinket	how do i unlock and recruit asagi in disgaea 2: dark hero days ?
0	why do multiple vehicles which are running the same route tend to bunch up together ?	oracles vs . terran
1	does difficulty matter for unlocking new ships ?	how do i unlock all the other ships in the hangar ?
0	problem running duke nukem 3d on linux	how can i give a nickname to an npc ?
0	is there anything special about luigi appearing during the start of some games ?	will diablo 3 use steam ?
0	what is these files in psp ?	are there long-term consequences for homicide ?
0	how do i vent phazon in metroid prime 3 after . . . ?	do pain au chocolats stack ?
0	why is the measure of lag amplified differently between two servers ?	how do i pull a guard off a roof in assassin 's creed 2 ?
0	ftb unstable crash on startup	how much experience is needed for each level ?
0	does item luck from feng shui have any affect on when new items appear in re-tail ?	how can i be downgraded to a lower league ?
0	how can i track " magic weapon"s cooldown ?	skryim enchanting problem - why is the base percentage only 17% when it should be 25% ?
0	enchanting armor with fortify magicka regen and fortify [ school ] ?	fastest way to earn coins ?
0	in loz:twilight princess , why does my sword ( or tail ) flash for a second ?	how to tend to a wounded dwarf ?
0	what do you get when you complete bonus objectives ( with the blue plus on it ) ?	for the end of season 2 , what are the new elo bracket percentiles ?
0	what governments do each civilization prefer and dislike ?	are legendary cards always gold ?
0	have the builder vips been removed ?	sword of the divine on riven
0	what is a ladder character ?	how do i turn off hardcore mode in mount & blade ?
0	is there a limit to how many weapons you can have ?	stuck halfway through sonic generations , have all available levels completed
1	is magic a powerful and effective offensive class on skyrim from level 1 onwards ?	if i want to focus on magic , can i ignore weapons entirely ?
0	how much longer does it take to mine blocks underwater or while airborne ?	how do i complete " proving honor " ?
1	how do i change my character stats after starting in gta online ?	what is the fastest/easiest way to level up your skills ?
0	can i kill off squadmates ?	can not continue college of winterhold quest , mirabelle will not give next stage
0	left shift does not work in ksp or other unity games	how do i scan riddler question marks ?
0	potions and poisons with both positive and negative effects	how to get the guide to spawn in his room ?
0	what is the best way to get grass onto a dirt platform ?	how do i become a hero in die2nite ?
0	how do i fix the steam overlay in payday 2 ?	eve online can not switch to geforce gt555
1	can not find the night time mega stones ?	why is my mega stone not in the location it should be ?
0	barb whirlwind not procing ' on melee ' effects	assassin 's creed 3: the tyranny of king washington dlcs total length
0	how do you access past levels in free play mode ?	how do i kill undead ?
0	how do i get the russian tanks ?	how should couriers be used in dota 2 ?
0	brightness level : adjusting from xbox 360 or tv	do warframe screenshot settings effect the screenshots that steam takes ?
1	item lock-up bug	minecraft inventory dragging glitch
0	can the original age of empires ii be played online with the hd version on steam ?	has team fortress 2 sped up ?
0	fable 2 end-game achievements	which abilities can fizz 's e not avoid
0	what is the right sequence in grow cannon from eyezmaze ?	gmod - music on map jb_summer
1	crystal ship in ftl	how do i unlock all the other ships in the hangar ?
0	uncharted 3 salim cutscene glitch	i choked a quest npc in dishonored . am i in trouble ?
0	razer megalodon problems	what is all of the diablo literature relating to the lore ?
0	how do i pass the doors next to the images of dance sequences in the osohe castle ?	can not unlock bend will shout
1	in minecraft i heard creepy music while mining	what does minecraft 's scary music mean ?
1	what is the right order to play skyrim ?	playing skyrim regret-free
0	do different anvil materials have different capabilities ?	in which way should i approach the expansions of fallout 3 ?
1	how do you beat a zerg player that roach rushes using protoss ?	how do i counter the 7 roach rush build ?
0	is the type of dremora summoned by the sanguine rose variable each time it is used ?	most viable strategy champion 5 picks for 1v1 showdown
0	why is my minecraft launcher not working ?	who is that in the wall in reachcliff cave
1	what is the difference between black souls and white souls ?	what are the advantages and disadvantages of each version of azura 's star ?
0	why is my cordless rumblepad 2 gamepad not being detected ?	how do the threat mechanics work in tera ?
0	are the limits for getting banned in a casino static ?	can i withdraw my battle .netaccount balance into paypal ?
1	is there ever a case in which an item not useful for research is useful for anything but selling ?	what alien bits should i sell ?
1	is it possible to play a japanese xbox 360 game on a us xbox 360 console ?	i just bought an xbox 360 game with wrong region . what should i do ?
0	why does money fly out when i die ?	can i unlock crushing difficulty after beating the game on normal ?
1	vampire annoyance	how do i cure my vampirism if i am already at stage 4 and can not talk to npcs ?
1	what do i do to complete find the bitizen mission	how do i complete " find the bitizen " ?
0	getting full lives	what do the bands on the door mean ?
0	what rendering api does rage use on pc ?	what do these strange parts mean ?
0	what skills from other party members affect witch doctor summons ?	how do i buy games in the form of psn codes ?
0	are seasonal unusual hats limited to seasonal effects ?	is there an effective way to increase affection without pokemon-amie ?
0	most effective way ( s ) to gain levels in dead rising 2	how can you see the performance index requirements of a race in shift 2 unleashed ?
0	can i configure my soldiers perks for multiplayer	how does matchmaking work in play mode ?
0	can not get in to dark brotherhood	computer level 2 bug question
0	is there an easier way to " combine " stuff in everquest ?	how do i start the mirage mission ?
0	are giants required for skylanders ?	not getting achievements in civilization 5 is there a difference between silver and bronze achievements ?
1	what are the rewards for each steam level ?	what do steam profile levels do ?
0	is diablo 3 open for mods ?	is there any way to predict where a star will show up ?
0	is there any way to change game pace of a game already in progress ?	borderlands 2 goty + ultimate vault hunter upgrade pack 2 , is it now complete ?
0	mouse button press in roccat macro manager	serious lag issues with deus ex : human revolution
0	is there any advantage to the pimp-boy 3 billion ?	what formula does religious pressure adhere to in civ 5 ?
0	can gnar jump multiple times ?	how do i stop trains from switching tracks in a ' stupid ' way
0	did the original super mario bros . contain a running glitch ?	how can i change thane 's fate in mass effect 3 with ' gibbed save editor ' ?
1	can i play diablo 3 on us servers with a euro key ?	buying diablo 3 in a different region
0	what are effective roles for each class in mann vs machine ?	how can i drain power from a door lever post and charge an inactive one ?
0	how can i stop civilization 5 from asking me twice which directx mode to play in ?	does bouncing my connection through personal computers or phones prevent detection ?
0	how big is the update for cataclysm after buying the digital upgrade ?	how to i connect xbox 360 to monitor ?
0	what horde race is better for a priest ?	how do you get to whirlpool level ?
0	how can i tell what level of difficulty i have completed on a given mission ?	what is a good terran anti aircraft strategy if you are on the move ?
0	how do i activate a product key in desura ?	can i take my slime downstairs ?
0	why do i not have any of the steam achievements for borderlands ?	how can you train for blind hooks with pudge
1	what pieces of armor can carry the increased attack speed attribute ?	what affixes are available on items ?
0	i am downloading minecraft for the first time . will i need to buy anything ?	how can i make ps3 recognize an hdmi to vga converted cable as a displayable screen ?
0	can you trade in darkspore ?	what weapons have a flashlight ?
0	where is the quest log ?	the ending for super mario world ( wii virtual-console )
1	why does meta-inf keep coming back ?	how to install mods for the new minecraft launcher
0	can i take legion on tali 's loyalty mission , complete all loyalty missions ( including his ) , and still save my whole crew ?	technical guide for setting up a lan party ?
0	serana 's location for follower recruiting after dawnguard quest .	do the characters in the classic x-men arcade game have different fighting capabilities ?
0	do i have to buy arr if i have original final fantasy xiv disc without account ?	how often can i expect egg-laying animals to lay eggs ?
1	how to avoid 6gb download after restoring current tf2 backup on another pc ?	how do i copy team fortress 2 to other computers ?
0	how do i assemble a spaceship ?	the graphics in need for speed : hot pursuit 2010 are too dark . how do i fix this ?
0	xbox 360 anti-dust cover	where can i find a fusion chart ?
0	adr , high value or fragile cargo , which upgrades to get for the highest paying jobs ?	what effects does streetpass have with pokemon x/y ?
1	how much knockback does a normal punch do ?	how far are enemies knocked back ?
0	how to counter protoss ' fast expand as zerg ?	what actually unlocked the previous assassin 's outfits
0	in mass effect 3 , how does fortification work ?	query number of players on a minecraft server
0	what are all the ( hidden ) achievements in papers please , and how do i get them ?	why is there a achievement tab on your profile ?
1	how to route units in sc2 ?	how to make a unit do x then y in starcraft 2 ?
0	utility of level 3 sensors ?	what is the best strategy to staying alive ?
0	what does " f1" key do and how to use it to spread units ?	is it possible to play new leaf on multiple systems with a cartridge ?
0	best methods of pissing off other civilizations ?	can monsters open doors that are not on ground level ?
0	the gases , metals , and medals from mass effect 1 . . . do they have an effect on me2 ?	what does initiative do ?
0	how do i keep skeletons from jumping in my xp farm ?	what is up with the rotten ?
0	how do i restore a dragon age 2 save file ?	redeem icoke prize voucher ?
0	how often do business produce income ?	why are the shields not upgraded ?
0	what is the chunk update radius in single player minecraft ?	what are the limitations in the dungeon defenders demo ?
0	what is the range of psi abilities ?	do i need a harbor in the capital to make trade routes from other harbors work ?
0	should i finish torchlight before playing torchlight ii ?	what are the differences from dead island to dead island riptide ?
0	levelling as a medicine operative	i am surrounded by idiots . who do i have to kill to get my hands on a superior brain ?
0	super training , ev 's , and exp . share	what does the number in red near to the " defend " menu stand for ?
1	what does destroying communications stations do ?	how , and when , do resource constraints affect just cause 2 ?
0	is it possible to buy a pvp-only account in guild wars ?	how do you dodge sivir 's boomerang ability ?
0	what counts towards weapon skill ?	what are the benefits of leveling up my heros ?
0	is it possible to save val ?	exactly how do the contents of a furnace effect a comparator ?
1	diablo iii affix range list ?	what is the cap for equipment modifiers ?
0	i did not find 1.6.2 . jar	how do i use a town portal ?
0	does the timer include the time between waves ?	how does skill cooldown reduction work ?
0	does company of heroes cd-key from a pc version work on a mac ?	which does more damage - floor spikes or wall blades ?
0	jet grind radio dreamcast not loading	how do i change lego batman 2 's language to english ?
0	jungle fortitude damage reduction not appearing on details window	cavalry charge before or after infantry engages ?
0	how do i know which quest is the " main quest " ?	do the bonus to health globes work also on items equipped by my companions ?
0	how big is a 3ds storage ' block ' ?	how do i reach the hidden star in dr snow ?
0	are medkits consumed on use ?	villagers disappeared
0	what do i lose by entering the holy pillar ?	what is new in call of duty : modern warfare 3 ?
0	is dishonored an open-world game ?	how does the campaign scoring system work ?
0	in a zvz match , how do i deal with early mass zerglings ?	how do i change lego batman 2 's language to english ?
0	how can i extinguish myself ?	i missed some homestead missions . can i go back and pick them up ?
0	is it viable to buy ap items with shen ?	borderlands 2 in true vault hunter mode , does madame von bartlesby always drop a legendary weapon ?
0	why does money fly out when i die ?	what is the minimum required number of playthroughs needed to get all trophies/achievements ?
0	does legendary item power scale with difficulty ?	how do you access the " point of interest " that appear on the map ?
0	can an xbox one player party or voice chat with an xbox 360 player ?	what does steam backup ?
0	heroic mode naxxramas	is there nudity in wwe '12 ?
0	can you determine protoss buildings while still under construction ?	should i ever use buckshot ?
0	unconnected territory civ5	is there a limit to how tall my tower can be ?
0	the direwolf20 pack regularly lag-crashes when i near large amounts of oil	where and what are the " unusual crystal formations " on alderaan ?
0	i can not log into my own bukkit server ?	how do you reassign an xbox controller 's id under windows without rebooting ?
0	signature spell damage comparison with attack speed	how do i collect redstone on ios ?
0	why does the nvidia geforce experience incorrectly report my driver as " up to date " ?	how many traitors and detectives are there ?
0	how can i generate a redstone signal when players are near ?	can i miss puppies ?
1	is scv pathing random or deterministic while building ?	is it possible to determine or control where a scv moves during construction ?
0	cannot shift right-click in minecraft	is there a trick to defeat red helmets ?
0	comparing tn vs . ips lcd monitors for gaming	is it possible to get more missions in jetpack joyride ?
1	how do i get a dragon to fight me ?	what is the easiest way to pull a flying dragon ?
0	am i really wearing the helmet and vest in urban terror ?	is the german ( de ) version of dishonored low-violence / censored ?
0	how do i activate the daedric gauntlet in the midden ?	how do i gift the rewards of the bioshock infinite pre-order ?
0	my wife , orla , ran away . where to ?	anyone know the tools/process used by starcraft 2 commentators to create the screen recordings of games ?
0	starcraft build order terminology ?	what are reaper destroyers made out of ?
0	do nomads in banished wait ?	what are the specs for the highest-end sd card the 3ds can support ?
0	when do trinkets apply their passive effects ?	do stone quarries respawn in hearthfire ?
0	steam running linux and wine at the same time	what is the purpose of collecting feathers ?
0	how to play rayman legends without uplay	how is precision used to calculate critical chance ?
1	lost in the nether in creative mode	lost in creative mode
0	diablo 3 ah - see item stats after item sold	how do i get all the bananas on level 21 without blind luck ?
1	what caused eve to die ?	what happened to the female krogan ?
0	how to increase actions per minute	do neutrals spawn in 1v1 mid mode
0	are earthquakes just for the sake of better game experience ?	am i able to complete horde mode as a single player ?
0	copying wow addon settings between characters	can i keep my gtav triathlon clothing ?
1	when gaining level should we just kill enemies or do quests ?	how can i level up more quickly ?
0	completing the star player challenge	how can i determine an npc 's level ?
1	hanar quest broken	where do i go to investigate the hanar diplomat ?
0	how exactly does the +1 airjump mechanic work ?	gta v disc 1 download
