0	can not survive the night	gnome robot daily quest in orgrimmar
0	how do you get the key that is guarded by the jumping lizard in the " urchin " area ?	how do i change the gamemode shown in the title screen ?
0	how do i increase the number of lives players are given in one in the chamber ?	how long is a unit of distance ?
0	is there a plants vs zombies pc version with local co-op ?	what are the differences in the difficulties ?
1	what combination of genre & type make for excellent combinations when developing a game ?	what pairs well with the " time travel " game type ?
0	borderlands : how can i get mouse wheel scrolling to work in game dialogs ?	what is a good road layout when starting up a city ?
0	what is the cap for equipment modifiers ?	how should i approach the fight with ordrak ?
0	how can i change my personal information on blizzard account ?	how do i get my shield to shut up ?
0	good tactics for anomaly warzone earth ?	does content scale with level ?
0	can i have more than one weapon set ?	how can i back up a patched version of starcraft 2 ?
0	sibbi 's stash key not opening stash in quest " promises to keep"	ksp : saving number of kerbals in ship
0	where do i get exp share in pokemon emerald ?	can i restore my wiped out religion in civ 5 gods and kings ?
1	is kerrigan level achievement bugged ?	how can i earn the level 70 kerrigan power achievement if i was not awarded it ?
0	what time does the special events start on tiny death star ?	steam : instantly finish downloads
0	how come you can play counter strike almost immediately after you start downloading in steam ?	why does the sword i found still have a price tag on it , and what does it mean ?
0	is skyrim kid friendly ?	where can i buy elemental resistance potions ?
0	would i be at a disadvantage if i played quake live with an hud that displayed damage to death " instead of " health and armour numbers ?	which starting planets are shared with which classes ?
1	does the difficulty setting have any impact on the results of interceptor dogfight ?	what are the differences between normal and classic difficulties ?
0	how can i stop people from joining and taking stuff in survival mode ?	stop reanimated corpses turning into ash piles
0	space plane take-off & landing using only basic parts ?	where did the apple that altair hides in the library come from ?
0	what are the differences between the free version and the ' pay ' one ?	capacity limit for trade boats ?
0	where is maramal ?	add gog dosbox games to steam
1	how can i play diablo 3 with a gamepad ?	can i use a game controller to play diablo 3 ?
0	how can i quickly earn money after the story is over ?	possible to select game type on halo reach noble map pack ?
0	water station reports 2 different statuses , which is it ?	is it beneficial to sacrifice yourself so that your team might possibly get the baron steal ?
0	how do i change my offline name on the mac ?	what are " additional points " awarded for ?
1	how do i find lydia if i have lost her ?	how do i find my follower if and when they leave me ?
1	how can i join a minecraft server that is not located within my local network	how can i trick minecraft into thinking two computers are on the same wifi network ?
1	how to get the best enchantment on your pickaxe	how do i improve my chances of getting silk touch when enchanting ?
0	how to access wifi connection in psp ?	what parts of autorun need to be disabled to avoid autosave lag in skyrim ?
0	can a new save withdraw from the pokemon bank ?	starting a love interest in mass effect 2 from a mass effect 1 save file
0	progression through wow that avoids spiders	is there a benefit to buying landmarks ?
1	what do the numbers next to each character indicate ?	what is the number next to the character picture ?
0	how can i convince players who " want a new challenge " to stay ?	is it harder to sneak when carrying a heavy load ?
1	sucky armor for long side quest line ?	what is the deal with orange items without stats ?
0	does cod : modern warfare mix players from every console ( ps3 , xbox 360 , pc ) ?	driver : san francisco settings problem
0	dota-2 profile on shared pc	is it against the rules to use a bot-client without using it for botting ?
0	what kind of helicopter hats can i wear ?	at which percentage of 2nd perk , perk reset leaves 1st perk at 100% ?
0	can two players without compatibility mod play borderlands 2 together online coop ?	how do i make a custom uniform in dwarf fortess ?
0	best strategy against worker rush cheese in 2v2 and other matchups	is there a height limit on bookshelves enhancing an enchantment table ?
1	how does the new ' weight ' feature work ?	how does weight affect the cooldown of my abilties ?
1	rebuilding your house in skyrim xbox	how do i reset my manor so i can rebuild it with different options ?
0	is plague of toads as unhelpfull as it seems ?	can i permanently kill important people ?
1	what is the formula for damage mitigation in ingress ?	how much protection do the various shields give
0	can you obtain the " stack the deck " and " extra credit " burn cards ?	what is the effect of breaking lights ?
0	do i lose my power ups in infinity field ?	how do +damage mods work when dual wielding ?
0	why some types of ranked matches become unavailable ?	how do i rabbit hop and micro snipe ?
0	is there any other opportunity to get the map in pokemon yellow ?	thorns crusader build
0	how does one unlock a volus adept ?	is there a way to make changeups or curveballs faster ( mlb 2k13 ) ?
0	what happens when i block someone on steam ?	where are save games stored on my computer ?
0	how to whitelist people without restarting the server ?	in skyrim , what race is best suited for a mage , a juggernaught ( warrior ) , and a thief ?
0	best way to play defense of the ancients ( warcraft 3 ) on a mac ?	best way to micro/split push with phantom lancer
0	i do not know where my . minecraft is	is there any point in buying the shack next to onett ?
0	imperial assignments " costume " reward	how do you enter a dungeon if your group is already in there ?
0	assassins creed 2 story recap	what are greater nephalem rifts and how do they work ?
0	is there a way to know what areas are appropriate for certain levels ?	is it possible to complete all the side quests in a single 3 day period ?
0	what are the cheat codes for age of empires 2 ?	i can not let the iron flow out of my smeltery and my stencil table does not work !
1	pro 's and cons of being a vampire/werewolf in skyrim ?	what are the advantages and disadvantages of becoming a werewolf ?
0	how can i help the ezic organization ?	what does betapropin do ?
0	governors ' daughters and what to do with them	does magic find on followers do anything ?
0	there is a way to auto upgrade skills using a pre-made build ?	how can i get back to level 5 in legends of grimrock , once i have gone to level 6 ?
0	how can i go to war without getting everyone else displeased in civilization v ?	if i get a dota 2 beta key , will i get to keep the game after it is released ?
0	left for dead characters	what exactly is the gold covetous serpent ring ?
0	how to mark notes as unread ?	how to know more about creatures ?
0	how can i make a glowing mushroom farm ?	what is the best way to maximize gold find in diablo 3 ?
0	how can i play asari vanguard effectively ?	is there a quick way to defeat master gee ?
1	diablo 3 ah - see item stats after item sold	is there any way to check a recently sold item 's stats ?
0	how to master shooting while running ?	how do i fix the steam overlay in payday 2 ?
0	[ how ] can i use alternate controllers for rock band on my ps3 ? ( *i . e . * , my guitar-hero controllers . )	where is the shadow trinket in swordigo ?
0	dead money dlc perks	is there an easy way to figure out which dlcs have you bought already ?
1	minecraft xbox differences with pc	what features differ between the xbla and pc versions of minecraft ?
1	are there any unique bows whose enchantments make them a better choice than a custom enchanted bow ?	is there a definitive ' best weapon ' for each weapon type in skyrim ?
0	can you activate do not starve purchased from gog on steam ?	can you play all the hd remake collections on vita ?
0	technic launcher not downloading modpacks	does bunk selection make a difference at the beginning of psychonauts ?
0	how can i talk to the goth kids if i sold part of the goth set ?	my claimed clash mob prize did not appear in my inventory
1	am i using shouts correctly ?	how do i use shout power levels ?
0	npcs claiming wrong house	steam shortcuts with no images
0	how does cs go rank system work	how to force controller ids in windows 7 ?
1	what does the monster suffix " chains " do ?	what are the special abilities the unique/champion monsters can have ?
0	do i have to pay again for a game i bought on a different pc with the same steam account ?	minecraft will not run after updating java ?
0	can i lower the video quality settings using some extra configuration ?	do some ores become totally obsolete ?
0	how do i catch enemies in environment traps ?	is intelligence useless for clerics in disgaea : hour of darkness ?
1	how many " organizations " can you join ? do some block you from joining others ?	what guilds are in skyrim ?
1	armour ratings and armour values	what is the difference between armor and rating ?
1	where 's my horse ?	how can i find or recall my horse ?
0	do friends ' villagers retain their original furniture ?	i did not receive keening for completing arniel 's endeavor
0	mario kart 8 total coins collecting logic	what do you lose when you enter prestige mode in mw3 ?
0	damage attribute in character/inventory screen good enough for wizards ?	dwarf fortress military and bedroom issues ?
0	giving player extra hunger	what is a self-propelling " working " piston mechanism called ?
0	have portal gun crosshair highlight when focused on a " portal"-able target ?	most effective terran rush in sc2
0	does teemo blind blocks darius ultimate ?	access to the lost hotel in x and y ?
0	do returned cards go to the back of the deck ?	is there any way to know how many pokemon you have ?
0	can i see how many mission items i have found during the current mission ?	is there a way i can disable mods for specific players ?
0	how do i get the true/best ending ?	how can i change thane 's fate in mass effect 3 with ' gibbed save editor ' ?
0	how to consistently play demon 's souls with a friend ?	how can i lower my " templar awareness " quicker ?
0	in yakuza 3 does the tokyo ishun magazine become unavailable ?	how do i unlock the hidden/secret vehicles ?
0	does skyrim take advantage of 2gb video cards ?	can not pan map far enough south
0	first dos videogame ever ?	should i sell my magic items , or salvage them ?
0	are there disadvantages to leaving forest/jungle tiles ?	how should one weigh critical hit damage when selecting equipment ?
0	how do damage calculations account for damage buffs and dot effects ?	stats required to use various pieces of equipment ?
0	is combat avoidable ?	how and when do my hero weapons evolve ?
0	check the summary of spent money for steam games	is it possible to get a pet in skyrim ?
0	how can i see my character 's numerical health value ?	when are bone charms found during a mission determined ?
0	how to access the multifarm gui ?	does the ender dragon egg ever hatch ?
0	how to check internet speed on ps3 ?	what is " katamari drive " mode ?
1	secret of the room with 10 cube unfold markings	how do i solve the puzzle with ten symbols each with six boxes ?
1	how to turn on the light in the dark room on candy box 2 ?	can i do anything in a dark room ?
1	just downloaded minecraft no bin folder or minecraft . jar	lost my bin folder and my minecraft binary files , what do i do ?
0	how to cause idconflicts to be saved in a folder	what is ' arcade mode ' ?
0	can material outposts cause a daily net gain of materials ?	optimizing axton for solo play
1	how to cancel an objective ?	is it possible to dismiss an objective that i no longer want to accomplish ?
0	how to handle people camping your generator ?	can i change the difficulty during the game and still get the appropriate achievement ?
0	is resource trading in endless space a flat fee or a per-turn thing ?	will minecraft 1.9 pre-release map seeds be changed in the final version ?
0	when can different races party up ?	where 's my horse ?
0	stacking mobs on players in vanilla minecraft	where can i find all of the crafting patterns ?
0	at what levels do monsters get skill points ?	where do i go next in reclaimer ?
0	can i connect to counter strike 1.6 using counter strike : go ?	how can i get rid of items that can not be phased to their ' box ' form in the pattern buffer ( queue of items that can be ' phased' ) ?
0	how do i unlock rosalina in mario kart wii ?	adding minecraft to steam with 64bit jre
0	what is with the dark side of the moon ?	thunderstorm sound when joining server followed by fire ?
1	how long do monsters take to despawn ?	when do mobs despawn in minecraft ?
1	can you still become a vampire lord if you have killed harkon and cured serana ?	becoming a vampire lord and getting bloodcursed arrows after curing serana
1	i selected a different quest and now i can not get back to the quest i was on	what goes missing when changing your quest in diablo 3 ?
0	is it possible to be immune to dark attacks ?	what advantages do i gain from playing a game through steam ?
0	is there a way out of being stuck in base in siege mode as derpl ?	where are the save files in skyrim ?
0	how do i get a mount in moria ?	how do i unlock the new " second wave " options ?
0	most efficient unit production control group model ?	are you supposed to be able to beat limbo without dying ?
0	play harvest moon without reading game guides and the like ?	how to build a base in dayz ?
0	what is the maximum health amount i can have by using hearts to upgrade my max health ?	what is the time limit for turns in words with friends ?
0	why does diablo 3 insist on downloading 18gig when i try and install from dvd ?	is the old republic end-game focused ?
0	what are the recommended specs for minecraft ?	will my xbox 360 from the uk work when i move to australia ?
0	can you get three stars on all angry birds space levels using only one bird ?	how to voip/voice with my friends in battle log ?
1	increasing the amount of ip gained from battles	how much ip do you get for winning & losing games in the various modes/maps ?
0	i lost my game save by changing gameboy . can it be recovered and if not , will it happen again ?	how can i get the monsters to like me ?
0	what weapons can deal damage over time ?	does changing production transfer hammers ?
1	knockback on hit with witch doctor	how do " on hit " effects work with channeled / dot skills ?
0	what are the primary stats of your followers ?	help me to understand the alan wake ending
0	where can i find telekenisis ?	when reloading , are the remaining ammo in a partially empty gun magazine/clip discarded or not ?
0	what happened to steam 's second hand game market idea ?	does a crit boosted backstab do more damage against giant robots ?
0	is the first daily spin in bejewelled blitz rigged ?	is it possible to upgrade the barbarian 's stances ?
0	killed by another player ?	where is the switch or fuse box that will turn off the electrified fence in hero 's pass ?
1	bad math in borderlands 2 badass tokens ?	how do badass tokens work ?
0	requirements to turn the " achievements " statue golden	eat cake achievement game dev tycoon ?
1	minecraft launcher will not run with any version	minecraft gave up trying to download files
0	what are special miis ?	in minecraft i heard creepy music while mining
0	can i stop the steam client from crashing each time i shut down my mac ?	can endermen teleport up a hill with overhanging edge
0	strange nether portal bug	does a wizard 's lightning hydra proc the paralysis passive ?
1	how does a clan start a clan war ?	requirements for a clan war ?
0	what should guide your deck selection in the archenemy campaign in dotp 2012 ?	what carries over to new game plus ?
1	thieves guild skyrim - return the skeleton key or complete jobs in other towns ?	can i become leader of the thieves ' guild without finishing the main chain and is there any benefits from being the leader anyway ?
0	locking xbox 360	how can i find my followers skills and stats ?
1	how much armor/mr blocks . . . % psysichal/magic damage	what is the formula for armor/magic resist reduction ?
1	does water mean my city has a finite lifespan ?	does the water table replenish ?
0	is there any advantage to selling units before winning the game ?	bc filler is not working
0	what can i do with halo 4 and xbox smartglass ?	why will not the guide leave ?
0	how do you get past the owls ?	tekken tt2 - using weapon items from costumes ?
0	what do lollipops do ?	horde progression through the new azeroth
0	conditions for getting new migrants in dwarf fortress ?	is there an npc i can hire or create that will do my farming for me ?
0	frequency of the golden bowser train ?	dragon souls not activating new words
0	skyrim : hired goons are trying to kill me	does the xbox windows controller work with directinput games ?
0	how to remove buildings	is it even possible to have a melee based class play a range style in diablo 3 ?
0	how do i inspire more units ?	how do i remap the ' take screenshot ' in starcraft 2 when playing on keyboard without f13/printscreen ?
0	what is the blue swirl of wind that drains my magicka in skyrim ?	can i make custom characters not end up in their underwear when their armour breaks ?
0	what are some good counters to cassiopeia ?	what items are mutually exclusive between worlds ?
0	installing ftp game on steam without downloading again ?	how do i make people admin ?
0	what is the blue/orange symbolism in portal 2 ?	how do i know if there are any other player in my city ?
0	washing playstation controllers	how does background mode work ?
0	are there any gameplay relevant benefits of prestiging on cod:bo ?	are xbox 360 game prices displayed pre-tax ?
0	how do i get a horse/horse saddle ?	help with running siege of avalon
1	how many dragons are there in skyrim ?	do dragons respawn ?
0	at what point can i start playing against the bosses in naxxramas successfully ?	how do i strategically use promote ?
0	are fps browser-dependent in games like quake live or battlefield heroes ?	how do i earn reaper energy ?
1	how can i get dubbing or subtitles in portal ?	how can i get dubbing or subtitles to portal 2 ?
0	is elemental damage on a legendary gem affected by elemental damage on gear ?	how to use my gamepad globally as xbox controller ( on pc ) ?
0	can more playable characters be unlocked in mario kart 7 ?	how " disadvantage " works on starcraft 2 ?
0	what can i do if my single player enemies are too low level for me ?	how can i know which option is renegade and which is paragon ?
0	what is a good strategy for reave ?	are there any other asterisks in candy box 2 ?
1	how can i stop the ai great prophet from running around my cities forever ? ( civ5 )	can i politely stop an ai 's great prophet from getting to my cities ?
0	building a road to a faraway city state - are they kidding ?	does a socket count as a magical property ?
0	how does the from ashes dlc affect your war assets ?	what is the optimal way to use eagles ?
0	karaoke for xbox	does the misc item drop rate conflict with the hat drop rate ?
0	how do not let the game close itself	how does the game decide which building to center on when double-tapping a hotkey bound to multiple separate buildings ?
0	is enabling steam features possible for non-steam copies ?	how can i improve in the arena in big time gangster ?
1	what is the shortcut in diablo 3 to show item to a party without dropping it ?	how can i link an item in the chat ?
0	is it considered a loss if you logout or close the game during the countdown ?	how to defend in fifa 12 ?
0	how do i unlock skins ?	what is this purple tree ?
0	how do i find or earn higher level weapons in diablo 3 ?	what are the limitations in the dungeon defenders demo ?
0	back up saved games in galaxy on fire 2	how to reset base attributes skyrim
0	is there a way to group or organize friends within diablo 3 ?	can you determine protoss buildings while still under construction ?
1	how does a goliath level up ?	how do goliath enemies work ?
0	how do i apply a new card back ?	what is the deal with vsync ?
0	how do i use the grenade launcher effectively	why is my minecraft not letting me login ?
0	is counter-strike/counter-strike : condition zero compatible with cs : source ?	getting to terramorphous peak cult of the vault symbol ?
0	is there any way to get older seasonal achievements ?	how do i get past the laser detectors in the mission searching for proof ?
1	how does saving in a dark room work ?	can i start a game on one pc and continue on another ?
0	is there anything behind this door ?	input a 63-character wpa2 key on an xbox 360s
0	how to reach martial arts club : central ?	what does giving lutefisk to the lutefisk god actually do ?
0	what moves can i do while driving to avoid being blocked and get a dunk ?	what is the best mission to gain lots of money in gta v online below rank 3
0	what the difference between relative and absolute input ( mouse vs . joystick ) ?	how do i solve the puzzle ?
0	gta v installing disc 2 ?	how do i breed a peridot dragon ?
0	does uncharted have trophies on the ps3 ?	if two people who have never played co-op before play together , will they both get the " professor portal " achievement ?
0	does " holy cause " only work if my equipped weapon deals holy damage ?	what are various pros and cons of granting or rejecting military access ?
0	can i meet the grox or get to the center of the galaxy without antagonizing anybody ?	crysis2 complains of strict nat and cannot find session
0	when jungling , why do certain champions get blue first or red first ?	my 3d games crashing in these scenarios
0	where do i change mod settings	how to identify the real phantom lancer from the clones ?
0	why do decorator droids just dissapear when sent to a level ?	how do i access the desk and conference room computers in the lab ?
0	does an airstrike bring more money than shooting down over water ?	if i leave a companion in f:nv can i get him back later ?
0	help me fix minecraft	how do the melee weapons compare to each other in terms of swing arc and reach ?
1	lost follower on skyrim	i lost my follower ?
1	what is an initiator ?	what are the playstyles of the different roles ?
0	watch dogs crash on loading screen	is there any way to control which vehicles i get ?
0	what do i need to change to get these minecraft trees to grow ?	how can i play plants vs . zombies in full screen mode ?
0	how large is skyrim ?	in the star wars timeline , when does sw:tor take place ?
0	tutorials play very slowly , what can i do ?	most efficient unit production control group model ?
0	lost my bin folder and my minecraft binary files , what do i do ?	uqm : star *constellations* for balance of bio and mining
0	what effect does sludge have ?	can not seem to find sycamore after elite four in pokemon x
1	how do you get the purple shark fin ?	what is the item to the right of the green shark fin ?
0	is there a specific order to complete saints row 2 ?	how can i kill adorable animals ?
0	what yields the most points , to knock down all opponents , or to finish the task without touching anybody ?	do i need to buy multiple games to be able to play diablo 3 with my wife ?
1	how can i make it so people can not join on my minecraft pe world even when they are on the wifi zone ?	password protect a multiplayer game ?
0	which stats should i add to as an outlander using shotguns/canons ?	strange polygons appear in fullscreen
0	is there a way to transfer game progress from an ios device to android	where can i find my " face code " ?
1	anti-mob houses in minecraft ?	how can i protect my buildings against creepers ?
0	how do i become a vampire ?	minecraft redstone logic - comparing 6 inputs
0	how do i know who i slept with ?	how do clues in max payne affect gameplay ?
0	what determines military victory ?	how do i evolve kadabra to its final form without trading it ?
1	where is draven and how do i return his bow ? i can not find him anywhere	what quest is the object dravin 's bow from ?
0	are there downsides to saving my xbox live profile to usb ?	can you play l4d in 3rd person ?
0	can you select multiple players in a command ?	two stealth kills in less than three minutes
0	does setting a connection speed in steam limit bandwidth usage ?	how do i reset the super secret settings ?
0	what are the different tiers of armor ?	what are good z+t strategies for multiplayer starcraft 2 ?
0	how can i tell who i am allied with in crusader kings ii ?	rock band 3 and ion drum rocker cymbals
0	slam it all ! ( imported character abilities missing )	what is the most efficient way to reach the armor rating cap ?
0	what is the best way to kill a floater in dead island ?	where to find the secret monolith
1	how do i delete my clash of clans village and start over ?	restarting with new account
0	where can i get a few thousand replays sorted by league ?	how can a deaf player detect where monsters and caves are ?
0	joining an ipad-hosted game from android	how do i capture a stealth infiltrator ?
0	how to micro/counter siege tanks properly in tvt	what is the effect of solipsism , and how is it triggered ?
1	do you receive trading cards at set intervals ?	how often do trading cards drop ?
0	is there an npc who can repair to 100% in fallout 3 ?	what are these corruption stacks ?
0	why is the giant hothead/flashwing not working ?	what lubricant does sony use for the ps3 analog stick ?
0	why are my goblins panicking for no apparent reason ?	i am about to die in lava . how might i save my inventory ?
