0	how do i throw a meat shield after holding it from behind ?	when to build the stone quarry in goblin camp ?
0	how can i isolate the brotherhood virus ?	does volcano avalanche really have 3 times the damage of the other runes ?
1	what are the most expensive cars you can sell to los santos customs ?	which stolen cars can you bring to ls customs and what are their sell prices in gta online ?
0	after reviving my vampire companion , how do i get his equipment back ?	how do i buy cars in gta online ?
0	how long is a unit of distance ?	is it possible to skip battles when travelling in puzzle quest 1 ?
0	the legend of zelda ( original ) virtual console can not select item to use on b !	how many z-levels can a marksdwarf engage from ?
0	sims 3: mad scientist looking for a new job	how can i get a save file from a psone game ( played at ps3 ) , into my ps vita ?
0	why are not my soil-planted fireblossoms growing ?	having terrible lag on a certain server
0	random new world in conquest of paradise save reverts back to standard north america	if i finish the campaign mode , will i get some benefit when i play on-line ?
1	pvz2 far future incorrectly displays 24/25 levels beaten	how do i unlock level 25 of far future ?
0	is there any easy way to determine what equipment i am wearing ?	what is the name of the sequel to manic miner for the zx spectrum ?
0	obtaining the solar gun in metal gear solid 4	is elemental damage on a legendary gem affected by elemental damage on gear ?
0	what exactly is the difference with challenge mode ?	what are the proximity bonuses for adjacent buildings and when do they apply ?
0	absolute best race for mage ?	how do i get the new total war promo items for tf2 ?
0	do we keep votes from puppet citys as venice ?	how do i restart a game at a new-u and not a fast travel station ?
1	what are the effects of civilization v responses to other leaders ?	is there any diplomatic effect for " you will pay for this " responses when talking to other players ?
0	my tunnel bore has corrupted , what can i do ?	what is the highest you can upgrade the enhanced dwarven crossbow to ?
0	how many different endings are there for cave story ?	are there any racing wheels that support both xbox 360 and ps3 ?
1	how do vehicles become disabled ?	what happens when a vehicle is " disabled " in battlefield 3 ?
0	how to cancel acu upgrade	are item rarities different on 50/100/150cc ?
0	can i influence my steam region ?	how useful are watchtower upgrades in die2nite
0	how to get rid of bed head	can i play games made for windows on a mac ?
0	at what point do items that alter specific skills start appearing ?	what do the numbers mean on the passive skills section of the skill calculator ?
0	free screen recorder for games ?	how do i breed the amber dragon ?
0	why can not i access my hardcore permanent skill in kingdom of loathing ?	where can i find neloth 's apprentice ?
0	players outside of playable map in rush game mode - exploit or legit ?	will rabbits come out of their hole on their own ?
0	how do i fix the nightingale hood glitch where it turns white instead of its normal black color ?	does world of tanks really have a ' russian bias ' ?
0	how to tame/capture animals in dwarf fortress ?	how do i earn a higher level sega license ?
1	can you import someone else 's mass effect 1/2 save game ?	can i import someone else 's mass effect 2 save on a ps3 ?
0	what is mordekaiser 's role in team fights ?	what is the next item in the list after a pitchfork ?
0	how can i export super meat boy replays ?	will loading a level from the title screen mess up achievements/endings ?
1	is there a way to change the skills so that right mouse is not always secondary	can you assign right-click skills as 1-2-3-4 keyboard skills ?
0	can i continue after the last mission ?	do guild wars 2 beta characters carry over to the full release ?
0	where do i go to purchase unlocked characters ?	2 xbox live accounts signed into 1 console ?
0	how can i use a custom widescreen resolution ?	how to increase fov in borderlands ?
0	disabling the safe alarm in chapter 3 ( "enemy of the state" )	where is the potion shop near the second dungeon ?
0	what is the secret in the infinite purple room ?	how does " the hunt is on ! " work if kha'zix and rengar are on both teams ?
0	how long does it take to recharge the disruptor to detonate proximity mines ?	general rules for minion placement in hearthstone ?
0	psn downloads for the psvita --- interpreting game availability	rewards for completing landmarks and hints ?
0	my followers keep dying ! what am i doing wrong ?	can i mine diamonds with tnt
0	witch doctor build for inferno ?	when is the latest i can kill mr . house ?
0	when copying single player world to server , i lose my structures !	does the jag 's build bonus apply to moving allies ' buildings ?
1	does skyrim on the 360 allow mods ?	is it possible to get skyrim mods on xbox 360 ?
0	battlefield 3 freezes 5 minutes into the campaign	how do i get out of soul form ?
0	how many season i can play in manager mode ?	what parameters are taken in account in " stat changes if equipped " tooltips ?
0	are there any specific places where the bike spawns ?	what is the best area to farm the chestmaster 2000 achievement ?
0	is it possible to escape the yeti in skifree	does resolving the civil war make areas inaccessible ?
0	which bombs will i drop ?	contribution in rift : invasions , rifts , footholds and other events
0	what are the " payoff " times for eve learning skills ?	what must i do for " destiny dominated ? "
1	how do i activate the daedric gauntlet in the midden ?	what is the oblivion-symbol gauntlet in the midden ?
0	is it really possible to find group a pokemon on a ( ! ! ) bush with the pokewalker ?	with a flame runner , do you turn , drift , and turn the other way immediately to not turn so much ?
0	smart cast option for a specific champion ?	do galcon and galcon fusion track what boards or levels you have completed ?
0	how to handle the swiss-cheese like caverns ?	how do i know when it is time to push ?
0	can i be competitive in planetside 2 without leveling ?	which condition is converted to which boon ?
0	can pc users without the mechromancer dlc play with a user that has it ?	does changing the world size option affect the size and number of locations that are not on the main map ?
0	how to continue playing godus on different computer ?	is the door to nowhere important , or is it an easter egg ?
0	what happens to the governor and the troops which finally took over the village ?	how do i counter a suicide reaper rush as protoss in starcraft 2 ?
0	how do i export goods if there is a factory consuming them ?	when should i eat people ?
0	my 3d games crashing in these scenarios	how do i know what type of soul a creature has ?
0	gear for an inferno wizard ?	how to get ingress portal ownership duration ?
0	specialization name	are there any quests from mobs in mount hyjal ?
0	how do i pick up the batteries in slenderman : unknown chronicles ?	can i keep jaheira/khalid and montaron/xzar from killing each other ?
0	how to get the credit achievements ?	how long do corpses remain ?
1	what determines mission difficulty ?	how does enemy progression work ?
1	can not break any block in survival in minecraft	why can not i destroy or place blocks ?
0	what are the two floating circles/rings in the catacombs ?	company of heroes balance
0	is it possible to make a backup of my survival world automatically when i exit my game 1.6.4	minecraft : ftb/techic , cables not connecting to me controller
1	how has ros changed diablo 3 's legendary drop rate ?	drop rates for set / legendary items
0	i seem to be dying for some reason on inhospitable planets	do melee damage weapon mods affect heavy melee ?
1	is there a block that spider can not climb	are there any blocks that spiders cannot climb ?
0	how do you get the " running the show " achievement ?	what is an effective way of acquiring the demolition derby achievement ?
0	companion gear comparison	what are the different types of abilities and what do they mean ?
0	in civ5 , is there any point to immediately annexing a city ?	what are the patterns for finding savannah animals ?
0	can white critters drop legendary equipment ?	gmod addon trouble ?
1	how to change fov on kingdoms of amalur ?	how do i zoom out ?
0	how to get the ftl patch for linux ?	what can i win in the mine cart racing game ?
0	i just bought pokemon platinum , my brother got diamond . can we catch them all ?	my follower died and her dead body follows me instead
0	how do you progress to a new rank on the cs:go elo system ?	what are the best together mode weapon sets ?
1	why can not i get inside the college of winterhold ?	where do i get the key to enter the winterhold college ?
0	when to start or form a teamfight group ?	why does my follower never get up ?
0	what are the base line of sight values for units in age of empires 2 ?	what is the difference between sniper elite : nazi zombie army 1 and 2 ?
0	can i sort characters by how recently they have been played ?	do players only see loot usable by their class ?
0	do sheep regrow their wool in minecraft 1.0 ?	ipad touchscreen stops recognizing touch
0	what is the point of loading logs in riverwood ?	does deconstruction/removal regain used materials ?
1	leveling up in borderlands 2	fast leveling and easy experience farming
0	how can i enable chat in spectator mode ?	what does durability do ?
0	strategies for using turian solider proximity mines	where is michael mamaril ?
0	stuck on victus when he crashed	why does my opponent keep driving into a wall ?
0	installing a hard-disk on xbox 360 4 gb	stuck in flotsam
0	stuck after spawning in minecraft	is there a way to share my inventory to my friends ?
0	how can i download a free copy of battlefield 1943 ?	loading a single player world crashes with an internal exception
1	what are the pros and cons of taking the skeleton key ?	skeleton key . return or keep ?
0	cant play 1.7.10 minecraft with forge	can i use the xbox 360 headset for game sounds instead of voice chat ?
0	where are the dancers ?	why can not i beatdown deadshot in batman arkham origins ?
0	bought a new headset but no one can hear me	lego harry potter years 1-4 save on iphone
0	can i jump low walls more effectively ?	what is the optimal strategy for this game ?
0	what amount is needed to construct the world congress projects ?	is there an npc who can repair to 100% in fallout 3 ?
0	can i speed up showing tooltips in dragon age ii ?	how do i screw my neighbor ?
0	how does charm sniping work ?	do skins carry between characters ?
1	where to find specific monster items	where to farm rank 3 monster materials ?
0	how do you use items in the teemo mini-game ?	is there any advantage to having 4 units in your tank ?
0	are bunnies supposed to spawn only on the surface ?	what is the difference between teams and squads ?
0	playing a sneaky character in oblivion	why does updating my mtgo always comes up with protocol errors ?
1	how come the ai makes like 3000 gold per turn on warlord ?	how is it possible to have 700+ gold income ?
0	where are the lorestones in gorguath ?	what is the biohazard symbol on the player info card mean ?
0	how can i see my character again after breylna 's spell practice ?	cost for resetting trait points
0	how can you reliably survive uranium ?	more character dialog in tf2 ?
0	i can not view offline clan member 's profile	nether portal ( that has been used both ways ) suddenly move
0	can i run an snes emulator without it having input focus ?	where can i buy this speeder bike ?
0	how do i get the gold standard ?	do you lose your stuff when you go to point lookout
0	can green set items be picked up by other players ?	viewing stats ( such as critical chance ) in kingdoms of amalur
0	minimum psu numbers for gpus do not make sense ?	after a horse 's owner is dead , is it still a crime to take his horse ?
0	how do i set my level , unlocked weapon equip slots and playthrough mode ?	does blowing out candles count as destroying objects ?
0	halo:reach matchmaking campaign	chop chop ninja hd pause button
0	capturing culture specific wonders	what do each of the bonus wizards do ?
1	gta5 online : if i log off and come back in an hour will the garage buy cars again ?	how much time do we have to wait to sell another car ?
0	are there list of quests that might be unable to complete ?	problem spawning grunt off an item pick up in amnesia
1	when people turn to ash does it count as a body ?	does using shadow kill lower your chaos level ?
1	is there a way to hotkey builds ?	is it possible to quickly switch between attack types ?
0	my fugu in hatch is surrounded by flies but there is no poo . she will not eat . what can i do ?	how do you take screenshots on assassins creed iv on the ps3 ?
0	how smart are enemies on hardened and veteran difficulty on mw3 campaign ?	how do i earn " no one left behind " with as few squadmates as possible ?
1	i got stung by bees in animal crossing new leaf	where can i find medicine ?
0	who is in charge ? i want to fart on some authority figures to speak truth to power	how can i tell whether i should fight or flee ?
0	been hit by a spell cast during a timestop while i am invisible ?	how far does the piston extends ?
0	how can i get doc 's notebook from biff ?	when are sector sub-types determined ?
0	how to murder efficiently as an assassin ?	what are the weaknesses of the miracle rogue deck ?
0	how can you turn a rapid pulser on and off ?	what is the value of ip and xp boosts ?
0	is it possible to get the saved game progress from ps4 to pc ?	is there a way to view my current equipment from the auction house ?
0	where did the conduits in infamous second son come from ?	how to incorporate individual cells into existing cell blocks ?
0	built upward staircases in dwarf fortress do not reveal tiles ?	how to get the watchmen and overseers to stop attacking you ?
0	is there any point to the interplanetary shuttle in frontier:elite ii ?	why can not i get anywhere near the medal times for survival mode ?
0	starcraft ii profile url path	dwarf fortress saved games
0	why is there so much empty space on some df screens ?	can i get new crafting recipes from the trainer ?
0	how many ghosts are there , and what do they say ?	how can i make the transmute spell more useful for producing silver ore ?
0	levelling in fifa 12	minecraft 1.6.4 - different mods on different profiles on the same version [ linux ]
0	does the flag on dante 's jacket change ?	how do you beat the choices , choices challenge in hero academy ?
0	can all items drop anywhere ?	does the a press to " x is attacking y " need to be on-beat to initiate a combo attack ?
0	on minecraft multiplayer , do all the members in the server save a local copy of their attributes and the map ?	how do i obtain a golden frying pan ?
0	i do not remember all my me2 choices . can i look them up somehow ?	will i be able to purchase items from steam market after additional credit transfer ?
0	what items carry over between campaign missions ?	minecraft 1.4.6 force update problem
1	what is the advantage of very-rare items over common or rare items ?	what are the differences in ingress portal shield types ?
0	do non-microphone standard stereo headphones work with ps vita ?	how do i get the lava in my lava fountain to flow ?
1	wow : post-cataclysm zone levels ?	horde progression through the new azeroth
0	does becoming a vampire/werewolf change your normal appearance in eso ?	what materials are required to craft a full set of exotic armour ?
0	what determines if a player will prematurely die while downed with second chance ?	bioshock 1 for pc stuck at first level
0	is ea sports active multilingual ?	why are there heartless in kingdom hearts 2 ?
0	how did i get kills without gunship or missile as a commander ?	can i save my campaign on computer 1 , and then continue on computer 2 ?
0	payday 2 inventory capacity increase mod ?	can i play black ops 2 without playing the first one ?
0	how does growth and food work in pandora first contact ?	use phone keyboard to control pes on android phone ?
0	can not end mission at msv strontium	are charisma , dignity and ferocity used for something besides npc dialogs ?
1	modern warfare 3 multiplayer xbox360 and ps3 same servers	does mw3 support cross-platform multiplayer ?
0	what are the benefits/consequences when deciding the fate of the rachni queen in mass effect 3	how do i re-enable civ 5 's opening movie ?
0	how can you make minecraft look like it did back in the alpha stages ?	why does power management ignore logitech rumblepad 2 input in windowed mode ?
0	iphone galaxy of fire - finished opening campaign , now what ?	would an old nintendo wii remote work with a wii u ( without the gamepad ) ?
0	how do i get out of the rocks around the chest in the maze ?	do the charge badges in streetpass mansion stack ?
0	what is the difference between dr . robotnik and eggman ?	how does the spawning pool work in goblin camp ?
0	how can i find all buildings of a certain type in anno 1404 ?	what is cat & mouse ?
1	how do i kill a dragon critically ?	what are dragons most vulnerable to ?
0	what are some good armors dark souls 2	how do i get the last energy sphere in level 1-2
1	is there anyway to reset my stats in black ops 2	how does resetting work in black ops 2 ?
1	age of empires iii : lag in multiplayer game ( lan )	aoe3: multiplayer game through lan lags
0	hot shot feat of strength	adding foreground blur to enbseries dof in skyrim
0	what strategy do you use to level up fast ?	when does the great wall become obsolete ?
0	what is the " a " button on the pc ?	how can i counter thornmail ?
0	where can i find serpent emblems ?	is iris 's gifts set story points ?
0	do the minor conflict decisions on the citadel have any major impacts ?	what is the difference between non-player characters ( npcs ) and bots in video games ?
0	how do i get more factories built in victoria 2 ?	why does world of goo on the ios have to be downloaded via wifi ?
1	what is a gib/gib kill ?	what is the meaning of the term " gib " ?
0	is there any story justification for " traversing the white light " ?	what are warning quests ?
0	what is the penalty for dying in swtor ?	can i lose a follower by horse riding over a long distance ?
0	ksp : lv909 and nuclear engines flaming out ?	do i need to be influential with my human teammate to win tourism victory ?
0	how can i make a glowing mushroom farm ?	what are all the keyboard/mouse controls in skyrim ?
0	when should i pick a fight ?	i can not get past the opening splash screen when i try to start playing skyrim
0	what is the purpose of desura 's cache diretory ?	magma location
0	optimal mission order in regard to unit upgrades	how can i determine which part of the game is best/worst for a particular champion ?
0	how can i save a game to a usb stick on playstation 3	if i am farming the warrior using the moonshot , can i switch to the new tiny tina dlc and still farm ?
0	how can i check which coop missions i have gold medal in red dead redemption ?	allow minecraft to use more cpu
1	how do i apply mods to minecraft ?	how to install mods for the new minecraft launcher
0	how do you delete your first world on minecraft ?	when should i start farming crawmerax minions for efficient leveling ?
0	do the boxes and containers in borderlands work much like the different kinds of chests in diablo 3 ?	why does haunt ( consuming spirit ) slow ?
0	is it possible to re-name crew-members in-game ?	how long does a booster trooper guest pass last ?
0	why can some games run on my computer , but some others do not ? is it my video card ?	what is the best set of runes for a fast jungle with warwick ?
0	where can i find agents for a relatively new player ?	fml will not run in demo mode
1	minecraft multiplayer : how to get rid of a bunch of ender dragons	is it possible to remove animals from a minecraft map ?
0	how does steam work with alternative accounts ?	is there pvp in diablo 3 ? how does it work ?
0	do cards come back ?	how does regaining my vigor work ?
1	can i play assassin 's creed 4 in windowed mode ?	does assassin 's creed iv have a windowed or fake-fullscreen mode ?
1	can starter edition/guest pass characters carry into the standard edition ?	do guest pass characters carry through an upgrade to the full game ?
0	random stone brick replacement with worldedit in minecraft	how many degrees can the sniper autoballista turn ?
1	where is the battlefield report for the act iii achievement espionage ?	where are the act 3 lore books ?
0	how do you run ?	on ac4 it wont let me buy the last upgrade 's for the jackdaw , is this normal ?
0	get woodland grace in skyrim	any way to buy buildings not for sale in the guild 2 ?
1	how do i guarantee a finishing move animation ?	what determines when you do a finishing move ?
0	why did caesar 's legion become hostile to me ?	does the ios version of chrono trigger put save games in the cloud ?
0	how does one pump huge lakes of lava fast ?	what is the most efficient way to get ( rid of ) experience ?
0	what is with the gas ?	fighting a zero suit samus cpu in brawl
0	need a little help reading aid items	how to ease bots ( ai ) management and configuration ?
0	if i buy little big planet 2: special edition from craigslist , will i still be able to use the " bonus content " offered from the special edition ?	how do you compare 2 players in different leagues in sc2 ?
0	what is the best defense strategy for survival in grand theft auto online ?	daoc can not connect to update server
1	how much should we spend on wards ?	how do i ward properly in league of legends ?
0	how can i breed a panlong dragon	how does bayonetta shoot the guns on her feet ?
0	do frenzys/cookie multiplyers add to the amount of cookies wrinklers drop ?	do critical hit bonuses apply to staves ?
0	can i get blackboxes from ships i did not destroy ?	how much money do you make for returning craft safely to kerbin ?
0	in infinity blade 2 how many times we can use a secret ?	how can i integrate my game libraries in steam and desura ?
1	when can you roshan solo ?	hero that can solo roshan at an early level aside from ursa
0	why does all the basic commendation gear from vendors have no defense ?	is there any way to quick switch between first and third person perspective in skyrim ?
0	how can i easily remove caves for my mob trap ?	reinstalled starcraft 2 ( new system ) , lost my achievements
0	what is the " media " section in steam for ?	how to highlight interactable objects in skyrim ?
0	multiple questions on tropico 3 game mechanics	how long is vayne 's tumble animation ?
1	how do i add a game to steam i have purchased somewhere else ?	can i register a retail boxed copy of a game with steam ?
1	is my video card " better " than the one in system requirements ?	how do i buy a graphics card ?
0	tools not working on garry 's mod multiplayer	turning off new shop in heroes of newerth
1	dawnguard vampire lord and companions werewolf question	how often can i change my mind about vampirism or lycanthropy ?
1	what is the minimum number of booster tracks needed to get up to full speed ?	what is the maximum number of powered rails in a row that is useful ?
0	was there a playable helicopter in the first grand theft auto ?	what am i missing from my inventory ?
1	how to install gta v play disc on my xbox 360 ?	should i install the play disc or not ?
0	how do i get the end of the world ?	foiled game singleplayer ?
0	does yorick 's passive count towards his ultimate ?	how to get 5 biohazards in plague inc
1	my minecraft lan	why is not my minecraft lan server working ?
1	'ping ' in multiplayer games	what is ping , and why is it important ?
0	fulfill a krogan 's dying wish	blind eye pro - what qualifies ?
1	how to easily get gold coins ?	how do i earn gold ?
0	shouting gets disabled the moment i need it most ?	does viewing the map pause the game ?
0	are there variations in the value of goods sold ?	both my opponent and i are in waiting mode for the game ?
0	how fast does pac-man move ?	x3 albion prelude custom game start
1	thinking of buying elder scrolls anthology used , will steam code still work ?	retail boxed steam activated games : can they be resold ?
1	how do i retexture minecraft blocks	how do i make a custom texture pack for minecraft ? ( 16x16 )
0	what chemistry sets come with the " collector 's " quality ?	what kind of weapons to use in unepic ?
0	minecraft greed trap	how to bind my controls permanently ?
0	what makes bolts of kessak the devourer so special ? ( got it ! )	how do you clear the saved-games , high-scores , etc . from ( some gameboy ) cartridges ?
0	can not click the buttons in the pause screen	how can i turn on battle animations when playing online in civilization 5 ?
1	skyrim skill damage cure ?	why is my archery skill lowered in the skills view ?
0	will your pokemon always lose hunger at the same rate ?	how to trade power between cities ?
1	when would i want to be somebody 's friend ?	are declarations of friendship worth it ?
0	how do i attain a 100% approval rating ?	how do i get the second to last achievement ?
0	does multiplayer difficulty scale with the number of players ?	what are some good counters to cassiopeia ?
0	do unlockables run out ?	ignoring front missions , can this cause popularity to drop ?
1	what stats should a wizard invest in inferno ?	what stats are best for casters ( wizard/witch doctor ) doing inferno ?
0	problem using kinect for chat	how is the match bonus in modern warfare 2 determined ?
0	what is the best hm pack mule in generation v ?	what is the max level in steam version ?
0	dragons age : origin mac version	how can i beat level 3-15 in angry birds ?
1	does the distance between nodes effect the advance of the rebel fleet ?	is rebel advancement determined by the distance between two beacons ?
0	what kind of helicopter hats can i wear ?	how can i tell which weapon is rare in mass effect 3 ?
