0	how to get to the third giant in sen 's fortress in dark souls ?	tropico 4: how do you level up character traits ?
1	if i have 100 ad and my opponent has less than 0 armor , will i deal more than 100 damage ?	how does negative armour / magic resistance work ?
0	how do i get an older windows 95/98 game to run in windows 7 64-bit without some colors looking off ?	what is the easiest way to farm gil ?
0	how do gregtech machines explode from rain ?	most effective base set-up ?
1	can i use red stone in pocket edition ?	how to use redstone dust in minecraft pe . 0.8.1
0	what is the best place to get monster claws early in the game ?	when do smoke grenade defense bonuses apply ?
1	these decision are too hard	what alignment is action mode ?
0	after blocking someone , how do i keep someone from chatting ?	how to report people terrorizing the lobby
0	is healing blade nerfed too like all other life steal ?	how should i search for jungles and jungle temples in minecraft ?
0	how do the different difficulty levels affect the gameplay ?	what easter eggs are in hearthstone ?
1	how can i have my friends join my lan server ( on minecraft ) if we are not using same wifi connection ?	how can i trick minecraft into thinking two computers are on the same wifi network ?
0	how do you share dlc across multiple profiles ?	where do i find an expert engineer or expert cook ?
1	how can i go back to the overworld when playing in creative mode ?	i have lost my portal home , and i am invincible . how can i leave the nether ?
0	if i have 100 ad and my opponent has less than 0 armor , will i deal more than 100 damage ?	is anyone playing recent builds of aprq2 on linux which has a save game bug ?
1	enchanting armor with fortify magicka regen and fortify [ school ] ?	fortify destruction and magicka regen enchantment on armor
0	in arkham city , how do you interact with azrael ?	how do i transport my titan across water ?
1	how to identify unidentified items in diablo 3	how do you identify rare items ?
0	can you change a hero 's save slot ?	how to get this chest in noria mines ?
0	what are the advantages and disadvantages of each choice for ships doctor ?	armour ratings and armour values
0	what does the sorceress 's hat do ?	is my relationship level affected by only my actions ?
1	left 4 dead 2 special infected tips for versus	how can i avoid being detected as an infected in left 4 dead 2 ?
0	custom name data tags with /summon	my game tends to crash
0	does a wii/3ds automatically notify you of game updates ?	my gamer profile does not have permission to access member content but i have family settings off
0	why are vendors offering ( much ) less gold for items than expected ?	what happens if i succumb to demonic temptation ?
0	how does the ' cash for relics ' shop work ?	is there any way to hide your steam status from others ?
0	minecraft ( ftb ) lags with fps of 100/200	will i lose my shot at the law pistol if i complete playthrough 1 ?
1	when i break a block it reappears and when i place one it disappears ?	why can not i destroy or place blocks ?
1	bioshock infinite ending - everything is messed up	how does the ending fix anything ?
0	where is nobutsuna kamiizumi and alternis dim in chapter 5	how far is 1 meter ?
0	how can i know which option is renegade and which is paragon ?	why does this put 1/2 of items in top chest ?
0	follower 's inventory does not show up for trade	unlocking weapon slots in borderlands 2
0	empire defense 2 - what do the drummers do	how does chronology work in the final fantasy 10 universe ?
0	crime .netoffline play ?	can i deactivate a ps3 i can no longer use ?
1	damage based on ult cast or on hit ?	when are teemo 's bomb 's damage calculated ?
0	is there any way to use a controller with feeding frenzy 2 on pc ?	hero that can solo roshan at an early level aside from ursa
0	what does the icon next to your squad leader 's name mean ?	is there access to beyond hardest ai in super street fighter iv arcade edition ?
0	what does " ship spinning " mean in eve ?	how to defeat yak liches and the yak master
0	how to enter a custom server	playing gothic 2 without playing first chapter
1	where to buy lumber ?	where can i buy sawn logs for all the different plots in hearthfire ?
1	faralda is not at the college	can not get into the college of winterhold
0	planetside 2 cert points system	how do i fail the first level ?
0	do mini-sentry guns count for the gun down achievement ?	do an imposter ditto 's nature , ivs and evs matter ?
1	is there a difference in difficulty between hardcore and softcore ?	differences between hardcore and normal heroes
1	is there a way to skip the " choose production " option for a city for a turn ?	civilization 5 unending turn ?
0	why can not my unit attack within two hexes ?	minecraft 1.6.2 alternate mod loader folders
0	where and how do you download mcedit ?	what ingredients make strengthen enchanting potions in skyrim ?
0	anarchy online in wine on mac ?	when copying single player world to server , i lose my structures !
0	possible graphics driver problem	what weapon does the most damage in early game ?
0	the bureau is not giving me any missions any more	how do i fix bugged quests on consoles ?
0	how do i stack enchant with area for spells ?	how to take backup of your xbox 360 games ?
1	how do i use scorestreaks ?	how do i use my scorestreak ?
0	does the drop-boost still exist ?	in what order should trading centers be established in the campaign flying trader ?
0	conflict between railcraft and gregtech in minecraft 1.6.4	do origin cloud saves work properly with steam ?
0	what level can a bounty hunter dual-wield pistols ?	in delugerpg , how do you get groudon ?
0	why will not zombie villager kid take the golden apple ?	are there any practical benefits to humming ?
0	chad ( world 2 boss ) level bugged in super meat boy on osx	traders standing at the corner of the map
0	what is the use of magnifying staffs ability ?	stuck in shadowrun returns ntsb warehouse part 2
0	options for boosting signal over dsl/live match for xbox 360	what is the deal with the new rarity level in the captain scarlett dlc ?
0	how to reconfigure my xbox 360 hard drive back into a hard drive ?	qualities of a good custom starcraft 2 map ?
0	what zombie game is this pvp comic referencing ?	stuck in flotsam
0	do my companions gain abilities by themselves or do i need to train their abilities somewhere ?	why does the ammo bar color change ?
0	can you transfuse a damaged structure while it is being built ?	is there a solution to xcom - enemy unknown save game bug ?
0	the android version of open ttd has the multiplayer window too large for my display	blademail damage return type
0	how can i reduce latency while playing world of warcraft ?	what is the most efficient way to light a plane to prevent hostile mobs spawning ?
0	differences between the ios & android versions of guardian cross ?	is a sensor tower useful in starcraft 2 ?
0	how can i prevent mobs from escaping from my mob zoo ?	when would i want to be somebody 's friend ?
1	why does my mouse not work in counter strike global offense ?	cs go having problem playing with friends
0	how many dragon souls do i need to unlock all shouts ?	how does value affect the gain of smithing experience ?
0	how do i auto equip items into empty inventory slots ?	is it worth if the entire team takes smite ?
0	does affinity stack ?	why are my vassal bishops paying taxes to the hre kaiser ?
1	why wont minecraft let me break blocks or use my inventory	why can not i destroy or place blocks ?
0	how can i make guests come in my second home ?	what race would be better for a beginner in starcraft 2 ?
0	what can i do about baby starvation/dehydration after mother was injured ?	witcher 2 will not start
0	what xp gains are affected by shrine of enlightenment ?	what combos are available in batman : arkham city lockdown ?
0	transefer time is included to passengers transportation time ?	what is valve test sub 74 ?
1	how can i tell how long ( more or less ) it will take me to complete a game ?	how long to beat disgaea ?
0	in df2014 , what causes traps to attack own dwarves ?	how can i shatter the cockpit of an atlas ?
0	how to create a line of wool sorted by color ?	nc max anti-infantry weapon choices
0	how to get the " offline mode " log entry in anno 2070 ?	how do i get the sand hawk smg ?
0	what is " copying a frog " in pocket frogs ?	ward placing on bottomlane
1	how to equip serana ?	my companion will not wear her armor
0	what is the most efficient way to gain fame ?	can retail xbox one and playstation 4 game disks be “upgraded” to digital ?
0	is the nintendo 3ds region-locked ?	do different merchants pay more for items depending on their type ?
0	in intensity stacking conditions	is there a way to change kyogre 's nature or any of the legendaries ?
0	can i sort my steam games by installed size ?	d3dcompiler_43 . dll contains an error
0	how can i return the golden claw ?	pumping stations not working ?
0	unepic : where i can find the first healing tome ?	how do i pick up an ectoplasmator in runescape ?
0	smithing capacity ?	which hold item is more effective ?
0	is there any recognition for doing assassination quests for the dark brotherhood after you complete the main questline ?	play the same saved world around the ( real ) world seamlessly
1	do guitar hero peripherals work with rock band and vice versa ?	[ how ] can i use alternate controllers for rock band on my ps3 ? ( *i . e . * , my guitar-hero controllers . )
0	is it possible to delete useless links on friendly portals ?	is there a way to use an iphone as bluetooth headphones for a ps3 ?
0	minecraft nodus config and begone control settings not saved	in rock band/guitar hero , what is the best approach to hand postion on the guitar for hard ( and higher ) difficulties ?
0	in planetside 2 does activating your shield as heavy assault slow your movement speed ?	where can i find more diamonds or champagne ?
0	how do holo calls work ?	is that possible to create a villager who sells pufferfish ?
1	how to become better at super smash bros brawl ?	how can i become a pro at super smash bros . brawl ?
0	what is the maximum number of hearts you can get ?	what time does the daily quest timer reset ?
0	how do you join or create a server in multiplayer ?	what are the power requirements for a carpenter ?
0	how can i press the # key in a dosbox game ?	is the halo 4 goty edition dlc on the disc or an included code ?
1	minecraft pocket edition multiplayer not working	how to join games with minecraft pocket edition 0.7
0	which unit to build first ?	does sweeping wind activate resolve ?
1	how do i progress more ?	how do i pass the forest stage on candy box 2 ?
0	what are the benefits to taking a concubine as a pagan in ck2 ?	does running away from pokemon while chaining stop the chain ?
0	how can i run diablo ii on mac os x 10.7 ( lion ) ?	why can not i record pvzgw ?
0	how to win the rebellion in poland 1066 ?	in minecraft i found a zombie with an iron enchanted shovel but my brother never made one
0	how to fix ( sporadically ) jerky animation for loading books or using enchanting/alchemy/smithing instruments in skyrim ?	can you play coop online ?
1	can you complete all angry birds space levels using only one bird ?	can you get three stars on all angry birds space levels using only one bird ?
0	how can i shatter the cockpit of an atlas ?	convincing a camper to move in ?
1	can i move the minimap to the main screen ?	is there anyway to get an onscreen map ?
1	what does tracking do in bf4 and what are field upgrades ?	what affects field upgrades in bf4 ?
0	having a guest on a local xbox join a party on mw3	which kinds of objects are worth destroying for fragments ?
0	what is the simplest layout for a truck proof bridge for bridge 1 in " the ridge " ?	do vehicles load/unload faster the more that the resource is covered ?
0	cheapest/fastest way to raise a mind mag ?	can i do anything about a grenade in mass effect 3 ?
0	how to hit frank wests ' servbot head hyper combo ?	can i stop the steam client from crashing each time i shut down my mac ?
0	how can i tell what my spells ( signs ) do ?	did minecraft 1.4.2 nerf high level enchantments in favour of the new anvil ?
0	diablo 3 skill progression	what does the luck attribute do in morrowind ?
0	just downloaded minecraft no bin folder or minecraft . jar	how to get better gear as a high level character ?
0	in minecraft how do i make a video with my secound account moving around by itself ?	where can i read hints again ?
0	how do i uninstall black mesa if it was not installed via steam ?	number of tiles in civilization
0	installing command & conquer 3 on a new computer	what are the benefits and drawbacks of sprinting ?
0	when do my skill point modifiers apply ?	do claws have any special effects ?
0	what is a reliable way to determine if a container is safe ?	does a mutation count as a campaign ?
0	how do i acquire artifacts ?	warping to certain bonfires ?
0	what is the lowest level you can get kairoes without gems or real-life money ?	how useful is spark ?
0	ascendancy ships not availible	how do i solve the first set of clues in part 1 of paper trail ?
0	unlocking warcraft 3 reign of chaos campaigns	windows/modded minecraft performance : how can it be improved most effectively and cheaply ?
0	not getting into flotsam anymore	what are the misc . stat categories in offspring fling ?
1	how to see diablo vs imperius	where can i view cinematics i have unlocked ?
0	what does the sewer qr code return ?	bit . trip runner crashes immediately on boot
0	how can i/am i able to set up a macro to cast several spells in sequence in wow ?	how do i copy an xbox 360 game to the hdd ?
0	starcraft 2 - installation help	what is wrong with my mob spawner ?
0	lonesome road dlc	the conditions are right . where 's my mega stone ?
0	how can i see the ingredients for equipment in atelier totori ?	does the misc item drop rate conflict with the hat drop rate ?
0	can i save the guards stuck in the walls ?	are there any advantages to playing cod : black ops multiplayer in 3d vs . 2d ?
0	what can i do to improve the very poor performance of rage ?	why am i not getting any crystal ?
1	how can i enable civ 5 mods button on mac os x mountain lion ?	how can i enable civ 5 mods on mac os x ?
1	how can i find the hidden level ?	how can i reach whimsyshire , the secret level in diablo iii ?
0	can i play cardinal quest in a window ?	how to know more about creatures ?
0	feed the beast unhinged version history	do towers and/or minions regenerate health ?
0	do guards/npcs respawn	does dead man 's hand require you to have c4 equipped ?
0	how do you destroy walls behind your house ?	can you acquire the infinity blade other than buying with earned gold ?
0	how many total perks are there in skyrim ?	fastest way to farm ip ( general assumptions inside )
0	why can not i unlock the last 6 or so levels on tiny death star ?	is there a macro player/recorder for games ?
1	i could not get the mega stone upgrade	why is my mega stone not in the location it should be ?
1	is there a car faster then the adder in gta v ?	what is the fastest car in gta 5 , and where can i find it ?
1	what does the " black mushroom " good for in the full version of d3	what is the " black mushroom " item used for ?
0	where are the rift and the reach ?	skyrim " summon arniel gane " casting technique ?
1	minecraft servers not connecting	why does every server i try say it can not connect ?
0	do speed boosts only apply when at full health ?	premature vs mature town hall
0	how does "3x damage " work ?	hated with the legion early in the game - do i have to restart ?
0	how dangerous is it to explore aimlessly in breath of death vii ?	do special buildings need citizens to produce benefits ?
0	how does attack speed stack ? is there a point of diminishing returns ?	is there a vendor who sells golden carp ?
0	what can hit me during smoke screen ?	how to use the phone ?
0	big trouble in a talking barrel ?	do any of the dead rising 2 books help combo weapons ?
0	price reductions on xbox live arcade games	why is this rare belt account bound when i did not reroll it ?
0	does inspiring presence stack ?	skyrim install problems
0	farming using mob spawners in minecraft	error logging into minecraft
0	paper mario best sidekick	is spawn killing a good reason to report a player in battlefield 3 ?
0	lightning strike locations	where do i find the china broom shotgun that comes with the gamestop pre-ordered version ?
0	how to get mods on a hardmod ( modchip ) original xbox ?	what merchant has the most gold ?
0	practical solution for giant spike balls	is parry available in pve ?
0	does it matter how i complete " under saarthal " ?	can i redeem my reputation with a faction ?
0	how do i launch sid meiers civilization 5 to play in offline mode ?	are there list of quests that might be unable to complete ?
0	what are the roles of supports in team fights ?	does a mutation count as a campaign ?
0	how can i change my controls ?	can all items drop anywhere ?
1	is my character ambidextrous ?	do weapons and spells in the off-hand suffer from reduced effectiveness ?
0	at what level do items start producing higher-tier crafting materials ?	why does not barry shoot his shotgun sometimes ?
1	i broke my quarian . do i get a replacement ?	does anyone step in to fill the holes in your roster ?
0	where can i find a listing of games that run on iphone 2g ?	why should i wait to turn in items for " turn-in " ( gather items ) fates ?
0	how to use the wire cutter tool ?	how can i stop getting bsods when using motioninjoy ?
0	should i move offices ?	is it better to not buy some upgrades in temple run ?
0	do i always get an abundance of just a couple different metal ores ?	what is this object on my map ?
0	what is this object on my map ?	do you lose anything when you die in watch dogs ?
0	what is the difference between yellow and white unlocked storylets ?	what should my stat priority be for a demon hunter ?
0	what pieces of eqipment are safe to sell ?	is it possible to use a wii extension controller on a pc without a wiimote ?
0	if you and your angel both end up with the stone status do you get kicked out of the dungeon ?	how can i get outfits ?
0	what is a high damage infiltrator setup ?	where can i buy sawn logs for all the different plots in hearthfire ?
0	what are these glowing yellow objects ?	cities xl not starting after windows reinstall
0	is the order of the missions story relevant in starcraft 2 ?	what does the ' forgeborn fireheart ' skill do ?
1	how does trail of cinders work ( both 1.04 and 1.05 )	how is skill damage calculated based on weapon damage ?
1	how do i make signals in dota ?	how do i call a specific hero missing ?
0	how do i get to the top of the room with the frost boss after killing him ?	can you make an ectoplasmator into a staff ?
0	options after completing borderlands	increase of monsters with increased difficulty ?
0	what are devout units ?	how to place a quarry in tekkit
0	can i play games that existed in the sega genesis/mega drive platform in my pc ?	how do the different difficulty levels affect the gameplay ?
0	which type of pokemon are affected by the move " whirlwind " ?	is there a way to buy cheap health potions ?
0	how do i perform a ledge-pull kill ?	what determines my respawn time ?
0	when to stop worker production	which truck has the highest hp ?
0	is there a way to tell my horse to get lost ?	do the conditions of skins i put in the trade-up-contract affect the condition of the resulting skin ?
0	are enemy subtypes level restricted ?	how can i hold off a 2 player 7pool rush ?
0	is the amount of sand finite ?	how to build a water lander that can move ?
1	exactly how do crimson/corruption/hallow spread , and which blocks spread them ?	how does corruption spread ?
0	is it possible to dig through a damp stone ?	is there a way to disable the mighty eagle icon ?
0	what happens when an item 's durability drops to zero ?	why did onin tell the krimzon guard about jak 's arrival ?
1	which challenges unlock skins ?	collecting all skins and customizations
0	what are the sidequest i can do before mt . bur-omisace ?	what do i do with ship gummies ?
0	how do you train falxmen in rome total war ?	target priority for turrets ?
0	techniques for playing wrench tennis effectively ?	how do i convert a down stairway to an up/down stairway in dwarf fortress ?
0	switching ammo for bows in terraria	is there a hotkey for the general " next move " button ?
1	gun lost in battlefield 3	i keep having to unlock the same things over and over again for battlefield 3
0	dragonvale app does not have facebook login	how does the link amp mod affect the maximum link range for portals in ingress ?
0	league of legends crashes on windows 8.1	what does the star mean in the screen selection ?
0	what is the relation between shin megami tensei and persona games ?	where can i find altair ?
1	strategies for obtaining weapon/character/equipment upgrades in mass effect 3 multiplayer	are spectre or veteran packs more cost effective ?
0	how can i speed up or slow down old 3d games ?	left mouse button will not work in games
1	unlock first house in the village	where do i get the key for the first house ?
0	what level is recommended before starting nightmare/hell/inferno ?	possibly for slow client to dupe
1	what salvages into what ?	at what level do items start producing higher-tier crafting materials ?
1	what is the armor movement penalty ?	what are the movement speed effects of walking & running with or without weapon drawn and heavy or light or no armor ?
0	how do i take out the cops ?	victus and wrex have disappeared
0	extending the pedal cable on a " madcatz microcon mc2" steering wheel ?	how to build elevators in single player mode ?
1	houses in skyrim	what are the locations of all the purchasable houses in skyrim ?
0	disable " wrong way " timer in nfs:shift 2 ?	mysterious right-angled triangle with a chain of circles around it ?
0	how do i trade my friend 's genuines ?	is the retroblade mount available to all characters ?
0	who are the dwarves of the pink galley ?	what are the differences between xbox 360 consoles ?
0	heavy rain branches	is there a way to open everything in my park at once ?
0	when fiora does her dash attack , why do not abilities affect her ?	how do i pass the last level of bugdom 2 ?
1	is bawsaq down / under maintenance right now ?	why is bawsaq still under maintenance ?
0	playing red alert 2 yuri 's revenge ra2 with white boy 's rules mod online multiplayer mode	why can not i download an already purchased game on steam to my other pc ? ( via steam )
0	vim adventures level 10	how often can i change my mind about vampirism or lycanthropy ?
1	can i play my psone games ( previously bought for ps3 ) on ps vita ?	does the vita 's backwards compatibility with psp games extend to ps1 games ?
0	getting " unable to load steam . dll " when trying to load peggle extreme	can a bounce of luna 's glaive be evaded with normal evasion ?
0	is there a way to use the rmah if all you have is a pay-as-you-go phone ?	how do you craft the new nether blocks ?
0	how much cdr does yasuo 's q get from bonus attack speed ?	what does the x1 elemental damage mean ?
0	how does snare effect work ?	final fantasy 8 on windows 8
1	in skyrim , i told my follower to stay somewhere , but i have forgotten where . how can i find him ?	i lost my follower ?
0	what is the most efficient way to find caves in minecraft ?	is it possible to hit your own men with normal weapons ?
0	how to heal heroes and armies ?	recording gameplay from my console
0	no pearl dragon - 15 pairings already	how can i clown-proof an area ?
0	how can i tell which way mushrooms and powerups travel when hitting a ? block ?	i am seeing bright lights at the end of this tunnel in seiklus , should i be worried ?
0	check balance of inactive account on eve	urban terror not launching on mac os x
0	is it possible to rejoin a dungeon in progress ?	how is a hero 's individual progress calculated ?
0	how can i make sure to get a storyline mission from a specific corporation ?	does dual wielding have any effect ?
1	installing diablo 3 on multiple computers	do i need to own diablo iii to download and install the game ?
0	how do you open the door to mr . burke 's office without being detected ?	default dota 2 config . cfg file ?
0	does starcraft 2 have cheat codes ?	making player invincible to mobs , but not other players
0	does the scorpion pistol work as expected with mods and ammo powers ?	is it more effective to aim for the head in day of defeat:source ?
0	how do you identify " manipulated markets"	can you silence summoner spells on league ?
1	do all orange ( upgradeable ) items have the same base stats ?	what is the deal with orange items without stats ?
0	what is the use of the traveled distance in the near application ?	in skyrim , how is the duration of the slow effect from frost damage determined ?
0	why is not the dispenser giving me spectrespecs ?	having trouble getting steam terraria running in linux
1	why does clairvoyance always point me in the wrong direction ?	details on clairvoyance ?
0	do nether strongholds only spawn within a certain radius ?	how does one get in the steam mobile app beta ?
0	how much is the total cost for each town hall level	why do not animals always follow me when i am holding wheat ?
1	can not find mega stones	why is my mega stone not in the location it should be ?
0	are these chickens or ducks ?	how to view regular tribute of our fraction to/from another one in rome total war ?
0	how is accuracy calculated in battlefield 3 ?	how can i drain power from a door lever post and charge an inactive one ?
0	can not return to my house after falling in lava	why is there no dialogue options for serana to follow me ?
0	what achievements/challenges are missable ?	what are viable roles for leona besides support ?
