0	does medic grenade hurt my teammates ?	why is the first assassin in the city not available for missions ?
0	strange mouse cursor change during games	how to complete " if they came to hear me beg " achievement
0	what are the spawn / despawn rules for mobs for the minecraft xbox 360 edition ?	what is the impact of a good support in a ranked solo queue game ?
0	what does the injection gun do ?	play online without expansion packs
0	what carries over to new game plus ?	how can i tell whether pokémon were hacked/cheated ?
0	does psvita not support psone classic games ?	what percent of attack speed would max evelyn with her ult on ?
0	any way to undo using an alchemical tome ?	how can i pass the bathroom part in the mission " enter the bank " undetected ?
0	what exactly does the christmas update in cookie clicker do ?	when do you get your first spy ?
0	do the thugs on the streets respawn ?	can the mac and windows version of civilization v play a multiplayer game together ?
1	is magic a powerful and effective offensive class on skyrim from level 1 onwards ?	if i want to focus on magic , can i ignore weapons entirely ?
0	is the only way to raise my strength by drinking a potion of strength ?	how can i tell if a borderlands 2 matchmaking party requires dlc ?
0	command & conquer : tiberium alliances data sheet	did the update to puzzle swap which added kid icarus also add any other puzzles ?
0	knifepoint ridge ebony mail question ?	how to take screenshots in borderlands 2 without third-party software ?
0	am i supposed to have no idea what is going on in the first few hours of play ?	is there a special dialog grunt " easter egg " in halo 4 ?
0	how on mw2 do you play with friends on free-for-all	woobat into swoobat !
0	are thieves at a disadvantage when it comes to dragon fights ?	how to change the campaign completion point ?
0	where 's all this light coming from ?	best place to shoot technicals to disable them
0	how do i enter cheat codes for lego star wars iii on nintendo ds ?	how to effectively transfer to midgame tech in starcraft 2 ?
0	resurrect a lost religion	how to place 1x1 block instead of 2x2 blocks ?
0	is it possible to continue the main quest line if i took whiterun with the stormcloaks ?	how to install spc and worldedit in an old minecraft version with the new launcher ?
0	how can i get more of each evolution stone ?	how many chunks do i need to keep loaded to keep quarries working in buildcraft ?
1	pokemon shiny hunting	what is the chance to find a wild shiny pokémon in x & y ?
0	how exactly do the tracer pistols work ?	can you . . . get it on . . . with anyone or just certain characters ?
1	what is the advantage of very-rare items over common or rare items ?	what are the differences in ingress portal shield types ?
0	why every time i open the bitbook it auto quits	can mobs see me through glass ?
0	can multiple silo add bonus to same harvester ?	what is the easiest/fastest way to get tokens ?
0	how to speed up construction in tropico 4 ?	can not get followers to touch the altar in boethiah 's calling
0	what are the types of bag loot items and how much are they worth ?	how to dig through an aquifer
1	skyrim highest level ( combat/character lv )	what is the level cap in skyrim ?
0	can not break any block in minecraft server bukkit	what exactly do infusions do ?
0	how to buy benefactor schafter	why are there two " gto twin turbo " cars ?
0	starcraft 2 continuing campaign	how do i build a courthouse in a captured city ?
0	what is the fastest firing rate for a submachine gun in borderlands ?	are there any risks to leaving my xbox one on all the time ?
0	how do i use the *really* secret unlocks ?	i think i am stuck on an island . how can i escape it ?
0	modern warfare 3: viewing stats online	easiest world of warcraft class to level
0	ran out of quests	check balance of inactive account on eve
0	changing audio language in hearthstone	is there any way of knowing if it is day or night before joining the server ?
0	how do i unlock all the other ships in the hangar ?	what is the maximum number of gateways you can power off 1 pylon ?
0	list of act 4 curse ( debuff ) effects and visuals	is there a way to remove level requirement to oblivion 's quests ?
0	minecraft server save-all does not work as soon as expected ?	how can i remove things from my shop ?
0	how do i install a game to games for windows ?	are items carried over to a newgame+ ?
0	how do i roll in warframe ?	battle for fort hraggstad glitch
0	are there any alternatives to livestream and justin . tv when it comes to streaming games ?	which of the 3 support items can earn you the most gold ?
0	best place to farm money in borderlands 2	whats the highest scoring word ?
0	how do i continue the companions ' quest line after " blood 's honor " ? ( encountered the " forever mourning " bug )	in full metal alchemist brotherhood for psp , what is the trick to avoiding the combined attack ?
1	is any elevated surface a valid place to store unconscious victims in order not to get eaten by rats ?	how do i prevent rats from eating a corpse that i left unattended ? also , is this a bad thing ?
1	can i use red stone in pocket edition ?	how to use redstone dust in minecraft pe . 0.8.1
0	what are the differences between ' hard ' and ' normal ' difficulties ?	does incognito kills count as silent too ?
0	how can i tame a horse in 1.6 ?	witcher 2 starting gold
0	can enemies see me through smoke ?	what is the optimal monster power to play at ?
0	how does distance affect the disappearance of items after death ?	does help , pix ! grant kills to the recipient of the buff or lulu ?
1	where does james come from ?	am i supposed to know who james vega is ?
0	why can not i link certain portals after creating a field ?	victoria 2 presidential dictatorship to monarchy
0	unexpected blast in call of duty 4	mining diamonds in minecraft
0	would talos amulet work if equipped during cooldown ?	how do i choose which runes to get in league of legends ?
0	i just can not beat the reaper on rannoch in me3	what happens if you choose glados ' way in portal 2 ?
0	fps capping , regardless of setting in options	fallout 3 alien weapon
0	is there a way to change/mod/reconfigure/cheat bioshock 1 's hacking mini-game , to something less tedious ?	where is the kakliosaur specimen/fossil ?
1	is there a difference between ias from armor and weapon ias ?	why do some items that increase attack speed work , and others do not ?
0	can an allied elise steal orianna 's ball ?	what are the differences in maps between difficulty levels ?
0	i got a creeper in my trap . . . and that is a bad thing	are items in me3 multiplayer shared across characters ?
0	will a xbox gamertag transfer remove the account entry in billing.microsoft.com?	how do i play original xbox games on the xbox 360 ?
0	how does the alliance 's timer help in games of war fire age work ?	how can i prevent my partner from taking damage ?
0	is there a limit as to how many lolligators you can buy ?	is there anything to eat besides basic rations ?
0	showing up on speedrunslive	using a remote pc as a gamepad
1	minecraft went small	how do i get the minecraft gui scale to go back to auto ?
1	skyrim dungeons respawn	do dungeons repopulate ?
0	what are the must-have ( overpowerful ) aircrafts in ace combat 5 ?	blackops zombie strategy
1	how to farm as an early lvl 60 in diablo 3 ?	best farming place to get ready for inferno
0	what are the locations of the junkyards ?	how do you get to the tower in chaper 12 ( "abducted" ) of uncharted 3 ?
0	how can i minimize my chances of losing in minesweeper ?	is it necessary to play crysis warhead in order to enjoy the full game experience ?
0	anti-aliasing in minecraft ?	skyrim good intentions / revealing the unseen quest glitch ?
1	how do you charge soul gems ?	how do soul gems work ?
0	is it possible to connect to an smp server without authenticating ?	when can i farm a boss ?
1	can i call odahviing back to skuldafn ?	is it possible to return to skuldafn ?
0	is there a compilation of the loading tips ?	what determines the weapon sold by the black market weapon trader ?
1	what do i open the " coalesced . bin " file with , for mass effect 3 ?	how can i edit coalesced . bin so that i can use cheats and graphics tweaks ?
0	can not level up after level-50 in borderlands 2 in true vault hunter mode	what are all of the cheat codes ?
1	how do i get more berserk potions	how can i increase the number of potions ?
0	what can i do to improve the very poor performance of rage ?	is there really a power tunic in final fantasy 2 ( aka final fantasy iv ) for the snes ?
0	can you create a new character using your previous character 's weapons ?	how many seconds does afterburn damage last ?
0	does progress in s.t.a.r. labs missions count towards trophy completion ?	mods for civilization 5 do not work on my mac
0	what is the easiest way to get antlion mandibles in terraria ?	m_forward and m_side in counter strike global offensive ?
0	how much health does a maniac have in cod : ghosts ?	what are the misc . stat categories in offspring fling ?
1	how to become better at super smash bros brawl ?	how can i become a pro at super smash bros . brawl ?
0	what is wrong with this item stats ?	mercenaries and how/when to hire them
0	dead or alive : dimensions control mechanism	is incinerator clayton good or evil ?
0	follower disappeared after the " a night to remember " quest	is the amount of damage absorbed by diamond skin proportional to weapon damage
0	is click-spamming hindering my abilities ?	is there a detailed manual for command & conquer red alert for iphone ?
0	minecraft crashes with error " no opengl context found in the current thread"	what are the 3d analyze settings for splinter cell chaos theory
0	what are some good armors dark souls 2	minecraft is corrupt and will no longer play , update , or delete
1	how do i get the phantom prospect dog tag ?	how do you complete the " phantom prospect " assignment ?
0	what requirements are needed for a soldier to use the gollop chamber ?	new twisted treeline base walls - skills or spells that jump over them
0	how do i milk a cow ?	can i get a bigger basket ?
0	how do i place attachments on the side of other objects ?	after i murdered/robbed people , how do i get rid of the bounty ?
0	what tf2 items can i sell to the steam market ?	how can i get shadowmere back after riding another horse ?
0	can you permanently miss the dragon buster sword in demon 's souls ?	wii browser capabilities : specifically : chat/js/flash/local storage
0	what is a good build to maximize the time you spend as a chaotic berserker ?	where and when can i find kasumi goto in me3 ?
1	loot quality between single player and co-op	does multiplayer improve loot or just increase the amount of enemies and loot drops from them ?
1	diablo 3 difficulty scaling per added player	what is the maximum party size and the corresponding monster buffs ?
0	i keep dying when i am mining obsidian on minecraft . why ?	how can i find out the rarest steam achievement ?
0	there is a bug where you will not receive the quest after the eye of magnus has been overloaded what to do ?	minecraft 1.6.2 cannot craft drill or chainsaw
0	can you have 4 players simultaneously in a spec ops survival lobby ?	how do i complete the ' the madness contained ' achievement ?
0	what are the numbers on the character descriptions ?	how to increase fov in borderlands ?
0	what is the difference between epm and apm ?	why do rechargers sometimes not offer their services ?
1	fallen out of the world through the void in minecraft	how to get back to original spawn when in creative and spawn resets ?
0	how do i get museum items / collections ?	best way to use summoned souls effectively
0	balancing queues in rollercoaster tycoon ?	can i get to the tropical island as a citizen ?
1	how are resources gained , distributed , and spent ?	at what rate do players and commanders receive resources per resource node ?
0	do both exceptional friend candles replenish simultaneously ?	how can i defeat the final boss in petz dogs 2 ?
0	us playstation plus on eu playstation on ps4	can i reset my stats after i have used my prestige reward ?
0	what benefit does upgrading walls have ?	does pierre stay dead if i kill him ?
1	+mf or +xp rings on followers	do i earn less experience or items if i have a follower ?
0	how to reserve barrels for drink ?	where are the magic bushes ?
0	how to move cars from one shard to another ?	what exactly does upgrading the " venom " augment of caustic quills do ?
0	is there any way to access delisted xbox live arcade games ?	how much damage does fire do in total before it burns out ?
0	what meme is " track and field " responsible for ?	does the rock band 3 squier lock you into playing notes/chords a certain way for the game ?
1	how to restrict steam games to x hours per day ?	can i enforce a time limit window on steam games , notably team fortress 2 ?
0	what is the order of any type of " resurrection " in league of legends	do adrenaline skills have separate adrenaline bars ?
0	clash of clans help me its real plz help me	tanking ( health or resists ? )
0	is it possible to have more than 4 zombie dogs ?	how can i quickly lose all my stuff to talk to the pope ?
0	is it too late to start using the sneak playstyle ?	where can i find an item i can disenchant to learn fortify alchemy ?
0	do you get extra sticker book pages ?	what are the requirements for the katagelasticism achievement ?
0	is there a reward for collecting all of the stars in super mario galaxy ?	what are the dlc spells/characters , and how do i use them ?
0	is it possible to play cthulu saves the world on mac ?	can i play wow with missing expansions ?
0	what can not you do in brawl with a sideways wii remote controller , and does using a nunchuk fix this ?	how do i put away my weapons in skyrim ?
0	how do level seeds work ?	how can i prevent being affected by the fear effect from nightmarish mobs ?
0	how does the seasons clock work ?	what do i do with my egg
0	how do i wear hats ?	how can i reduce spell casting duration
0	borderlands 2 in true vault hunter mode , does madame von bartlesby always drop a legendary weapon ?	wow & battle .netaccounts
0	can i change my appearance later in the game ?	do split grenades inherit their properties ?
0	what is mann-up mode ?	what are the differences between normal edition and the goty ( game of the year ) edition ?
0	what is the optimal tech i sub-capital ship and fit to defeat an amarr interceptor ?	remove games from origin list
1	when gaining level should we just kill enemies or do quests ?	how can i level up more quickly ?
0	binding of isaac soundtrack	does the item evaluation screen take off-hand weapon or shield into account ?
1	can i turn off chat auto-join ?	how can i disable automatically joining the general chat when i log in ?
0	distribute items evenly through pipes	which arcane enchanter is closest to a fast travel point ?
0	what to do with workers in civilization 5 when all tiles improved ?	what does the light on the power switch of my nintendo wii indicate with its colors ?
0	which camo has an effect on thermal signature ?	how can you control cities in sid meier 's pirates ?
0	do different hunters have different projectile speeds ?	how can i use a custom widescreen resolution ?
0	can not drop an airport	what guns do the most damage in cod : ghosts ?
0	how to start pacific fighters	how does ' enduring cry ' calculate the number of charges ?
0	i got dire aids . what are its negative effects ?	traveling in red dead redemption
0	does this life end , or do i keep having to fix-it ?	how to stop a fast ride in gta online ?
0	how to play against a friend ?	if i exit the game during a battle , can i resume it later ?
0	how does the zombies campaign work in black ops 2 ?	is there a point going beyond bellman 's map ?
0	what is the stream . ini file for in gta : sa and how do i mod it ?	can i rebind the camera drag to another mouse button in starcraft ii ?
0	how to get the ender dragon egg to the overworld	what is the effect of light , medium and heavy armor ?
0	how to install deathmatch server on mac osx for counter strike : source	what is the darkling ?
0	how many controllers a cronusmax can handle in a time ?	being invaded in crusader kings 2
0	can i join a minecraft pocket edition world on my pc through lan ?	how do i destroy structurally weak areas above my head ?
0	how do i use poisons ?	can not find the night time mega stones ?
1	borderlands 2 is it possible to duplicate items	how can you duplicate weapons in borderlands 2 ?
0	how do i recruit the old cpus to my party ?	minecraft multiplayer block placing issue
0	how can i find diamonds ?	in portal games , do you always exit a portal at a right angle to its surface ?
0	help finding a minecraft friend on whatever server that i do not play on or know	garry 's mod gamemode without weapons
0	how to determine shotgun range in frozen synapse ?	buggy vtol controls in crysis ?
0	my ps3 suddenly says it has the wrong wpa key	what is the purpose of closets ?
0	assault ships v . interceptors	how do i fix an " invalid program gbuffers_textured_lit " error in minecraft - glsl shaders ?
0	why should i care about bleed damage ?	how to increase residential density ?
0	in qwop what exactly is the action assigned to each key ?	usf4 matchups with m bison
0	where are the radscorpions ?	how do you defeat the yeti as a templar ?
0	why has my enchantress been turning me into a chicken ?	maximum spirit regeneration
0	what is the difference between half life : source and the new black mesa ?	single player commands " java . lang . stackoverflowerror"
0	what are the christmas easter eggs for minecraft 1.7.4 ?	what is the direct benefit of levelling up a role ?
0	learning new racial motifs	do the random vampire attacks end when you finish the main dawnguard quest ?
0	what combos exist in infinity blade 2 ?	what does a weapons technologist do ?
0	is the call of duty elite service available for pc ?	will ashley ever forgive me ?
0	what do skill boosting affixes affect and what they do not ?	what items carry over between campaign missions ?
0	which walls are bombable ?	pixel perfect puzzles ( animals 9 ) : where do i start ?
0	minecraft mods- not working	bad company 2 freezes on bootcamp
1	options after completing borderlands	start another borderlands playthrough
0	how do you sheathe your sword ? also , how do i change the default controls ?	ways to earn money in gta sa
0	using mass effect 3 coalesced utility tool how can i unlock armors ?	what gives higher experience in smithing ?
0	death by a thousand cut ( scenes )	what are the best troops to have in your clan castle in clash of clans ?
0	are dandelions flowers or weeds ?	open level up window
0	do the different kart pieces affect gameplay ?	how many wired controllers fit on an xbox 360 ?
0	stat priority for monk/barb in inferno	does the faction i align with change the story ?
1	is there a difference in disenchanting strong items vs . weak ones ?	how does learning enchants from disenchanting work ?
0	what is the most effective ratio of defenses in endless space ?	how can i get my temporary quest follower to stop following me in skyrim ?
0	is there an updated list of the most frequently banned champions in the ranked solo game ?	why should i keep one of every item ?
0	what is the point of the archangel armor 's " flight " capability in xcom ?	how does the mundane infusion work ?
0	change a mass effect keybinding for vault ?	does cannibalism count as food ?
0	can i turn azura 's star from white to black ?	will mass effect 2 bought in us work in uk ?
0	can companions have their own light/dark side rating ?	is it better to upgrade melee attack or flying attack to boost broodlord damage ?
0	how do i take a screen shot in mass effect 3 ?	what can i do with xbox gold ?
0	can i watch a dota 2 replay " as a broadcaster " ?	how to get the people of a village like me again after killing their livestock ?
0	can i share my diablo 3 account ?	how do i play chess in watch dogs ?
0	bukkit permissions : owner group not giving me all permissions	best way to micro/split push with phantom lancer
1	how to easily get gold coins ?	how do i earn gold ?
0	how do i get to the hidden levels ?	how can i keep ghosts out of my machine ?
1	where is the sacellum of virtue ?	where are all the random dungeons ?
0	odd symbol below my stamina bar	how do i improve my land price ( lp ) ranking ?
1	how do attribute/stat increases scale after level 60 ( paragon levels ) ?	how are attributes allocated ?
0	kane and lynch split screen	hold items used when breeding
0	in red faction : armageddon , i played infestation coop and resumed later , the difficulty seemed to have dropped , why ?	how can i improve my accuracy ?
0	where do i get the legionnaire imperial armor set to solve " missing in action " ?	civilization 5 hotseat with diplomatic victory
1	left 4 dead 2 special infected tips for versus	how can i avoid being detected as an infected in left 4 dead 2 ?
0	can i join the legion and do the civil war quest line after completing the main story ?	what causes a snes game to lose its save game ?
1	what do the names mean	what do those abbreviations mean in league of legends ?
0	minecraft crashes on world load	is it possible to create and store 2 person avatar kinect sessions offline ?
0	what kind of pick does it take to mine emeralds ?	difference between using a bed or a sleeping bag in rust ?
0	which biome has the most plants on it ?	why is pure damage especially dangerous to strength heroes ?
0	why is not my minecraft wither skeleton farm spawning any wither skeletons ?	why do not i get xp in some matches in bf3 ?
0	what are good debugging strategies with cheat engine ?	which trucks transport raw materials to factories - those of the factories or trade depots ?
0	where are favored indicators located and how do you interpret them ?	fallout new vegas and boxing
0	how can i get past chapter 3 - lesson 4: air chains ?	extremely low fps in dwarf fortress
0	how are the ranking points decided for a win/draw/loss over pes 2012 online quick matches ?	what are the typical nest placements of yukon ?
0	will the airport 's x-ray scanner damage my xbox 360 ?	is there a good ending in save the date ?
0	is it possible to use a spektrum dx5e as a normal joystick ?	how do i restart a game at a new-u and not a fast travel station ?
1	how to identify buc of item in nethack	how to identify items without getting killed
0	topdown maps of moonview highway ?	processor factory output is full and factories have nowhere to ship freight . how do i fix that ?
0	every time my computer starts it fails to connect to steam . . . how can i fix this ?	how do i get burnout paradise 's " boosting around the world " in-game achievement ?
0	is it possible to earn individual medals of the same type multiple times in mass effect 3 multiplayer ?	does choosing to complete optional missions affect the level of chaos in the city ?
0	in a newgame+ , what happens to promoted mp characters ?	minecraft world viewer , or play in a read-only world ?
0	why is soul trapping black souls considered immoral in the elder scrolls ?	what are the flags behind the animal king ?
1	how can i recover my password ?	how can i log into draw something if i have forgotten my username and email ?
0	is there an updated cataclysm flight path/travel map anywhere ?	is it possible to re-enter the joker 's factory to get the titan canister ?
1	what is the right order to play skyrim ?	playing skyrim regret-free
0	how do you trigger riddler buttons that are mounted on the wall ?	xbox 360 will not play mpeg-4 video files
0	can you still become arch-mage of the mage 's guild if you kill trebonius before getting the quest to become arch-mage ?	why am i always in offline mode to friends ?
0	does nvidia 's 3d vision take any additional compute power ?	how can i increase my population
0	how can i upgrade my units with the ikanda	ic2 brewing recipes ?
0	how do i share media with my playstation 3 wirelessly ?	why are my parachutes failing to deploy ?
0	does cull the weak also apply against stunned enemies ?	queue as a healer in pre-cata instances as shadow priest
0	should i buy a gamepad or joystick for pc gaming on my media center ?	when not to zealot rush ?
1	is there a way to " turn off " creepers in minecraft ?	removing some hostile creatures in minecraft
0	is there a purpose for the cinderblocks ?	will battlefield 3 shortcuts level you up ?
0	can you run an installed xbox 360 game off of usb flash drives now ?	what is the most efficient way to acquire dark oak saplings ?
0	is it possible to solo the larger underdome challenges ?	in skyrim , how do i know which soul gems i have filled ?
0	what are the clear bubbles for ?	how do i replay levels ?
0	eso recommended server for india	how do you relocate npcs in terraria mobile ?
1	how can delete " games " from the steam library ?	how do i remove a steam game from my library ?
1	gem slot search auction house	is there a way to tell the ah not to take gems into account when searching ?
0	i seem to have explored myself into a dead end , how do i get out ?	what is the secret to the burnt treasure map with the polytron logo , the candle room , and the floating black monolith ?
0	how to equip the right items to companions ?	what do the equipment stats do ?
0	incorrect aspect ratio for games using nvidia surround	what does the clock icon mean in skill descriptions ?
0	cannot use keyboard/mouse ?	how can you restore health in sword & sworcery ?
0	how do i view other people 's screenshots on steam ?	what is the most powerful sword in chrono trigger ds ?
0	do " special ops " mission level ups carry over to multplayer mode weapons and perks ?	what determines a kerbal 's uniform ?
0	what are the primary stats for each champion ?	can i craft saddles and horse armour ?
1	how does early access work ?	"early access " - what does this mean ?
