0	how do i finish the first level in no heroes allowed ?	is it possible to rob marcus a second time ?
0	why can i get more lums than the level maximum in rayman origins ?	how do you discover passcodes ?
0	pc black ops : why are not my games being saved in theatre mode ?	playing coop games on duels of the planeswalkers
0	can you kill the desert birds ?	what can i do with all this copper ?
1	how can i grow trees underground ?	can trees grow without sunlight ?
0	is it possible to own a jump beacon in x3: albion prelude ?	who should i give titles to ?
1	my world has a huge void gap . how do i fix it ?	how can i get rid of this black hole in my minecraft world ?
0	where is my room when i buy it ?	what are the icons next to people 's names ?
0	what do the 4 icons under the player name mean at the bottom of their callsign ?	how to lane against gnar as a melee champion ?
0	does " spare grain " give you food without you doing anything ?	can xbox one codes for fifa 14 ( day one edition ) be redeemed worldwide ?
1	i have lost my wife . where can i find her ?	how do i deal with a runaway bride ?
1	how do i activate the daedric gauntlet in the midden ?	what is the oblivion-symbol gauntlet in the midden ?
0	how do i complete " proving honor " ?	playing riki : how to counter a spirit breaker with dust ?
0	is it possible to change just cause 2 's difficulty ?	how to get the timing right when parrying ?
0	how do i solve the vanguard hacking mini-game ?	mind control over telekinetic field
0	do i have to complete another map to make progress on my mann up tour ?	how do i fix the error " connection failed after 4 retries " ?
1	where can i find lava in minecraft 0.7.1	where can i find obsidian in the pocket edition ?
1	how do i take off my pants in animal crossing : new leaf ?	how do i take off my pants ?
0	is a charismatic build really worth it ?	can you make a longer-lasting fortify destruction potion ?
0	is there a way to create a water item-slide from a creature-trap without chickens passing through it in minecraft ?	can i give up on a den that is being attacked by templars ?
0	can i earn achievements in the classes category while playing as another class ?	how do the 3ds and n64 ocarina of time releases compare in content ?
0	can you utilize both basic trainers ?	how are ' most heroic attack ' and ' most heroic defence ' determined in a clan war ?
0	do you need a teleporter to use a boarding drone ?	can i choose squad members ?
0	how do i change profile name on minecraft	how do i change my ship 's pilot ?
0	how can i store a crazy amount of items on one character ?	how do items go missing ?
0	does the hori real arcade pro v3 sa stick work with touhou games ?	how do i save my graphics settings in lost planet 3 ?
0	split screen online echo issue	do item bonuses stack ?
0	mikael 's crucible stopping effects	how can i increase productivity ?
1	is it possible to automatically switch active unit in a group after cast in dota 2 ?	bind a key for multiple units to use the same spell
0	what is the purpose of exhausting galio when he ults ?	leavebuster while playing with bots only
0	is there a shortcut to the executioner 's chariot ?	how far and at what height are dungeons ?
0	is quarry mining as effective as staircase mining ?	why are the edisons blue in some versions ?
1	what is the number of different magic properties that a hellfire ring can have ?	how are random properties chosen for items in diablo 3 ?
0	how can i place my bed on glass blocks ?	how to force csgo server to change teams at mid rounds ?
0	how do i change unit size ?	xbox360 troubles
0	why is minecraft snapshot 13w39b launching when i am expecting 1.6.4 ?	what are the white hearts ?
0	how do i get the obscuridad del santo andres ?	how can i turn on battle animations when playing online in civilization 5 ?
0	does kha'zix 's stealth work vs . towers ?	do skill tree skills stack ?
0	how do i quicksave on the ps3 ?	how can i find out which enchantments that i know ?
0	do titans have a weak point ?	how to avoid killing monsters
0	how do i poison someone ?	what race would be better for a beginner in starcraft 2 ?
1	why does meta-inf keep coming back ?	how to install mods for the new minecraft launcher
0	does blitzcrank / nautilus q stop a channeled fiddle ?	how long will items from the island stay in the island item drop off box ?
0	can you keep bethany after act 1 ?	increasing ugridstoload in fallout : new vegas
1	stoping the crimson/hallow	how can i defend my home against hallow/corruption in hard mode ?
0	dwarf challenge - team effort	can i cancel a mission i started in tiny tower ?
0	how do i fully uninstall the diablo 3 beta for mac ?	can the snorlax you find on route 7 in pokemon x/y be shiny ?
0	why is izual a demon again ?	what are the answers to the boss 's ciphers ?
0	are buildings currently being upgraded able to function during clan war ?	how do i create a wall of maps with item frames ?
0	final fantasy for iphone : increase font size	are portals of power cross-platform compatible ?
0	what is the absolute minimum number of bookshelves to reach a level 30 enchantment ?	how do i play multiplayer in myminecraft pe world
0	why was jeanne d'arc killed ?	what heirloom weapons should a dps death knight pick up
1	what is the advantage of cities in a region that are not connected ? is it possible to connect them ?	are some things ( rci demand , commuters , unlocks , etc . ) shared only by " cluster " instead of region ?
0	game asking to install older directx . should i allow it ?	what songs from final fantasy 13 are used in the sequel ?
0	using a ps3 controller in the pc version of far cry 3	how to disable the slowing down of trains in slopes and in curves ?
0	what items can followers use in diablo 3 ?	techniques for playing wrench tennis effectively ?
0	where are the character chests for toy story in space ?	how can i create recurring appointments in the calendar ?
0	crimson altars wont spawn in terraria	is it worth investing in magic find early on in diablo 3 to build up your piggy bank ?
0	i have a dozen or more big spenders in arrivals from a reward . how do i use them ?	how does the internal attack list work in super smash bros . brawl ?
0	where have all the item set bonuses been moved to in tf2 ?	how well does civilization 4 handle automation of workers ?
0	do olimar 's pikmin increase his weight ?	how do you get to the secret room in the tavern ?
0	how to make peace after i have what i want	what do the letter-number codes under my name mean ?
0	momo racing force feedback wheel power unit	when is pierce the veil counted in your damage ?
0	my tree farm is not growing even with bonemeal	what is the purpose of a " hell bringer " ?
0	is there a limit to how fast one can harvest minerals and gas ?	is it possible to get the return to castle wolfenstein prequel maps on the pc ?
0	where did my sim 's cat go ?	how do i leave people 's home streets ?
0	transferring all dlc to new xbox 360 -- " download all " ?	adc starting items ( since patch 4.10 )
0	how can i change the maximum number of players in my server ?	change what " ttt_radio traitor " says in gmod
0	falcon m-37 possible glitch with firing ?	how does the campaign award difficulty medals in anno 1404 ?
0	what is the redacted lyric in portal 2 's credits ?	does it matter when i repair ?
1	pyro tactics and tips ?	what is the secret to playing pyro ?
0	can i play borderlands 2 goty edition without the original game ?	in zombie panic source , what effect do guns have on running speed ?
0	is this balcony endermen-proof ?	sound mostly not working in skyrim
0	my villager has one trade and it is locked . is that a glitch ?	why can not i change my skin in minecraft ?
0	can i craft sapphire staff in terraria on android ?	how close do you have to be to your party members to gain xp when they get a kill ?
0	help reinstalling skyrim on a different computer	how does the nintendo nes four score work ?
0	bugged bins & barrels after reclaiming a fortress	how do i use the assassin 's creed 2 goty edition dlc on the xbox 360 ?
0	what does the healattribute do ?	does dungeon siege 3 support usb gamepad controllers ?
0	why is my redstone energy cell losing power ?	what is the mineral composition of each type of ore ?
1	how many " organizations " can you join ? do some block you from joining others ?	if i am a member of one guild , am i prevented from joining any of the other guilds ?
0	optimizing performance hearthstone linux	how much storage does a tent have in dayz ?
0	where can i find tall grass ?	can i buy the expansions from steam if my copy of sims 3 was not bought from steam ?
0	when can i play the mass effect 3 dlcs if i have already beaten the game ?	are there any bonuses for finishing flight school ?
0	how to get fireth of july achievement in hoard ?	how long before a wooden crate respawns ?
1	what does the " fast forward " mission feature in borderlands 2 do ?	how does mission progress work in multiplayer ?
0	why is minecraft magic launcher playing 1.5.2 instead of 1.7.3/1.7.4	how to enable gfwl overlay on windows 8 / windows server 2012 ?
0	who owns a dog ?	i can not play online on battleblock theatre
0	how to sell custom cars and planes in gta 5 ?	how do soldiers increase their attributes ?
1	how do i get realms for minecraft : pe 0.8.1 ?	where did the " play on realms " option go ?
1	how do you set up portal 2 split-screen co-op on a pc ?	can we play portal 2 co-op on one pc or mac ?
0	how do you get an enderman ?	do magic find bonuses increase rune and gem drop rates ?
1	what is the highest difficulty that can reasonably be soloed ?	will i be able to complete inferno without a group ?
0	best spot to gold farm in hell as a barbarian ?	why did my zombie pigmen form a flash mob ?
1	what is more likely to boost my gaming performance : a new gpu or more ram ?	which is better for a gaming pc graphics card - more ram , or faster gpu ?
0	help with skyrim combination	will a higher level staff of herding open the lower difficulty whimsyshire ?
0	old minecraft versions not in launcher	are flashpoints the quickest way to earn social points ?
0	how to further my playing of jungle lee sin ?	is there a downside to not be all renegade or paragon ?
0	how difficult are nethack and crawl ?	does having your knife out make you move faster ? if not , what does ?
0	is not there another atronach forge ?	how do i complete the " viatrix , the annoying pilgrim " quest ?
0	realms does not show in mcpe	does anivia 's wall grant an assist ?
0	how do i get to orgrimmar from silvermoon city at level 11 ?	what can i make with the lab station ?
0	some questions regarding xbox live service	why can not i craft my cleaver
1	full list of inventory items	what is the item to the right of the green shark fin ?
0	so , what did happen on that drunken night anyway ?	what do i get if i connect a uplay account ?
0	when i look at a map , is the y co-ordinate at my head or my feet ?	do different nationalities have different default levels of morale ?
0	how can i tell if i am drunk and how long will this last ?	does shen using his ultimate on a character in stealth show either ?
1	do you receive trading cards at set intervals ?	how do i pick up trading cards ?
1	do i have to restart the game if i miss " ride the wind " ?	how do i get the ride the wind achievement ?
0	melee combat : heavy armor vs . light armor	which wifi channels does the wii support ?
0	per user language settings on wii u	how to make a tree miller
0	how do i leave the psychameron ?	what guns do the most damage in cod : ghosts ?
1	what do i do to complete find the bitizen mission	how do i complete " find the bitizen " ?
0	lost one scavenger bot when i started a new game+ at ' impossible ' difficulty - how do i fix or avoid this ?	what triggers a battle event in timeline ?
0	why will not this ocelot do anything but breed ?	subtitles for portuguese dialogues
0	create a race on the ls-airport	changelogs for xbox 360 title updates
0	what is the progression route in terraria ?	fastest ways to level multiple skills in skyrim
0	how do i beat dracul puzzle #3: rivalry ?	why are all my classes deleted ?
0	is walking with just the mouse possible in skyrim ?	how to find the location of my target in dwarf fortress ?
0	how do executions work in league of legends ?	nuclear launch details
0	best race if playing as an archer	where are some good places to grind cp ?
0	when will i get attacked in clash of clans	skyrim achievements are locked although i have completed them
0	why do raids with one unit fail ?	how can i stay connected to xbox live without other users ( including friends ) knowing that i am online ?
0	how do i get weapons to level x in singleplayer ?	why are items in the store marked red ?
0	friends blocks not showing up	how do i get my suv through that ring ?
0	what is this glowing red box ?	how do i recover from a bad early game ?
0	what is the difference between dr . robotnik and eggman ?	how can i beat the final boss in faster than light ?
0	what are these " miser run desc " objectives in temple run 2 ?	how do i set hotkeys in realm of the mad god ?
0	where are the missing books ?	remove weapon effect
0	what carries over to new game plus ?	how to kill brayko in alpha protocol
0	how do i start the mirage mission ?	is there a way to save airi 's father ?
0	sockets and items	general strategies to avoid game crashes
0	how do i withstand fire breathing attacks ?	how to prevent being stunned by the first form of vol opt ?
0	crysis2 complains of strict nat and cannot find session	will i be handicapped if i do not choose an alignment ?
0	what is attack move for ?	list of champions by fastest move speed
0	can you invest in a shop multiple times to keep increasing the vendor gold ?	which weapon has the highest potential for petrification ?
0	where are all the bottles ?	where can i see co-op standings in f1 2013 ?
0	what is the best counter to marine spam ?	where is vernon roche in for tameria ?
0	minecraft 1.6.4 - different mods on different profiles on the same version [ linux ]	how often do cities refresh their job list ?
0	mop : vendor with 372 gear	are mystery gifts bound to a single save ?
0	why will not garry 's mod load my addons ?	are there " one-shot " collectables in dead island ?
0	in lands of lore : throne of chaos , is there a secret way to cross lake dread early ?	how can i make the military 's life harder ? ( in just cause 2 , that is )
0	where can i find implants ?	what is the " specialist bonus " and what does it do ?
0	last save point in lufia ii : rise of the sinistrals	how is rayman legends different on different consoles ?
0	"refilling " items in a chest	what difference will the more skillful ( 1 star or 2 star ) crew members make compared to a non-skilled one in ftl ?
0	how can i create a custom automatic status on steam ?	how can i fix my face ?
1	ac:r using mute effectively	how is the mute ability supposed to work ?
0	after i login to a server , i continuously fall through the ground .	what does "+n levels damage in combat " mean in geneforge 2 ?
0	how does eve central get the market data ?	what is friendship affinity ?
0	what is the scoring algorithm for rock band 2 ?	what use do skyshards have ?
0	how to obtain four fusion batteries ?	blazblue : continuum shift - how to beat unlimited hazama at the end of arcade mode ?
0	what are the consequences of updating a minecraft smp server ?	can you transfer your saved game from the pc version of ftl to the ipad ?
0	what do frozen synapse 's " focus on zone " commands do , and how do i use them ?	are skylanders " adventure packs " compatible with skylanders giants ?
0	what do the secret vault symbols look like ?	odd symbol below my stamina bar
0	how do i increase the tech level of my industry ?	how to fix a broken screen on ms . pacman ( midway ) arcade
0	how to use war3chart tool	why did the portal close on level 5 of soul arbiter 's maze ?
1	how can i keep a monster spawner spawning whilst i am away ?	how can i get my spawners to work when they are far away ?
0	which crown is best for growing each stat as party members gain levels ?	steam error-118
0	nice dpad controllers for fighting games on xbox 360	does each void level have a specific blueprint ?
0	how to move steam games on os change ( 32-bit to 64-bit )	minecraft command block testfor certain player
0	in fighting games , what is a ' setup ' ?	how does " wrong-warping " happen , and how can i do it myself ?
0	what does overclocking sensors do ?	is it possible to leave the silent realm without completing the trial ?
1	is witcher 2 very different to witcher 1 ?	how much of the witcher 2 will i have trouble with , not having played the first game ?
0	unlock other levels/maps in nintendo land wii u	who are the most foul-mouthed and sexually deviant characters ?
1	what is the difference between tvhm and uvhm ?	how do subsequent playthroughs work ?
1	what is vampirism - how does it work ?	how much hp/mp you get with vampire/siphon/balance runes ?
0	how can you find all world treasures ?	how to bind middle mouse to attack ground
0	what is the requirement for new ships/derelicts to arrive ?	why is my mfr harvester harvesting blocks behind it ?
0	is there a way to spawn in travel tickets ?	do healing globes improve as you progress ?
0	how can i loot the bones from st . eadric 's tomb without being detected ?	what are the ports used by magicka wizards war ?
0	how can i gain silver coins quickly ?	how do i kill sigdis gauldurson ?
0	map for spider-man 3 meteorites and spider emblems ?	where can i find homeless people to beat up ?
0	where 's the line between friends and lovers ?	how do kill count achievements work in multiplayer ?
0	what is the maximum number of slots in the adventure pouch ?	what pokémon are catchable on route 1 in pokémon : ash grey ?
1	what is smartcast ?	smartly using smart casting
0	resurrect npc without corpse	are there any side quests that can only be found by breaking and entering ?
0	how do i make an x potion ?	why are my enchantments rubbish , and how do i improve them ?
1	is there a maximum size limit for valid housing ?	how do i build a house for my npcs ?
1	do follower bonus stats affect loot that is dropped for me ?	does magic find on followers do anything ?
0	mad science mod not loading	tekkit computercraft lua error
0	is there a tutorial for ghost recon : advanced warfighter ?	do those gold collectibles have a use ?
0	how do i earn the hidden achievement " play it again sam " ?	are there differences between the original and the one from the psn store ?
0	does a promotion series have time constraints ?	how do i get the russian tanks ?
0	how to get rid of bounty in skyrim ?	how important is my choice of town ?
1	if two people have the same aura item , do they stack ?	which aura items can be stacked ?
0	in dark matches , do i " see " killed enemies that are out of my line of sight ?	civilization v on osx is very very slow
0	what are the advantages of going through the practice league ?	how to get prior notification that your home is under attack with enemies that attack your home in hearthfire ?
1	is there a way to change the weather ? xbox 360	is it possible to control the weather ?
1	what are the most expensive cars you can sell to los santos customs ?	which stolen cars can you bring to ls customs and what are their sell prices in gta online ?
0	steam account security	what do i do if i can not unlock shouts ?
1	what crimes can you get away with as thane ?	what crimes can a thane commit without punishment ?
0	what is the difference between tekkit and normal minecraft ?	where can i find out about new demos that came out on ps3 ?
0	are there any differences between spelunky hd player characters ?	about the " tic-tac-toe squirrel challenge"
0	cannot enter safe mode on otherwise working fat ps3 with 4.53	can i gain all of the achievements in one playthrough ?
1	how does redstone power side blocks ?	confusion on redstone wire transmission
0	is there anything to lose ( permanently ) by starting a second playthrough asap ?	what is hunters for hire ?
0	wha 's the best evs for a charmander ?	how to find the location of my target in dwarf fortress ?
0	how do . nav bot map navigation files in the steam workshop work ?	simcity regional freight shipping
0	if i use the ankh and manage to kill the final boss , who gets credit for the kill ?	is locust swarm ranged or melee
0	do i need a u-play account to get 100% completion in ac4 ?	why is tds using so much bandwidth ?
0	so , what did happen on that drunken night anyway ?	what affects how many units you can recruit per turn ?
0	how can i turn off the tutorial popups ?	how do i remove journal entries in skyrim , or mark them as finished ?
0	can i sign up for betas with multiple battle .netaccounts ?	how to get better at wordament ?
0	become trusted by ignacio rivas	multiple user accounts on same ps3
0	how come the game does not end when i lose ?	what is the playstation quest for greatness ?
1	what is the cap for increase attack speed in diablo 3 ?	is there an attack speed cap ?
0	can my companions take items out of legacy storage ?	is there any advantage to lingering in sandbox mode ?
0	do your opponents gain the benefit of a religion you found ?	did my companion steal my gold ?
0	which is more important as a monk , dodge% or block% ?	what is the best way to play a support champion ?
0	are there some levels that can not be finished with certain characters ?	why are my ally 's powers greyed out ?
0	how does grim harvest work ?	stuck at hidden blade cutscene
1	increasing the amount of ip gained from battles	how much ip do you get for winning & losing games in the various modes/maps ?
0	what do i do with my extra friends ?	code for yoshi 's island ds mini games ?
0	do i need to clear out all the reaper code in rannoch : geth fighter squadrons ?	is there any way to get rid of the homeless ?
0	why can not i equip the " hunter 's vest " ?	why did the engineering bay lose the ability to lift off in starcraft 2 ?
0	how can i romance samantha traynor ?	what does the ukelele do ?
0	how do i keep my old saves for batman arkham city ?	can i reinstall starcraft 2 on windows using the key from my mac ?
0	how do i unlock the air guardian entry in ars magica 2 ?	can us and uk ps3 games share save files/trophies ( in regards to agarest generations of war 2 )
0	how can i reduce border friction with my neighbours ?	installing black mesa through steam
0	how to pass the battle of xin ye	roughly how much data is used when playing mass effect 3 muliplayer online ?
0	how can i change my worlds from survival to creative ?	can not find faralda
0	minecraft forge 1.7.10 keeps crashing as soon as i launch the game ?	how do i keep two different versions of minecraft installed ?
0	what does the different furniture do ?	what is a good terran anti aircraft strategy if you are on the move ?
0	slimes do not spawn in smp	how to breed a copper dragon ?
0	why did i get 250 station cash ?	does help , pix ! grant kills to the recipient of the buff or lulu ?
0	can i take an output from slender : the eight pages to trigger a flashgun ?	what weapons are effective against pips in deathspank ?
0	can you play street fighter 4 over lan ?	game asking to install older directx . should i allow it ?
0	why is umbra 's damage 10 instead of 28 ?	what are the requirements to unlock the seasonal transmorg reward ?
0	how can one counter offensive teleports ?	how to make icon-based clan name in cod ghost ?
0	how do figures work ?	why is my screen completely black ?
0	how do i get the other two starter pokemon ?	do the character traits of other leaders affect anything ?
0	which mobs can spawn on snow-covered ground ?	why do i get a " level too low " message when trying to techcopy ?
0	what happens when choosing magicka , health or stamina when leveling up in skyrim ?	skyrim taste of death quest bug - eola keeps attacking me !
0	how do i change the background image of the main menu ?	how can i farm jimbo hodunk ?
0	is there any advantages to playing birth by sleep in any particular order ?	what is the most effective ship for soloing higher difficulties in jamestown ?
0	error installing 1.6.2 minecraft forge source	how do i make stone bricks in minecraft ?
0	what are the benefits to taking a concubine as a pagan in ck2 ?	titanfall periodic stuttering ?
0	what are the best stats you can roll/reroll for each class ?	hiding minecarts , security system
0	which walls are bombable ?	what are some pros and cons for the different zerg and protoss research options ?
1	do more followers act the same as a multiplayer game ?	do i earn less experience or items if i have a follower ?
0	what are the benefits of the different jobs in forsaken world ?	how to complete " starcraft master " achievements ?
0	differences between simcity 4 and citiesxl	i am seeing bright lights at the end of this tunnel in seiklus , should i be worried ?
0	previous prestige icons under callsign , can i prestige in earlier cods and get the updated icon ?	how do i reset my password ?
0	framerate drop on the clock tower level ?	is there a way to save an outfit in gta 5 ?
0	is there any way to fix input lag ?	how to be self-sufficient in the sky ?
0	what is the nationality of bayonetta 's protagonist ?	do assassin recruits die if the templars retake a den ?
0	how to combat protoss walling in a zerg 's base	does " spare grain " give you food without you doing anything ?
0	xbox live email address	can i use my computer 's wi-fi connection with the desmume core in openemu ?
0	what are the differences between pokemon x and pokemon y ?	with amd crossfire enabled , i experience some flickering in simcity ( 2013 )
0	can i reread acquired text logs in dead space ?	can you utilize both basic trainers ?
1	what stats should a wizard invest in inferno ?	what stats are best for casters ( wizard/witch doctor ) doing inferno ?
