0	why does borderlands 2 run better on my old pc than my new one ?	fastest ways to level multiple skills in skyrim
0	what are the difference between tanks from different countries ?	why every time i accept an assassin contract , a bird leaves the cage ?
1	how can i add froakie to my pokedex ?	how can i get all three kalos starters ?
0	how is the weekly income for the junkyard in gta v calculated ?	what is the point of duchies if you are king ?
0	how is magic damage calculated in infinity blade 2 ?	in minecraft is there a command to spawn blocks in the air with worldedit ?
0	what is the maximum number of seed slots you can get in plants vs . zombies ?	how do additional songs work on the wii version of rock band 3 ?
1	can i download wow online	do i need the original discs to install wow on a new computer ?
1	how do you obtain the grisly pointman title in borderlands 2	what do the extra words next to players name and level mean ?
0	why can not i get anywhere near the medal times for survival mode ?	does " tribute " passive count twice if spell is aoe ?
1	does psvita not support psone classic games ?	does the vita 's backwards compatibility with psp games extend to ps1 games ?
0	sub-quests reset in chapter 5 ?	why do i have a purple key ?
0	tank-like sniper mode for artillery mod ?	where can i find a league of legends tutorial ?
0	unable to click on hologram level to view imperial objectives after moving under construction imperial level	why did niko bellic join the army ?
0	how do i do the parkour ( green hoop ) mission near the bridge ?	no need for introductions
0	what factors to consider when upgrading from engineering bay ?	what does " kite " mean in lol ?
0	person to person trading in guild wars 2	what should i do when my faction is dying ?
0	how do i equip pack dlc after i buy it ?	powered rail not powering down
0	do any items break down/refine into cooking materials ?	is possible to use 2 xbox 360 wireless controllers in pc , using just one receiver ?
0	where are all the secrets in shadow warrior ( 2013 ) ?	which resources are not renewable ?
0	are there any stunt jumps ? or are jumps just to break police pursuit ?	has arngeir completely run out of words of power ?
1	will wolves eat ocelots in minecraft ?	will wolves attack ocelots ?
0	which console commands get flagged as suspicious ?	thieves guild special job bug
0	why does not my wailmer hatch with aqua ring ?	changes made to cities during stormcloak civil war quests
1	when determines when one gets a magic or bow killcam ?	what determines when you do a finishing move ?
0	how can i throttle steam ?	how can i find a corpse ?
0	can i have only hardcores ?	minecraft - decorative and peaceful fish plugin for bukkit
0	my nemeses are rampaging the countryside . does it matter ?	how would i solve this level ?
0	am i able to store games downloaded from psn onto an external hard drive	how to make sense of the cave story+ soundtrack in the humble indie bundle 4 release ?
0	how do i stop animals from starving ?	where and how can i improve my pokemon to get through nimbassa city ?
0	how is ranged damage calculated ?	is there drawbacks to rushing an era ?
1	is there an easy way to identify what is lootable and what is not ?	is there a function that highlights items you can interact with upon keypress ?
1	can i delete quests ?	is there a way to clear quests from your journal in skyrim
0	bioshock infinite lutece statue transformation	how to practice celebrations in fifa 12
0	why is not my minecraft lan server working ? is it because the zip codes are different ?	computercraft trading machine script
0	ftb direwolf20 1.6.4 crashes when installing icbm mod	what are the highest fids yields possible for each planet type ?
0	does xbox hard drive transfer transfers achievements/avatar awards ?	do skill enchantments on armor work for companions ?
0	battlelog not saying i am premium , battlefield 3	what does the starcraft 2 client download when entering the league queue ?
0	is that a saddle or a shell on the back of yoshi ?	how do you put a shaders mod into pixelmon ?
1	will i be able to do more quests ?	ran out of quests
0	how do i get rid of a caged goblin ?	which herb provides the highest chance to mill misty pigment ?
0	why do i now have 1 autosave in a mission instead of 3 ?	what are the differences between the corruption and the crimson
0	how do you send a personal message to someone in league of legends ?	when does a speedrun start and end ?
0	how is tnt on the xbox version of minecraft different than pc minecraft ?	skyrim crashes my system when i open map
0	can i create or edit a track in local multiplayer ?	for evolving slowly get better creatures or get lots of weak ones
0	how to use pre order bonus items ?	where are the green and yellow memories in the second leap of to the moon ?
1	what is the total cost of leveling up your crafters ?	how much gold does it take to unlock all crafting recipes ?
0	do i need to buy/play certain dlc from the previous games to get access to certain squad mates ?	can not download marketplace games to us xbox in foreign country ( non-us )
0	how do i save my xbox live profile to a usb drive ?	how does blizzard determine if i preordered a retail copy of diablo 3: reaper of souls ?
0	why will not the mission selection screen update in might and magic : heroes 6 ?	is there a way to resolve this bug and make my house appear ?
0	how do i set up an automated rubber farm ?	when do merchants start paying the actual value of items ?
1	does block and dodge chance stack ?	how do armor , resistances and missile/melee damage reduction interact ?
0	missing jade statue on the waterfront	unable to craft mv-transformer ( industrial craft 2 experimental + gregtech )
0	when comparing weapons or armor , what should i look at ?	bukkit plugin groups manager is not working ?
0	do hand-to-hand weapons count as one-handed or two-handed weapons ?	what are the categories of league of legends champions ?
0	ridiculously high numbers in final scoreboard	how to play the nfs final pursuit efficiently ?
0	how do i activate the daedric gauntlet in the midden ?	how is it possible for an item to have 300+ stat ?
0	skyrim - how to remain neutral on thirsk mead hall quest	is there a way to get dlc for a psp umd using the ps3
1	can i use resources more than 3 tiles away from a city , but within 5 ?	is it true that cities only use resources within 3 tiles from your city , no matter your city borders ?
0	can monsters open doors that are not on ground level ?	what is the best way to harvest organs from the infernal machine ?
0	how to cancel a reloading action properly ?	which galaxies in super mario galaxy 2 are borrowed from previous mario games ?
0	more than 4 players in terrorist hunt and campaign ?	why is it not recommended to trade hats for weapons or vice versa ?
1	is there a car faster then the adder in gta v ?	what is the fastest car in gta 5 , and where can i find it ?
0	what does a gift from ormagöden do ?	how to change skin to batman beyond ?
0	how do i download minecraft 1.6.4 ?	what are the best builds for a carrier sentinel ?
0	how to defeat the final boss , ugh-zan iv ?	how much gold does it take to unlock all crafting recipes ?
0	can the cauldron make any potions that are not in the instruction manual ?	will moving iron golems allow more to spawn ?
1	how to give money to another player ?	how to donate gold in diablo 3 ?
1	easter egg in act 2 ( desolate sands )	wheel of misfortune
0	how do i improve civilization v 's performance ?	when do mobs despawn in minecraft ?
0	what happens to players between missions ?	how does exactly stashes collide when league 's changed ?
0	how do you manage monster crystals with infusion ?	how to deal with the swarm ?
0	what happens to items when i kill monsters off the main path ?	am i missing something by not owning a home ?
0	where are the locations of tarohne 's tomes ?	do olimar 's pikmin increase his weight ?
1	where do i get more chocolate bars from ?	how do i get more chocolate bars ?
0	how does mann up mode affect item drop rate ?	how can i change the texture of a block so it is invisible
0	can shen teleport fiora around the map ?	is it safe to buy a pre-owned wii ?
0	is chell the last person alive ?	what is the optimal position of a sentry gun ?
0	how much does respeccing cost ?	will hero characters return after being unlocked ?
0	how long can a guild name be in swtor ?	can i have two rotoms with the same forme on the same team ?
0	what game is this ( possibly recolored ) sprite of a girl with a sword from ?	list of starcraft ii " detectors ? "
0	what is the maximum number of heart containers i can have ?	skyrim character freezing repeatedly
0	how is the best way strategy to level up in clash of clans	what is the significance of the blue hallway before the ' two door ' room ?
0	does the ps4 or xbox one need an internet connection to work ?	what is the solution to level 89 ?
0	getting celebi in ssb melee	what is the advantage in upgrading your expansion into a lair instead of the main ?
1	what is the easiest way to level light armor with all the dlc ?	how can i improve light armor as an archer ?
0	what is the height of a hopper ?	does paralysis stack with wyrdward ?
0	how can i play age of mythology on wmware fusion with windows 7 ?	how do i get the summer theme ?
0	can you play alien swarm in 1st person ?	my tds does not earn any credits while i am not playing
0	what does " in one game " / " in one round " means in zombie gunship achievements ?	repair reactive armor in bf4 like in bf3 ?
0	how can i upload screenshots from my wii u ?	how do i lower the post game mega stone price for charizard ?
0	can i get the ' enough coin to disappear ' achievement with a high chaos save from knife of dunwall dlc ?	can i trade pokemon between different versions ( e . g . pokemon ruby and emerald ) ?
0	where can i see my highest spree ?	when should i baron ?
0	alu in minecraft , what can be achieved with this ?	where can i find all the resplendent chests ?
0	can i restore a ps3 backup to different console without erasing the existing data there ?	which hybrid ammunitions are best under which circumstances ?
0	why do electronic arts games for genesis ( mega drive ) have a different cartridge size ?	is there a place that compares halo ce and anniversary glitches
0	how to disable f keys ? ( f1-f9 )	how can i improve my accuracy ?
0	can not login to dragon 's call	what is the point of future sight ?
0	how can you master an item more than once ?	what happens if i activate a product key on steam for a game i already own ?
0	any downside to pick-pocketing characters in the ragged flagon ?	can vitality and specific class help in belcher 's bluff ?
1	what determines the amount of battle points awarded at the end of the match ?	how are the battle points you earn calculated ?
0	how can i most effectively use the kairos " activate " ability ?	what is " below radar " and how does it work ?
0	which is faster , brawler claws or raptor claws ? ( no speed modifiers )	what class determines class time spent in battlefield 3 ?
1	how to get rid of steam items , especially coupons ?	can i throw away contents of my steam inventory ?
0	does chronoboost shorten warp gate 's cooldown time ?	counter strike source keymap configuration
0	how up to date is the android version of tiny tower , compared to the ios version ?	is there a limit to how much health i can have ?
0	how do i use the cruise control ?	clash of clans on wrong google+ account when moving from ios
0	techniques and tips for tuning cars in gt5	how can i set the display mode in aciii ?
0	how can i teleport only certain people in minecraft	is there any reward for collecting treasures ?
0	which genre fits or works well with which platform ?	how does the " hyper-reactive pupils " gene mod work ?
0	spawn quillmane in eq1	is there a way to tell the inventory button to stop flashing at me when i pickup new items ?
1	what are the pros and cons of taking the skeleton key ?	skeleton key . return or keep ?
0	how to kill ebony warrior as a mage	how can i tell what glowy-ring buffs the enemy team currently has ?
1	steam installation on another computer	does steam store my savegames ?
0	what is the purpose of the dark matter counter ?	tds : what to do with the imperial flag icon ?
1	where can i find a transcript of portal 2 dialogue ?	how can i extract the full audio or get subtitles of glados 's sentences in portal 2 ?
1	can i generate a new nether in minecraft ?	i do not like hell , can i go somewhere else ?
0	when does rowf 's badge shop get new inventory ?	how can i most effectively destroy enemy turrets ?
0	what is the strange chirping noise ?	why does not the angel watch building work as per the in game description ?
0	what are the indie royale bonuses ?	how do i win level 5 ( grey void ) in eufloria ?
0	"updating steam " window at startup when no updates were downloaded	how can i remember to build supply depots all game ?
0	can not view played game list from my dota profile	what levels are the dlcs ?
0	why does my mouse not work in counter strike global offense ?	what is the square symbol on the wii u gamepad ?
1	can you romance liara if you had already been with someone else in me2 ?	are my romance options in me3 limited if i cheated on my me1 romance in me2 ?
1	in xcom : enemy unknown , which types of scenery are destructible ?	is there a way to recognize destructible environment in xcom:enemy unknown ?
0	can you make your dreams come true ?	what do the different coloured quests mean ?
0	best first night shelter design in minecraft for the ultimate survival noob	are there enough resources in metro : last light to make exploration optional ?
0	can i install magicka on 2 computers ?	how to know what books will give you any skill ?
0	does the quest for beating ore chasm count towards the " did it all " achievement ?	what are the various melee combat combinations ?
0	who sings " want you gone " by jonathan coulton ?	battle nations buildings and units are all invisible
0	our city has 40 citizens . our well has 114 water rations left . what gives ?	wha 's the best evs for a charmander ?
0	how does infamous 2 change based on the way i played infamous 1 ?	how do you kill children ?
0	powered rail not powering down	will combining the same two muppets in harv-e always give me the same result ?
0	do cave spider spawners work by a different set of rules than other monster spawners ?	effective military scheduling
0	are gear spawns random ?	can i abort a blitzball league ?
0	do i need to complete x3 and terran conflict to understand albion prelude ?	how do i form a tribe ?
0	is it possible that the ai in starcraft 2 learns ?	how do i unlock the final gadget ?
0	how do you cancel the interaction bar ?	is there a higher chance of the sham shield dropping elsewhere ?
0	how does the reduced level requirement affix interact with other gear ?	what does it mean to cancel a burn card ?
0	how do i spawn potions with command blocks ?	can the enderdragon be killed by snow golems
1	do you receive trading cards at set intervals ?	how often do trading cards drop ?
1	how do i start a ' new game +' after beating it for the first time ?	how do i start a new game plus in fiz ?
1	what levels-up psi-abilities ?	how do soldiers advance their psionic skill ?
0	how can i install firefox on the ps3 ?	how can i improve my gameplay to carry myself out of bronze league ?
0	are objective change random ?	which is better for pikachu in pokémon red : swift or slash ?
0	how do i progress past the initial tier of gear/crafting in terraria ?	does the " iron will " perk add will bonuses randomly ?
0	how do i get fireballs ?	find game which a steam profile background is from ?
0	does it hurt to leave rot on the ground ?	is it a common bug , that the screen turns blue and textures become missing indoors in fallout : new vegas ? is there a solution ?
0	what are the possible mission outcomes in the singleplayer campaign ?	is there a definitive list of what gifts a companion likes ?
0	as a zerg against a bioball , should you focus fire on the medivacs , or on the offensive units ?	is it possible to set item " loadouts " to a hotkey in tf2 ?
0	is " xbox live vision camera " the same as " kinect " ?	will landmines affect planes ?
1	can you cure lycanthropy after the companions quest line ?	how can i cure lycanthropy ?
0	will followers drown ?	how does team play work ( e . g . in instances ) ?
0	how many seconds count until bomb detonates in counter strike ?	forge mod loader could not connect to this server
0	what does the player role ' captain ' in fifa 14 do ?	how can i use the knot of rust effectively ?
1	i have missed the use the wind achievement . how can i get it without losing my save file ?	do i have to restart the game if i miss " ride the wind " ?
0	is sona a better champion as defensive support or an aggressive one ?	how to configure applied energistics to increase item count to an exact value when smelting ?
1	companions will no longer give me radiant quests	cannot get a new radiant quest from companions in skyrim
1	minecraft constantly times out on when i am playing multiplayer	internal exception : java . new . sockettimeoutexception : read timed out
0	how to unlock the monument of leonidas	how do you kill the dragon in tiny tina 's assault on dragon keep when it keeps regenerating health ?
0	died and lost my jewel , can i get another one ?	how can i play asari vanguard effectively ?
0	do i need to have downloaded the cerberus armor in mass effect 2 in order to buy it in mass effect 3 ?	does the minister of defence participate in armed conflict ?
1	what xp do you lose when you exit a game mid play ?	what do i lose when i quit a multiplayer game in bf3 ?
0	is it normal to continue levelling after reaching the level cap ?	how do i enter cheats using the javascript / developer console ?
1	query about clash of clans - your own clan	can i still join a clan after starting my own ?
0	where do horses spawn in minecraft ?	how exactly does keymaster work ?
1	civ 5 wonder tracking	is there any way to see progress towards achievements in civ 5 ?
0	do i need a seperate memory stick pro to access a different playstation store on psp	how can i find the hidden level ?
0	how do you get black dye besides buying it ?	maintaining squad cohesion
0	why do i have two companions in skyrim ?	how can i get two xbox 360 's to be in " open nat " mode behind the same router ?
1	how do i unlock the sewing machine ?	how can i import patterns via qr code ?
0	which patches and mods should i install before playing fallout 1 ?	is it possible to load a save file from a game of another region ( ps3 ) ?
0	can i add defiance to my steam account ?	why is my ascii art all wonky ?
0	dota 2 config file in steam gets reset all the time !	one with the shadows achievement - no solitude quests ?
0	how do i enable big picture mode ?	as science research points increase in civ 5 , why does the research itself not hasten ?
1	does diablo 3 have any secret achievements ?	what are the feats of strength in diablo 3 ?
0	will i get another chance to punch that reporter ?	does titanfall have split-screen now ?
0	can you cast a spell with a bow equipped ?	how can i find out how many blocks are needed to download a game ?
0	minecraft pe for ipad	does the stopwatch affect bosses ?
0	what is a viable character build for using a whip ?	starcraft starjewel how to spawn more marines ?
0	how do i get the little maiamai out of trees ?	have they changed the power of the honey badger
0	does zonya 's hourglass cancel spells that are travelling ?	what is prestige in globulation ?
0	what can i get from the secret super training ?	what do the letters for job compatibility with different item types mean ?
0	is there a way not to damage your allies and civilians while using explosive weapons ?	what constitutes a house for villagers ?
1	i am getting ' bad login ' when attempting to join multiplayer servers in minecraft	why does my minecraft say " bad login"
0	demon fusion in smt : strange journey	will new minecraft features appear in existing worlds ?
0	steam updated today ( 2012-02-08 ) and now civ crashes on icon execute	do traded cities produce unhappiness ?
0	is there a fix for the bugged playthrough 2 in borderlands 2 ?	what does hc stand for in world of warcraft ?
0	how do you install the fifa 12 demo with fifa 11 also installed ?	do you have to beat the game in one sitting ?
1	which class has the highest dps against tanks on wave 666 ?	for each class , what are efficient methods to destroy the tank robot ?
0	pocket planes - no cities on map	what do the weapon prefixes mean in dead island ?
1	i broke my quarian . do i get a replacement ?	does anyone step in to fill the holes in your roster ?
0	how do i change the appearance of my banner ?	what bonuses do you receive for being elevated ?
0	why did sin destroy zanarkand ?	how can i drop aggro against monsters while playing solo ?
0	age rating/recommendation for dwarf fortress	difference between the restaurant and the market
0	what are the differences between defense of the ancients ( dota ) and dota 2 ?	can other mobs spawn in the vicinity of a mob spawner ?
1	cannot find underground jungle temple	cannot find underground jungle temple
0	best end-game guns and character setup ?	how can i make breaking walls less tedious ?
0	make a column of floating blocks become a row	fallen out of the world through the void in minecraft
0	how can i recover my deleted minecraft bin folder and minecraft . jar ?	philosopher 's stone tooltip bug
1	how do i lose a bounty when i have murdered the guards in whiterun ?	how can i get rid of a bounty and keep my stolen items ?
0	should i farm sudden insight with " talk to the porters " ?	how do i get past 97% campaign completion ?
1	at what point does arena become better value than boosters ?	spending gold : arena or card packs ?
0	completing " discerning the transmundane " with a clear conscience	is it possible to create diagonal pool pieces ?
1	why does a dead elder dragon kept spawning where ever i go ?	why is it suddenly raining dragons ?
0	how much food does it take to get a dragon to level 15 ?	do zombie testifacates naturally spawn like regular zombies in minecraft xbox 360 edition ?
0	what is dunking ?	how does force regenerate ?
0	opening deposit boxes	great khan quest fo:nv
0	input lag when in third person	what game does extra credits use in the " working conditions " episode at 6:12
0	ps3 controller not turning on or syncing	how are people playing betas before they come out ?
0	is there any way i can use my wii u to play movies i have on my computer ?	did the original super mario bros . contain a running glitch ?
0	can you play diablo 3 multiplayer between pc and xbox	how can be changed the path to save folder in fifa10 ( pc ) ?
0	kinect sports : season two . top jumps .	the longterm motivation of diablo 3
0	what is the chance of being discovered by zombies as a scout ?	is there a high-res patch for dark reign ?
0	can item spawn with over cap hero/tower stats ?	how to start the morgan 's spiral quest chain ?
0	how do i ascend a +10 normal weapon to a +11 normal weapon ?	how can i earn dungeon achievements in the regular version of cookie clicker ?
0	how to build a tnt cannon with adjustable range and direction ?	why does magicka quit as soon as i open it ?
0	trying to add a second player on skylanders swapforce wii u	level 51 - owl icon in top right
0	what is up with the two elves outside phillipa 's house ?	ps3 audio & speakers issue
1	how do i get power armour training in fallout new vegas	how do i get power armor training in fallout new vegas ?
0	how do i get rid of ctos scans ?	does the order matter when talking to the ghost travelers ?
0	what do the card levels mean ?	do critical hit bonuses from the sniping tree apply to melee attacks ?
0	how can i get science from my space station to cash in the points ?	minimum fire resist to counteract vampirism weakness
0	which item is the most cost effective for a bruiser ?	does armor break have any impact on gameplay ?
1	are there multiple levels of difficulty to unlock in mass effect 3 ?	is there a difficulty level above insanity ?
0	which color packs overlap ?	how do i remove introduction movies in games based on the unreal engine 3 ?
0	how to save the life of silus vesuius ?	what are the tiers for characters in street fighter 4 ?
1	how much do various delay options actually delay the fleet ?	what factors influence the speed of the rebel fleet ?
0	should i always turn the same direction in temple run ?	where 's all the ladies at ?
0	how can i talk to odahviing again ?	problem loading multiple units into multiple medivacs
0	when do purchasable upgrades take effect in desktop defender ?	farming in league of legends
0	when does the blacksmith restock ?	what is the best bow / gear available according to my perks ?
0	where is the ravager 's head ?	what is the difference between skyrim . ini and skyrimprefs . ini ?
1	in intensity stacking conditions	how much can buffs and debuffs stack ?
0	why can not i destroy blocks in minecraft in single player mode ?	can you level down ?
0	cluttered map on me 2	where is cedric during the quest " where is triss merigold " in the witcher 2 ?
0	how do i make a custom texture pack for minecraft ? ( 16x16 )	is it possible to run knights of the old republic 2 at a higher resolution ?
0	what is the best way to earn experience in dragonvale ?	are the dead space 3 collector trophies dependent on optional side missions ?
0	do i need to have all the weapons for treasure hunter achievement in my inventory ?	what is the meaning of the three kinds of penetration ?
0	how can i start a gamecube game without using a wii remote ?	what triggers the option to buy a guild ?
0	what is the deal with this hinox ?	how do you become eligible for team fortress 2 and dota 2 booster packs ?
