0	what affects resistances ?	are there any treasures in the first chapter of uncharted 3 , in the english pub ?
0	how do filters and gas masks work ?	does the " life on hit " affix work on channeled / dot wizard spells ?
1	how do i filter out regions that are full ?	joining a game with an empty slot
0	has anyone encountered a dark brotherhood assassin ?	how can you romance diana allers ?
0	how to select champion before automatch ?	fallout 1 and 2 version on gog and steam
0	how do you know what a care package contains in modern warfare 2 ?	adjusting fore/background fps in diablo 3
0	is there a way to increase the carrying limit ?	running lol on guest account on mac
1	"secret " ending in mass effect 3 ?	does mass effect 3 have a secret ending ?
0	can legendary firearms spawn ?	how can i use a custom resolution ?
1	do i earn enough skill points to unlock everything ?	how many skill points will i have at max level ?
0	where 's the rainbow jetpack gone in jetpack joyride ?	is it possible to get the saved game progress from ps4 to pc ?
0	what happens when i use the map flags ?	is spore as effective as on , when off ?
0	is there a way to play a clean start in borderlands 2 ?	can i lock my doors ?
0	what does it mean for a game to be linear ?	environmentalists are annoying me , how can i silence them ?
1	how is the damage reduction calculated from armor/mr ?	how can the damage reduction from armor in league of legends not have diminishing returns ?
0	how do i sell old items ?	what happens if you enter a steam powered serial key by accident of a game you already owned ?
0	how to make sea races appear in gta v ?	do achievements earned in windows phone game trials transfer to the paid version ?
0	keeping track of multiple bases in minecraft	how do i get critical hits in fruit ninja ? and what are they ?
0	how do i do guild management ?	when is the " resourceful " trait active ?
0	does a firestorm kill a fire elemental ?	can i buy the xbox live gold family pack for only 2 accounts ?
0	can i send money to my friend 's steam wallet ?	how do i play against hunters as a zoo warlock ?
1	when installing mods , release does not show up in ' use version:' list	how to install mods for the new minecraft launcher
0	how do i solve the agbaar 's academy slowing pt 1 puzzle ?	can i play the same starbound character on multiple computers ?
0	does the drake sword in dark souls not scale with any stats ?	does the skyrim prima guide book include access to the online eguide ?
0	how does sunburst work ?	how do you use potions ?
0	what is the answer for question 19 in the impossible quiz ?	what is preventing players from receiving new quests in the new 80-85 cataclysm zones ?
0	does dawnguard make any significant balance changes to skyrim ?	what are these " o-power " things ?
0	multiple characters and hall of monuments	how to progress when stuck in " limbo " between ilvl 200 and 220 @ level 81
0	why does mumble interfere with steam ?	does bristleback 's passive block huskar 's burning spear ?
0	what network settings are best for counter-strike : source after the update ?	how do campfires/fire pits work ?
0	are there more gems than i need ?	what happens to items in pipes when a chunk is unloaded ?
0	where are biomes saved in minecraft ?	is evelyn viable somewhere else than in the jungle ?
0	what are the differences between the easy , medium and hard difficulty levels ?	making dark souls just a little bit easier ?
0	how do i prevent my imbecile son from being an heir ?	a +1 , 10 strength dagger , or a mundane , higher strength weapon ?
0	does mourning the dead serve any practical purpose ?	how do i orientate the navball properly with a probe ?
0	making mobs invincible	if one player does not own a dlc-civilization , can the others still use it in multiplayer ?
0	who does a.d.a.m. talk to on the elevator up from the tro section in metroid fusion ?	where are good home base sites in fallout : new vegas ?
0	is xmp blast falloff linear or quadratic ?	how can i identify all these items ?
0	"hold position " command	how do i unlock the secret room in dungeon defenders
0	can quarry borders overlap in buildcraft ?	does replaying missions on a lower difficulty still give me the relics ?
0	hero 's father in dragon quest vii	how do all of the damage reducing methods interact with each other in league of legends ?
0	how do i heal outside of battle in hunted : the demon 's forge ?	how do the dice loot chests work ?
0	how do you put +alchemy or +enchantment onto armour ?	how does auto-leveling work ?
0	how can i control my distance from the final boss ?	what can i do with all these ingots ?
0	adding minecraft to steam 's games library with multiple jres	what are the statistically most likely places to buy certain items from merchants ?
1	how do i maximize the loot from a treasure goblin ?	how do the treasure goblins work ?
0	does jiub 's opus page 9 eventually reappear ?	are functions lost forever ?
0	will a hero take damage from rupture if he was hooked by pudge ?	is the infiniti-lift in tiny death star worth the bux ?
0	how does terrorblade 's sunder ability work ?	are diablo 's abilities predictable ?
0	why will not the blank map qr code map work ?	does it matter which resistance type i stack when using one with everything ?
0	are there any websites that list common build orders ?	where can i get my horse ?
1	playing high elf mage with spells only	if i want to focus on magic , can i ignore weapons entirely ?
1	how should i build a barbarian as i progress through inferno ?	building barbarian in inferno
0	open broadcaster software compressing video size	how do i attain a 100% approval rating ?
0	prevent knockback when shield is active	occasional spawning with full health
1	what do i need to do with a parrot statue that is missing a red eye ?	purpose of one-eyed statue in skyloft ?
0	who is the bounty hunter on the star wars : the old republic loading screen ?	is there any way to increase my maximum health ?
0	are there certain sounds that only occur when a unit is born ? or is it random ?	is there any way to make the text scroll faster ?
0	does giving miranda alliance resources change anything ?	how can i turn mods on and off with modloader without uninstalling them ?
0	cannot get shen 's " god or man " conversation	how do i complete the " fill a business with all skill 9 workers " ?
0	why did many commodore 64 games feature different music than their original arcade or other computers version ?	when should i invest in boosts ?
0	which ephemeral & remote ports do steam & valve games use ?	do i ever stand up ?
0	in the focus the oculary in skyrim , the beams of light are not popping up they do not appear	is minecraft turing-complete ?
0	cannot connect to own team fortress 2 server	why did i lose all my piety upon death ?
0	does crew headcount or race influence oxygen usage ?	what is the server command to change mann missions ?
0	how do i get rid of the remaining enemy in the bandit slaughter quest ?	what stats of malzahar 's do the voidlings mimic ?
0	keeping a long term base in dayz	are there other ' casual outfits ' available for shepard ?
0	can pc saves be imported into console version of mass effect 3 ?	dota 2 faceless void tier
0	what happens to costume pieces , powersets etc . when i drop to freemium ?	is the skull heart capable of having a male host ?
0	does the sensor tower sense cloaked units ?	how do gregtech machines explode from rain ?
0	technically , does wii u produce better graphics than ps3 ?	cs : go does not play smoothly with a 1 gb graphic card ?
0	set 2 buttons to same action	what is the easy way to get the germaphobe achievement in jetpack joyride ?
0	what is a theming bonus ?	does diablo 3 have any secret achievements ?
0	how do pigmen children become pigmen children ?	how to use perks ?
0	do you need xbox live for squads in call of duty : ghosts ?	how do i disable or hide the big picture mode option on steam ?
0	does the wii/wii u sensor bar need to be plugged into the console to function ?	what exactly does weapon weight affects ?
0	how do you get the barricade blaster-achievement ?	is there a way to change my spawn point in terraria ?
0	is braid on ps3/pc different in any way ? is there a definitive choice ?	how much does the repair arm augment repair ?
0	what dlc and unlockable items are available for mass effect 3 by playing other ea titles ?	why was supernova paired against jaedong in battlegrounds detroit ?
0	can you influence the traits your ' family ' gets ?	where am i to most likely find the last 16 coins in live freemium or die ?
0	how to disable production/research recommendations in civilization iv bts ?	can i have multiple saves ?
0	showing custom messages to players joining my server	why does everybody ask me whether i am sick in skyrim ?
0	how can i select a single bit out of an array of latches ?	how do i unlock the missing cheat and skater in tony hawk pro skater 2 ?
0	how do i create floating islands and lava columns ?	is it worth if the entire team takes smite ?
0	how do i start multiplayer sessions in icewind dale ii ?	what happens if you put a different tank 's crew in your new tank ?
0	longest illusion in dota2	does harbor master really want 100+ product containers ?
0	how to beat black phantoms in dark souls ?	what happens when i get attacked by another player ?
0	cooperative game vs multiplayer game	how can ap tristana be used viably in season 3 ?
0	can i make the journal screen show only incomplete missions ?	maestro becoming a sigel knight - which skills will remain ?
0	where/how can i farm mana stones ?	mass effect in origin client does not work ( win 7 64 bit )
0	how can i effectively play siren ?	is there a way to auto-collect suns in plants vs . zombies for pc ?
0	how do i automatically change the camera in a track in trackmania 2 ?	where can i find stardrops ?
0	why will not my music play ?	what are the dice for in angry birds ?
1	what ways can you counter or avoid being hit by karthus ' ult ?	how to counter karthus ' ultimate ?
0	what specific bonus/loyalty powers are available ?	can’t find a switch in cave 2
1	what is realms and why can not i connect to it ?	what is realms and why does it keep telling me " no available servers " ?
0	if i stick a blank hard drive into my ps3 will it work ?	where do confiscated items go ?
1	how do i change my name via the command-line of the minecraft . exe ?	how do i change player name in minecraft multiplayer in offline mode in linux ?
0	do intermediate portal levels have an effect on loot quality	is spore as effective as on , when off ?
0	geonosis and mustafar apts	hints , not walkthrough , for braid ?
0	how to react to jungle invasion ?	why do mighty blow and massacre not always give experience point bonuses ?
1	where 's my tank ?	how do you access your " special vehicles " in gta v ?
0	is there a way to remap the inventory hotkeys in warcraft 3 ?	how long does each o-power bubble take to recharge ?
1	how do you kill an enderman without them teleporting ?	what is the best way to fight an enderman ?
0	how to access quests that are required for certain building ?	do challenge runs count towards isaac 's completion achievements ?
0	why are there champion trains in low-level maps ?	how much damage is dealt per newton of force ?
1	i can not get my sister on my singleplayer	why is not my minecraft lan server working ?
0	where can i buy a stealth boy ?	does the juggernaut 's health increase progressively in survival ?
0	how to defeat stalker solo ?	is it possible to switch to a different squad within the platoon of which you are part ?
0	how to view sales per minute on tiny death star ?	what is the highest critical chance and critical damage that is possible through items alone ?
0	how to counter a heartbeat sensor ?	what do these abbreviations mean in rise of nations ?
1	is plague of toads as unhelpfull as it seems ?	why does my plague of toads make me croak ?
0	is there a way to only join games that have not started yet ?	what can i do about " a fire is raging " ?
0	what do the qualities applied to monsters mean ?	is this the real face of tali ?
1	do you need to play the entire deus ex saga to understand deus ex h.r. ?	should i have played the first game and/or invisible war to fully understand human revolution ?
0	when should you give up top tower for dragon ?	players outside of playable map in rush game mode - exploit or legit ?
0	will any wireless headset work with the xbox 360 ?	does the operations training dummy hit back ?
0	how do trainers work in skyrim ?	prison architect- dog patrols do not work
0	when is it a good idea to punch people ?	chad ( world 2 boss ) level bugged in super meat boy on osx
0	videos do not work	missing plant on pvz2 ?
0	how to capture a screenshot without my own character in the picture ?	how do i to get level advantage ?
0	execute command relative to block	how do i start steam without it automatically logging in ?
0	assassins creed 2 story recap	what passives abilities does doom disable ?
1	when do my items lose durability ?	are weapons and armor damaged by anything other than death ?
0	what level do i need to be to purchase tier 3 runes ?	how do i stop flinging people to their death ?
0	some dwarf stays outside ignoring all my " commands"	does the masuda method work with a ditto ?
0	chances of encountering a charged creeper ?	what might cause and/or solve a super-noisy 3rd gen ps3 ?
0	which console versions do amazon . com sell ?	only backup files in my bin folder in %appdata% . minecraft
0	what is the most effective way to pick in ranked teams ?	how do you upgrade nook ' n ' go into nookway in animal crossing city folk
0	why does my meat disappear so quickly in a dark room	is the ' heaven ' in miner 's heaven meant literally ?
0	peer to peer transfer on lol	file validation stuck at 100%
0	what good are bugs ?	is it possible to adjust game speed ?
0	how to change the difficulty of a field in gemcraft chasing shadows ?	i can not get the knight 's honor trophy
0	is there a world generator that can create a minecraft world that is solid rock ?	how to pass the barge death challenge ?
0	is there a hotkey sequence to send minerals or gas to your ally ?	how do i pause starseed pilgrim ?
0	how can i find out what the current build of deus ex : human revolution is ?	is there any benefit to destroying non-target breakable objects ?
0	how do i use the computer ?	how to instantly get item counter back to 1000 after power up expires ?
0	how do i send ships in assassin 's creed 3 liberation ?	who are essential and will not attack you ( purposely ) ?
0	in war metal tyrant , where can i actually watch my saved replays ?	does matter to match furniture built with the same kind of wood ?
0	minecraft keeps crashing	why will not my escape key work in the keybindings ?
0	how does the assault rifle piercing mod work ?	how do i fight dr . zomboss in the pirate and wild west levels ?
0	do more surplus resources mean greater war asset ?	hide my updates from friend 's steam activity pages ?
0	is there any way to tell what color an item is dyed ?	error with double-dabble decoder
1	swtor character transfer & legacy level	what happens to your legacy when you transfer characters in swtor ?
0	which characters unlock each scene ?	is it possible to remove blue lines in mega man 10 in widescreen mode on ps3 ?
0	is there a way to maintain momentum while shifting gravity in a different direction ?	how can i return the golden claw ?
1	what is the fastest way to get candies ?	is there any way to increase the number of candy made ?
0	how can i heal in battle ?	minecraft crashing - ubuntu 12.10
0	do i have to make light sources in dwarf fortress ?	in team fortress 2 , what is " telefragging " , and how is it done ?
0	why does not my hopper put drops into a chest ?	how can i make it so people can not join on my minecraft pe world even when they are on the wifi zone ?
1	champions that dominate early , only to fall of late game	what exactly defines a champ who " falls off late"
0	how to get the " this . is . skateboarding " achievement ?	can skarner 's ultimate ( impale ) cause a friendly turret to switch focus away from champion he has impaled ?
0	do mac and windows versions of source games contain the exact same files ?	skyrim sudden fps drop during zone transition
0	which dragon for which race ?	how to find extreme hills biomes
0	are there any server commands to despawn neutral mobs in minecraft 1.6.4 ?	what are all the facts that core 3 babbles about in portal 2 ?
0	what is the difference between miss fortune and mysterious stranger ?	is there a hotkey for the general " next move " button ?
0	does dueling in brotherhood of blood affect k/d spread ?	how do you recharge the venom edge ?
0	in minecraft i found a zombie with an iron enchanted shovel but my brother never made one	is selling or trading my world of warcraft account a violation of the terms of service agreement ?
0	is it possible to recover lost xbox 360 achievments ?	unlocking all decks in magic dotp 2014
0	how can i find the lagging region on minecraft server ?	is there a horadric cube in diablo 3 ?
0	what do noteblocks do ?	arena reward tiers
0	khaaaaaaaan ! ( how to kill him )	do health wells , chests , and other interactive objects that allies use count towards the achievements ?
0	where is link at with ilia in this screenshot ?	how do i jump onto really high stuff in halo ?
0	counterstrike 1.6 hangs for a while and then runs again	how to dice chain in veggie samurai ?
0	how would i solve the twins riddle in qasir al-wasat ?	does the damage from dragon breath attacks fall off with range ?
0	when do monstars change direction and when do they fall ?	how does veil of discord damage amplification works ?
1	are there any penalties for swapping out heroes ?	how do equipment buffs work on towers when switching characters ?
0	is there a way to stop mobs pick up blocks mod for forge/ftb	what is this pink target ?
0	can a starcraft ii digital download be put on multiple computers ?	why are some 32-bit pc games not supported on 64-bit operating systems ?
1	what am i doing wrong while mining in minecraft ?	how do i find diamonds ?
0	are there any cave systems generated in minecraft pocket edition ?	how do i jungle with nature 's prophet ?
0	what does fortification do ?	extra experience from equipment
0	how to kill the mega interplanetary ninja assassin claptrap ?	how many rats does it take to get to the center of a corpse-pop ?
0	is there a quick way to delete saves off of the steam cloud ?	can you enchant your other characters ' gear ?
0	how do i learn what my enemies ' powers do ?	is it possible to move some steam games to a different library location ( without re-downloading them ? )
0	where to find the secret monolith	can my saved game in kotor be used for anything in kotor 2 ?
1	upgrading uchigatana +11	how do i ascend a +10 normal weapon to a +11 normal weapon ?
0	how do i connect starcraft 2 and facebook ?	how do i make stone bricks in minecraft ?
1	when i break a block it reappears and when i place one it disappears ?	why can not i destroy or place blocks ?
0	how can i change the installation directory to drive a ?	does blinding cloud completely disable siege tanks in siege mode ?
0	dragon quest 8 skills	which zelda and link are featured in the super smash bros . series ?
0	do i keep my guns through later prestiges with their levels still there and not reset ?	determine which rooms are unsolved in antichamber
0	how do i unlock the onion knight job ?	is cracked tusk keep supposed to be empty ?
0	how much is my damage mitigated when i am underlevelled ?	portal texture problems
0	how do the skills actually work ?	how to efficiently configure working item counts from applied energistics
0	going for religious dominance in civilisation 5: gods and kings	where do followers go when not at their home ?
0	why can not i break blocks in minecraft ?	how can i catch the killer rabbit of caerbannog ?
1	i have lost my wife . where can i find her ?	how do i deal with a runaway bride ?
0	how can i improve my success rate when farming ?	is there a chronological order to the earth defence force series ?
0	how does dual-wielding affect weapon skill special attacks and stat bonuses ?	how can i leave a level after donning the boots of introspection ?
0	how do i stop my ps3 from making so much noise ?	is the call of duty elite service available for pc ?
0	how do i get monsters to spawn in a certain place ?	what is the best counter for protoss carriers ?
1	do i have to have the actual instructions on a cloning potion to make one ?	how do i beat the desert temple third room ?
0	are some racers faster than others ?	help ! where 's my face ?
0	is there any way to beat the universe ?	how to transfer in single player mode in fifa 14
0	what makes gragas strong mid and how can you counter him ?	what is it with the edge of the world ?
0	what is a world boss ?	how was the cow level discovered ?
0	tomes : how can i use them ?	how exactly do you go about disable " emulate format changes " in dolphin ?
0	how to dig through an aquifer	where are the secret controllers on the title screen ?
0	can i still replay desmond 's missions after completing the game ?	connection to own q3 dedicated impossible
0	when is streetpass unlocked during smt4 ?	are there any benefits of helping " friends " other than a little extra cash ?
0	how to prevent being stunned by the first form of vol opt ?	is it possible to save the game during a mission ?
0	where can i get the final fantasy xiv client ?	when will the forge have new weapons availible ?
0	in modern warfare 2 , are there any achievements in the museum ?	is it possible to buy a video card for a shuttle sa76g2 v2 that will play wow well without upgrading the power supply ?
0	under what circumstances do i have to buy the mega stone for my second starter ?	what are all the ways a country will leave the alliance ?
0	does urn of shadows have a limit to charges , and what is it is radius on damage to enemies ?	what does the patriotism bonus do on some of the guns ?
0	who do i talk to to buy a house in falkreath ?	how do i run starcraft : brood war on windows 7 without problems ?
0	is it possible to have more than three saved games in super mario 3d land ?	what is a good way to acquire a target when approaching from low level flight ?
0	how is fi 's name pronounced ?	how can i quickly spam charge attacks ?
0	what prevents transporting troops by ( inland ) sea ?	is there really a black hole in eve online ?
1	anyway to reduce attack at night by killing zombies ?	how does zombie spawning in die2nite work ?
0	what is satan doing here ?	how do i win against a zerg on many bases as protoss ?
0	villager 's do not move on to the next livestock after gathering food	how to use skyrim " power " with new voice command kinect ?
0	where to find " prefs " for beat hazard ?	how is shepard supposed to know how to make the final decision in mass effect 3 ?
1	i could not get the mega stone upgrade	why is my mega stone not in the location it should be ?
0	at what speed should i stop " punting"	convincing a camper to move in ?
0	can i sacrifice the old and weak , or is a graveyard necessary in black and white ?	do you need xbox live for squads in call of duty : ghosts ?
0	is there a way in wow cataclysm to raise bloodsail buccaneers reputation without harming steamwheedle cartel ?	how can i play multiwinia fullscreen on one screen ?
0	how to increase merchanidising revenue in football manager 2014 ?	does the looting enchantment affect drops from players ?
0	what different backstabbing techniques are there ?	does chaos storm silence 0.5 seconds constantly ?
1	what is the average time to finish diablo iii in normal mode ?	how can i tell how long ( more or less ) it will take me to complete a game ?
0	how do i get my joystick to work with touhou 7.5 immaterial and missing power ?	minecraft : i can not create an account
0	sigil of force + of the night , and dual-wielding	are demon hunter pets valid targets ?
0	what is the murder-to-renovation ratio ?	what is the max level in steam version ?
0	how do i switch to a different starter deck ?	how do i play original xbox games on the xbox 360 ?
1	mega ring problem in pokemon x	why is my mega stone not in the location it should be ?
0	in sniper elite v2 , how is the kill score calculated ?	can i keep my world between dwarf fortress versions ?
0	which parts of inferno act 1 actually drop ilvl 63 items ?	once poisoned does it matter if i stay in poison clouds ?
0	how well does xbox live work with mobile broadband connections ?	do i need to conserve ammo ?
0	what does the x mean over my crosshair in bf3 ?	how can i increase the density of residential zones ?
0	how to lightning-proof a structure ?	what is the use of the lever at the end of level 4 ?
0	how do i breed a blue fire dragon in dragonvale ?	how do you unlock skulls in halo anniversary ?
0	how can i get the steam overlay on skyrim , if i am using the skse . exe to launch the game ?	where is the easiest spot ( s ) to get dfa kills ?
0	is urn of shadows affected by magic resistance ?	how long is the " temporary " account ban from bungie/halo reach ?
1	how to make dwarves stay indoor in dwarf fortress 2010	how do i get rid of unwanted immigrants ?
0	do hydra and manticore mobs only appear on higher difficulties ?	as a bronze league hopeful , is it better to focus on one race or should i keep playing as random ?
0	any way to get a clean reputation on xbl ?	can i upgrade my save games ?
0	can i cancel my teleport command ?	in luftrausers , how do i complete the " kill 30 enemies while firing nonstop " mission ?
0	what is the wager in cod:bo gun game ?	why is chess so easy ?
0	what bonfires should i burn ascetics in to get ng+ items or higher ?	why will not my ps3 go online ?
0	feeding the " tree of wisdom"	what exactly does upgrading luck do ?
1	batman arkham city strange radio channel	what is the meaning of this broadcast ?
