0	rainbow six - vegas 2 " failed to initialize . . " at multiplayer	what affects the amount of hitpoints each eaten candy increases ?
1	what happens after achieving l8 in ingress ?	what do you do and get once you are ingress level 8 ?
0	how do i drop an entire stack at once ?	is it better to sell bpcs vs t2 bpcs ?
0	has anyone else got a " temporary " worker ?	dual wield damage calculation
1	are there any penalties for swapping out heroes ?	how do equipment buffs work on towers when switching characters ?
0	what is the recipe to not getting obliterated in the final level of serious sam : the random encounter ?	what do i do with diamonds ?
0	enlarging embark location after embark ?	does killing wards increase my cs ?
0	is there a way to increase the odds of getting a portal key ?	which of the 3 support items can earn you the most gold ?
0	do items bought from kadala have a different stat range when bought in a torment game ?	how can i improve my search effectiveness early on ?
0	can you cut a smoker 's tongue after it wraps around you ?	jacob romance in mass effect 3 ?
0	how do i solve level 11 on mad difficulty ?	what is valve test sub 74 ?
0	why is this challenge room locked ?	how do i configure a plasmid to a keyboard key ?
0	how do i speed up a round of civilization 5 ?	in story mode how do i change my team to attack mode ?
0	is research percent needed at max ?	how to counter protoss 's forge fast expand as zerg ?
0	how do i see my inputs ?	is it possible to complete moonlit grotto without using the teleporter in the midboss room ?
0	what does it take to persuade people in promises to keep ?	what happens when stats go above the " max " ?
0	what do fifa 14 position acronyms mean ?	how to book many marines quickly
1	how do i hold items in front of me ?	how do i manipulate objects ?
1	does " rend " stack ?	does rend stack ?
0	what is the requirement to give my party members the nephlem bonus ?	are the class requirements different in final fantasy tactics for the iphone ?
0	is the reputation bonus retroactive ?	is there a way to check my achievements inside the game ?
0	is there a way to turn off the lime limit	what does " team collision " in cs:go mean ?
0	are enemy subtypes level restricted ?	how can i tell if two minecraft mods are compatible ?
0	naturally occuring wildfires in minecraft ?	where can i get the chain vulcan ?
0	do elves ever forget a murder ?	why is my cursor blinking constantly ?
0	is it necessary to get the memoir pages ?	how many move controllers do you need to play playstation sports champions ?
1	how can i continue playing with my demo character ?	can i import my diablo 3 demo character into the full console version ?
0	what is the most efficient way to make money ?	patch notes for playstation
0	how can i switch between automatic and manual air combat ?	how do you breed a blue moon dragon ?
0	do i need to get all the red dead redemption achievements to get 100% ?	terraria freezes on ps3
0	how can i free city states and accomplish a diplomatic victory ?	how do i power redstone through a block ?
0	how to unlock broodwar units in original starcraft campaign ?	what is this star next to the player name/health bar ?
0	how viable is taric as a support in higher level of play in comparison to , say , soraka ?	what does it mean when a monster starts drooling ?
0	is it possible to re-name crew-members in-game ?	are stealthed opponents visible when capturing altars on twisted treeline ?
0	percentage letters do not show up on bottom of screen	where is my time machine ?
1	what are the secret acheivements and how to track them ?	what are all the " hidden " quest in hearthstone ?
0	what are the equivalent pc keyboard keys of the xbox 360 game controller buttons shown on the screen ?	how long does it take for the " give valentine " to reset on your neighbor 's character ?
0	how well were the games in loz : collector 's edition emulated ?	can slimes spawn in chunks surrounding slimechunks
0	can i complete optional tasks later ?	what is mann-up mode ?
0	what is the hidden achievement in 10,000,000 ?	do followers get encumbered ?
0	how do i start the freedom cry dlc ?	how do the new missions work in cs go ?
0	is the 3ds version of " link 's awakening " identical to the original ?	what are the controls on the ps3 for operation flashpoint : dragon rising
0	can not level up after level-50 in borderlands 2 in true vault hunter mode	how do you exit minecraft on kindle fire 0.8.1
1	what is the significance of the red mark in civilization 5 ?	why do some tiles have red " chips " on them in civilization 5 ?
1	problems installing civ 5 , steam errors . . . no solution yet	can i play civ 5 without having steam installed ?
0	does the last champion in a pack drop better loot ?	league of legends amateur league ?
0	what are the different ways to earn valor points and which one ( s ) is/are the fastest ?	what bonuses do i get from the tile on which i place my city ?
0	are the winter map files still accessible ?	are these buttons solely for cosmetic purposes ?
0	how do you use function keys in torchlight 2 ?	is griefing by mobs in minecraft really random ?
0	how do i complete the " fill a business with all skill 9 workers " ?	how do you get into a gold dungeon in the aether ?
0	where can i find more element zero ?	how much damage does the scythe do in candy box 2 ?
0	dwarf fortress : protecting dwarves during an attack	can you level down ?
0	how does the stat "- ## to all armor " work ?	how long does a specific moon last during superbrothers : sword & sworcery ep ?
0	what counts as a death ?	what are the rules of station building so the ai can find you ?
0	if i quit during a mission , will i resume at the last checkpoint or before i started ?	how come i can not register for a mojang pe account ?
0	what kind of miis can i use to defeat the mummy ghost in find mii 2 ?	can a headless zombie eat your plants ?
0	will i lose my escape pod if i use it ?	how do you counter heimer mid ?
1	is there a downside to using heavy armor as a mage ?	are there disadvantages to wearing armor as a mage casting spells ?
0	how is the rating calculated ?	my xbox 360 s will not update the clock when connected to xbox live . why ?
0	how do i actually use a phoenix up ?	in infinity blade 2 , when is the right time to take on bog giant and moss golem ?
0	do i need to launch steam everytime to play football manager 2012 on os x ?	what rare items exist in minecraft , and where can i find them ?
0	how to tell if there is a spy on my head ?	what happens when you die ?
1	how do i promote from multiplayer ?	what does it mean to " promote a multiplayer character " ?
0	what do i need to do to find the missing girl ?	how to use the titan extractor ?
0	what order are the '5-days ' games meant to be played in ?	how to disable production/research recommendations in civilization iv bts ?
0	lost connection to xbox live	is it possible to play multiplayer against the dark tribe ?
1	why would anyone want an enemy to flee combat ?	is there any reason to use the fear spell over the calm spell ?
0	buying vs catching a horse in red dead redemption	is it necessary to touch the mystery block ?
1	what happens when your follower dies ?	can followers ( templar , enchantress , scoundrel ) die ?
0	can i regain the ivory claw to use in folgunthur ?	is there a way to increase the resolution for diablo ii past what the game allows ?
1	how long until the bomb goes off in condition zero ?	how many seconds count until bomb detonates in counter strike ?
1	clone the hdd of a broken ps3 to a new one	is it possible to get data off of a dead ps3 ?
0	getting all kanto starters in x and y ?	are there any similarities between the plot of modern warfare 2 and the plot of modern warfare 3 ?
0	do the " catchable " types of fish vary by time of day ?	why do people do the doran 's blade stacking ?
0	in story mode how do i change my team to attack mode ?	is there any reason to need a manyullyn pickaxe ?
0	what is taking up so much space ?	what are the spirit-generating mechanics for crippling wave - rising tide ?
0	ward placing on bottomlane	well fitted/custom fit armor perks : if the armor type of the shield is different , will it affect these perks ?
0	how to get a+ ball handling grade in nba2k14 my career ps4 ?	left 4 dead 2 - purchase non low violence version ?
0	problems installing the ultimate vault hunters pack with season pass	what determines size of the zone in skyrim ?
0	restarting with new account	how do i counter support zyra ?
0	how can i sell buildings ?	how is critical hit damage calculated ?
0	is there somewhere i can go to easily ' catch up ' to current events ?	what is the correct terminology for games like final fantasy ( the early ones )
0	usf4 matchups with m bison	do the different skills on the skill tree add to each other ?
0	when wheat is harvested , does it drop 0 - 2 or 1 wheat ?	how should i allocate terraforming and infrastructure in sword of the stars ?
0	do i need to own diablo iii to download and install the game ?	strategy for killing a bronze colossus ?
0	is it possible to win in project zomboid ?	pocket edition server problems
0	minecraft forge profile will not launch	if i hit 100% in city control , will it stay there or do i need to keep sending my assassins on missions ?
0	help with animal crossing save transfer	is it possible to activate a dvd copy of dead space with steam ?
0	tds unexpectedly stopped after imperial propaganda challenge began ( march 2014 )	is the login for the minecraft pocket edition the same as that for the computer edition ?
0	gmod fading doors dosnt work after i reload my savegame	the sims 3: athletic skill stuck , any way to fix ?
1	i lost my purchased horse in skyrim - please help ?	what happens to my horse if i ride another horse ?
0	how do i beat the desert temple third room ?	how to always start league of legends in fullscreen mode ?
0	how to placate a very angry priest ?	soloing sunwell with a rogue
1	why will not my arms dealer move into the house i built just for him and his family ?	how do i build a house for my npcs ?
1	what is the point of the super secret settings option in the video settings in minecraft 1.7 ?	super secret settings
1	how do i make a button with delayed reactivation time ?	what is the terminal velocity of a sheep ?
0	does anyone know which age of empires map this is ?	difference between ezreal 's adc and blue builds
0	what is the point of xp in freeway fury 2 ?	how do i avoid friendly fire in starcraft 2 single player ?
0	does world of warcraft benefit from amd crossfirex or nvidia sli ?	where does the hallowed set drop ?
0	which house / safe storage chest is closest to a fast travel destination ?	is it possible to change gamemode or gametype while the server is running ?
1	d3 unable to join act 2 public game on hell difficulty	is there a list of the ' levels allowed ' range for joining public games of a particular quest and difficulty ?
0	does a crit boosted backstab do more damage against giant robots ?	what books increase skills ?
1	what is that icon next to your name ?	what does the symbol with a shield and two swords next to clan members ' names mean ?
0	how do the different color tokens work for materials ?	is there a chart showing all building and their prerequisites in civilization 5 ?
1	how do i solve the first set of clues in part 1 of paper trail	how do i solve the first set of clues in part 1 of paper trail ?
0	am i able to add my copy of the secret world to origin ?	what does 8-bit / 16-bit actually refer to ?
0	how do i gain altitude with the wing cap ?	how can i chat with friends while in a lol match ?
0	how to change the campaign completion point ?	garry 's mod steam server ?
0	how do i count in myst ?	minecraft cannot connect to server ( java . io . ioexception )
0	how can i persuade my lords to pass a law ?	what is inside the jail ?
0	how can i install custom firmware on psp 3001 , version 4.21 ?	average minecraft ram
0	skill change penalty during a battle	is there any way out of the infinite corridor ?
0	minecraft 1.7.9 crashing when connecting to server	what is this attribute represented by a purple skull ?
0	how do i mine redstone ore on minecraft pocket edition 0.7.0	what is the total amount of exp needed to go from level 1 to 70 ( 71 ) in modern warfare 2 ?
0	what achievements are " missable " ? *spoilers*	why my cellar changed and now is full of spider webs ?
0	the jump at lvl 2 of prince of persia classic	where to go for missions in crash time ii ?
1	what determines suppression ?	who and what can lay down suppressive fire ?
0	what are the counters in aoe 3 ?	how can i counter thornmail ?
1	i am getting ' bad login ' when attempting to join multiplayer servers in minecraft	why does my minecraft say " bad login"
0	how do you become ' stylish ' enough to access luminose stores : pokemon x and y ?	only backup files in my bin folder in %appdata% . minecraft
0	skyrim equation to calculate if ingredient a and ingredient b can make a potion	pile of bones - what are they ? where come from ?
0	who killed iron wolf bowden ?	where are the 15 fallen members of new tristram 's militia ?
0	use the bandage automatically when i got shot ?	how do you get a tank without owning one in gta online ?
0	where is the treatment plan for the " citadel : chemical treatment " mission ?	do mini glaciers reappear on the same spots in the next winter ?
0	query server time from minecraft server	does your location or equip influence drawn cards ?
0	can i win anything from the eshop roulette wheel ?	is there supposed to be no ( non mission ) boats in watch dogs ?
0	where is the creature slaughter dome ?	how do i get the special skin from the potato sack pack for portal 2 ?
0	what is " fire group 3" and how can i use it ?	how can i recover my gta save game ?
0	can i change the loadout of a started mission ?	can i safely desynth raw materials from previous floors ?
0	who , or what , is dr . narud ? ( spoilers )	is there a way to see what the worker automation is up to ?
1	minecraft multiplayer	how to join games with minecraft pocket edition 0.7
1	how can i search for +mindmg-maxdmg attribute in the ah ?	how do i filter items in the auction house by additional damage ?
1	if i upgrade another players tower , how is the xp divided ?	how does experience work in dungeon defenders ?
0	difference between battlefield 4 and battlefield 4 premium edition	what is " legion 's mission in mass effect 3 ? "
0	can roads in neutral territory be pillaged or destroyed ?	my bin folder is missing
1	i can not build or destroy anything in minecraft !	why can not i destroy or place blocks ?
0	multiplayer book copying	world edit 100 million blocks
1	where are the act 2 lore books ?	where can i find hunter 's journal part 2 ?
0	what is the most efficient method to grind kills on cubemen ?	action replay code to cut jigglypuff 's rest sleep time in super smash bro melee ?
0	how does technology spread work ?	power build and play strategy in mass effect 3 - radius/range vs damage ?
0	how can i get the top tier energy weapons without the van graffs ?	how do you deal damage to your opponent 's nexus in dominion ?
1	what is the base drop rate of steam booster packs ?	how do trading card booster packs drop ?
0	where to find a juvenile wolf ?	can an xbox one player party or voice chat with an xbox 360 player ?
0	are there exceptionally rare items in diablo 3 like the high runes in diablo 2 ?	how do i effectively use the tranquilizer rifle on deus ex hr ?
0	how to catch the hylian loach fish in ocarina of time	how do you increase the amount of attack hits ?
0	civ v : how efficient is allocating workers on auto mode ?	can i remove a grass tile in harvest moon gbc ?
0	do the systems always follow the same pattern ?	do i have to go to london if i want to look cool ? or can i buy cosmetic clothing anywhere else ?
0	paw shaped keyhole in hospital	is the scene it ? big button pad compatible with you do not know jack ?
1	installing minecraft mods on os x	how do you install minecraft mods on a mac ?
0	plotme bukkit plugin causes player invincibility	if equipped items become bound to you , where do all the items in the auction house come from ?
1	starting in world of warcraft	do i need to buy all the released updates to begin playing wow ?
0	what can i do with leftover commendations ?	do coffins block movement ?
0	does the juggernaut 's health increase progressively in survival ?	how do i use proton torpedoes ?
1	what are all the skills and special abilities of each multiplayer class ?	what are the differences between the races in multiplayer ?
0	how does performance index work ?	is minecraft pocket edition 0.9.0 better than the other versions ?
1	in arkham city , how do you interact with azrael ?	can the mystery watcher still be found ?
1	how do experience points work in skyrim ?	which actions result in experience ?
0	can i learn dual talent specialization ?	darksiders continuously scrolls when i start the game
1	what levels-up psi-abilities ?	how do soldiers advance their psionic skill ?
0	should i max out my walls before going to town hall 9 ?	are there only 81 levels in tiny death star ?
0	on what memory is the first desmond level ?	how do you use the ballistic knife ?
1	borderlands 2 lost save character playstation 3	how do i recover a lost borderlands 2 game ?
0	how can i play multiplayer against creeps on minecraft smp servers ?	do nether strongholds only spawn within a certain radius ?
0	why is not the /playsound command working in 1.7.2 ?	will zombies die if i put a light in their house ?
0	who is the voice actress for the terran adjutant from the first starcraft ?	where / how can i check if my minecraft key is an alpha-version ?
0	how can i optimize use of civilization iii in virtualbox	where can i find the lexicon machine for " discerning the transmundane " ?
0	disadvantage of two-hand weapon + shield in wow ?	are pandas extinct ?
0	offline bots ( alone against bots )	how do i complete " find the bitizen " ?
1	3ds later download : shall i close the lid while later downloading ?	how does download later work ?
0	how do i fix hexxit giving me a white screen when starting minecraft ?	are trees required in new leaf to have a perfect town ?
0	is there a way to keep the walls from coming back in the mine area ?	how to re-update a game ?
0	can someone explain different nozzles ?	purchased and earned coins not showing
0	what does the lost word attack from the knocker demon do in shin megami tensei : devil summoner : soul hackers ?	when would i use arcane strike instead of disintegration wave ?
0	when does the item count reset for the puzzle ring ?	can i change the order of my weapons in bioshock 2 ?
0	how do i get past the ledge outside the kitchen in machinarium ?	what item bonuses apply to my follower ?
1	full list of inventory items	what is the inventory item after the pogo stick ?
0	how does wood compare to coal in terms of home heating efficiency ?	why can not i click enemy units anymore ?
0	quickest way to gain experience in gears of war 2	do clothing , jetpacks and vehicle upgrades help you in jetpack joyride ?
0	installing battlefield 3 premium where battlefield 3 " standard " already exists	why is my character suddenly attacking really slowly ?
0	console command for completing valuable minerals quest	are all three healing classes equally viable healers , or is one the " primary " healer ?
0	is there any point to helping the rabbit ?	when do blimps spawn , and how do i kill them ?
0	in what zone does each event occur in ?	how to use an enemy as a meatbag ?
0	huntress doubleshot ?	language options ?
0	increase poké miles yield from streetpass ?	can i pick up items in mass effect while in a vehicle ?
0	practical solution for giant spike balls	what affects the wear rate of clothing items ?
1	on what memory is the first desmond level ?	are there any desmond levels ?
0	what is the optimal approach to hacking ?	thieves guild lock box reset
1	chopping blocks	why can not i destroy or place blocks ?
1	is it possible to fix xbox 360 slim red ring ?	can i fix the xbox 360 “red ring of death” myself ?
1	can skylander characters be used across platforms and games ?	can you use skylanders giants on the new swap force ?
0	do you ever need to revisit gathering or mission skill trainers ?	does closing the d3 launcher reset download progress ?
0	different editions of rift	how can i get rid of jarate ?
0	how can i mine from two asteroids at once ?	answer for battleships lieutenant level 16
1	what are the most strategic spots to ward on summoners rift ?	how do i ward properly in league of legends ?
0	starcraft 2 license problem on the website	purchased and earned coins not showing
0	where is the hidden switch for the hidden level in dedede resort ?	how do i unlock the red gun ?
0	what do i do with diamonds ?	which gender suits which side of the force better ?
0	what do i get if i connect a uplay account ?	how do i safely farm mid while pudge is missing ?
0	what is the advantage of buying elixirs ?	can i play with more than 1 player in dungeon defenders ( demo ) ?
0	can i exchange my character for another one of a similar level ?	how do you redeem the mini-thor wow pet that comes with the starcraft ii collector 's edition ?
0	2v2 strategy if partner drops out early ?	do system component effects stack ?
0	where can i buy the invisibility spell book ?	is my spirit ( or any other ability resource ) rounded up/down ?
0	what level and what strategy is recommended to get the " beryllium " achievement	how do i kill soul destroyers ?
0	in fifa 13 pc i cannot switch to different players during the game	how do i not get lost underground ?
1	how do i put armor on in pocket edition ?	how do i equip armor ?
0	can sibling in-laws have romantic relationships in the sims 2	how can i sync to my companion 's target in ratchet & clank : all 4 one ?
0	what does the a missing page trinket do ?	diablo 3 conversation achievement from merchants " sales and tales"
1	where can i equip weapon modifications ?	how do i modify my weapons ?
0	are there cheat codes for mass effect 3 on the xbox 360 ?	counter strike source anti-cheat
0	how do protections work in global agenda ?	reverse pick-pocket , is there an animation ?
1	how do badass ranks convert to badass tokens ?	how do badass tokens work ?
1	how do you spread taint in thaumcraft 4 ?	how can the taint spread ?
0	is it possible to share my character 's profile through a web page ?	how do i assign rooms in dwarf fortress
0	plot does not continue after killing darko in gta iv	ps3 sending bad data over hdmi ?
0	what is the most productive use of early game gold ?	what does being a marshal entail ?
0	what is fuel used for in ninja fishing	how can i rename my characters ?
0	can i get skyrim to remember my custom keybindings ?	what has happened to sora 's family ?
1	installing mods for 1.5.2	how to install mods for the new minecraft launcher
0	download steam games outside of steam	0 magicka usage
0	what are the bosses ' weaknesses in mega man 2 ?	is it possible to change my loadout in the middle of a heist ?
0	can mobs spawn in an ocean biome ?	how does aggro work in diablo iii ?
1	mobs keeps spawning in my house	how do i construct a safe sleeping area in 1.5 version ?
0	who picks up street fighter x tekken easier a street fighter veteran or a tekken veteran ?	what benefits are there to setting a home planet ?
0	what does it mean when residential demand is halfway faded ?	is it still possible to acquire halloween cookies in cookie clicker ?
1	how do i enable steam at system start ?	how can i stop steam from loading when i start my computer ?
1	who is ratman in portal 2 ?	what is the story behind the drawings on the wall in portal 2 ?
0	how to change hotkeys	how can i level up more quickly ?
0	netherrack , paranormal events , and c418-11: prank , mod , expected ?	how to handle colossi + high templar as zerg
0	diablo item drop lost after end credits in public game	how to get rid of steam items , especially coupons ?
0	how to get items on one square platforms ?	why are vendors offering ( much ) less gold for items than expected ?
0	zombies found on minecraft server with mobs disabled	steam menu does not show games ?
1	how to report " invalid " portals ?	how can i report misplaced portals in ingress ?
0	what is the purpose of this unreachable lever ?	how to deal with arthur 's long range assault in mvc3 ?
0	what do i do if my minecraft doesnt ask for a password ?	when i try to break a block it opens the game menu
0	dragon quest ix : skill to prevent enemies from escaping ?	why is gibrien marsden asking me to change citizenship ?
0	why can not i build the sydney opera house in civ5 ?	tvp : how to counter protoss double expand if you commited to 1rax expand yourself ?
0	accessing bonus campaigns in l4d game of the year edition	starting minecraft via batch script in maximized mode ?
0	how can i recover my offline lost achievements and saved games ?	how do i win against a zerg on many bases as protoss ?
0	how to nerf ghasts with nethrar ?	will ashley ever forgive me ?
1	how do i take off my pants in animal crossing : new leaf ?	how do i take off my pants ?
0	how to increase faction bpc from 1 run to 2 runs in eve online ?	how to get the bottle on the tower near the railway in go west , young raccoon ?
0	how is skill level calculated in battlelog ?	how to reliably capure cities instead of destroying them ?
0	why is pure damage especially dangerous to strength heroes ?	enemy units spawn nearby on immortal ?
0	how can i capture ( high definition ) audio and video from my xbox 360 ?	is the scottish resistance useful in tf2 ?
0	does the nephalem valor buff affect the whole group ( regardless of level ) ?	how to get past the stone head in karthspire ?
0	how much of the spacechem mobile campaign is duplicated from spacechem pc ?	where are towerfall replays stored on os x ?
