0	optimal all-around character builds	how can i list all of my steam games i have ever downloaded in my library ?
0	why can not i play fez when offline ?	why do not my beefalo produce much manure anymore ?
1	what happens if you get all vault signs on the slots ?	what kinds of things can i win by gambling ?
0	how can i tell when a power is ready to use ?	what color is the ball ?
0	can stun damage kill you in runescape ?	do i have to monitor the junk that fills in empty space ?
0	how can i make bao-dur an effective jedi guardian ?	are there weapons which regenerate ammo ?
0	mass effect : how to grind singularity ?	how does " proficiency " work in borderlands ?
0	where did the " arrow in the knee " joke start ?	infinity blade iii worker of secrets level ?
1	what is the best way to mine through lava ?	recommended way of clearing large lava pools
0	is there any reason to need a manyullyn pickaxe ?	how do i adjust steam chat font sizes ?
0	do i have to steal " litany of larceny " items during the quest ?	how do i invite a friend in the expendabros ?
0	what determines the glow color/particle effects of a weapon ?	are there any tricks to surviving lag spikes ?
0	uplink : hacker elite gateway upgrade problem	what effects do the sun goggles have on a merc ?
0	what is the maximum stack size for potions in diablo 3 ?	is damage reduction applied before unity splits damage , or after ?
0	what are the active reload effects on gow3 weapons ?	how do i change my technic launcher playername for offline lan play ?
0	how can i break a minecart with the environment without destroying it ?	can i reason with dr . mobius ?
0	paladin , shield and healing . which hand to use for those ?	where to spend chronoboost once you saturated with probes ?
0	fort zancudo gates	where is the master destruction spell at ?
0	why did my weapon recharge bars get cut in half ?	forming clans in clash of clans
0	is it possible to give or receive false intrigues from the ai ?	what is a " pixel shader " ?
0	why can not i make any tinkers construct parts with iron ?	how do i get past these letters that require camera light ?
1	is there a reason why nes is called 8 bit ?	what does 8-bit / 16-bit actually refer to ?
0	how can i add one title on a scoreboard with two teams ?	accessing the recovery menu on lcfw pro-b10
0	how long does it take for a sim to die from hunger ?	what will happen if i delete satellite uplink ?
0	which is the fastest way to reach the scientist 's silo ?	migrating data to a new ps3
0	how to create a line of wool sorted by color ?	will offline progress on another system update trophies on my system or psn account ?
0	how can i make optifine compatible with ftb ?	what are the special rooms ?
0	why is my mechanic occupied ?	can i restart godus from the beginning ?
0	ps3 hdmi issue " resolution not supported"	how do i find out the highest worldwide scores in temple run 2 ?
0	buying pistol magazine upgrades	civ 5 mod compatibility
1	how do make a redstone signal select a random set of command blocks	how can i make a random number generator with vanilla redstone ?
0	do enemies have a similar magic resistance system to human players ?	does an increase in max allowed items carry over ?
1	do sheep regrow their wool in minecraft 1.0 ?	do shorn sheep regrow their wool ?
0	is progress in the coop campaign in portal 2 saved ?	how can i get more workers ?
1	what stats should a wizard invest in inferno ?	what stats are best for casters ( wizard/witch doctor ) doing inferno ?
0	are enemy subtypes level restricted ?	when does priority : tuchanka activate ?
0	what are the differences between the difficulty levels ?	choosing an end point for just cause 2 ( spoilers )
0	do i get my gold back when i make a bid in the auction house and it fails ?	gta online - calling another player in-game
0	how do i get nethackcocoa to read my . nethackrc ?	how to fix " steam unable to sync " error ?
0	what are good strategies and build orders for a newbie player ?	how do you do diablo iii boss runs ?
0	can you cast a spell with a bow equipped ?	what is the algorithm/formula for natural leaf decay ?
0	am i able to play civilization 5 offline ?	how to remove/disable specific sounds from the . fsb files ?
0	can you still use single-attacks in dota 2 to avoid creeps ?	should i use a headset or a desktop mic for pc gaming ?
0	what is the best way of leveling restoration ?	influence of employee stats on game quality
0	what does the ' forgeborn fireheart ' skill do ?	is there a secret star here ?
0	is there a way to put kids up for adoption in virtual families 2 ?	what elements of teleglitch are random ?
0	do you lose some of the " first win of the day " ip boost by playing in beginner ai games ?	what exactly does the blood orb do ?
0	sun god vs . temple of the sun god ?	where can i find a list of players ' fantasy points for ti3 ?
0	are the lips wireless microphones for xbox 360 compatible with guitar hero and rock band games ?	can i carry more than two weapons at once ?
0	what happens if you have more than one stalker mark ?	what does " inspire loyalty " actually do ?
1	how to complete borderlands 2 missions in right order ?	when should i start the dlc ?
0	how does the report system in league of legends work ?	are there benefits to buying the box version versus the steam version of civilization 5 ?
0	how to change language in dead space 3 ?	broken ds card ?
0	what are some tips for a pve/pvp gunslinger build in aura kingdom ?	what are the dark souls loading screen hints ?
1	why my mob grinder/farm is not working ?	what is wrong with my mob spawner ?
0	do some ores become totally obsolete ?	getting started - no jobs , no community lots , no rabbit holes
0	why does knocking out a cat only sometimes yield a diamond in sega game flicky ?	how to leave/disband my team ?
0	faralda is not outside of the college in winterhold ?	how can i mine from two asteroids at once ?
0	what are the secret achievements for runner 2 ?	why does the ammo bar color change ?
0	what are the keyboard controls for nfs most wanted 2012 ?	what is the right sequence in grow cannon from eyezmaze ?
1	left 4 dead 2 - purchase non low violence version ?	left for dead 2 - unlock australian censorship
0	what are the differences in gameplay between modern warfare 3 and battlefield 3 ?	input controls for keypad ( milkman conspiracy )
1	is there a way to collect more chocolate bars ?	how do i get more chocolate bars ?
1	how do i fix the left mouse opening the menu instead of breaking blocks ?	minecraft button 1 takes me to menu every time
1	i cannot understand why this is not valid housing	how do i build a house for my npcs ?
1	is it possible to run the steam version of gta 4 on ubuntu ?	how do you get your steam games to run on ubuntu through wine or something similar ?
0	has anyone been able to run assassin 's creed 1 on windows 7 ?	conquest of the world
0	what is the difference between guardian angel i , ii , and iii ?	is the xbox 360 wired headset compatible with rock band 3 ?
0	how do make a redstone signal select a random set of command blocks	scouts-many-marshes will not move to breezehome
0	bullet speeds in cs go	are there ways of recording your game without using the game-playing pc 's resources ?
0	why does my sapphire crystal disappear when i purchase catalyst the protector ?	who should i choose for a heist ?
0	errors in reloading minecraft	my world has a huge void gap . how do i fix it ?
0	in fallout : new vegas , is it possible to drop bottle caps ?	what items " fit snugly in small areas " ?
0	what is the best way to stop greek fire ?	how do i place blocks without breaking existing ones ?
0	what is the darkness spell used for ?	i can not run this xna-based game
0	where to find the items i steal in ac3 ?	why can i continue to hit diablo if he is already dead ?
1	how do i open the gate in the seperate section of level 5 ?	opening the gate inside the center pit on level 4
0	is it possible to play the community levels of littlebigplanet 1 in littlebigplanet 2 ?	where is the " jar of souls " event in act 1 ?
1	small spoiler . can i store 2 cars in a specific safehouse garage ?	how does the garage system work in gta v ?
0	can you steal from someone 's house without being caught ?	what are the various item colors , and what do they mean ?
0	what are the pros and cons of flat vs . scaling runes ?	are dream job employees a level 9 automatically ?
0	reducing/turning off particle effects	ps3 super slim bricked
0	what is the loa 's master control ship ?	how can i stop f3 from dimming my display ?
0	what affects resistances ?	tf2 crashing during map transition
1	my tds does not earn any credits while i am not playing	no sales when i am away from game
0	what game mechanics in minecraft introduce lag ?	soloing dungeons or how to stop those pesky npcs from tagging along
0	how do i create a microphone stand ?	what is final quest in guild wars ?
0	best end-game guns and character setup ?	is it possible to finish the third level of snapshot within the targeted award time ?
0	how do i reach enclosed chests ?	list of unit statistics ?
0	are the creatures in the never seen that before achievement randomly throughout the world ?	why will not the cerberus network dlc detect mass effect 2 ?
1	is it possible to get steam to continue downloading a game while i am playing ?	how do i continue downloading a game in steam while playing ?
0	in bayonetta , what are the circumstances/contexts where the different weapon combos are most useful ?	what is a good tactic to kill a witch in left 4 dead without being hit ?
1	stealth bomber will not fire on cities	why will not a stealth bomber fire on cities anymore ?
1	minecraft version not showing in launcher ( even though i have renamed everything )	how to install mods for the new minecraft launcher
0	do 's & do nots for island traveling ?	which items are stackable ?
0	what is more efficient - liquid xp from openblocks or mob essence from mfr ?	how do i earn the " creamed corn " achievement ?
0	what is the maximum summoner level in league of legends ?	why does gravel remain static in the nether ?
0	aesthetic items in diablo 3 ( limited edition )	minecraft pocket edition 0.9.0
0	minecraft 1.8 mac osx 1.6.8 - minecraft . app not running at all	what happens if you save your buddies instead of the civilians ?
1	do the monk 's mantras affect witch doctor pets ?	what skills from other party members affect witch doctor summons ?
0	how do i find the code in the 3rd assignment ?	what are the differences between ' hard ' and ' normal ' difficulties ?
1	is a 4 gb xbox 360 enough for installing gta v ?	how much storage space is required to play grand theft auto 5 on the xbox 360 ?
0	does dragon ball : raging blash 2 limited edition have the original music ?	does the war have an ending in planetside 2 ?
0	how to enter a custom server	edit custom made number plate in gta 5 ?
0	can not get into sushi high roller despite beating the champion	what attributes identify a " cheese build " in sc2 ?
0	dragon quest 8 skills	how do i get the perfection achievement in fruit ninja ?
0	la noire : do you get any bonus for 100% completion ?	is it possible to change the linkage of nether portals ?
0	how to reverse the effect of burning an effigy	is it wise to try unrecognized pills that i find ?
1	why can not i unlock shout skyrim	dragon souls not activating new words
0	are there any risks associated with installing a game to the xbox 360 hard drive ?	is charisma a useful stat in fallout : new vegas ?
0	uplink : hacker elite gateway upgrade problem	how do i optimize pcsx2 's performance ?
0	how many resources are enough ?	what happens when you conquer a city where a spaceship is under construction ?
0	can i murder my friends to death with poison ?	how can i view fps in skyrim ?
0	where can i find a firing squad ( for time takes its toll and a forceful rebuke ) ?	do tracking disruptors affect missiles ?
0	what is the most efficient way to mine doge ?	what do i need to know about dungeons in world of warcraft ?
0	can the templar ( follower ) actually tank act 3 and 4 inferno ?	how do i get the most gifts ?
0	what makes the entire room on fire in inferno butcher ?	removing optical sights from weapons
0	minecraft launchers & ersions and mods ?	how can i turn notability into storable value ?
1	how can i turn off the bot spam messages ?	is there a slash command to mute ( or squelch ) a player in diablo 2 ?
0	what is the max level we can get in skyrim and max perks ?	how do i change my steam username ?
0	how can i punch someone ?	minecraft server problem
0	cookie clicker : heavenly vs infernal key	can i bind a key to a macro without applying it on an action button ?
0	what is the goal of minecraft and what can users achieve in this world ?	can not type in transfer fee amount
0	can not give kids stolen toys	what does tethering to enemies do ?
0	what is the black floating ghost ?	how to fix a cell that has tunnels ?
0	does it matter if i kill amodar or lightning first ?	how much power does the solar great works provide ?
0	is there anything special about the blood rooms ?	does link between world 's hero mode impact the street pass battles ?
0	tips on killing enemies effectively using the time bomb	resistance levels to tank in inferno
0	how do i raise my luck by 2 during the zeta scan ?	how does the expand singularity upgrade work ?
0	how to raise gold production ?	how do i achieve the replicant challenge ?
0	how to open doors ?	can we starve to death ?
0	can you attack time eater as classic super sonic ?	candy crush on new tablet
0	why do characters keep talking after dying , and how do i fix it ?	what does color mean in the pets/livestock list ?
0	what counts as an " assist " ?	how to use the wire cutter tool ?
1	how can i kill an erratic dragon ?	are dragon fights buggy in the current version of skyrim ?
0	is trading a cost-effective way to get diamond tools ?	how do i search for profiles online without logging into the game ?
0	does killing in the opening sequence count against the pacifist achievement ?	the bonus artifacts do not show up in tunnels and troglodytes ( liberation campaign )
0	when optimizing for coins , should i stock the 3-coin items first or the 1-coin items ?	where is vodianoi found ?
0	what is the recipe for gold mail and other armor and weapons ?	best way to create shops for minecraft 1.7.2 bukkit/spigot server
1	how do i solve the first set of clues in part 1 of paper trail	how do i solve the first set of clues in part 1 of paper trail ?
1	how do i level up in ars magica 2 ?	how do i progress in ars magica 2 ?
0	how can i rename my player ?	does the singularity require maintenance ?
0	what can shaco 's ultimate dodge ?	wheres my saved profile in dirt 3 ?
0	how do i unlock all the special kairobots ?	where is my insaniquarium steam product activation code ?
0	most effective terran rush in sc2	what do these symbols mean ?
0	prototype 2: lairs location map	i have medium crown authority , why are my vassals still fighting each other ?
0	how can i scan and destroy a t3 booster ?	where to find a " good " fifa online community ?
0	why am i seeing serious wiimote latency on donkey kong country returns ?	severe error when trying to launch voltz server
0	does the avatar logbook store unequipped skills ?	should i do " totems of hircine " the 1st or 2nd time as a werewolf ?
0	do bonuses to power damage affect damage from grenades ?	what is the best way to use the marines ?
1	ways to get conjuration and destruction up fast	what is a quick way to level conjuration ?
0	how do you get out of a boat in minecraft ?	how do you switch applications in mac osx when in starcraft 2 ?
0	how do i solve the math puzzle in ' connecting the pieces ' ?	how do you eat in minecraft pocket edition 0.8.1 ?
0	why will not pigs spawn ?	how to reduce loading times in forza motorsport 4 ?
0	what happens to unique buildings in occupied cities ?	is there anyway to get pix to move without moving lulu or using an ability ?
0	how can i get a bunch of 1-ups in new super mario bros ( ds ) ?	why do not i have any friends ?
0	pokemon : are there any adverse effects to making a legendary beast faint ?	when do damage-over-time and healing-over-time effects calculate their effect ?
0	how do i activate kingdom of amalur 's online pass on the pc ?	how can you take a horse home without a saddle ?
0	how do i stop the launcher bringing up the uac prompt every time ?	what are the christmas easter eggs for minecraft 1.7.4 ?
0	worms reloaded - awards	what is the best bot lane combo in solo queue ?
0	how to use different origin accounts for different windows users	is it possible to split a steam account ?
0	how far does the piston extends ?	how to micro infestors most effectively
0	how do i make people admin ?	how to save game on kinect stars wars ?
0	does every steam user have their own unique . exe file for drm protected games ?	what does it mean if a pokémon has become friendly to me ?
0	cheapest mystic forge recipes ?	what is the fastest way to get candies ?
0	what happens when you grow claws while wearing cursed gloves ?	in mass effect 3 , what are the race/class combinations & hidden bonus ones ?
0	how fast do iron golems respawn ?	in batman : arkham asylum for windows live , how do i get back to offline profile ?
0	what do the levels of nvidia physx do ?	how does attacking/defending direction affect the way players play in fifa 11 ?
0	will the ai go for an impossible victory ?	loa : using deep space gates
1	the shrine of winter door will not open ?	how do you access the shrine of winter ?
0	can torches cause fire ?	how is base income calculated in greed corp ?
0	how to avoid sand/gravel blocks to break when using in minecraft mechanisms ?	what items can i disenchant with an enchanting skill of 450 ?
0	is it possible to max 2 skill trees ?	can entangling shot - shock collar be extended indifinitely ?
0	where can i play poker ?	how do i solve level 11 on mad difficulty ?
0	how do i stay alive in a dungeon ?	how do i get weapons to level x in singleplayer ?
1	is there a difference in disenchanting strong items vs . weak ones ?	how does learning enchants from disenchanting work ?
0	how do i change the map-change time after the game ends on my server ?	can changelings be detected ?
0	are unique/elite/champion monster spawns deterministic ?	what am i missing out on by not clearing outposts in far cry 3 ?
0	when i go into the dark brotherhood 's sanctuary , my followers do not come in with me ?	diablo 2 digital download patch level
0	where can i find tf2 servers that play freight or fastlane ?	what is the object near the exit of the escape tunnel in metroid ii : the return of samus ?
0	modern warfare 3 crashes after " bag and drag " mission briefing	what is the difference between turbo mode and normal mode in marvel vs capcom 2 ?
1	when would i want to be somebody 's friend ?	are declarations of friendship worth it ?
0	what are the requirements for crowns ?	what is the difference between " active " and " wait " combat modes ?
0	is there any benefit to not runing a skill ?	do breeding times match hatching times for dragons ?
0	how to prevent water from freezing	is whimsyshire worth the cost at inferno ?
0	where do you find a booze barrel ?	how do i build an effective rail network ?
0	making dark souls just a little bit easier ?	contaminated ore and mysterious green liquid
0	how do i actually use a phoenix up ?	can i play the game without the disc by installing disc 2 to hdd ?
1	how do i remove water from my base ?	how can i clear the water out of this area ?
0	how to display your guild emblem ? ( guild armorer )	do monster respawn in diablo 3 ?
1	where can i find the keys and the plans for the infernal machine ?	where are the key wardens and where are my keys to create a hellfire ring ?
0	final fantasy vii - best way to defeat ruby and emerald weapons	two-handed weapon builds/play-styles that are actually viable ?
0	what does the code included with new copies of amalur do ?	how to make the key ' win ' used for key bindings ?
0	what causes experience discrepency between members of the same party in dungeon defenders ?	does cooking corpses make them more nutritious to eat ?
0	skylanders swap force level 6 jumps	where can i find a transcript of portal 2 dialogue ?
0	cs:go weapon inspection	which world is each playable character from ?
0	dwarf fortress sound	what is the use to the memories that you unlock ?
0	what is the meaning of circles near allied portraits in lol	where can i find each type of ultra rare cargo ?
0	do i need all the dijinni to complete the game ?	can i install files directly onto to ps3 hdd ?
0	my 3d games crashing in these scenarios	100% completion of batman : arkham city
0	are the walls slowing down minecarts ?	starcraft 2: why use roach over hydra ?
0	error code 6002 while installing	how to handle axe when he has blink dagger / invis + blademail ?
0	why doom and not wolfenstein 3d ?	does blood star affect followers ?
0	does the repeated turn in of water/food/champagne ( etc . ) result in anything significant ?	spain 's comeback
0	can you transfer characters on a wow account to yourself ?	do i have to have sakura samurai running in order to dedicate steps from the 3ds pedometer to the rock garden ?
0	do snow golems die in the rain ?	how does infamous 2 decide if you were good or evil in the previous game ?
0	wii and s-video results in black white window	how to add commentator ( "6th player" ) ?
0	which champions are suited to league of legends dominion map ( and which should be avoided ) ?	when do implants drop ?
0	what are the considerations for gaming speakers/headphones ?	can i lower vending machine prices ?
0	is there a way to retreive your hidden stats ?	can not get followers to touch the altar in boethiah 's calling
0	how many puzzles do i need to solve in order to finish the game ?	why do not my sims move in together when they get married ?
0	what is the purpose of the " beautify " tool ?	where do i find a courier ?
0	why do not some games have add to wishlist button ?	ac black flag : how to show all items with overlay ?
0	how do i remove a steam game from my library ?	how much of a priority should my priority missions be ?
0	how should i use janna 's ultimate ?	what is the meaning of symbols in farming simulator ?
0	does bunk selection make a difference at the beginning of psychonauts ?	what did heart of the swarm add to the map editor ?
1	how long is the main quest ?	how can i tell how long ( more or less ) it will take me to complete a game ?
0	where are all the secret music disk located ?	how do the bow-related archery skill perks affect crossbows ?
0	adding recovered files to xbox 360 usb	how to host a minecraft server ( without using realms ) ?
0	what is good combat exp on runescape ?	chie is weak against fire
1	how can i search a rare item by name in the auction house ?	is it possible to search for existings auctions of a rare item ?
0	what are some good ways to earn cash ?	where do i find sacrifice ?
0	what are relevant skills for the captain of the guard/hammerer positions ?	difference between different ammunition
0	how do i obtain an azure flute in generation iv ?	what do these am , ffa , sea , etc . buttons on ggtracker do ?
0	who has been buffed in blazblue : continuum shift ?	kite like a man achievement
0	how do you manually change filters ?	i can not leave lanayru province in twilight princess ?
1	mod installation	how do you install minecraft mods on a mac ?
0	"recover " broken games on xbox ?	what different versions of xbox 360 are there ? what is the hd for with xbox ?
0	is the progression of my progress saved ?	what are these wool houses ?
0	are spectre or veteran packs more cost effective ?	why does my ps3 see media servers over wifi , but not a wired connection ?
0	out of sector combat in x3: how can i tell my ships to evade enemies ?	is it a glitch that all three legs of blue were broken simultaneously and it still lived ?
0	is there a save point before fighting bonetail in the pit of 100 trials ?	what are the secret acheivements and how to track them ?
1	arena reward tiers	arena keys and corresponding wins
0	implication of specialist step order	what are the various sw:tor servers named after ?
0	what is this purple eridium totem ?	on bejeweled 3 ; diamond mine ; how do you change from dollars to points ?
0	message from my university it people explaining why starcraft ii wont work on campus , does this sound plausible ?	do tf2 dedicated servers require special config to allow players to get item drops ?
1	guild wars 2 beta client same as the real client	do i need to download the client again ?
0	in co-op , when does the level difference xp penalty kick in ?	where i can find a good house schematic to live in terraria ?
0	will i lose the enhancements if i trade my robot ?	what would be the best magic robes for me to use ?
0	kite like a man achievement	can i play 4 on 4 games on the xbox 360 with system link ?
0	is there any reason to save credits in mulitplayer rather than blowing them immediately on packs ?	does borderlands 2 have a special developer 's chest
0	oracle of ages 3ds linked game items	some permissions and plugins dont work in the nether , players cant drop stuff anywhere . any thoughts ?
0	when you fire do bushes become invisible for your allies ?	do nirnroots regrow in skyrim ?
1	how do i level up archery fast in skyrim ?	what is an effective way to level archery ?
1	when determines when one gets a magic or bow killcam ?	skyrim updated to 1.5 but no ' cinematic killcam'
0	skyrim bows : light or heavy one ?	how do i get rid of quest-related weapons and armor that i no longer need ?
0	fifa 11 career mode take virtual pro when moving clubs	i have bukkit 1.7.2 running , how do i connect ?
0	should i demolish my residence ?	how/can you access videos from online vault , online ?
