0	is energy released during change of state ?	where is the " true " higgs if the lhc 125 gev signal is rather a higher dimensional radion than a sm higgs ?
0	stochastic process corresponding to schrödinger evolution	what is the difference between a vortex ring and a circular line vortex ?
0	what is the mathematical definition of work ?	question on the hagedorn tower in type i string theory
0	how do i determine when this object is about to get covered in dew ? i can measure the environment parameters	moon and sun at the same time
0	particles for all forces : how do they know where to go , and what to avoid ?	how small of a depletion signal can the best modern mass spectrometers detect ?
0	can we transfer the charge on a plate of a capacitor elsewhere ?	is $\hat{\phi}^{-}\hat{\phi}^{+}$ a well defined observable in the quantum field theory of a scalar field ?
0	direct observations of a black hole ?	total power of cmbr
0	is the energy of a photon continuous/discrete ?	trying to understand laplace 's equation
0	analogy between magnetic bottle and van allen 's radiation belt	reynolds number and inertial force
0	magnetic field lines can be entirely confined within the core of a toroid , but not within a straight solenoid . why ?	in copenhagen , can this idea preserve locality for bell inequalities ?
0	gravitational potential energy of mass between two planets	what techniques can be used to prove that a spacetime is not asymptotically flat ?
1	light pulses and energy-time uncertainty principle	uncertainty and wave-trains
1	is it possible to have temperature below absolute scale ?	prove that negative absolute temperatures are actually hotter than positive absolute temperatures
0	fracture because of high-speed rotation	does heat increase the volume of a gas , and in turn its pressure ?
0	how to reconcile angular momentum measurements ?	does the mass point move ?
0	which causal structures are absent from any " nice " patch of minkowski space ?	do these equations apply to an object on a zip line or slope ?
0	is quantum gravity , ignoring geometry , the theory of a fictitious force ?	the sound when boiling water
0	does the total mass of an isolated object include the mass stored in its gravitational field ?	most elegant/fundamental formulations of the laws of classical mechanics ?
0	calculate heat loss of aquifer with unknown shape	a lawnmower problem
0	square bracket notation for dimensions and units : usage and conventions	calculating focal length of meniscus lens
0	how to derive schrödinger equation ?	how does this particle behave in the magnetic field ?
0	how to estimate size of nucleus from minimum scattering angle of electrons ?	about stellar evolution
0	relationship between the continuity equation and the wave equation	charged oil drop in electric field
0	charges and topology	sending information over a wire--mechanically
0	$d$-brane and 5th dimensions	reality error and relative velocity
0	electromagnetic wave penetration into conductors	additional mass of block on inclined plane
0	what happens to cosmic ray neutrons at the earth ?	why was the truncated icosahedron ( i.e. . soccer ball ) geometry chosen for the implosive lenses in the “fat man” atomic bomb ?
0	i can not figure out crystal planes with negative intercepts	why is “dark matter” a more parsimonious explanation than “more normal matter than we thought” ?
1	if nothing can travel faster than the speed of light , how can there be parts of the universe we can not see ?	why is the observable universe so big ?
0	classical dynamics with schrodinger equation	how does general relativity emerge from brans-dicke gravity with an infinite omega parameter ?
0	how long can you survive 1 million degrees ?	meaning of the word " moment " ?
0	differential or integral form of the conservation equations ?	photon " stuck " on the event horizon of a black hole
0	thermal resistance of thermal interface materials ?	quark space tensor product vs angular momentum space tensor product
0	schrodinger equation in term of fokker-planck equation	clarification on factors of $c$ in the lorentz ' force
0	information scrambling and hawking non-thermal radiation states	virtual air-surface temperature difference above a water body
0	bullet : piercing vs . deflection	reusing the bremsstrahlung energy in circular accelerators ?
0	time required for water to freeze	how to use an accelerometer to correctly quantify the magnitude of vibrations
0	infinite plane wave and ray vectors	what is the correct term to describe matter converting into energy ?
0	the path integral and feynman diagrams	acceleration of a car in a collision ?
0	degeneracy and the unitarity of a gauge theory with a non-compact gauge group	particles and their charges
0	poynting 's theorem simplified ?	"dynamic albedo of neutrons " and all these farnsworth fusors
1	can silence happens when 2 sound waves destroy each other	what happens to the energy when waves perfectly cancel each other ?
0	what does planck/wmap/cobe actually measure when studying the cmb ?	decoherence in everett quantum mechanics
0	simple vector problem	the units of gain and number of atoms in population inversion in a laser
1	if we suddenly lost track of time , how would we know what time is now ?	if time standard clocks and any memories about the time standard are destroyed , can we recover the time standard again ?
0	field tensor and classical limits	time reversal operator
0	must a reversible engine be a carnot engine ?	newton 's second-law word problems with coefficient friction
0	is the change in kinetic energy of a particle frame independent ?	can pockets of air exist underwater ?
1	difference in velocity of light in change in medium	what really cause light/photons to appear slower in media ?
0	can high charges ( like $1\times 10^{-3}$ coulomb ) be acheived ?	are the $10^{500}$ different string theories being whittled down ?
0	proton or electron charge in the weinberg-salam model ?	why is a hot air balloon " stiff " ?
0	spinor formalism in qft	what determines which observables are qm ?
1	questions about gravitational and inertial mass	understanding the different kinds of mass in gravity
0	what allows us to infer the existence of dark energy ?	interaction between neutrino and an anti-neutrino ?
0	diffraction pattern when wavelength tends to zero	the faddeev-popov lagrangian
0	how do we see different colours ?	do massive particles exchange higgs bosons ?
1	would love to learn quantum physics	what is a good introductory book on quantum mechanics ?
0	what is the meaning of $g/cm^2$ ?	in the αβγ cosmology paper , how do the authors assume the integral of density over time in the early universe ?
0	non-stationary capacitor	gravity theories with the equivalence principle but different from gr
1	what exactly is charge ?	origin of electric charge
0	extracting water out of silica gel	poynting vector direction
0	what are the facts that allow accepting the oort cloud theory ?	forces acting on a point mass in a spinning rigid body
0	how to prove the relations between the variables in bispherical coordinates ?	energy conservation law validity
0	gupta-bleuler formalism	using local u ( 1 ) transformation to solve problem in path integral
1	what are the potential technological advances that the discovery of the higgs boson may unlock ?	practical matter of the higgs-mechanism
0	determine date of birth from " astrological " signs ?	extent of coordinate freedom to set metric components along a spacetime path
0	why do excited states in $^4$he not decay by photon emission ?	how can one diagonalize the second variation of action ?
0	why does a car go down the hill backwards even though the engine keeps running ?	how to solve schrödinger 's equation for this potential algebraically ?
1	open-source up-to-date cosmological datasets	are there free data available online from cosmology ( or astrophysics ) experiments that anyone can analyse ?
0	do neutrinos of any flavor get trapped in black holes ?	what is the perturbative vacuum ?
0	how can super massive black holes have a lower density than water ?	which friedmann equation is redundant ?
1	study basic quantum mechanics	mathematics for quantum mechanics
1	what is difference between inertial mass and gravitational mass	what is the difference between the five masses : inertial mass , gravitational mass , rest mass , invariant mass and relativistic mass ?
0	how to reconcile the two definitions of work ? ( mechanical and thermodynamical )	spin drift velocity ?
0	friction on roads	does the mass of an object change as it moves away from the earth ?
1	a roadmap for learning standard model of particle physics	a no-nonsense introduction to quantum field theory
0	mean-field approximation of the disordered state of heisenberg model	current flowing through a square loop - magnetic field
0	what is euler density ?	which direction does the electron move ?
0	force with zero acceleration	shot noise at high frequencies ( can it really be ideal white noise ? )
1	why is everything colder nowadays ?	when they say that the universe cooled after the big bang , where did the heat go ?
0	how much water must flow trough canal to maintain a constant water deep ?	how energy curves spacetime ?
1	causality and quantum uncertainty	why quantum entanglement is considered to be active link between particles ?
0	how to model/simulate pressures and flows in a network of pipes	lowest gravity on earth 's surface ?
0	how can i determine whether the mass of an object is evenly distributed ?	how much can a laser 's position be fine-tuned ?
0	young elasticity modulus anisotropic media	why does not ehrenfest 's theorem work for a particle in a an infinite square well ?
0	why are noble gases used for lights ?	what would be the real-world implications of the kessler syndrome ?
1	energy needed to raise energy level of an atom ?	is the photon energy required to cause an atomic transition $\delta e+\delta ke$ , where $\delta e$ is the " transition energy " ?
1	how does the planck length hold true ?	how to get planck length
1	is there an analogue of a geodesic for the evolution of the electromagnetic field ?	geodesic for electromagnetic forces
1	uncertainty principle and commutation relations	how does non-commutativity lead to uncertainty ?
0	how do radio telescopes work ?	why is this mass equation giving me mass = weight when clearly it is not ?
1	recommended book for beginners on advanced science topics	getting started general relativity
1	trouble with classical mechanics self-learning ( how to avoid going down the physics rabbit hole ? )	recommendations for good newtonian mechanics and kinematics books
0	a tunnel inside the earth ( but not an ordinary tunnel )	reflection & transmission curves of waveguides
0	pde from dispersion relation ?	moduli space of $\mathcal{n}=4$ sym on $\mathbb{r} \times s^3$
1	basic question about law of gravitation	radial fall in a newtonian gravitational field
0	divergence calculation of a lie algebra valued quantity having spinor indices	the eigenspinors for the spin operator in the $x$-direction ?
1	is a magnetic field just a moving charge ?	how do moving charges produce magnetic fields ?
0	is there a way to tell what frequency an unmarked antenna is designed for ?	why does global supersymmetry commute with gauge transformations ?
0	field from non-conducting plate ?	have i discovered how to calculate the proton 's mass using only integers ?
0	how to find the total current supplied to the circuit ?	why is ${\partial^i}{\partial_i\phi}$ = ${\partial^i {\phi}}{\partial_i{\phi}}$ ?
0	"delayed choice " quantum imaging experiment - why would not it work ?	current map of galaxies ' z 's and distances ?
0	do all closed systems , only considering kinematic/mechanical principles , exhibit time reversal symmetry ?	why do i feel cold air in the shower ?
0	applications of a certain wave equation in physics ?	current density in 1-d
0	good ways for learning and cramming formulas ?	clarifying constraint forces in lagrangian dynamics
0	is time travel possible ? is it possible to go back in time ?	dirac equation in general relativity
0	why is there a gravitational attraction between two objects at rest with respect to each other ?	toolbox for complex networks and graphs
0	proof for $p=\gamma_pmu$	how big would the impact of a nuclear warhead be ?
0	calculating lifetime of a pi meson via heisenberg uncertainty relationship ?	aharonov-bohm vs de witt
0	computing planetary positions	about the definition of expectation value in quantum mechanics
0	what techniques can be used to analyze a rod rotating about the edge of a table ?	is it possible to derive schrodinger equation in this way ?
0	capacitor physics problem	change of coordinates from an arbitrary frame to a locally inertial frame in general relativity
0	what is the difference between linear and non-linear magneto-optical effects ?	boundary conditions of relativistic wave solutions ?
0	thorium based nuclear reactor	is this description of particle 's spin strict ?
0	how is the theory of partial coherent light related to quantum-mechanics ?	how to calculate mass of a closed universe ?
0	nuclear magnetic resonance ( nmr ) conceptual questions	when does centripetal force cause constant circular motion ?
0	graviton emission from d-branes	a tensor summation question
0	neutron decay and particles	why can not we destroy energy ?
0	why do they call it quantum teleportation ?	de facto superluminal travel ?
0	how to demonstrate that there are just 14 types of bravais lattice ?	confused about the hall effect ?
0	experimental study of the photoelectric effect	how to define angular momentum in other than three dimensions ?
0	when a star turns into a red giant what stops its core contracting	do composite particles that are electrically neutral but have charged constituents radiate ?
1	has a metric formulation of electromagnetism ever been attempted ?	geometric interpretation of electromagnetism
0	tungsten wire heat discipation	how and under what principle are measurements made at quantum level ?
1	measurements and simultaneity	wavefunction collapse in relativity
0	what is the common difference between partial time derivative and ordinary time derivative ?	would string theory change everything ?
0	the curl of a special cross product	what is the most precise test of electroweak unification in the standard model ?
1	supplements for kittel 's solid state physics ?	books for condensed matter physics
0	what are functions of a complex variable used for in physics ?	atlas and cms calorimeters
1	why does gravitational force bring the clouds down ?	the density of clouds
0	can we apply quantum superposition	loop-quantum gravity versus string theory
0	electric field for a hollow sphere with point charge	reaching speed of light
1	how does electricity ' decide ' on it is pathway ?	electricity takes the path of least resistance ?
0	calculating axle load in cargo container ( pics are included )	gas mixture flow rate equation
0	is the wind 's force on a stationary object proportional to $v^2$ ?	evaluating the ricci tensor effectively
0	rigid rectangle in schwarzschild	how can we describe the trajectory of an object projected into a viscous fluid ?
1	what areas of physics depend on the sum $1 + 2 + 3 + 4 + 5 + 6+ 7+\ldots= -1/12$ ?	how does the sum of the series “1 + 2 + 3 + 4 + 5 + 6…” to infinity = “-1/12” ?
0	how does a thin film of soap help defog bathroom mirrors ?	breaking ocean waves on other planets possible ?
1	the collision of phobos	collision of phobos
1	is dark energy pushing us or pulling us ?	could the acceleration of universe expansion be caused by gravity itself ?
0	what does activation energy actually do ?	prove : $ [ p^2 , f ] = 2 \frac{\hbar}{i}\frac{df}{dx}p - \hbar^2 \frac{d^2f}{dx^2}$
0	diagonalizing/eigenvalues of the infinite dimensional matrix of n harmonic oscillators on a ring	question about the boltzmann distribution
0	first integral of an equation of motion : $\mu\ddot r=-\frac{k}{r^2}$	which areas of physics are related to the act of playing drums ?
0	functional determinant question	is matter a continuous part of the field of space-time ?
0	direct rocky planet formation without protostellar disk ?	ladder operator killing state
0	why is latent heat required ?	how many quarks in a proton ?
0	term for " atmospheric ricochet " due to wrong " angle-of-attack"	weird terms in w boson self energy
0	incommensurability between different observers describing the same universe ?	what determines whether a pool ball will bouce backwards after colliding with another pool ball ?
0	distant bodies emitting photons	poles for a particle scattered in a delta potential
0	does turning sharply on a bicycle conserve more energy than a wide turn ?	partial pressure - which solution is right ?
0	did physicists solve the grandfather paradox ?	can something travel faster than light if it has always been travelling faster than light ?
0	electric field homework question	how do i calculate the work of a gas showed up on a graph ?
0	is there a way for an astronaut to rotate ?	bra-ket notation , bits , & superposition
1	is the lorentz force conservative ?	is there any potential associated with magnetism
0	how use the higgs branching ratio plot to extract information about the higgs mass compared to experiment ?	once a quantum partition function is in path integral form , does it contain any operators ?
0	references for nuclear masses , mass deficits , decay rates and modes	dry ice in liquid states
0	isospin and weak isospin	how to describe a well defined " zero moment " in time
0	sub-light speeds and momentum conservation law	centre of instantaneous rotation problem
0	influence of a capacitance matrix of a voltage measurment	what is the fluid approximation for bcs action ?
1	as the earth rotates around itself , does this have any effect on the dynamics of flights ?	does the rotation of the earth dramatically affect airplane flight time ?
0	what explains the effect of water 's path falling around a ball/curve ?	rays in symmetric resonator
0	charge in a layered ball	why does not the firewall argument also apply to far away ingoing modes ?
0	noether current for the yang-mills-higgs lagrangian	why is uv index so high when storms are announced ?
0	what is the initial velocity of a projectile so that it passes through a target point in its trajectory ?	degrees of freedom in the infinite momentum frame
1	time taken for gravity of a distant object to interact with a newly created particle ?	the speed of gravity ?
0	induction for massive objects	easy formula for ultrarelativistic bremsstrahlung ?
0	quantum mechanics book that emphasizes momentum space approach ?	decelerating car
1	electron pathways	how do electrons know which path to take in a circuit ?
0	2013 russian meteor event , sonic boom or explosion boom ?	zero divergence of energy-momentum tensor and gravitational energy
0	forces : why are the theta 's equal ?	electric field of a dipole
0	entropy $dq=tds$ and work $dw = -pdv$ conditions ?	i want to do a phd in quantum computing . which universities in english-speaking countries have prominent research groups in this field ?
0	how to understand the equivalence between andreev reflection and cooper pair injection ?	is there any way to annihilate matter without the use of anti-matter ?
0	quantum computing and quantum control	sunspots and brightness
0	speed of an object in air versus in vacuum	galilean transform
0	why muonium is unstable ?	elastic collision in two dimensions
0	why do bullets in a magazine go up instead of down ?	frequency of a tuning fork
0	conservation in space-time curvature	steam bath physics
1	measurement of tangential momentum accomodation ?	measurement of tangential momentum accomodation ?
0	how to represent a multiple in the frequency domain	why do not bubble lights explode ?
0	why do black lights show bacteria and proteins ?	when jumping into water , how deep should the water be to survive ?
0	equation that tells me the rpm and mass of a spinning disk needed to keep a second large mass stable using gyroscopic effects	quantum simulation of schrodinger 's equation
0	why does water freeze from top to bottom	amplitude of a forced harmonic oscillator
0	confusion regarding geodesic of thrown ball - curved or cartesian coordinates ?	does the unit of inertia include radians ?
0	relation between shm and circular motion	what is dark matter and who discovered it ?
0	randomly sampling a " well-mixed " solution of brownian particles	probabilistic vs statistical interpretation of double slit experiment
0	capacitance of a conducting disk	representing a polarization vector for light as a ' manifold of two state'
0	how to check a worm and a worm gear fit ?	how does one subtract two light beams ?
0	equal and opposite reaction - forces coming in pairs - or just common sense ?	why does the second weyl scalar describe electromagnetic radiation ?
0	scalar product of coherent states	why does not this metric cover all of de sitter space ?
1	can matter be created from energy ?	what keeps mass from turning into energy ?
0	what is the critical temperature of the xy model on a triangular lattice	accelerating an elevator
1	mathematical books to become a successful mathematical physicists	best books for mathematical background ?
1	how far away is cosmic background radiation ?	why is the observable universe so big ?
0	what force is acting on the charge in the dielectric ?	two air bubbles inside a liquid
0	which is the axis of rotation ?	why do three dimensional gauge theories flow to conformal theories in the infrared ?
0	bell 's theorem graph	necessary air pressure in flexible vessel to lift a certain mass
0	ricci tensor of the orthogonal space	common approximations for fluid outflow beyond torricelli 's law
0	work done by gravitational field	what is $k$ in newtons law of cooling ?
0	peak at zero in one device and not the other	are there anti entropic agents
1	richtmyer meshkov instability in mhd	richtmyer meshkov instability in mhd
1	where does the pauli repulsive force come from that counteracts the attraction between atoms and ions ?	how can i stand on the ground ? em or/and pauli ?
0	what was the motivation behind suggesting the trichromatic theory of vision ?	does heisenberg 's uncertainty under time evolution always grow ?
0	electric potential energy and speed	expansion in spherical harmonics in cubic symmetry
1	is the expansion accelerating or decelerating ?	dark energy / accelerating universe : naive question
0	harmonic oscillator - wavefunctions	the equation of the location of l1
0	decomposition of representations of the virasoro algebra under $sl ( 2 ) $	elastic collision with objects of the same mass
0	how does the earth move ?	quantum chemistry : localized molecular orbitals
0	nuclear fission and half life	basic concepts of water pressure for plumbers
0	qm with complex eigenvalues	need help with relativistic dynamics
0	is the emdrive , or " relativity drive " possible ?	what is the difference between linear and non-linear magneto-optical effects ?
0	if a photon is a boson and has spin 1 , should not it have 3 spin orientations since spin 1 is a triplet ?	twin paradox question
1	physics textbooks reference request	book recommendations
0	stability of hypothetical lunar atmosphere	feynman diagrams for interacting theory of scalar field
0	what is the correct orientation of earth 's rotational-axis w.r. t ecliptic at equinox ?	how much energy in form of heat does a human body emit ?
0	a question from srednicki 's qft textbook	some questions about ward-takahashi identity
1	how can we know the size of a dimension ?	measuring extra-dimensions
1	reference on chern-simons theory	reading list in topological qft
0	reflection of electromagnetic waves	the hole argument
0	how to calibrate an ammeter ?	what happens in electron-electron collisions ?
0	how can there be really any instantaneous velocity ?	why do astronomers never put a scale on their photographs ?
0	could the center of the combined mass of the entire galaxy change if there were no external forces acting on that galaxy ?	why does the current increase in an lc circuit while the capacitor is being discharged ?
0	electric potential energy after nuclear fission	quantum entanglement and bb84 protocol
1	reaching speed of light	rotate a long bar in space and get close to ( or even beyond ) the speed of light $c$
1	was the mass of the universe the same when it first began as it is now ?	given that matter cannot escape a black hole , how did the big bang produce the universe we see today ?
0	can a hybrid vehicle ever be more efficient than a hydrocarbon-only vehicle built with the same parts ?	are the second and third generations of matter required or optional ?
0	how far from a spacecraft would it is exhaust cool to br temperatures ?	why does strong interaction increase with distance ?
0	what is euler density ?	is magnetic force non-conservative ?
0	what kind of system respects $su ( n ) $ symmetry ?	how do electrons choose their path ?
0	is the pressure at the outer hole on a pitot static tube equal to atmospheric pressure ?	what is an energy eigenstate exactly ?
1	recommended book for beginners on advanced science topics	book recommendations
0	friction on atomic scale	field emission beyond fowler-nordheim
0	10 big problems - condensed matter	what is the difference between biot-savart law and ampere 's law ?
0	aspherical lenses	naive quantum gravity
0	what is the effect of surface tension on an air bubble inside water ?	is there any dynamical reason for the winter solstice to happen close to the perihelion ?
0	running : determine how much more energy is needed per extra kilogram of weight	cassini ' s and pioneers rtg power output datafile
0	is it fair to judge this speedskating race by only 3 thousands of a second ?	given wave function at $t=0$ , what is the process of deriving time dependent wave equation ?
