0	finding the mass of bed/patient	the physical definition of work seems paradoxical
1	about heisenberg uncertainty principle	is the uncertainty principle just saying something about what an observer can know or is it a fundamental property of nature ?
0	spontaneous disintegration of an unstable particle	what do mathematicians mean by navier stokes existence and smoothness problem ?
0	photon statistics of an incandescent light source	how to optically rotate images in small increments ( for eyeglasses ) ?
1	is carbon dioxide a greenhouse gas ?	what experiments prove the greenhouse effect ?
0	how can a body be transparent ?	my conundrum with gauss’ law in electrostatics
0	london into australia in 90 minutes	does a change in electron 's direction affect direction of force ?
0	welding physics ( black body and heat conductance ) ?	intensifying a light source using black body concept
1	books on representation theory	best books for mathematical background ?
0	is schrodinger 's cat a real conceptual problem or just a problem with approximations ?	are there correct physical predictions made only from thought experiments other than in general relativity ?
0	eddington-lemaitre model	matrix element approximation
0	gravitational time dilation with big masses	what else does the fabric of space-time do ?
0	hierachies of ads/cft holographies	can a particle have momentum without energy ?
0	what is the speed of light relative to ?	closed circuit integral , magnetic vector potential for straight line segment
0	archimedes ' principle : innacurate terminology ?	topology for physicists
0	do monochromatic waves carry information ?	best ( most realistic ) physics game ?
0	electro-gravitation - is it real ?	combining proportions to get newton 's law of universal gravitation
0	why do pores make ceramic opaque ?	how does rust behave as a pn junction ?
0	silicon/silicon dioxide interface	what does the concept of phase space mean in particle physics ?
0	what interesting physics problems can not be solved because mathematics is not developed enough ?	statics of rigid bodies -- can there be two possible solutions ?
0	does firing electrons at an object change its colour ?	determine the acceleration and angular acceleration of a disc
0	what happens to a photon in a black hole ?	what ring weave disposition should be the most resistant against stabbing and/or how to determine it
0	explanation for speed of an electrical impulse	distance versus drop
0	transfer of angular momentum during oblique impact with ( out ) adhesion	unitary spacetime translation operator
0	is the mathematical form of the acoustic diffusion equation present in other fields of physics ?	obtain the same maxwell 's equation after a change of coordinates
0	a question about brst current in bosonic string theory	phonon-polariton literature resources ?
0	is there johnson noise in superconductor ?	generator of velocity transformations - galilean transformations
0	about stellar evolution	is real voltage always the real part of complex voltage ?
0	question concerning the lindhard function	how to determine the angle a camera has to be at to image a desired scene , given the camera parameters ?
0	reducing general relativity to special relativity in limiting case	dashed lines in feynman diagram
0	do atoms and molecules affect light rays	potential function and angular momentum of a quantum particle
1	alpha scattering , observations and conclusions	rutherfords alpha scattering conclutions ?
0	is a free proton a positive hydrogen-1 ion ?	difference between steady state and equilibrium ?
0	energy of a cylinder rolling down a path	total momentum of the universe
0	what is the relationship between strain and electric current ?	linear motion with variable acceleration
0	derive conservation law using divergence theorem	how does the viscosity ( besides density ) of a fluid affects sinking
0	is a track in a cloud chamber made by one particle or many particles ?	flux on a gaussian surface between two charged plates
0	why can not you hear music well over a telephone line ?	mass-energy equivalence theory energy or momentum is not conserved ?
0	condition for closed orbit	schmidt basis : entanglement
0	change in volume of air held at the top of a tube with upper end closed and holding some liquid	proofs that every professional physicist should know
0	how to show that basis of space of dirac gamma-matrices is given by following matrices ?	power , force velocity
0	high current at first and then steady from a battery	definition of angular velocity
0	causality and determinism	quantum scales and the flatness of space-time
1	confused about the concept of time and time dilation	is gravitational time dilation different from other forms of time dilation ?
0	theories that relate gravity , electricity , and magnetism	what is the roaring in a roaring fire ?
0	optical constants of noble metals : the drude model for microwave modelling	catalysts as traces in a monoidal category
0	thermodynamics and energy conservation in the scope of the universe	why do we fall when we ride bicycle slowly but we do not when riding it fastly
0	chain of balls on an inclined plane	why does the water rise ?
0	electric field and magnetic field question here ?	what is the typical career path to become a professional astronomer ?
1	what is light and how does it travel ?	how is a vacuum able to propagate light ?
1	why there is no operator for time in qm ?	is there an observable of time ?
0	could a bipolar nebula be produced by a time gradient ?	how does the correlation length of weather emerge ?
0	if you stop water from expanding , will its temperature stop rising ?	would infinite time elapse relative to an outside observer if an object was completely at rest ?
0	showing that the ricci scalar equals a product of commutators	how should we put two lens ?
0	minkowski to euclidean	are fresnel lenses widely used for solar electricity ? if not , why not ?
0	how to work out momentum when there are velocity and mass changes	the geodesic line on poincare half plane
0	intuitive explanation of why orbits are closed ?	why does not my house get misty ?
1	why can not we accelerate objects past the speed of light ?	travelling faster than the speed of light
0	simplest interferometer	the schwinger model
1	would oscars made of pure gold bend ?	stacking gold bars
0	how seriously do string theorists take the " landscape"	mangnetic flux summing up like kirhoff ?
0	what is inside a proton ?	what is a hilbert space filter ?
0	is there a general physics simulator for learning purposes ?	force in special relativity
0	does electron in wave form have mass ?	faster than light due to reference position
1	is the 74.2km/sec per megaparsec accidental ?	hubble time , the age of the universe and expansion rate
0	where do electrons get their ever-lasting circulating energy ?	quick question concerning the heisenberg model
0	can we make a space elevator/lift ?	how to find out whether a transformation is a canonical transformation ?
0	perturbative vs . non-perturbative approaches to a well-defined yang-mills theory in 4 dimensions	does entanglement have a speed or is it instantaneous
0	how to apply an algebraic operator expression to a ket found in dirac 's qm book ?	question about moment of inertia and velocity
1	reaching the speed of light , rockets	double light speed
0	what are the topics of string theory that are comprehensible with only a mathematical background on manifolds and algebraic topology ?	how to obtain the distance traversed by a free falling body equation ?
0	what is the position and orientation of the earth as a function of time	should annealed disorder be characterized by the average of the partition function ?
0	deriving expression for motional emf	axiomatic structure behind dirac 's formulation of qm ?
0	magnet spinning between two other magnets	why is the wave function complex ?
0	determining friction for unbalanced wheel to roll without sliding	ground state assignment for nuclear shell model
0	why the world is so deep and dark ?	imposing anti-commutation relations on fermionic quasi-particles
0	which is the smallest known particle that scientists have actually *seen with their eyes* ?	relationship between the continuity equation and the wave equation
0	potential at a point	what does the quantum state of a system tell us about itself ?
0	what is the best insulator for static charges ?	why is it that a carnot heat engine will reject no heat to a zero temperature sink ?
0	calculating two particle position and velocity with each other ?	is it possible for a photon to be at rest ?
0	how much red , blue and green does white light have ?	relation between casimir and hydrophobic effects
0	if a balloon is continuously filled with air and stays at a constant shape and size will there be any empty space in the balloon ?	put a bullet into orbit around the moon
0	can we have consistent histories inside a black hole ?	how do internal forces affect motion ?
0	topological insulators : is hgx a special case ?	how bright will an asteroid be ?
0	experiment regarding myopic correction by a manipulation of fingers ?	what is the relativistic energy of a moving strained spring as $k\to\infty$
0	which experiment gave scientists reason to believe nuclear fission/fusion produced energy ?	is the universe we know just shaped due to time ?
0	time , distance perception	is it a total or an explicite time derivative in the schrödinger equation ?
1	with a box that has perfect mirrors on the inside would it be possible to trap light ?	what longest time ever was achieved at holding light in a closed volume ?
0	time dilation as an observer in special relativity	dimensional analysis to determine a formula
1	why does black get heated the most ?	radiation– white vs black house , hot or cool ?
0	møller scattering : twisted ?	energy of an inductor
0	how to know if something is a primitive concept , a law , a definition or a theorem	energy equation
0	primary direction in planet-centered equatorial reference frame	dark matter and so ( 10 ) grand unification
0	formation of a black hole and hawking radiation	does the global financial system violate laws of thermodynamics and energy conservation ?
0	does a rotating moving body in " flat " space curve its path because of frame dragging ?	direction of motion
0	why does light of high frequency appear violet ?	how do electrons know which path to take in a circuit ?
0	how do black holes accrete mass ?	what does qft " get right " that qm " gets wrong " ?
0	problem in applying takens correlation dimension	has anyone else thought about gravity in this way ?
0	is this static mechanical balance possible without trickery ?	parton distribution functions plot
1	how to measure power used to sustain something in a ( gravitational ) field ?	why does holding something up cost energy while no work is being done ?
1	how does an inflationary universe solve the flatness problem , horizon problem and monopole problem ?	what is the evidence for inflation of the early universe ?
0	is it possible for a sound to be louder as you move away from it ?	scaling solutions in context of denef - moore
0	how to compensate ray displacement caused by refraction in glass slab	when moving fast time slows down vs speeds up
0	photon spin projection to arbitrary axis	does the mass of a star change as it collapses into a black hole ?
1	why light can not go faster then 300 000 km/s ? what prevents it ?	why and how is the speed of light in vacuum constant , i.e. , independent of reference frame ?
1	prerequisites for griffiths electrodynamics	what does it take to understand maxwell 's equations ?
1	how does heat actually stay kept in the carbon molecules in the atmosphere ?	how does carbon dioxide or water vapour absorb thermal infra red radiation from the sun ?
0	intuitively , what is the source term of the einstein field equation ?	why photons are emitted because of changes to electron behavior
0	what is precisely a yangian symmetry ?	drawing the circuit from a differential equation
0	tsallis entropy and other generalizations	do all black holes spin in the same direction ?
1	with redshift , energy is lost . where does it go ?	photons in expanding space : how is energy conserved ?
0	advice on doing physics under the umbrella of mathematics and the converse	why does your reflection suddenly turn upside down while slowly walking away from a curved mirror ?
0	how mirror equation can explain farsightedness correction ?	why are cooper pairs formed by electrons of opposite momentum and spin ?
0	does the exact string theory $s$-matrix describe all physics there is ?	based on note , how fast is a stringed instrument 's string oscillating ?
0	at what size will self-gravitation contribute more to stability than surface tension ?	what is the geometrical interpretation of ricci tensor ?
0	speed of liquid being blocked at end of pipe	physics of anathem
0	why does not a typical beam splitter cause a photon to decohere ?	pump pressure required to fill water tower
0	natural electricity in the atmosphere - lightning	hubble 's law and conservation of energy
1	electrons and energy	why electrons can not radiate in their atoms ' orbits ?
0	back-of-the-envelope calculation of electron anomalous magnetic moment	how much photons are needed to erase a complete mountain ?
0	why there is a whirl when you drain the bathtub ?	imaginary part of poynting vector
1	simple pendulum and perpetual motion	would a pendulum swing indefinitely in a frictionless vacuum ?
0	why do non-newtonian fluids go hard when having a sudden force exerted on them ?	which optics textbooks are good ?
0	how to compute speed without knowing mass or charge values ?	error in sear 's and zemansky 's university physics with modern physics 13th edition ( young and freeman ) ?
0	are carnot engine efficieny and fourier heat trasmission law related ?	how long does it take for radio or light waves to travel from earth to jupiter , saturn , uranus , neptune and pluto ?
0	is there an equivalent to wetness for air ?	windflow in a car
1	what good is extraordinary matter to the consumer ?	practical matter of the higgs-mechanism
0	showing lorenz gauge is satisfied in retarded potential - vector calculus	how to estimate the kolmogorov length scale
1	how should semiconductors be understood ?	what are " electron holes " in semiconductors ?
0	energy conservation	why is a hot air balloon " stiff " ?
0	airplane on a treadmill	the energy-momentum tensor and the ward identity
0	what is a photopeak ?	can unexposed pmma be reused ( successfully exposed ) after development ?
1	universe inflation	size of universe after inflation
0	chsh inequality : why $\pi/8$ ?	a charged particle moves in a plane subject to the oscillatory potential
1	symmetry factor of $n$-point one-loop diagram	formula for symmetry factor
0	can a pushed plank beat light and break the laws of physics ?	what happens when we bring an electron and a proton together ?
0	massive excitations in conformal quantum field theory	what can cause a change in wave 's shape - one dimensional wave
0	intuition behind the notion of reflection positivity	source of beating phenomena of a michelson interferometer ?
0	recommendation on mathematical physics book of symplectic geometry	why is energy = voltage x charge , and how to prove that ?
0	books dealing with quantum field theory	fluid mechanics problem - ball in reservoir
0	first-order and second-order wave equations , versus the uncertainty principle	representation of su ( 2 )
1	born 's rule , what is the reason ?	probability and probability amplitude
0	e and b field from time varying current	can a planet have a larger diameter than jupiter ?
0	why/how does an electron emit a photon when decelerating ?	do quartz watches actually implement the si definition of the second ?
0	should i be concerned about spot corrosion on a telescope 's primary mirror ?	wave or particle in the end
0	which exact solutions of the classical yang-mills equations are known ?	where does $r/\gamma^3$ come from in relativistic e&m ?
0	simple thermodynamics basics - can internal energy be calculated ?	what could generate a high-pitched whine in electronics where the frequency depends on the current ?
0	what are the implications of superliminal neutrinos ?	why do we say that in coulomb 's law the force is proportional to $\frac{1}{r^{2}}$ and not $\frac{1}{r^{3}}$ ?
0	does an oscillating electrical monopole radiate ?	how energy curves spacetime ?
1	study basic quantum mechanics	mathematics for quantum mechanics
1	quarks are now considered to be fundamentals , but so were atoms some time ago . so the way we see is only limited by our technological advances ?	is everything in the physical world composite ?
0	can nuclear transmutation be observed in real time ?	energy expended in moving point charge in e field . having trouble understanding an excerpt from e&m textbook
0	proof of the inverse square law for a uniformly bright sphere	is there a physical system that emulates mathematical cellular automata ?
0	calculating the electro magnetic field strength needed to repel a permanent magnet	is this a correct interpretation of pressure ?
0	dependence of chemical potential to zero point of energy	what quantum states can be measured using entanglement ?
0	when one thinks of a field of operators in qft , is it reasonable to think of a matrix being associated with each point in space time ?	solve my confusion about electrons ?
0	at what point does everything become nothing ?	wind bouncing off surfaces
0	is this a photograph of an electron-positron annihilation ?	formulas for kinetic energy
1	magnetic field resistance material : are there any ?	shielding magnetic field without mu-metal
0	derivation of the gauss-codazzi equation	finding release angle and final velocity of projectile when the target has a different coordinations
0	a quantum particle in a box ( with a catch )	classical em neglects electron recoil ?
0	simple ( but wrong ) argument for the generality of positive beta-functions	2 electromagnetic loops , with light-speed constraints : is newton 's third law violated ?
0	what predictions can a quantum gravity theory make ?	space-time continuum
0	force to stop a moving rope vs . stagnation pressure of a fluid	why must the dirac equation multiplied by its complex conjugate give the kg equation ?
1	how can there be magnetic force without velocity	the equivalent electric field of a magnetic field
0	non classical mechanic answer to : length of time a thrown object spends in rest before falling down ?	hot air balloon and buoyancy
0	can air bubbles sink at extreme depths ?	understanding the algebra associated with an implicit potential
0	aurora effect from galactic wind ?	theories that relate gravity , electricity , and magnetism
1	does kinetic friction increase as speed increases ?	does the force of kinetic friction increase with the relative speed of the objects involved ? if not , why not ?
0	liquid nitrogen expansion to desired temperature	ricci scalar higher dimensions
0	vertical uniform circular motion . . can it really be uniform ?	did galileo offer an explanation why his law of falling bodies is independent of mass ?
0	creating matrix hamiltonian for feynman 's ccnot	how laser interact with atoms ?
0	large and small gauge transformations ?	why can not noncontextual ontological theories have stronger correlations than commutative theories ?
0	bell states entanglement	experiment demonstrating interference patterns of neutrons
0	interpretation of qm as discrete derivative	relative weights in rotational bands of symmetric diatomic molecules
0	sound propagation using finite-difference time-domain ( fdtd ) considering wind effects	minimum required to lift a roller up a step
0	how ' faster than light ' neutrino was product of loose cable at cern ?	using moments to influence the thickness of beams in structure ?
1	what is the " event horizon " of a black hole	general definition of an event horizon ?
0	immediately after the big bang , was the universe in a state of extremely low or extremely high entropy ?	what is the physical meaning of the action in lagrangian mechanics ?
0	view of the sun from voyager 1	on a frictionless table , what is the angle at which a cue ball should hit another ball for it to go in ?
0	non-minimal coupling of electromagnetic field	what is the main downfall of using qpsk rather than dqpsk in fiber optics ?
1	how do bikes stay upright ?	why does not a bike/bicycle fall if going with a high speed ?
0	what is meant by proton structure function ?	how can we detect x-rays ?
0	what are the implications of bell 's theorem ?	does hestenes zitterbewegung explain why complex numbers appear in qm ?
0	will magnetic field lines change when a magnet gets closer to other magnets ?	can observers be particles ?
0	more data points or more averages ?	conservation of energy and the poynting theorem
0	what methods can astronomers use to find a black hole ?	light in the absence of colloids ?
0	can a saltwater solution conduct electricity forever ?	how do transformers work ?
0	where is noncommutativity in the state-effect formalism of quantum mechanics ?	resonance of a tube of air in case of more complex shapes
0	work done by spring over distance	electric field strength at the center of an equilateral triangle
1	why does a motor draw more current stopped or under load ?	relationship between current through a motor and it is load
1	does light ( em signal ) undergo accelration during reflection ?	what happens when a photon hits a mirror ?
1	when one monkey accelerates up a rope , what happens to the other ?	man on a rope task
1	if i lift a box vertically , why is the work i do equal to the distance i lift it times the force of gravity on the box ?	what exactly is $f$ in $w = \int_{a}^{b} f dx$ ?
0	decoherence inside black holes	adiabatic proccess and carnot cycle in a photon gas
1	why can not classical information be transmitted through quantum entanglement by measuring time between change events ?	the choice of measurement basis on one half of an entangled state affects the other half . can this be used to communicate faster than light ?
0	how a plasma reacts with an ac electromagnet	is the big bang defined as before or after inflation ?
0	pendulum : deduce proportionality from experiment	what is polarization in case of blazars ' emission ?
0	a problem concerning the force between currents or moving electrons	double variation of schwinger action principle
0	why does black get heated the most ?	picture and isomorphisms
1	how to prove gauss 's law div ( e ) = rho/epsilon from coulomb 's law ?	how is gauss ' law ( integral form ) arrived at from coulomb 's law , and how is the differential form arrived at from that ?
0	schwarzschild geodesics	what are bootstraps ?
0	flow of freezing liquid or a melting solid	is it possible that galaxies ' redshift is caused by something else than the expansion of space ?
0	why are all force particles bosons ?	it is possible to create a proton colliding a positron with enough energetic photons ?
0	heating coffee by yelling ?	navigating a time machine
1	do particles travel backward and forward in time ?	is anti-matter matter going backwards in time ?
0	what is the relationship between luminosity , intensity , and flux ?	work due to introducing a dieletric in a capacitor
0	calculating angle of projectile motion	mass vs . weight on a spring-loaded bathroom scale
0	sound frequency of dropping bomb	baryogenesis only at the planck scale , or none at all ?
0	nuclear reactions conservation laws	best observing techniques for a total lunar eclipse ?
0	how to analyse data that is in four dimension ?	how do we know the universe is expanding , and not that its contents are shrinking ?
0	why do objects of a given color appear white under light of that color ?	fitting an exponential when values are negative ( while taking error into account )
0	why did everything in space cooled out ?	specific problems with the quadrupole formulation of gravitational radiation
0	hydrogen radial wave function infinity at r=0	17 joules of energy from a mouse trap
1	proofs that earth is not flat ?	what is the simplest way to prove the earth is round ?
0	intuitive explanation for angular momentum uncertainty ?	modern references for continuum mechanics
1	why do we fall down when the bicycle slows down ?	why does not a bike/bicycle fall if going with a high speed ?
0	why is there a wave on the water surface when i put something in the water ?	newton 's law of graviation : why $g$ and not e.g. $\dfrac{1}{4\pi g_0}$ ?
0	temperature loss of a moving object	why defects moderate ( reduce ) electric field ?
0	gravitational redshift of temperature and electrostatic potential	magnetic declination
1	why is there no massless spin 1/2 particles with charge ? is there any underlying theory ?	massless charged particles
0	orienational order parameter in isotropic systems	does spin of the earth vary at different locations ?
0	parity of the ground state of a majorana chain	can low-gravity planets sustain a breathable atmosphere ?
1	special relativity time expansion	how is the classical twin paradox resolved ?
0	what is the best way to measure bioimpedance using ac bridges	a conceptual problem with the field equations of general relativity
1	self-contained book about complex systems and nonlinear dynamics	what are some of the best books on complex systems ?
0	violation of lorentz symmetry on cosmological distances	what is the correct term to describe matter converting into energy ?
0	observables - what are they ?	in quantum mechanics , given certain energy spectrum can one generate the corresponding potential ?
0	paraxial wave equation solution ?	is it possible create current by spinning a charged sphere ?
0	calculate rotational intertia	trying to understand infinite gravitational energy
