0	is a superconductor really a super conductor ?	why is heisenberg picture used if schrödinger picture is simpler ?
0	distorted colors of google streetview photographs near electric power lines	why can tv broadcasts send such large amounts of data ( photorealism ) and a pc cant
0	is acceleration an absolute quantity ?	why is current $\propto$ number of loops ?
1	does time exist in space or does space exist in time	what is the difference between space and time ?
0	maxwell equations and fourier decomposition	problem involving 1st law of thermo and ideal gas law
0	understanding the e=mc2 for multiple objects	cosmology with a negative cosmological constant
0	i am looking for ' programming+electronics+ physics ' field	indistinguishable particles in quantum mechanics
0	what pauli matrices should i use for this two spin system ?	using centre of mass in gravitational field calculation
0	phonon wavevector $q\le 2k_{f}$ for electron-phonon scattering	what condition is fulfilled by the path of a mass sliding down a lumpy hill ?
0	calculating band gap from band structure	difference between $\psi_{\alpha}$ and and $u^{\pm}$ in dirac fields ?
0	transforming an equation to the co-vector version	confusion regarding photons ?
0	there is no electricity at home , i need to light a 15w cfl bulb . can i do it with the help of a hamster ?	tachyon vertex operator ( polchinski 's book )
1	water displacement in the oceans as a result of global warming	what happens to water level when ice xii melts ?
1	do the changes of gravity travel across distances instantly or limited to the speed of light ?	the speed of gravity ?
0	does noether 's theorem also give rise to quantities conserved over space ?	does all electrical insulator can be electrostatically charged ?
1	heat energy in special theory of relativity	is temperature a lorentz invariant in relativity ?
0	why does vaccum have a nonzero characteristic impedance towards electromagnetic radiation	parity of proton is 1 ?
0	quantum entanglement : does it necessarily imply superluminal information transfer ?	why might the normal force on a box not be equal to its weight ?
0	soft bremsstrahlung : why $\hat{k}\cdot\mathbf{v}= \mathbf{v}'\cdot\mathbf{v}$ ?	matter - antimatter reactory practicality
0	why does the amount of energy transferred depend on distance rather than time ?	expectation of 2-form field $b_{mn}$ in string theory
0	locality in the scattering amplitude	what are the most realistic ways of high speed space propulsion ?
1	can the laws of classical mechanics be derived from quantum mechanics ?	classical limit of quantum mechanics
0	gauss vs mw/cm^2: same thing ?	where does the lost energy go in a rubber band powering a rotating shaft ?
0	is there a nice tool to plot graphs of paper citations ?	more forces at low energy ?
0	what happens when a bacteria tumble ? is it an active or a passive process ?	what formula connects the moment of inertia and angular velocity ?
0	does pulling or pushing take more effort ?	spin in relativity
1	orbital motion ( mechanics )	book recommendations
0	ms scheme and its rg equation by cheng and li	does the speed of sand flow in a hourglass depend on a height of a sand column above the hourglass neck ?
0	percolation in a 2d ising model	what does a positive gradient on a graph of v plotted against i mean in terms of emf and internal resistance ?
0	how much faster is the fusion we make on earth compared to the fusion that happens in the sun ?	dual photon in d=3
0	how to calculate error of parallax and sextant based navigation ?	the bicep2 data are evidence of gravitational waves and of inflation . are they also the first observation that requires quantum gravity ?
0	light vs . x-ray interactions with phosphor	equations of motion for the yang-mills $su ( 2 ) $ theory
0	how can sunlight be white , but pictures of the sun be orange ?	how to determine the mass of a quark ?
0	if an electron can not go faster than light , how is energy conserved here ?	terminal velocity of a body in a vacuum
0	what force particle mediates electric fields and magnetic fields ?	what limits range of gravitational attraction concerning space expansion ?
0	can we measure an electromagnetic field ?	is the superposition principle universal ?
0	how do i show that all brillouin zones have the same volume ?	do you feel more impact force when falling straight down or tipping over ?
0	derivation of differential scattering cross-section	what algorithms can be used to compute the binodal in a ternary flory-huggins theory ?
0	what are typical values of the critical thickness of insulation ?	temperature in an isobaric process
1	what is the intuition behind the direction of torque ?	torque direction meaning
0	where is the velocity term in dirac current hiding ?	quantum boltzmann equation
0	does a constant factor matter in the definition of the noether current ?	how do einstein 's field equations come out of string theory ?
0	the secret behind the spinning , asymmetrically weighted , 2d disk-shaped top ?	lie algebra and lie group about quantum harmonic oscillator
0	kinematics and motion	wigner-eckart theorem of su ( 3 )
1	what is $k$ in newtons law of cooling ?	what does 1/k represent regarding newtons law of cooling ?
0	what is the simplest way to prove the earth is round ?	is this generalized hawking radiation formula right ?
0	inserting metal into parallel plate capacitor	launching a unpropelled rocket
0	quantum mechanics lx operator	is there a way to compute ( trivalent ) feynman integrals inductively from smaller diagrams ?
1	exam on physics for graduate	book recommendations
0	what is the difference between background field and dynamical gauge field ?	quantum tunneling in field theory with time dependent potential
0	cartesian coordinates to polar coordinates	what does the height refer to in the bernoulli equation ?
0	impurity scattering temperature dependence	what makes waves at beaches to come with high velocity and frequency at nights ?
0	position dependent speed , how to compute position	predicting faraday 's law , changing fields
1	how does cold fusion work ?	why is cold fusion considered bogus ?
0	examples of number theory showing up in physics	ducted or open fluid flow , which is best for aerodynamics and lift
0	the eigenstate existence problem in dirac 's ' principles of quantum mechanics'	christoffel symbols and dirac matrices mathematical similarities ?
1	is it possible ( theoretically ) to divide black hole into two parts ?	is there a way to split a black hole ?
0	why are black mosquito nets so much less visible than white ones ?	how does rolling resistance of rail wheel depend on diameter ?
0	difference between a central potential that is a point and one that is a sphere ?	how was this pressure pulse propagation speed be derived ?
0	what highest amount of energy can we get from a laser ?	should a radiation-filled universe be scale invariant ?
0	is " a brief history of time " still up to date ?	what is the speed of light from a star moving towards a observer . ?
0	is gravity an entropic force after all ?	degenerate perturbation theory applied to topological degeneracy ?
0	how is the speed of light constant in all directions for all observers ?	is it true that any system of accelerating charges will radiate ?
0	can an " absolute " frame of reference be determined by measuring the compression of light ?	lagrangian density of an interacting real scalar field theory
0	optimality of product input state in quantum channel	would a beam of light moving through a vacuum be considered an example of perpetual motion ?
1	how to explain spin of electron ?	what is spin as it relates to subatomic particles ?
0	translation invariance in crystals	salt water conduction
1	movement of a ball on a curved ramp	what is a natural movement of a ball on a upward curve ( the two arrow lines pointing upward ) given no external force ?
0	the definition of lorentz transformation	scaling : gravity and friction
0	if sound travels through matter what medium does light travel through ?	introductory texts for functionals and calculus of variation
0	the expansion of a function in powers of a parameter	blue-shifting as opposed to violet-shifting
0	can you prepare the superposition of two arbitrary light beams ?	calculate water flow rate through orifice
0	what does symplecticity imply ?	conservation laws in photon parametric down-conversion
0	question on 1st order lagrangian derivation in faddeev-jackiw formalism	magnetic force and terminal velocity of falling loop and falling disc ?
1	exeeding the speed of light by adding velocities	what is the relative speed of two near-light speed particles headed towards each other ?
0	if $f=ma$ , how do can we experience both gravity and a normal force even though we are not accelerating	how can the black body radiation formula be so general ?
0	how to get the cosine of a waveform ?	partition function of classical quadrupole in an electric field
1	suggested reading for classical field theory	book recommendations
1	how far is the range of an ultrasonic sensor as far as it can transmit ?	ultrasonic wave through air
0	equivalence between differential geometry and mechanics ?	spontaneous conversion of heat into work at negative temperatures
0	euler 's buckling formula applicable for impact calculations ?	what is the microscopic picture for warm air rising ?
0	does quantum mechanics depend solely on electromagnetic waves ?	why does a smaller acoustic impedance mismatch produce lower transmission ?
0	understanding well defined states	explain polarization in rf in which the conductor is stationary
0	how can i estimate relative humidity ( $e/e_s$ ) from temperature and dewpoint ?	why does a gas get hot when suddenly compressed ? what is happening at the molecular level ?
0	abacus about the thermal expansion of copper	asymptotic invariants in general relativity
0	pseudo force in rotational motion ?	perceived weight in dumbbell vs . barbell
0	physics talk with an emphasis on mathematics	wigner 's friend and quantum zeno effect
1	is there any evidence that everyone sees colours the same way ?	how can you test what color different people perceive ?
1	is there an upper limit to a rocket 's size/payload ?	why are rockets so big ?
0	why does the kruskal diagram extend to all 4 quadrants ?	work done by friction
1	coulomb 's law : why is $k = \dfrac{1}{4\pi\epsilon_0}$	coulomb force in si and cgs
0	why is it hard to give a lattice definition of string theory ?	lagrangian mechanics and time derivative on general coordinates
1	why do lagrangians and hamiltonians give the equations of motion ?	why the principle of least action ?
0	what was so surprising about accelerating cosmological expansion ?	what happens when a ferromagnetic object encounters a field too strong for it ?
0	integrating radial free fall in newtonian gravity	will accelerating a massive particle generates a blackhole ?
0	feynman lectures on physics	too small error on the calculus of wavelenght
0	tachyonic antitelephone vs messaging through a wormhole	approximating evolution as occurring in a two-dimensional subspace
1	physics books for mechanics	recommendations for good newtonian mechanics and kinematics books
0	can lee-yang zeros theorem account for triple point phase transition ?	euclidean derivation of the black hole temperature ; conical singularities
0	how to simulate a full-suspension bike ?	particle in oscillating field
0	spectral eigenvalue staircase and quantum system	comparing graphene and ni3 hitp2
0	rigid body rolling quesion	does perturbation theory break down for quantum gravity ?
0	what do people actually mean by " rolling without slipping " ?	gauss 's law problem
0	can light exists in $2+1$ or $1+1$ spacetime dimensions ?	some conceptual questions in bec
0	heavy nuclei surface exposed to positron gas	triangular symmetry of surface tension configuration of small grains on water
0	how is it possible for orbits to maintain stability ?	what formulations of qm are there ?
0	question on spin-orbit interaction	examples of manifolds ( not ) being : flat , homogeneous and isotropic
0	can the " milky way " galaxy be seen by the naked eye in a clear sky ?	explanation for $m{\ddot{r}}=-\nabla \phi$
1	space as a function of time ?	what is the difference between space and time ?
1	how does " space " expand ?	space expansion vs . relative motion
1	what is the invariant associated with the symmetry of boosts ?	what conservation law corresponds to lorentz boosts ?
0	emf of a rod sliding on two conducting rails	experimental evidence of a fourth spatial dimension ?
0	right hand rule to measure direction of electric field	sunspots formula
0	relation between the determinants of metric tensors	kac-moody algebras in 5 dimensional kaluza-klein theory
0	selection rules in electron spectroscopy	jumping on earth versus jumping on the moon
0	young 's experiment or why the light can not be described as a particle	is there a tb meson ?
0	why can certain functions be absorbed into the schwarzschild metric , while others can not ?	would sea water moderate a nuclear submarine meltdown ?
0	the signature of the metric and the definition of the electromagnetic tensor	how do we measure a quantum system properties ? ( length , mass and time )
0	topology and majorana bound states	why does the air flow faster over the top of an airfoil ?
0	quality loss when adding more components to a telescope ?	how to properly find equilibrium vectors when 3 or 4 vectors are present ?
0	can the motion of a cracking whip be described as the interference of two waves ?	reflected waves and phase changes
1	link between quantum and classical mechanics	momentum as generator of translations
0	angular momentum in an accretion disk	questions on 4-vector velocities and invariance
1	hydrostatic pressure at the center of a water planet	how to find the force of the compression at the core of a planet ?
0	is it possible to surpass the diffraction limit for telescopes ?	would matter-antimatter annihilation create a fireball or not ?
1	the paradoxical nature of hawking radiation	what is hawking radiation and how does it cause a black hole to evaporate ?
0	why electric field has a major role in vision ?	gamma functions integral identity
0	how much energy is needed to curve the space so the sun will come 1 meter closer to our planet ?	how does my car acquire satellite signal ?
0	why is electric potential positive ?	uniform chain falls off table diff eq
1	how does relativity explain gravity , without assuming gravity	does the curvature of spacetime theory assume gravity ?
0	does a full freezer freeze items faster than an empty one ?	qm : commutation relations between irreducible vectors and angular momentum $ [ j^2 , t_q^k ] $
0	object under resistive force	two puzzles on the projective symmetry group ( psg ) ?
0	when are we now ? time coordinate system	how does newtonian gravitation conflict with special relativity ?
1	rolling disk in inclined plane and flat plane ?	static as opposed to kinetic friction in rolling motion
0	mass generation by chern-simons theory	is it physically realistic to have an electric field and polarisation density but no displacement field ?
1	good books about waves and optics	where is a good place to learn ( classical ) optics ?
0	is newton 's law of gravity consistent with general relativity ?	does closing curtains ' make your home warmer ' ?
0	differences between time-independent and time-dependent schrödinger equation for potential generation	is it circular reasoning to derive newton 's laws from action minimization ?
1	learning about group velocity , phase velocity and particle velocity	what is a good introductory book on quantum mechanics ?
0	how long does it take for a roller coaster cart to reach point $x_1$ ?	the time component is $\gamma m c$ , so should not $e=mc$ ?
1	if the universe is 3d , how is space-time like a " fabric " ?	does the curvature of spacetime theory assume gravity ?
0	primary constraints for hamiltonian field theories	what are the frameworks of physics ?
0	if an electrical field can jump over a point on its stright path of propagation ?	solve spring system
0	what is the physical interpretation of force times area ?	what do the names " e mode " and " b mode " mean ? where do they come from ?
0	electrostatics:2 concentric spheres	about solitons , what is the difference between kinks and vortices ?
0	net torque on a frictionless pulley	a nonintegrable quantum system whose classical limit is integrable ?
0	can i prove boundedness of an operator without checking it for its whole domain ?	has quantum entanglement been demonstrated to be able to take place over infinite distances ?
0	motivation for maximum renyi/tsallis entropy	ohm 's law : drude model
0	resistance in a dc circuit	can massive fermions have zero modes ?
0	why does not a bus blow due to internal pressure ?	paramagnet : negative specific heat ?
0	the temperature dependence of the electron-hole ( or particle-hole ) continuum	will a tall narrow cup keep a cup coffee warmer than a more evenly dimensioned cup ?
0	reference for understanding characteristic length and time scales in a system ( in particular electronic transport )	chirality when moving around legs in feynman diagrams
1	facts about quarks electric charge	could the fractional model of quarks electric charge turn out to be false ?
0	what makes now special ?	recommendation for a physics history/non-fiction book
1	why do we have a galactic and a solar plane	why does everything spin ?
1	how does electricity ' decide ' on it is pathway ?	electricity takes the path of least resistance ?
0	period of an object in periodic motion	how to tell theoretically whether an electron behaves as wave or particle
0	how does a spinning electron produce a magnetic field ?	what is the physical meaning of the affine parameter for null geodesic ?
1	why is there still radiation left from the big bang now ?	why can we see the cosmic microwave background ( cmb ) ?
0	why use fourier expansion in quantum field theory ?	can all quantum superpositions be realized experimentally ?
0	example of hamilton 's principle to systems with constraints ( goldstein )	bell states entanglement
0	what is the schwarzschild metric with proper radial distance ?	without a reactor vessel breach , how does radiation build-up in containment buildings of troubled nuclear reactors ?
1	can we develop in the future a technology that can send a message to the past ?	is time travel possible ? is it possible to go back in time ?
0	diffusion of gases in the atmosphere	seeking chiral anomaly eft example
0	incompressiblity and speed of sound	are two waves being in phase is the same as saying that the two waves are coherent ?
0	how can planck units be consistent with conflicting dimensions of mass ?	pion decay in particle physics
0	what are some predictions from string theory that say some crystalline materials " will end up in one of many lowest-energy ground states ? "	universal speed limit
0	how did one get the defining equation of probability current and conservation of probability current and density ?	force on a magnet in a magnetic field
0	the gravitational potential of ellipsoid	why wire filament shakes inside a light bulb ?
0	why do not black holes have magnetic hair ?	why is " space-time " not fully explained as the observational effect of the casimir effect seen from a human perspective ?
0	which force would help find the mass ?	force acting on an object ?
0	stagnant air deep inside vintage mines	objective measure of anisotropy
0	hierarchy is no problem and susy is a mathematical tool for data fitting	does a negative line tension in a 3-fluid immiscible interface make sense ?
1	loschmidt 's paradox - really a paradox ?	does the scientific community consider the loschmidt paradox resolved ? if so what is the resolution ?
0	observing visible light itself by our eyes	can matter leave the cosmic horizon ?
0	heat equation with neumann boundary conditions	integration constants in maxwell 's equations ( ambiguousness ? )
0	behavior of black holes in higher- and lower-dimensional space-times	rabi oscillation
0	interference of independent electrons	why does light reflect more intensely when it hits a surface at a large angle ?
0	in ' t hooft beable models , do measurements keep states classical ?	ising formulation of the graph isomorphism problem
0	what does k denote in this equation ?	the movement of light
0	is it possible to study solid state from kittel after taking only one course in quantum mechanics ?	is there a way to create an artificial solar eclipse ?
1	what are the time operators in quantum mechanics ?	why there is no operator for time in qm ?
0	emf of a rod sliding on two conducting rails	calculating restorative force with hooke 's law
0	why do objects of a given color appear white under light of that color ?	why does the creation operator take a continuum value for the momentum ?
0	is the woodward effect real ?	does the wavelength always decrease in a medium ?
1	how can we depend on the mathematical axioms that break down at the nano-level ?	why are continuum fluid mechanics accurate when constituents are discrete objects of finite size ?
0	atomic weight in respect to the binding energy ?	is it possible to check from the em waves ( basically light rays ) ?
0	meaning of probability in a multiverse/a many-world interpretation ?	what is going on along the " sides " of an alcubierre warp bubble ?
0	does charge conjugation change the spin momentum ?	an electron has no known internal structure , does that imply it has an unknown one ?
0	( a , b ) -representation of lorentz group : coefficient functions of fields	can the vibrational energy of a engine be used to increase efficiency ?
0	dimensions in lagrangian potential	gravitational wave energy
1	how many dimensions are there in total ?	total number of dimensions in the universe ?
0	why is it suffice to show tensorial identity on a tensor composed of two vectors ?	change of variables in 3 dimensions
0	electron spin separation	dynamic light scattering
1	is it possible to generate usable electricity from the motion or magnetic field of the earth ?	can the earth 's magnetic be used to generate electricity ?
1	time for two objects to gravitationally attract each other	the time that 2 masses will collide due to newtonian gravity
0	potential step solution is not normalizable	atmospheric interference and ground based stellar observations
0	twin paradox an simultaneity	hamilton 's principle
0	why does microwaved food get cold faster	uniqueness and existence of polygonal orbits through a spherical shell
0	a question to the theory of multiverse	enhance a home build spectrometer
0	what is transverse energy ?	uniform circular motion : v = v_0 + ( a_t ) *t as a vector vs as a scalar equation
0	maximal gravity	hooke 's law does not work well with my spring ?
0	a question from a physics 2 exam : about electron cloud an a constant external field:	why linear wave equation does not have solitonic solutions ?
0	is the keppe motor " real " ?	why is near field communication ( nfc ) range limited to about 20cm ?
0	solving one dimensional schrodinger equation with finite difference method	electromagnetic field as a connection in a vector bundle
0	energy-momentum tensor in qft vs . gr	ice skater increase of energy
0	intuition behind coulomb 's friction force	why does evenly heating soup with a microwave take so long ?
0	superspace as the hilbert space for quantum gravity	what are phase conventions in angular momentum and rotation calculations ?
0	higher dimensions	wigner $3j$ symbols
0	polarizing beam splitter	effective field theory ( eft ) decoupling top
1	introduction to quantum mechanics	book recommendations
0	two charges in a medium where different permittivity is adjacent	existence of quantum computer
1	are temperature increases discrete ?	is temperature discrete
1	has time in the universe been found to be discrete or continuous ?	what is the fastest process or shortest time in nature ?
0	does a conductor need to touch the battery terminal for electric field to be set up inside it ?	higgs boson mass and electroweak energy scale
0	what limits the maximum attainable fermi energy for a material experimentally ?	pressure difference in water tanks at different heights
0	differential geometry of lie groups	indicate if objects after collision will stick
0	how to derive schrödinger equation ?	probability distribution of two particle types system
1	why are the anthropometric units ( which are about as big as we are ) as large as they are relative to their corresponding planck units ?	the origin of the value of speed of light
0	formation on image on screen ?	refractive index of dielectric in different frames of reference
0	what is meant by " nothing " in physics/quantum mechanics ( qm ) ?	newton 's rings : what causes the other rings ?
1	speed greater than light in circular motion	rotate a long bar in space and get close to ( or even beyond ) the speed of light $c$
0	atomic structure and corresponding superpartner behavior	alcubierre warp bubble effect on gravity and space
0	collision of two balls of finite radius	intuitive explaination for why higher engine compression ratio is more efficient ?
0	what is the capacitance of parallel plate capacitor with different electrode material ?	potentials in feynman path integral ii
0	should not the sign of generated entropy always be positive ?	showing that an operator is hermitian
0	what is the difference between “evidence of a new particle” and “discovery of a new particle” ?	how can we claim something violates some physical law , when so many physical laws have been postulated ?
0	surviving under water in air bubble	how many atoms in the particle ( aunp )
0	where and how is the entropy of a black hole stored ?	how does tempered glass work ?
0	is conservation of statistics logically independent of spin ?	what is currently incomplete in m-theory ?
