0	if hydrogen and helium are lighter than air , why will not liquid hydrogen and liquid helium defy gravity ?	does time expand with space ? ( or contract )
1	does the universe have finite number of particles ?	dumbed-down explanation how scientists know the number of atoms in the universe ?
1	wave packets , group velocity , and phase velocity	group velocity and phase velocity of matter wave ?
0	derivatives of fluctuations about a condensate	element of area in 4-dimensional space-time
0	equilibrum position of an extensible spring	einstein 's cosmic speed limit $c$ challenged by black holes/massive objects
1	can statistical mechanics explain the second law completely ?	how do you prove the second law of thermodynamics from statistical mechanics ?
1	if i lift a box vertically , why is the work i do equal to the distance i lift it times the force of gravity on the box ?	why does holding something up cost energy while no work is being done ?
0	give a description of m-theory your grandmother can understand	what is the worst thing about the tomographic approach to qm ?
0	vertical wind gradients in the atmospheric boundary layer	kiessig fringes
1	are lorentz force and maxwell 's equations independent ?	can the lorentz force expression be derived from maxwell 's equations ?
0	resonance and natural vibrations in vacuum	is it possible for information to be transmitted faster than light by using a rigid pole ?
0	question about landau 's phase transition theory	specific energy and specific angular momentum of photon
0	long time deviations from exponential decay in radioactivity	acceleration of the expansion of universe
0	euclidean derivation of the black hole temperature ; conical singularities	moment of inertia of a planet
0	practical resonance derivation ?	( why ) can we simply assume a given alignment of vevs ?
0	why does this perpetuum mobile not work ? ( gases and densities )	is this the answer to artificial gravity ?
1	amateur 's question on black holes	why is spacetime curved by mass but not charge ?
0	car parking special-relavity puzzle	is this air cooling idea feasible ?
0	which big bang theory has more assumptions ?	d'alembert 's principle and the term containing the reversed effective force
0	how would the solar system change if earth was to just disappear ?	maxwell relations , confused on how the solution got to this answer
0	what is the point of a cobasis ?	what does the higgs boson have to do with the uncertainty principle and quantum oscillations ?
0	is the classical doopler effect , for light shift , $1-v/c$ , exact ? what is it an approximation of ?	differential or integral form of the conservation equations ?
0	what is volume * mass be called ?	what exactly causes an increase in resistivity ?
0	does car have more kinetic energy when turning ?	how would natural ( resonant ) frequencies affect amplitudes ?
0	given constant t , why does p affect internal energy ?	boundary conditions for the heat equation when solving a mass density gradient
0	oscillations and majorana neutrino	does sunrise and sunset affect the weather ?
0	understanding units manipulation ( speed of falling coconut after 20m )	derivation of relativistic energy
1	does light ( em signal ) undergo accelration during reflection ?	what happens when a photon hits a mirror ?
0	young 's double slit experiment question	why does lightning emit light ?
1	what is movement through time ?	what is the speed of time
1	coulomb 's law : why is $k = \dfrac{1}{4\pi\epsilon_0}$	coulomb force in si and cgs
1	question about torque and center of mass	what point of application of force ensures more acceleration in a rod ?
0	finding at a distance from the earth speed of satellite	why is kirchoff 's current rule valid ?
0	coordinate system	determine the number of days with north-east wind direction from the number of days with north and east wind direction ?
0	is the electrical signal delivered to a load by a receiving antenna always $\propto \frac {\partial}{\partial t}$ of the $\vec{e}$ or $\vec{b}$ field ?	why is the valence band maximum at the gamma point in the bandstructure view of dispersion relation ?
0	physical meaning of the energy density of an electrostatic field	why is not it allowed to use a flash when taking pictures in a certain place ?
0	total amount of energy in the universe	angular acceleration of stone disk
0	what happens to a rotating rod that breaks in two ?	determine the velocity and acceleration of the vertex $b$
0	simple & intuitive explanation of superfluidity ?	what will be the relative speed of a photon in a light ray to another photon of opposite direction light ray ?
0	stability of balanced masses with different surface areas	how many photons can an electron absorb and why ?
1	what would happen after the collision matter and the anti-matter	what actually happens when an anti-matter projectile collides with matter ?
0	how to determine divergence of a led source from a single biconvex lens	does the zero energy universe hold true on some mathematical grounds besides observations ?
0	physical significance of operator norm/spectral norm of a quantum operator	what if microstates increase proportional to universe volume ?
0	how do you calculate potential energy given a force that is dependent on time ?	general relativity and the conservation of momentum
0	why do some air-conditioned stores blast you with jets of air as you enter ?	how can quantum ( internet ) network be possible ?
0	calculating the number of quanta emitted as cherenkov radiation in a wavelength interval dl ?	questions about spacetime curvature and gravity
0	firewall 's grandfather paradox	effect of spin on gravitational field ?
0	baker and copson " the mathematical theory of huygens principle " 1987 page 17	adiabatic process of an ideal gas derivation
0	relation between earth 's rotation-gravity and moving object on earth	how could mass exist before big bang ?
1	mirrors into infinity	what color would you see if you place 2 mirrors in opposit when one is a one way mirror
0	conceptual difficulty in understanding continuous vector space	partition function for the jaynes-cummings hamiltonian
0	component of force field tangent to a curve	determining average number of fragments created upon explosion
1	understanding field representation of force	electric field lines density
0	how does energy depend on frequency in an alternating current circuit ?	physical intuition for higher order derivatives
0	where to find experimental/theoretical value of ( charge ) radius of particles ?	what is the 2d gravity potential ?
1	expanding metre sticks	why does space expansion not expand matter ?
1	why there is a 1/2 in kinetic energy formula ?	why is there a $\frac 1 2$ in $\frac 1 2 mv^2$ ?
0	how long does it take for the speed of the train to decrease to $1~\text{m/s}$ ?	eigenfunctions corresponding to degenerate spectra
0	must the lagrangian always be known for the euler-lagrange equations to be of any use ?	how to relate compression ratio to work input for a compressor in a heat pump
0	where to find lunar eclipse data	can he-4 atoms create black holes ?
0	physical interpretation of the lorenz system	derive vector gradient in spherical coordinates from first principles
0	particle physics getting started	power spectral density of constant speed data in a car
1	baryon asymmetry	baryon asymmetry
1	disk spinning at the speed of light	invariant spacetime - distance - circular motion
0	given angle , initial velocity , and acceleration due to gravity , plot parabolic trajectory for every " x " ?	equipotential contour mapping and making it 3d
0	why are the lighter halogens gases ?	electromagnetic waves and boundaries
1	why does not the light from galaxies appear stretched ?	how distorted does the andromeda galaxy appear to us due to the speed of light ?
1	does a moving star have a larger gravitational pull ?	does a moving object curve space-time as its velocity increases ?
0	why must spacecraft reach escape velocity to escape earth ( or any other big object ) ?	quadrupole potential generation in paul trap
0	how powerful would a series of rail guns or bombs need to be to destabilize a hurricane ?	polarisation directions in standing waves in cubical cavity
0	does ordinary refraction exert a couple on the refracting medium ?	do greenhouse gasses make the world habitable ?
0	pseudo force other than centrifugal force in a rotating frame	conservation of energy in the universe
0	su ( n ) symmetry and its representations	cosmology with a negative cosmological constant
0	problem in hamiltonian	interacting fermionic spt phases in 2d with time-reversal symmetry
1	sound difference between musical instruments	what are those characteristics by which every sound can be identified uniquely ?
0	how does a pressure suit work ?	light cone and order of events ?
1	why does lorentz factor not hold for relativistic mass when we apply it to photons ?	does $p=mc$ hold for photons ?
0	optimal telescope size ?	a 0.1kg ball of dough is thrown up with a velocity of 15m/s . what is the momentum halfway up ?
1	neutrinos and the cosmic speed limit	superluminal neutrinos
0	how do i find the force from drop shock using material properties ?	mass spectrum of type i string theory
0	anti particles : what exactly is inverted ?	what is the neatest way to describe a “non-autonomous” ( lagrangian ) system ?
0	how can dynamics be reversible if inflation-style baby universe spawning is allowed ?	state space of strings : spin-1 particles in the conformal gauge ?
0	what is the fringe separation in young 's double slit experiment ?	why can not you hear music well over a telephone line ?
0	does this equation mean anything ?	a question about electromagnetic stress-energy tensor
0	what are hidden variables exactly ?	why must the final state be stationary ?
0	how should a heat current be defined for two component system with unequal numbers	which is stronger , wire rope or chain ?
0	what happens to 5 electrons on a sphere ?	when will the moon fall down ?
0	explanation that air drag is proportional to speed or square speed ?	what are the borders of determinism ?
0	do we reside in any particular dimension ( s ) ?	piezoelectrical effect in a pendulum
0	quick-and-dirty way to integrate out heavy fields	how are atomic bonds created ?
1	general relativity & kepler 's law	what did general relativity clarify about mercury ?
0	velocity in a pseudo-riemannian manifold	how do you find the magnetic field corresponding to an electric field ?
0	is feynman 's explanation of how the moon stays in orbit wrong ?	electrodynamics using exterior calculus
0	possibility of bose-einstein condensation in low dimensions	how can we test if something is a wave ?
0	what are natural sources of longwave radiation	why is there a search for an exchange particle for gravity ?
0	how does pressure influence temperature in liquids ?	what is the physical meaning/concept behind legendre polynomials ?
0	why does joule heating not occur when no current flows through a conductor ?	are tidal power plants slowing down earth 's rotation ?
0	why does my gravity simulation do this ?	eddy current losses in electric steel by harmonics of a magnetic field
0	conservative forces & conservation of energy ?	role of pure mathematics in fusion ?
0	which theory predicts that dubbed tires have more friction ?	gauss 's law for a uniformly charged solid sphere
0	choosing sign for kvl ( mutual inductance )	is there anything physically infinite ?
0	difference between electromagnetic radiation ( emr ) and electromagnetic field ?	firewall 's grandfather paradox
1	confused about the theoretical origin of quadratic air drag	explanation that air drag is proportional to speed or square speed ?
0	what is the relationship between elasticity and compliance ?	what physical phenomena underly the shape of this graph of diurnal uv index ?
0	gravitational attraction of triangles	is electron velocity at induction higher than in a wire ?
0	linac : why are they being accelerated ?	why is $s^1\times\mathbb{r}^{n-1}$ the topology of $ads_n$ ?
0	is it possible to project a magnetic field at a location in space ?	adm hamiltonian formalism and quantum gravity
0	confusion about lie derivative on metric	buiding circuits from color superconductors
0	the galileo thermometer : why do the bubbles float in the middle of the tube ?	upper critical dimension in field theory
0	what is the physical interpretation of the papadodimas/raju mirror operators ?	which physically acceptable quantum interpretations do not require the existence of any observer at all ?
1	maximum voltage on metal sphere ?	what limits the maximum sustainable surface charge density of a sphere in space ?
0	relating theta_qcd to neutron edm	how to use the schwarzchild metric formula to get distribution representing " free-fall"
0	what is a better phrase than " speed of light " for the universal spacetime speed constant ?	physical origins of the heisenberg model of ferromagnetism
0	feynman rules for real scalar field interacting with electromagnetic field	why does not the existence of proper-time $\tau$ imply a preferred reference frame ?
0	human kinematics:does velocity or acceleration become zero at the moment of changing human limbs ' direction of movement ?	neutral current : terminology
0	conductors connected with a wire	the connection between classical and quantum spins
0	is $e=mc^2$ false ?	does the universe obey the holographic principle due to stokes ' theorem ?
0	determining spectra of edge states numerically	massless thirring model in 1+1 dimensions
1	if the observable universe keeps expanding would we eventualy see light 24/7 . . . . clouds permiting ?	will the night sky eventually be bright ?
1	integrating for velocity	integrating for speed
0	force applied to an inclined plane	squashed 3-sphere ?
0	understanding the time dilation calculation in brian cox 's doctor who lecture	temperature of bose-einstein-condensate in space
0	layer thickness measurement	modeling the trajectory of a particle in an electric field
0	what is the stress energy tensor ?	is particle number a problem for formulating statistical physics in a mathematically rigorous manner ?
1	gravity in the center of a hollow neutron star	is spacetime flat inside a spherical shell ?
0	why do some anomalies ( only ) lead to inconsistent quantum field theories	number of supersymmetric charge and the meaning of $\cal n$
0	difference between $su ( 2 ) $ and $su ( 2 ) $ gauge transformations ?	detecting coherence
1	is it possible to speed up radioactive decay rates ?	do some half-lives change over time ?
1	universal speed limit	accelerating particles to speeds infinitesimally close to the speed of light ?
1	what gives an elementary particle a charge ?	origin of electric charge
0	can this ratio be written any better ?	why electromagnetic waves propagating along x transfers to electron momentum along z ?
0	analog of klein-gordon equation from proca action	supersymmetry in quantum mechanics
0	in a glass of water , will an ice cube ever touch the bottom ?	what defines the adiabatic flame temperature ?
1	why do springs have helical shapes ? why do we not use a cylindrical rod as a spring ?	how does the shape ( form ; not cross-section ) of a spring impact performance ?
0	how far would i have to go to see a fully rounded earth ?	without apparatus can we say that the system is measured ( decohered ) by the environment ?
0	holograms ? sci fi or future fact ?	two definitions : ' semi-classical space-time ' and ' supersymmetric minkowski space'
0	nature of spacetime 4-vector and tangent space ?	are there higgs bosons in the sun ?
1	beginner question : timelessness of massless particles	how does a photon experience space and time ?
0	concerning the curvature of an airfoil ( shape )	boundary conditions for 2d helical waveguide
0	weightlessness on earth	what is the exact gravitational force between two masses including relativistic effects ?
0	interference - the shortest way from the point of constructive one to the point of destructive one	did einstein know about michelson-morley experiment ?
0	what is the deepest reason why qcd bound states have integer charge ?	creating a 2d magnet simulator
0	stoke 's drag constant	realistic calculation of heat loss for pipe
1	what good is extraordinary matter to the consumer ?	practical matter of the higgs-mechanism
0	infrared-free qed and higgsless standard model phenomenology	two observers moving opposite to each other will see each other movin at speeds greater than light ?
0	uncertainty relation and energy-position interference	minimizing the higgs potential equivalent to finding the minimum ?
0	how big would the impact of a nuclear warhead be ?	knotted token-ring network
0	satellite collision problem	associating a unitary operator to proper lorentz transformations ?
0	relativistic transformation of the wave packet length	dark matter and mass-energy conservation
0	inhomogeneous effective mass in a 2d lattice	how do i get the focal length from a camera matrix ?
0	generalization of a spin-glass order parameter definition	missing centrifugal acceleration
0	predicting faraday 's law , changing fields	is synchrotron radiation considered incandescent ?
1	why does not our body gets crushed due to the atmospheric pressure ?	why the pressure of atmosphere does not crush you when you e.g. walk outside ?
1	how to calculate the equation of projectile motion for curved ramps ?	how to find equation of motion for this trajectory ? - object leaves curved ramp at a given velocity
1	books for learning mathematics in physics ?	best books for mathematical background ?
0	base states with hamiltonian matrix	circular motion and centrifugal force
1	spinning theoretical object moving faster than the speed of light	is it possible for information to be transmitted faster than light by using a rigid pole ?
0	why does $\nabla \to ik$ when you fourier transform ?	irrelevance of parastatistics for space dimension > 2
0	what is the difference between lattice vectors and basis vectors ?	a certain $\cal{n}=2$ superconformal theory ( or is it ? )
0	where do the terms microcanonical , canonical and grand canonical ( ensemble ) come from ?	in dimensional analysis , why the dimensionless constant is usually of order 1 ?
0	minimal coupling of an atom to the em field	is a free proton a positive hydrogen-1 ion ?
0	hygiene thermodynamics 2	how can a transversality condition be invoked to reduce the euler-lagrange equation ?
0	what is the shape of a rope hanging from two ends	what is the physical meaning of the " decay rate " in fermis golden rule ?
0	is it true that quantum mechanics technically allows anything to happen ?	flattening rate of a parabola
0	intrinsic angular momentum in classical mechanics	first passage time of diffusing particle with partially absorbing boundary
0	cp violation of the ckm matrix	different kinds of s-matrices ?
0	help solve this paradox ?	imaginary angle on simple centrifugal problem
0	force exerted by fluid in circular pipe	laws of addition of vectors
0	naked singularity and extendable geodesics	can anything come out from the big bang ?
1	how did wmap measure the flatness of space ?	how/why can the cosmic background radiation measurements tell us anything about the curvature of the universe ?
0	age of the universe and age of stars	can diffusion produce energy ?
0	commutation of operator product expansion	why do almost all nuclear reactions release energy ?
0	why " light cones " have different shapes near black holes ?	can statistical mechanics be formulated generally in terms of phase space ?
1	why galaxies look like discs rather than spheres ?	why the galaxies forms 2d plane ( or spiral-like ) instead of 3d ball ( or spherical-like ) ?
0	what conservation law corresponds to lorentz boosts ?	knowing the mass and force acting on a particle , how do we derive the relativistic function for velocity with respect to time ?
0	phasor representation of voltage in frequency domain	will a free-falling rod ( without drag ) rotate ?
0	can spin be infinite ?	how do i calculate pressure drop across a reduction in pipe diameter ?
0	elastic collision of rotating bodies	is ( 0,0,0 ) an undefined vector ?
0	how do interstellar hydrogen atoms form stars ?	reducing the distortion of transmitted light through a prismatic array
0	looking for the name of a particular device	analysis of the impulse of 2 colliding carts under the effect of magnetic repulsion
0	is a plasma necessarily made of monoatomic ions ?	concept of a point particle in quantum mechanics
0	1d wave equation as a function of sound speed	reference request for exactly solved models
1	expanding universe and more	why does space expansion not expand matter ?
0	normalisation of linear harmonic oscillator - ladder operator method	why do wave packets spread out over time ?
0	two body particle problem with reduced mass	what forces are at play when molecules wiggle ( due to heat ) ?
0	under what conditions a person can lift a car alone ?	why the force of earth on a object is different from the force of object on earth
1	if atoms have specific energy levels , why do opaque solids absorb all visible light , not just some ?	transparency of solids using bandgaps and relation to conduction and valence bands
0	vector product in 2 dimensions	general relativity && quantum mechanics " incompatibillity"
0	is this a known entropy formula ?	from a cross section to a probability
0	what is the " center of gravity of a band " ?	what is the spatial derivative of strain tensor ?
0	shock absorber - bus - not uniform	tensor product of hadamard operators
0	second order energies of a quartic pertubation of a harmonic oscillator	why is a flower shaped diffraction occluder the best solution for controlling diffraction ?
0	is a uniformly charged conducting plate the same as a uniformly charged conducting sheet ?	when can i use wick 's theorem ?
1	relativity and speed of light again - two opposite light sources	double light speed
0	why are two independent sources incoherent ?	why do orbital speeds decrease further away from the focus ?
1	general relativity && quantum mechanics " incompatibillity"	a list of inconveniences between quantum mechanics and ( general ) relativity ?
0	doppler shift and escape velocity	circular motion question
1	how is it possible for you to be at the centre of the universe wherever you are ?	does the universe have a center ?
0	angular momentum in a rod rotating around one end ?	is the schwinger action principle important in renormalization ?
0	spin dependent andreev refelction	if time is not continuous , what is the best-known upper bound on the length of time intervals ?
0	magnetic field associated with edge currents in iqhe ?	treating $\psi$ and $\psi^{*}$ as independent variables when varying the action
1	numerical tests of titius–bode formula for artificial planetary orbits	why do the planets ' orbital distances fall on an exponential curve ?
0	qft 's that have no action	confusion on quantum field theory
0	propagator and expectation value	speed of light in a medium
0	how far are constellations recognizable ?	local epr-experiments with photons in vacuum ?
0	what is the difference between implicit and explicit time dependence e.g. $\frac{\partial \rho}{\partial t}$ and $\frac{d \rho} {dt}$ ?	energy versus free-energy diagram
0	how does the average mars-jupiter distance compare with the average earth-jupiter distance ?	chiral landau 's fermi liquid theory in 3+1d
0	interferometer problem about periodic fringe patterns	extrinsic photoconductor charge carriers
1	is not newton 's second " law " merely a definition of force ?	are newton 's " laws " of motion laws or definitions of force and mass ?
0	questions about the second law of thermodynamics	independancy of angular momentum with respect to origin for rotation about center of mass
1	calculating impact velocity and time with non-uniform acceleration	kinematics with non constant acceleration
1	classical understanding of an atom	why do not electrons crash into the nuclei they " orbit " ?
0	again about all-win lottery	quantum numbers of the helicity states of the w boson
0	normal modes of the 2d double pendulum	correspondence between wave function and state vector
0	what is the physical meaning of group velocity for elastic waves through crystals ?	bell states entanglement
1	if photons can be absorbed by electrons , would not that mean light has a charge ?	if electromagnetic fields give charge to particles , do photons carry charge ?
0	what does the current vs voltage graph of a halogen look like ?	what does the wind speed have to be to blow away a person ?
1	required skills for a scientist	how do you start self-learning physics
0	why do planets other than earth have colours ?	transformation from waves to matter
0	quantum field theory cross sections integrals	sign paradox in berry 's phase
0	the pressure in a water spout and bernoulli 's equation	reflections in rearview mirror
1	gravitational lensing	how does gravitational lensing account for einstein 's cross ?
0	conservation of angular momentum experiment	air vs glass refraction coefficient
0	photon and z boson interference ?	zeroth law of thermodynamics , temperature , and ordering
0	what is the highest useful magnification todays largest telescopes can offer ?	does $e$ really equal $mc^2$ ?
0	what does it mean that a wavevector is null ?	quaternions and 4-vectors
1	does influence on gravity increase with mass when velocities approach the speed of light ?	if a 1kg mass was accelerated close to the speed of light would it turn into a black hole ?
0	calculating the acceleration of a car	why do not most physics programs study the primary sources ?
0	with ideal gases , varying quantity of moles , and having a constant volume how do temperature and pressure behave ?	under what assumptions can we split a hilbert space into subspaces ?
