1	why does not the light from galaxies appear stretched ?	how distorted does the andromeda galaxy appear to us due to the speed of light ?
0	how to calculate max/min right ascension and declination in telescope field of view	light in fibre optic cables
0	a cosmological horizon at the hubble radius ?	electrical eddy current visualization or simulation
0	deriving the lorentz transformation	difficulty in understading a part of the book " a brief history of time " ?
0	saturation of an iron core ?	does a hdd ( hard disk drive ) emit radio waves ?
1	intuitive meaning of dot product	what is the physical significance of dot & cross product of vectors ? why is division not defined for vectors ?
0	bound states and continua in the spectral function	malus ' law ( polarization )
0	finding distance an object travels up an incline after launch	$\nabla$ and non-locality in simple relativistic model of quantum mechanics
0	rigged hilbert space and qm	what happens to the impinging light if its wavelength is smaller than the absorption band of a semiconductor ?
1	how does a snowflake " know " to form symmetrically ?	why are snowflakes symmetrical ?
0	does an aircraft hover at a constant acceleration or varied acceleration ?	is it possible to generate usable electricity from the motion or magnetic field of the earth ?
1	how do einstein’s equations support mass gain in particle accelerators ?	why does the ( relativistic ) mass of an object increase when its speed approaches that of light ?
0	about heat rate and dimensions convention	can a wave possess spin ?
1	conversion of information to energy	maxwell 's demon constant ( information-energy equivalence )
1	what is an equation for two astronomical entities both of 4000 tonnes in weight , colliding ?	do not heavier objects actually fall faster because they exert their own gravity ?
1	if the universe is 3d , how is space-time like a " fabric " ?	misused physics analogies
0	what is the physical difference between the quantities $\langle v_{i}v_{j}\rangle$ and $\langle v_{i}\rangle\langle v_{j}\rangle$ ?	light formed by the sun ?
0	use of escort distribution in nonextensive stat . mech	why does a small object stay in one place after being shot from a big gun ?
0	experimental foundations of the " otherwise galaxies would not hold together " argument for dark matter	surface area relative to element distribution
0	electric potential energy and speed	dropping a ball in a train moving close to the speed of light ?
0	braess 's paradox in electrical circuits	dark matter and dark energy
1	gravitational atraction of fast object	does non-mass-energy generate a gravitational field ?
0	do maxwell equeations change somehow after higg 's boson finding ?	what is the relation between electromagnetic wave and photon ?
0	does time expand with space ? ( or contract )	storing kinetic energy in bonds
0	does the material of the slits affect the pattern of the electrons in the double-slit experiment ?	is any work done when i walk ?
0	transfer of angular momentum during oblique impact with ( out ) adhesion	what is the difference between work in thermodynamics and mechanics ?
0	can a magnet spin a small machine ?	what physical value is described by following operator ?
0	is it possible to derive schrodinger equation in this way ?	what is the effect of polarization on diffraction by a narrow slit ?
0	path to obtain the shortest traveling time	circuit analysis : help getting the thevenin equivalent
1	why is the camera not the culprit ?	is not the uncertainty principle just non-fundamental limitations in our current technology that could be removed in a more advanced civilization ?
0	what really cause light/photons to appear slower in media ?	difference between matrix representations of tensors and $\delta^{i}_{j}$ and $\delta_{ij}$ ?
0	what is the fundamental difference between ghost and auxiliary fields ?	can inertia be explained by bremsstrahlung ?
0	gravitational waves as dark energy ?	rank $l$ spherical harmonic tensor as a $2l+1$ dimensional cartesian vector ?
0	interesting math topics useful for physics	tension in a massless string around a pulley
0	does quantum mechanics allow us to formulate causally sufficient conditions for the occurrence of an outcome ?	phonon-polariton literature resources ?
0	spherical harmonic projection on axis	can long strings always snap ?
1	does a point exist in the real world	is time continuous ?
0	how to calculate explicit form of stress energy tensor in any situation ?	results for the path integral formalism for a system with known start and end configuration ?
0	discord for partially decohered bell state	spring-mass system with two springs and three masses
0	gauge invariant but not gauge covariant regularization	on a frictionless table , what is the angle at which a cue ball should hit another ball for it to go in ?
0	hours of light per day based on latitude/longitude formula	what is a virtual ground ?
1	what really is reflection ?	what is reflection ?
0	rotating a stone with a string	cubic symmetry and a stiffness tensor
0	transfer of angular momentum during oblique impact with ( out ) adhesion	einstein 's mass-energy equivalence versus quantum kinetic energy
0	can we write the electromagnetic potential covariantly in terms of the four-current ?	how to deal with non fixed springs ?
0	vertical motion in air + density	does the nonlocality of the preferred basis mean qm is nonlocal ?
0	spin connection in higher dimension	hydrogen adsorption distance
0	two pendulums , which pendulum has shorter period	why do cd 's shatter in a microwave ?
0	lorentz force , must there be two magnets ?	is there an equivalent to wetness for air ?
0	photoelectric effect high frequency limit ?	what is the difference between ' least count ' and ' smallest division ' ?
0	whistling on bottle tops	magnetic engine
0	optical absorption in a semiconductor for $e <e_g$	what happens if a wind mill rotates in opposite direction ?
0	looking for review articles on big bang nucleosynthesis	switching from an accelerated frame of reference to a locally inertial reference system
0	where can i find the datasets from lhc ?	should the expression for energy conservation in alpha decay include the mass of electrons ?
1	does influence on gravity increase with mass when velocities approach the speed of light ?	reletivistic mass as seen by different observers
0	stripeless cleaning of windows	particles as a limit of classical field theory
0	experimental data for gas flow through pipelines	minimum height of mirror required to view image
0	gravitational potential of a sphere vs gravitational binding energy of a sphere	where 2 comes from in formula for schwarzschild radius ?
0	is there anything wrong with the cybernetic interpretation of quantum mechanics by ross rhodes ?	radiation emission and absorption
0	why is radiation for an ultrarelativistic charge zero on axis ?	what are some interesting coupled harmonic oscillators problems ?
0	is acceleration $a = s/t^2$ , or $a = 2s/t^2$ , or something third ?	at what expansion rate ( h ) would virtual particles be ripped apart into real particles , and what might be the density ( temperature ) of such an event ?
0	question about two masses connected by a spring	where 's the missing helium in the universe ?
0	is tripleaxis planet possible ?	neither biot-savart nor ampere law can solve this problem ?
1	quantum phyics project for a high schooler	study quantum physics
0	how is it possible that we see light from shortly after the big bang ?	how is dark energy calculated
0	calculating absolute speed of a relative object	gaussian unit of charge and force
0	how much energy in form of heat does a human body emit ?	could observing unknowingly cause the wave function to collapse ?
0	'negative pressure ' counteracting gravity ?	macroscopic superposition of humans and past thoughts ?
0	riemann tensor in 2d and 3d	gravity affecting a molecules speed ?
0	statistical sum of physical quantities in a quantum system	to all experienced theoretical physicists out there , what is the step by step process in your math education ?
0	true or false : the moon was touching the earth 1.2 billion years ago	how can molecule of a few angstroms absorb visible light of a few hundred nanometers ?
0	intrinsic angular momentum in classical mechanics	electron in magnetic field can lead to non-hermitian hamiltonian ?
0	why are we not affected by the radiation of the radioactive decay going inside the earth ?	why did they used to make the mill chimneys so tall ?
0	angular velocity in fluids ( air resistance )	derivation of maxwell 's equations from field tensor lagrangian
1	change in momentum	elastic collision
0	why do disconnected diagrams not contribute to the s matrix ?	quantum mechanics and probability
0	vertical component of moving weight at a 45 degree angle	can the electric field -- always -- be derived from the potential ?
0	are thomas breuer 's subjective decoherence and scott aaronson 's freebits with knightian freedom the same things in essence ?	equivalence between different formulations of qed
0	deriving the hamiltonian density for a free scalar field	why can not we think of free fall as upside down rocket ?
0	calculating hubble radius using relativistic effects	how does this formula for calculating the " mass sum " in a collision translate to 3d ?
0	chiral anomaly in odd spacetime dimensions	inertial frames of reference
0	what is the exact definition of center of gravity ?	how to find maximum velocity
0	2d soft body physics mathematics	simulating a proton
0	why " dark energy " is called energy instead of force ?	what exactly is a fluorescent lamp ?
0	when a gas expands against an external pressure of 0 , must the stopper on the cylinder be massless ?	finding $\psi ( x ) $ from fourier modes
0	what is most infeasible about a sky hook ( as in space travel not batman ) ?	can entanglement swapping be performed on already-entangled photons , and if so , can it preserve this entanglement over the swap ?
1	conservation of angular momentum tensor $l^{\mu\nu}$ in special relativity	how to define angular momentum in other than three dimensions ?
0	what is the effect of temperature on electrostatic-gravitational balance ?	doppler shift and escape velocity
0	n=2 dualities ; k-differentials on the riemann sphere and a spectral curve	conditions for characterizing a wave as plane wave
0	gravity near surface of a large body	does cosmological time expand like space does ?
0	circumference of a circular path	earnshaw 's theorem for ferromagnets
1	how does an accelerating charge radiate electromagnetic waves ?	how & why does accelerating charges radiate electromagnetic radiation ?
0	eigenstate of field operator in qft	emergence of $su ( 2 ) \times su ( 2 ) $ at the self-dual point in bosonic string theory
0	dispersion of probability wave packets	horizontal $e$-field for a charged conducting disk
0	can a small change in the earth temperature give rise to large-scale climate changes ?	what is the lowest possible theoretical temperature that nuclear fusion can occur at ?
1	how can i modify the bullet trajectory based on the ballistic coefficient ?	how to modify the bullet trajectory based on the ballistic coefficient ?
0	defining left and right independent of a human body ?	is normalization consistent with schrodinger 's equation ?
0	resources showing how to use differential forms in physics	experimental methods for finding london penetration depth
0	could time be changing without us knowing ?	proof of renormalizability based on analyzing the symmetry of effective action : is not regulator also important ?
1	how does string theory predict gravity ?	how does classical gr concept of space-time emerge from string theory ?
0	are the basic postulates of qm the only set of postulates that can give rise to a sensible semi-probabilistic physical theory ?	in ' t hooft beable models , do measurements keep states classical ?
0	x-rays from dark matter accretion into a supermassive black hole ?	looking for a good introductory-level review of pseudopotential methods
1	if particles can find themselves spontaneously arranged , is not entropy actually decreasing ?	chance of objects going against greater entropy ?
0	how long will the universe 's hydrogen reserves last for ?	why is $r^2$ gravity not unitary ?
0	infinite-range 1d ising model + hubbard-stratonovich-transformation	of all the electrical energy used in a home , is there any portion that will not eventually become thermal energy in the home ?
0	in bubble-multiverse theories , are the parameters values describing a given universe members of a countably infinite set ?	is gravitational time dilation different from other forms of time dilation ?
0	what is the relation between isothermal process and its surrounding ?	counting problems in physics
1	is there any general position function $x ( t ) $ that gives the solution to $x'' ( t ) = k/x ( t ) ^2$ , where k is a constant ?	integrating radial free fall in newtonian gravity
0	why is not all of the dust in a nebula used in the formation of a star ?	ising spin vs pauli spin matrices
1	why gravity is an attractive force ?	why is gravitation force always attractive ?
0	why are alpha particles made of 2 protons and neutrons ?	neutrino versus anti-neutrino detection
0	feynman diagrams in three dimensions	does earths gravitational force vary depending on where you are on the planet ?
0	baryogenesis only at the planck scale , or none at all ?	schiff equation in a polar orbit
0	what is p_t ? ( transverse momentum ? )	distinction between larmor frequency and rabi frequency
0	do monochromatic waves carry information ?	anti-matter repelled by gravity - is it a serious hypothesis ?
1	repulsion of the pieces of a broken magnet	why does it seem like a broken magnet 's poles flip ?
0	how many grams of explosive are equivalent to the energy in a battery ?	is the axial gauge with a $\xi$ term useful in yang-mills theory ?
0	how do i calculate the experimental uncertainty in a function of two measured quantities	the speed of electrons moving in different medium
0	how to guarantee that a kilogram of antimatter will quickly annihilate another kilogram of matter ?	electrolytes and electric field
0	how to apply the wkb approximation in this case ?	do processes $p\propto\frac{1}{v^2}$ , $p\propto\frac{1}{v^3}$ , $p\propto\frac{1}{v^4}$ , etc . , exist in the real world ?
0	galilean transformations and frenet frame	is the apophis asteroid a concern ?
0	does magnetism affect corrosion ?	how do wind turbines cause lightning ?
0	what is the state of matter of a ( solid ) yogurt ?	how to get the new direction of 2 disks colliding ?
0	questions about van de graaff generator	derivation of the centrifugal and coriolis force
0	relation between red filter band and redshift ?	what is the minimum pressure of a medium for which a sound wave can exist ?
0	sun energy production as a function of depth	how can the nucleus of an atom be in an excited state ?
0	work on ferromagnetic object due to solenoid	is schrödinger’s cat misleading ? and what would happen if planck constant is bigger ?
0	is having full information about the resonances of a rigid body equivalent to having full information about its material parameters ?	relative motion . setting course of closest approach ( requested resource recommendation as well )
0	is there a book that discusses general relativity in terms of modern differential geometry ?	2 following gates , permutation matrix
0	fresnel transform	if you could reverse gravity , what velocity would you achieve on leaving earth ?
0	virtual particles and s-matrix	what is an approximation of the average number of supernovae every century in the milky way ?
0	why do some particles have a greater mass than others ?	can spin be infinite ?
0	are there any modern textbooks on statistical mechanics which do not ignore gibbs ' analysis of the microcanonical ensemble ?	quantum version of the galton board
0	a formula for the photon gas correlation function	pressure rise in closed tank with 2 inputs
0	could micro black holes obey the eddington limit ?	energy conservation in diamagnetic levitation
0	smallest number of quantum gates to simulate other gates ?	funding opportunities for an independent researcher
0	numerical simulation of sound propagation in air	obtain oxidation numbers from looking at electron configuration ?
0	rf wifi radiation	electric potential at a point outside a charged sphere
0	calculating the deflection of an arbitrary beam of light from a thin lens	lqg demystified book ?
1	green theory and laplace theory	book recommendations
0	what happens when a charged ( negative or positive ) object touches an insulator ?	coherent $u ( n ) $ intertwiners in loop quantum gravity ( lqg ) and a measure on the grassmannian
0	pauli matrices as measurement operators	fundamental commutation relations in quantum mechanics
1	why does a floating balloon in an accelerated train moves forward but the pendulum moves backward ?	why does a helium filled ballon move forward in a car when the car is accelerating ?
0	water bottle moment of inertia	what is the difference between capacitors , ultra-capacitors and batteries
0	two definitions : ' semi-classical space-time ' and ' supersymmetric minkowski space'	how does the evaporation of a black hole look for a distant observer ?
0	comparison between cadabra and other symbolic computer algebra software	does graphene actually remain strong for macroworld engineering ?
0	why is there no ( time derivative of charge density ) in the $b$ field in jefimenko 's equations ?	torque , lever and mass
0	hypotheses a hindrance in physics ?	are there hidden parameters in neutron decay ?
1	how do gravitons and curved space time work together ?	nature of gravity : gravitons , curvature of space-time or both ?
0	irreducible representation in physics	non-existence of gluon singlets : any recent theoretical progress ?
0	how does one determine ladder operators systematically ?	mass of small fluctuation around vacuum
0	effect of reynolds number on wake region	are strange metals described by a quantum critical theory ?
1	electric charge is a intrinsic property how is there a prpoer way to explain electric charge ?	definition of electric charge and proper explanation
0	is dark matter expanding the universe , and creating the structures within it ?	what would happen in the final days of the universe ?
1	how can you use magnets to rotate a shaft , which in turn powers a generator ?	what prevents this magnetic perpetuum mobile from working ?
0	unitarity and quantum cosmology	in a universe where the speed of light is infinite , are relativistic models and newtonian models equivalent ?
1	interpretation of theoretical schrodinger 's cat experiment	schrodinger 's cat experiment
0	fourier rate equation valid in which frame of reference ?	static flow of water in the presence of a loudspeaker
0	incompressible quantum liquid	gravitationally bound systems in an expanding universe
0	which is the biggest object which can interfere with itself ?	three polarizers , 45° apart
0	practical example of stabilizer codes	varying electric field ?
0	can a system that holds information about it is past ever be markovian ?	physics behind a match performing a trick on center of mass
0	neutrino mass with dirac and majorana	is there a sqcd gluino string , similar to the gluon string ?
0	foundations of the notion of elementary particle in the standard model	solids : is energy expended in some fashion by , say , a table to keep the top from sinking down against gravity ?
0	what is the current state of research about the hayden-preskill circuit ?	ideal four-level gain medium ( or just any old gain medium )
0	what is the physical significance of the inner product of two wave functions in quantum region ?	lorentz 's amsterdam proceedings 12:986 ( 1904 ) paper ?
0	is there a better , faster way to do this projectile motion question ?	does photon possesses no time to cover any arbitrary distance ?
0	finding out the minimum deviation angle	change of variables , fermi integral
1	is there any acceleration of light ?	do photons have acceleration ?
0	cosmological redshift interpretation	helmholtz 's " ueber die bewegungsgleichungen der elektricität für ruhende leitende körper " in english ?
0	motion with damping involving both $-v^2$ and $-v$ terms	is there a consensus on the definition of wavelength for a solitary wave ?
0	what is the weight of the earth ?	symbol for dashpot/damper ( in a harmonic oscillator )
0	the rebound height of a mass on a trampoline	how is quantization implied by quantum mechanical theories ?
0	physical significance of negative temperature	question regarding operators and cylindrical coordinates
0	oscillations and majorana neutrino	layman explanation and demonstration of positive lightning
0	how do we know that clocks slow down relative to each other ?	car headlights glass - why such uneven shape/texture ?
0	how does capacitance work ?	solving the 1-d time-independent schroedinger 's equation with an infinite boundary
0	determining cloud cover from observer to near the horizon	intereference rings by light transmission ?
0	finding the basis vectors of a killing field vector space	is the gradual progression of day ( light ) into night a clue that the earth is a sphere ?
0	real and imaginary parts of dielectric constant vs refractive index ?	why is the moment of inertia for a hollow sphere higher than a uniform sphere ?
0	is wave–particle duality considered a valid interpretation of the behavior of photons ?	why does hawking radiation not add up to zero ?
0	polarization of light	does it take infinite energy to create a perfect vacuum ?
0	physically modelling the saltatory nerve impulse transmission ?	the angle of launching an angry bird that will land the bird furthest from the launching point is 45 degrees ?
0	distinguishing mechanical systems from general dynamical systems	implications of the jeans mass
0	weird definition of bohr radius on wiki	how do i explain to a 6 year old why people on the other side of the earth do not fall off ?
1	single plane ring system	why are our planets in the solar system all on the same disc/plane/layer ?
0	why is acceleration expressed as m/s/s ?	physical explanation for capacitive circuit
0	at near light speeds , are small objects in your path a problem ?	does the possibility of large scale entanglement mean 2-body problems are also unsolvable ?
0	is " microbunching " in a free electron laser limited by the pauli exclusion principle ?	what are the assumptions behind " term symbols " ?
0	primary constraints for constrained hamiltonian systems	speed of the moon
0	lorentz transformations , why $t$ and not $t'$ ?	didactics question ( "teams and times" )
1	volts , amps , and practical electrical knowledge	what causes an electric shock - current or voltage ?
0	diagonalize a dot product with pauli matrices	single plane ring system
1	space between particles	what exists in the space between atoms
0	electric field of a sphere	positive charge , current and electron flow in a simple circuit …confusion
1	visualisation of formation of electromagnetic waves	how em waves are produced by accelerating charged particles ?
0	question on " pocket " universes	should theory be the appropriate term ?
1	what are the potential technological advances that the discovery of the higgs boson may unlock ?	practical matter of the higgs-mechanism
0	explain what happens to object in lift	why does the specific thrust of an ideal turbojet drop with increasing compressor pressure ratio ?
1	does spacetime have a " this side up " arrow ?	does the curvature of spacetime theory assume gravity ?
0	why can not we see gases ?	hydrostatic pressure at lateral directions
0	can the velocity of the center of mass of two spheres change after a collision ?	superposition versus statistical mixture interpretation
0	concentration of fluid pumped through a tube ?	what changes occur while an atom approches the speed of light ?
0	how to determine the angle a camera has to be at to image a desired scene , given the camera parameters ?	seeking help simplifying this eom equation
0	how can electrons be confined in quantum dots ?	does coulomb 's law , with gauss 's law , imply the existence of only three spatial dimensions ?
0	instantons and non perturbative amplitudes in gravity	explanation for breaking up of a stream of water into droplets
0	what happens when one black hole eats another black hole ?	was the firewall paradox resolved ?
0	scale-invariant differential operator	equal time commutation relations
1	how can you calculate how fast a spinning ring/cylinder will accelerate a mass via gravitomagnetism ?	how can you calculate how fast a spinning ring/cylinder will accelerate a mass via gravitomagnetism ?
1	can statistical mechanics explain the second law completely ?	how do you prove the second law of thermodynamics from statistical mechanics ?
0	computing the efficiency of a heat engine	kugo and ojima 's canonical formulation of yang-mills using brst
0	calculating the speed of an object moving relative to another moving object ( frame of reference )	how to calculate magnification
0	a question from weinberg qft text	on constancy of cometary orbits
1	static friction on a circular road	direction of friction when a car turns
0	why is the range for a particle thrown at 90 degree same as that of a particle thrown at 0 degree ?	baryon operators for $n_f <n_c$
0	quantum entanglement and special relativity paradox	what is a superfluid in field theoretic terms ?
0	dimensional analysis on maximum speed of sailboat	meaning of the direction of the cross product
0	can the vanishing of the riemann tensor be determined from causal relations ?	the mathematical physics of saltatory neuron action potential transmission
0	combining metric tensors/curvature tensors	how does one quantize the phase-space semiclassically ?
