0	calculating an expression for the trace of generators of two lie algebra	magnetic needles in elastic media
1	why is it more likely that the particle with negative mass falls into a black hole ?	black holes and positive/negative-energy particles
1	with redshift , energy is lost . where does it go ?	photons in expanding space : how is energy conserved ?
0	is quantum entanglement an objective or subjective property ?	is the quantum state or information of a particle is all that differentiates it from another particle ?
1	why is the wave function complex ?	about the complex nature of the wave function ?
0	good place/supervisor for phd in theory of condensed matter	proving $rtln ( a_i ) $ equal to non pv work done by system , where $a_i$ is activity
0	dyson air blade principle as a propulsion system for an autonomous underwater vehicle ?	is there any reason to major in physics if you are certain you will never do a ph . d ?
0	the maths/physics in " the amazing spider man"	coulomb force on the center of a hexagon ?
0	acceleration of two falling objects with identical form and air drag but different masses	determine the effective radius of a gear ?
1	is the geometric formulation of hamiltonian mechanics really necessary ?	why is the symplectic manifold version of hamiltonian mechanics used in newtonian mechanics ?
0	reasons to consider the coefficient of restitution velocity independent - conditions when this does apply	is " now " the bounding edge of the universe in the time dimension ?
0	rotation , cats landing on their feet , and conservation of angular momentum	how to solve poisson equation in electrodynamics ?
0	regarding the possibility of closed timelike curves	could gravity hold electron charge together ?
0	light entering in a 0° angle , is there any reflection ?	quantum systems with real structure
0	is work done by how much velocity is changed or how much displacement is done ?	i have been reading that it is possible to create a " mostly magnetic " wave , and i have a few questions
0	sunrise/sunset on a planet with an a-class or b-class star	newtonian gravity equation in a 2 dimensional world
0	richtmyer meshkov instability in mhd	what is the " event horizon " of a black hole
0	band gaps : are they at the centre or at the edge of the brillouin zone ?	aharonov-bohm effect and flux quantization in superconductors
0	how do i show the existence of a conserved ghost number with brst in bosonic string theory ?	does the force of kinetic friction increase with the relative speed of the objects involved ? if not , why not ?
0	do electromagnetic waves really propagate through continuous induction ?	what sets the resolution on analog film ?
1	how fast does force propagate through matter ?	is it possible for information to be transmitted faster than light by using a rigid pole ?
0	current in ac circuit	why is not a pendulum clock considered a perpetual machine ?
0	is the " consistent histories " interpretation of qm a " many worlds interpretation " in disguise ?	any difference between thermodynamic double-derivative and derivative " at constant " value ?
0	connection between qft and statistical physics of phase transitions	does throwing a watch into the air cause it to gain or lose time ?
0	einstein equation at the singularity . understanding the dr . michio kaku 's explanation	does the discreteness of spacetime in canonical approaches imply good bye to str ?
0	energy formula for separating $o_2$ from mixture of $o_2$ , $nh_3$ and $h_2o$	conservation of momentum and energy in an explosion
0	massless string paradox	how is angular momentum conserved if a bullet hits a wheel ?
0	how far from a spacecraft would it is exhaust cool to br temperatures ?	mathematical explanation of why higgs has a vev
0	is spin an observable quantity for fundamental particles ?	how do capacitors work ?
1	where does mass come from ?	your mass is not from higgs boson
0	applications to the van der pol equation ?	matrix operations on quantum states in a composite quantum system
0	does double slit in a vacuum have any effect ?	the divergence in qcd series-- how many are they , and what do they mean ?
1	the future of supersymmetry	what if the lhc does not see susy ?
0	work done in an isobaric process	can electrons change the frequency of light as they bounce off/around ?
0	what is the logarithm of a kilometer ? is it a dimensionless number ?	electrostatic potential definition
1	thermodynamics , temperature below 0 kelvin	temperature below absolute zero ?
0	how to calculate the velocity of this body ?	how does classical gr concept of space-time emerge from string theory ?
0	why is there no theta-angle ( topological term ) for the weak interactions ?	gravity on a upward moving object
1	why is string theory called a theory	laws of atomic theory - how is this possible ?
0	how to replace $t$-product with retarded commutator in lsz formula ?	energy-momentum tensor in qft vs . gr
0	calabi-yau condition , moduli and lichnerowicz equation	derivation of relativistic uniformly accelerated motion
0	euler equation of fluid dynamics	how do you calculate power at the focal point of a mirror ?
0	alternative solar panels	a particular supersymmetry transformation
0	how does information about charges propagate through the electromagnetic field	calculating the neutron stopping power of complex materials
0	difference between regularization and renormalization ?	capacitor in series ?
0	calculating the expectation value for kinetic energy $\langle e_k \rangle$ for a known wave function	dispersion of ferromagnetic ( $e\propto k^2$ ) and antiferromagnetic ( $e\propto k$ ) spin wave
0	does the hilbert space of the universe have to be infinite dimensional to make sense of quantum mechanics ?	the surface area to volume ratio of a sphere and the bekenstein bound
0	when should i take wine out of the fridge - transient heat transfer problem	gibbs paradox - why should the change in entropy be zero ?
0	does a square wave " smooth out " in the air ?	what are some publications which continue schrödinger 's " what is life ? " discussion ?
0	uncertain if invoking uncertainty principle for wave function is handwaving	is the spin-rotation symmetry of kitaev model $d_2$ or $q_8$ ?
0	feynman 's subscript notation	calculating repulsion due to eddy currents ?
1	are black and white colours ?	explanation about black color , and hence color
0	can symmetry generators anticommute with the s-matrix ?	how to detect radiation on the metal ( coin ) ?
0	the feasibility of a satellite orbiting at a fixed time	regarding nuclear magnetic resonance
1	phase shift of resonance	phase difference of driving frequency and oscillating frequency
0	how much does sunlight affect inside temperature ?	unsure how resistors are connected ? ( series/parallel )
0	noether first and second theorem	point group symmetries and unit cell
0	"rocket in a box " thought experiment	massless particles and the speed of light - new ? theories of existence
0	does change of coordinate system require acceleration ?	what is many body localization ?
0	t duality under a small fluctuation of the compact dimension	bird flying in a cage
1	flight time toronto to moscow the same	does the rotation of the earth dramatically affect airplane flight time ?
0	is the unruh radiation isotropic ?	micro-canonical ensemble and classical reality
0	solutions of pdes in different coordinate systems	the role of dark matter in black holes and star formation
0	the feeling of fuzz on the display surface of a cathode ray tube television	over what distances can one send/ receive from a gps chip implant in a dog ?
0	static as opposed to kinetic friction in rolling motion	field action of linearized gravity associated with spin-2 particle in thorne book
1	how is it possible for light to be a wave and a particle ?	is the wave-particle duality a real duality ?
0	finding an equation relating the mass of a blade of a wind turbine to its velocity	is it true that gravitational lensing only occurs for objects made of plasma ?
0	measure energy state of quantum harmonic oscillator	rotational symmetry in integration
0	how can you calculate air resistances at different speeds ?	exorbitant number of counts per sec . in the rutherford experiment
1	does a black hole singularity last essentially no intrinsic time ?	in general relativity ( gr ) , does time stop at the event horizon or in the central singularity of a black hole ?
0	light rays that are perfectly parallel	why does not fusion contradict the 1st law of thermodynamics ?
1	entanglement , really ?	quantum entanglement - what is the big deal ?
0	friction + bouncing of an object against an elastic wall	help wanted achieving cryogenic temperatures
0	locally every force admits a potential ?	what is the importance of conformal transformations in general relativity ?
0	a problem about special relativity	why does a magnetic field generate clearly visible separation ?
1	why are the anthropometric units ( which are about as big as we are ) as large as they are relative to their corresponding planck units ?	why does the speed of light $c$ have the value it does ?
1	completeness of the state space and hilbert space	what is the physical meaning of a " complete " hilbert space in qm ?
0	precision of spectroscopy for astronomy	how to get rotation speed after disk-disk collision ?
0	energy of deflection of a moving object	supersymmetric nonrenormalization theorems
0	how does the expansion of the universe not violate causality ?	what aspect of quantum mechanics forces probabilities to be ( conventionally , at least ) central ?
0	what are the current experimental limits on the polarizability of the vacuum ?	is there a technical term for " meaningfulness " of mathematical operations ?
1	will we feel the gravity of a star 10 light years away for the next 10 years if , somehow , it vanishes today from its position ?	the speed of gravity ?
1	is there anything smaller than a quark ?	what is the smallest existing thing in theory and law ?
0	what limits of integration do landau and lifshitz use here ?	is it possible to break bulletproof glass with your voice ?
1	the relationship between the hubble constant and cosmological time	value of the hubble constant over time
0	maxwell equations invariant under lorentz transformation but not galilean transformations	second law of thermodynamics and motion
0	in electro-optic material , what is happening to the structure of the material for the index of refraction to change ?	can a super-extremal charged black hole be made out of electrons only ?
0	unstable particles and quantum field theory	how do you tell if a metric is curved ?
0	determine the effective radius of a gear ?	is this really how a capacitor works ? why does not it behave like a resistor ?
0	fermionic interaction potentials	what does it mean for electrons to be " diffusive " ?
0	why should the standard model be renormalizable ?	how much oxygen would be consumed on a 1 cm squared surface which is on fire ?
0	can the zeroth-component of a 4-velocity be negative ?	average resistive force exerted by a wooden block on a bullet
0	current density ?	upper bound for the kelvin scale
0	potential energy of a particle in one dimension ?	where does this derivation of the equation of motion for a simple pendulum go wrong ?
0	why was quantum mechanics regarded as a non-deterministic theory ?	free particle path integral matsubara frequency
0	"blue bumper " stars	finding the work required to move an object under pressure without knowing volume
0	how we know this solution is unique ?	finding the tension in rope tied to ladder using the principle of virtual work
0	scattering off a random magnetic field ?	how should i think about reciprocal lattice and miller indices ?
0	contact electricity and photoelectric effect	intuitive meaning of the hilbert space formalism
0	is it true that no one , not even planck himself , knows how planck 's constant was arrived at ?	is time travel different from time dilation ?
0	a ( mundane ) cs analogy for quantum teleportation	finding the voltage of an inductor in a rl series circuit
0	is there a wave function for anyons ?	dirac electron polarity ?
0	expected number of quanta in harmonic oscillator states	can flux pinning be used for propulsion in earth 's magnetic field ?
0	non-rigid body rotational dynamics	why does an electric motor burn up when you physically stop it ?
0	why is there a wave on the water surface when i put something in the water ?	air turbulence and diy laminar flow hoods
0	spin tensor from noether theorem and spin tensor from pauli-lubanski vector	topological quantum computation : anyon model
0	kinetic energy and temperature	when drift velocity equals thermal velocity ?
0	how to prove that the ground state of the hubbard model is not a slater determinant ?	why do we identify symmetric 2nd rank tensors with spin-2 particles in string theory ?
0	another inclined plane question	do we breathe air by creating a vacuum ?
0	purchasing semiconductor substrates	from symmetry group to physics equations
0	determining cloud cover from observer to near the horizon	are specific heat and thermal conductivity related ?
0	calculating an energy of an electron with known de broglie wavelength ( why can not we calculate it similar than we do it for a photon )	would wearing clothing that is black on the inside and white on the outside keep you cooler ?
1	earth 's graviational pull at the centre	if it was possible to dig a hole that went from one side of the earth to the other . . .
0	mathematician or physicists	does nonlocal theory violate causality ?
0	what is the effect of total internal reflection on polarized light	does $\lambda\nu = c$ hold for all the waves in the universe ?
0	how dc and ac relays works ?	sign crazyness on the stress energy tensor ?
0	can there be energy with no force or energy with no power ?	a question about the constraints in brst-fock theories
0	how to properly construct the electromagnetic tensor in curved space-time ?	origin of crossing relations in relativistic scattering amplitudes
0	light-like interval	running a stirling engine in reverse ?
0	psychorometric equation : calculation of dew point	why is electron presented in books , pictures as a sphere ?
0	recommended book for beginners on advanced science topics	same momentum , different mass
0	differences between 3 apples and 3 kg of apples according to base units	time dilation and dimensional compactification
0	understanding a sagnac interferometer with the half-silvered mirror reversed	a quanta of time
0	finding the equation of motion regarding a block pulling a uniform disk	lie algebra and lie group about quantum harmonic oscillator
0	book for multivariable calculus	difference between 1pi effective action and wilsonian effective action
0	how is the atmosphere composition of astronomical objects in solar system determined ?	understanding the difference between co- and contra-variant vectors
0	are string theories gauge theories ?	time reversal symmetry and t^2 = -1
1	does light change color on its way through a window ?	what determines color -- wavelength or frequency ?
0	is quantum hall current density local ? ( ${\bf j} ( {\bf r} ) = \sigma_h {\bf \hat n \times e} ( {\bf r} ) $ )	measurement of quantum state
0	cm : need to recover the hamiltonian , knowing conserved quantities and information about the eom , possibly via action-angle coordinates	diffraction grating in spectrophotometer
1	energy transfer in elastic collision	newtons cradle , collision theory
1	why do we say that light travels at a speed ?	would time freeze if you can travel at the speed of light ?
0	why do not fcc metals have a brittle-to-ductile temperature transition ?	can any physical rigid body be represented by an ellipsoid with the same angular dynamics ?
0	how is angular momentum measured in experiments/in practice ?	an operator on the other side of the schrödinger equation
0	what is the physical significance of the inner product of two wave functions in quantum region ?	are there any practical applications of the uncertainty principle
0	why does elastic energy only depend on first derivatives ?	inflation scale via cmb polarization
0	what is the difference between constant and changing magnetic and electric fields ? how do they occur ? how do they form an electromagnetic wave ?	dynamics - beginner question
1	is a scaled-up aircraft carrier ' ski-ramp ' a viable system to impart enough velocity to significantly assist a spacecraft to orbit ?	what is the possibility of a railgun assisted orbital launch ?
0	can divergences in nonrenormalizable theories always be absorbed by ( an infinite number of ) counterterms ?	does electromagnetic radiation make sense in one dimension ?
0	estimation nuclear force between proton and neutron in deuteron	hypersingular boundary operator in physics
0	convexity -- reference request	reference request for low entropy big bang
0	do particles keep on emitting energy ?	physical intuition for independence of components of velocity in derivation of maxwell–boltzmann distribution
0	horizontal magnetic attraction ?	geodesic conjugate points
0	step in derivation of solution to dirac equation for hydrogen	vanishing of weyl tensor contraction
0	where is the critical moment where the microcanonical ensemble enters the justification for the equilibium state ?	the ozma problem
0	what happens to a metal plate in the photoelectric effect ?	explanation for $e~$ not falling off at $1/r^2$ for infinite line and sheet charges ?
0	global warming and planetary thermodynamics	at what point does a projectile leave a slingshot ?
0	duality behavior of light and effect of system scale on its behavior	what is the significance of the qcd scale parameter $\lambda$ ?
0	is there any thing other than time that " triggers " a radioactive atom to decay ?	magnetic moment precession around magnetic field
0	will we feel the gravity of a star 10 light years away for the next 10 years if , somehow , it vanishes today from its position ?	all multipolar terms of nuclear fields must be confined ?
0	in which cases is it better to use gauss ' law ?	how do i figure out the momentum of a water balloon when it reaches the person i am throwing it at ?
0	the most distant point from the earth that a space shuttle has reached	what are the physics behind the coriolis effect ?
0	spin parity $j^p$ notation	does quantum mechanics allow us to formulate causally sufficient conditions for the occurrence of an outcome ?
0	in nuclear fusion reaction , what is the percentage of mass converted to energy ?	particles acting like waves
0	what advantages does action-at-a-distance description have over the field view of forces ?	measurement of the energy of an atom using a cold substance
1	how does isotropy of free space imply $l ( v^2 ) $ for a free particle ?	deriving the lagrangian for a free particle
1	does gravity weaken by the square of the distance because the energy is dispersed over the square of the distance	intuitive explanation of the inverse square power $\frac{1}{r^2}$ in newton 's law of gravity
0	how can there be net linear momentum in a static electromagnetic field ( not propagating ) ?	how do messenger fields break susy in the mssm ?
0	proof of canonical commutation relation ( ccr )	aharonov-bohm effect electricity generation
0	ir divergence and renormalization scale in dimensional regularization ( part 2 )	charge distribution on plates
0	find angle of force vector in equilibrium	is the historical method of teaching physics a " legitimate , sure and fruitful method of preparing a student to receive a physical hypothesis " ?
0	is there any physically relevant example of constructing series solution about infinity of an ordinary differential equation ?	time contraction
0	unclear how heat interacts with navier stokes	requirements for hydrogen fusion
0	cooking pasta : why does adding a lid lead to overflow ?	what is the source of earth 's magnetic field ?
0	why does a doppler red shift prove expansion ?	shor 's algorithm : why throw away the f ( x ) ?
0	why can not we set the lattice spacing ' a ' in lattice qcd ?	reversible gates
0	why do tuning forks have two prongs ?	coupled mass spring system with damping and initial values
0	gaussian surface question	where does a star 's angular momentum go as its spin slows down ?
0	why would antimatter behave differently via gravity ?	can the multiverse theory be tested by gravity waves ?
0	why does water freeze from top to bottom	deriving diffusion coefficients from velocity field ?
0	playground of forces	hall conductivity and edge response
0	calculating the power of a lightbulb	how 4-vector nature of the value is connected with it is conservation law ?
0	when calculating the local apparent sidereal time , which time scale should i use ?	technical detail in the solution of the hydrogen atom
0	infinitesimal transformations and poisson bracket for dirac spinors	quantized coefficients of chern-simons action and f $\wedge$ f $\wedge \dots$
0	generate force accurately	how isolated must a system be for it is wave function to be considered not collapsed ?
0	what is the acceleration of pendulum when velocity is zero	ising hamiltonian for relativistic particles
0	proof that qcd is the theory describing strong interactions ?	calculating the most probable radius for an electron of a hydrogen atom in the ground state
1	motion of mercury	how do i calculate the ( apparent ) gravitational pull with general relativity ?
0	quantum cryptography : encryptions	is dr quantum 's double slit experiment video scientifically accurate ?
0	rephrasing my question on qft and path intergrals ?	why there is a $\frac{1}{2}$ in the distance formula $d=\frac{1}{2}at^2$ ?
0	falling into a black hole	gravity and the second law of thermodynamics
0	does the earth rotate vertically too ?	how do i calculate the intensity of a diffraction pattern in a double slit experiment ?
1	why are interactions always mediated via bosons ( as opposed to fermions ) ?	why are all force particles bosons ?
0	is it possible to speed up radioactive decay rates ?	where will a board break when weight is added to the end ?
0	is there a table that sums up the parameters , the assumptions/symmetries , and the predictions of the standard model ?	can he-4 atoms create black holes ?
1	does the unit of inertia include radians ?	unit of torque with radians ?
0	water in vacuum ( or space ) and temperature in space	expansion in spherical harmonics in cubic symmetry
1	proofs that earth is not flat ?	what is the simplest way to prove the earth is round ?
0	do stationary states with higher energy necessarily have higher position-momentum uncertainty ?	do protons exchange photons with electrons ?
0	why do polarized sunglasses remove ( most ) reflections on car windows ?	ionization energy and bohr
0	how is the shape of the universe measured by scientists ?	the work done by running in a rectangle
0	simple qft exercise	a vector field $\vec{f}$ from cartesian to spherical
1	why do we fall down when the bicycle slows down ?	why does not a bike/bicycle fall if going with a high speed ?
0	can we create a magnet with only one pole ?	the asymptotic behavior of the propagator of a field
0	nonabelian gauge theories and range of the corresponding force	first order coherence function in terms of momentum distribution function
0	do the various frequencies of light within sunlight have the same coherence length ?	string theory and trace anomaly in semiclassical gravity ?
0	quantum fourier transform question	spin matrix for various spacetime fields
0	besides water , which substances are less dense as solids than as liquids ?	what is a flat rotation curve ?
0	how might clock synchronization work with rsa securid tokens ?	will two magnets lose magnetism if they stick to each other for infinitely long time ?
0	wightman axioms and gauge symmetries	jump method and the lindblad equation
0	why is capacitor used ?	where does the energy of a light bulb come from ?
0	effects of gravity on light	finding the velocity of a block down an incline plane after in moves a distance $x_0$
0	can a pool ball change direction mid-roll ?	why neutrons in nucleus do not decay ?
1	run with speed of light with a mirror in hand	reflection at speed of light
0	rotating sphere and circular trajectory : minimum speed	a reference frame must be non-moving ?
0	is the gravity between objects other than celestials observable ?	how we can manipulate the momentum of a particle ?
0	canonical quantization of quantum field	what does the chromatic polynomial have to do with the potts model ?
0	quantum entanglement , quantum measurement , spin and position	how long did the first rainshowers on earth last ?
0	calculating mass of object by lifting edge	what is the deepest reason why qcd bound states have integer charge ?
0	isometry group from information about the center of the group	wkb method of approximation
0	question about infinite sum in quantum field	spin of a particle and spin quantum number
0	why is moment dependent on the distance from the point of rotation to the force ?	how can you have a negative voltage ?
0	how is the earth heated by a full moon ?	majorana mass for neutrinos in standard model
0	how much effect does the mass of a bicycle tire have on acceleration ?	suggested reading for quantum field theory in curved spacetime
1	mathematics for physics resources	best books for mathematical background ?
0	how is weight distributed when legs are astride ?	calculating inertia tensor with parallel axis theorem
1	how to go from quantum world to classical world ?	classical limit of the feynman path integral
0	what makes matter travel along geodesics ?	how to set up a very simple experiment in optics ?
0	loop rule parts problem	what is the physical meaning of the connection and the curvature tensor ?
0	minimum connectivity required for mean field to be a good approximation ?	proving ampere 's circuital law
