0	what is better than time-dependent perturbation theory if the pointer states are not energy eigenstates ?	dual particle-wave behavior
0	why light can not go faster then 300 000 km/s ? what prevents it ?	a possible absolute reference system
0	relativity of simultaneity	velocity dispersion of galaxies
0	interpretations of quantum mechanics	inertial mass of a scalar field
0	electron hopping among molecules - marcus equation	what happens to a photon in a black hole ?
0	string theory and trace anomaly in semiclassical gravity ?	can ligthning produce a reverbed sound if it falls on a high-tension line ?
0	a problem with a basic thought experiment in special relativity	graphene chern number for dirac nodes
0	time travel outside of light cone without causality violation	quantum entanglement on cosmological scales
0	theoretical physics notation ( hamilton-jacobi in the relativistic domain )	can we design the orbit of a satellite with einstein’s curved space ?
0	books on collision probability and collision processes	measuring mass by acceleration due to electromagnetic forces in free fall
0	why 2s state is lower in energy that 2p state in atoms ?	adding versus multiplying identical photons ' wavefunctions ?
0	when will planck release all-sky cmb anisotropy measurements ?	quasicrystals - projections from higher dimensional regular crystal lattices
1	how to go from quantum world to classical world ?	is it possible to recover classical mechanics from schrödinger 's equation ?
0	confused about si and cgs units for e/m energy	su ( 2 ) yang-mills eom
0	what is the meaning of following expresion $c=\frac{\delta q}{dt}$ mathematicly	identifying a critical phenomena ?
0	what is the velocity area method for estimating the flow of water ?	where can i find a complete list of metamaterials up to today ?
0	what is the physical reason a $+5v$ equipotential coutour cannot intersect a $-5v$ equipotential coutour ?	light focus guider
0	relativistic centripetal force	searching for big bang neutrinos
0	reducing eddy current losses	what would be the effects of an inflating universe ?
0	does displacement current exist after the capacitor gets fully charged ?	effect of space time relativity on the age of the universe ?
0	wave particle duality because of discrete time ?	find drag force on link of rotating chain
0	can there be energy with no force or energy with no power ?	calculating diffraction patterns using fft
0	good place/supervisor for phd in theory of condensed matter	inner product of particle-anti-particle spinor components
0	creating a stream of single file atoms	interstellar bodies
0	why is renormalization necessary in finite theories ?	iii-v semiconductor compounds - band gap approximations
0	future of a universe with scalar field	resonance condition in confocal cavity
0	fermionic interaction potentials	in electrostatics total flux linked from the closed surface enclosing the charge is equal to $q/\varepsilon_0$ . this is according to gauss law
0	angular momentum of 2d harmonic oscillator	neutron diffraction device
0	equation for hubble value as a function of time	are we capable of discovering planets in the andromeda galaxy ?
0	decomposition of representation multiplication	how does tension apply torque on a pulley ?
1	quantum observation in the double slit experiment ?	what is an observer in quantum mechanics ?
0	modern references for continuum mechanics	"correlation energy " using the pair correlation function
0	how can things at the event horizon slow down and appear to stop to a remote observer ?	logarithmic discretization in anderson´s model
0	electrolysis of liquid hydrogen	irreducible tensors concept
1	period of small oscillations	harmonic motion
0	calculating lifetime of a pi meson via heisenberg uncertainty relationship ?	calculating the age of the universe now and 30 billion years from now
0	ricci scalar higher dimensions	loopless voltage measurement
0	what are the details of the renormalization of chern-simons theory ?	are circularly defined {velocity , distance , and time} a problem in physics ?
0	how does one expand gravity lagrangians about an $ads$ background ?	what force particle mediates electric fields and magnetic fields ?
0	what is the name for the whistling " musical " sounds that change stepwise in pitch when a hollow tube is spun like a lasso ?	why do bar magnets have least attraction in its center ?
0	why is planet cfbdsir2149-0403 hot ?	proof for the mass gap of sine-gordon action with $g \cos ( \beta \phi ) $
0	salt water evaporation	ratio of the isospin of the photon
0	why do electrons drift in an ideal conductor , since there is no field ?	energy required to start and then stop rotating an object , when we have gravity
0	invariance under charge conjugation . . . or not ?	quantum state with zero standard deviation of position operator
0	lorentz invariance of the 3 + 1 decomposition of spacetime	during an ice age , would someone at moderate latitude get a sunburn/suntan on a sunny day ?
0	combining ±% with ±db in measurement uncertainty	how does watering your plants help protect against freezing ?
0	quantum mechanical meaning of atomic orbitals	why did my liquid soda freeze once i pulled it out of the fridge and opened it ?
0	is the " great attractor " an indicator of the " multiverse " ?	black hole escape speed
0	ontology of the quantum field	spin-statistics theorem on spaces with non-integer dimensions
0	projectile motion maximum distance to origin	are there any substances that allow sound to travel better then air ?
1	cubic symmetry and a stiffness tensor	stiffness tensor
1	lecture notes to learn quantum field theory	what is a complete book for quantum field theory ?
0	when is the force null between parallel conducting wires ?	what are some problems with hugyen 's wave model of light ?
0	what happens after a rocket is fired with velocity equal to or greater than escape velocity ?	how exactly does linear regge trajectories imply stability ?
1	quantum mechanics and canonical conjugate	why is momentum ( instead of something else ) the canonical conjugate of position ?
0	has the aharonov-bohm effect been experimentally proven ?	n level nucleon photon emission in a infinite potential well
0	heat flux and spatial temperature gradients	thought experiment regarding an object approaching a mirror
0	how to find the andromeda galaxy without using a go-to telescope ?	$z_2 $ topological index in spin liquid
0	what is the fastest a spacecraft can get using gravity-assist ?	what the difference between " orbital " and " orbit " ?
1	what is difference between $\frac {dr}{dt}$ and $\frac {\partial r}{\partial t}$ ?	what is the difference between implicit and explicit time dependence e.g. $\frac{\partial \rho}{\partial t}$ and $\frac{d \rho} {dt}$ ?
0	why are not quarks free ?	given moment about a pin and a roller
1	literature request for books / review papers on gravitation , gauge theories and related mathematics	mathematically-oriented treatment of general relativity
0	is it possible to explain general relativity without tensors ?	how does inflation solve the magnetic monopole problem ?
1	how does atmospheric pressure work ?	why does the wind direction vary locally ?
0	i still do not understand how a gas with an equation of state f ( t , p , v ) =0 can change if 2 state functions are fixed ?	why it is called a newton sphere ? ( velocity map imaging )
0	question about weightlessness	temperature ; why a fundamental quantity ?
0	would it be possible to distinguish rap and singing from just seeing the soundwaves ?	why is this not a realisable operation on a quantum system ?
0	what really happens atomically in an explosion ?	does physics address the topic of consciousness ?
0	how does the following commutator for measured observables and this operator relation imply the following relation ?	kähler and complex manifolds
0	do gravitational waves travel on geodesics in gr ? if yes , why ?	distribution of dark matter around galaxies
0	what is the meaning of phase difference ?	can solar furnace achieve higher temperature than sun surface ?
1	what is the formula for calculating the length of any given day ( sunrise to sunset ) ?	hours of light per day based on latitude/longitude formula
0	how does radiation shielding using absorbing materials work ?	conversion from barn unit to square meter ?
0	some questions about wilson loops	calculating equation of motion using path integral
0	classical mechanics and the speed of a train-mosquito collision , when perfectly rigid bodies	why magnetic field generates around current carrying wire ?
0	line of action force	experimental study of the photoelectric effect
0	more about gravitation as the source of redshift of light beams	black hole entangled with the cosmological horizon
0	capacitance from maxwell 's equations	how to demonstrate that there are just 14 types of bravais lattice ?
0	gravitational force and time dilation	everyday example of diffusion unobscured by advection , wetting etc
0	how does space affect the human body ( no space suit , no space craft )	special relativity version of feynman 's " space-time approach to non-relativistic quantum mechanics"
0	why do most metals appear silver in color with gold being an exception from a scattering and em viewpoint ?	how does the fraunhofer irradiance distribution look for a double slit aperture of different lengths ?
0	decay of particle ( for example $\pi^+$ ) ; find energy	radio antennas that are much shorter than the wavelength
1	are we travelling at a speed close to the light speed ?	why is the observable universe so big ?
0	can mass dimension of a field be viewed as another ' quantum number ' ?	calculating the dimensional wall-normal coordinate for a self-similar compressible boundary layer using levy-lees transformation
0	eddy current losses in electric steel by harmonics of a magnetic field	why does the earth rotate ?
0	how do gravitons impact on general relativity ?	a fly in an accelerating car
0	absorption & emission spectra	calculating the most probable radius for an electron of a hydrogen atom in the ground state
0	does gravity change the closer you are to the earth 's core ?	was sun a part of a binary system ?
0	sound as a conserved quantity	resistance of superconducting wire in parrallel with standard wire
0	what is postselection ?	"low-energy effective action " but in what sense ?
0	acceleration of the expansion of universe	is it correct to say " like poles attract , unlike poles repel " while two magnets are placed such that one is inside another ?
0	what sustains the rotation of earth 's core ( faster than surface ) ?	does evaporation decrease entropy ?
0	what is the physical meaning of commutators in quantum mechanics ?	"string " infinity paradox
0	what is the magnitude of the force on a charged particle due to electromagnetic radiation ?	can one pump water without providing an external source of energy ?
1	how faster is the effect of force exerted by gravity ?	the speed of gravity ?
0	impact of the noise distribution on geometric brownian motion	how does the pressurization in a house 's water supply allow adjustable flowrates from a tap ?
0	ads3 soliton of witten - for hawking-page transition	is it possible to see domains in a metal/magnet under microscope
0	a quanta of time	what is the halving thickness of diferent materials against high energy gamma rays ?
0	what is p_t ? ( transverse momentum ? )	two-dimensional atomic trap--how to set up the problem ?
0	how does a spatial covariant derivative act on tensors that are not purely spatial ?	string theory and fourier analysis
1	can you lift yourself standing on a wooden block using pulley mounted on block ?	force on rope with accelerating mass on pulley
0	generating pink noise	two problems with free body diagrams . contradictions ( solutions are provided )
0	the search for calabicles	solve eigenvalues for particles enclosed in a hard surface ?
0	what is the electric field in a parallel plate capacitor ?	resolution of identity in interacting qft
0	center of mass of a body on an incline	why is the higgs mass renormalization considered a fine-tuning problem , while the electron mass ( in qed ) is not ?
0	why does moment equilibrium at one point of an object mean the moment is at equilibrium for the whole system ?	can horizontally and vertically polarized light combine to become circularly/elliptically polarized light ?
0	how do we know gravity is not acceleration ?	$u ( 1 ) {\times}u ( 1 ) $ local gauge invariance derivative
0	a question on singularity	why use fourier expansion in quantum field theory ?
0	bathroom photons from the edge at the universe	is the universe infinite ?
0	( iran 's nuclear timetable ) how iaea knows that iran is able to make nuclear bombs in four months ?	do particles behave like electromagnetic waves ?
0	particle inside a charged shell	reflectivity of a glowing-hot metal surface
0	can the time direction of wave function collapse be reversed ?	phasor form of maxwell 's equations
1	learning more about string theory	introduction to string theory
0	what are some unanswered questions in electromagnetism ?	stopping distance
1	law of reversibility of light and total internal reflection	does light reflect if incident at exactly the critical angle ?
1	speed of light and lorentzian factors	how can a photon have no mass and still travel at the speed of light ?
1	doughnut magnet	what happens to the magnetic field in this case ?
0	is the artificial gauge field a gauge field ?	grassmann fields according to peskin and schroeder
0	calculating the coherence length from a spectrum	non-minimal coupling of electromagnetic field
0	what circle aids/tools are there where angles are doubled ?	can the apparent velocity of an approaching spacecraft be faster than light ?
0	electrons and energy	direction of current in concentric cylinders
1	how to bend 3d space embededd in a 4d enviornment ?	calculating position in space assuming general relativity
0	in quantum mechanics , why position and momentum are related by fourier transformation ( only ) ?	please explain these equations relating to newtonian gravity
1	graviton through the horizon and force felt outside a black hole	how does gravity escape a black hole ?
0	what are the differences in using an eyepiece with a barlow instead of a shorter eyepiece ?	time evolution of gaussian wave packet
0	partition functions in $\phi^{4}$ theory	what the theta in schwinger function and what is theta formula ?
0	can gravitational potential energy be released in a fire ?	how to calculate riemann and ricci tensors for a sphere ?
0	how to find power factor value of parallel rl circuit knowing the power factor value for the series circuit with the same components	to which state of matter does the flame belong to ?
0	calculating the stability/invertibility of energy maps by multivariate time series model	fermi statistics and berry phase
0	what is the difference between phase difference and path difference ?	graphene and relativistic dynamics
0	hydrostatic pressure on a teapot spout	is it possible to increase the electromagnetic repulsion between two particles ?
0	complex polarizability of a dielectric sphere in a homohenious electric field	interpretations of quantum mechanics
0	what happens to the electrons that escape an atom when matter is converted to a plasma state ?	about turbulence modeling
0	what is the proper time used in relativistic non equilibrium statistical physics ?	how does weight/mass affect angular momentum ?
0	balancing stick on hand - inverted pendulum motion	how is the velocity not constant ?
1	why stars twinkle but planets do not ?	why do stars flicker ?
0	writing $\dot{q}$ in terms of $p$ in the hamiltonian formulation	what is the physics of tilt compensation of an electronic compass
0	life time of a wave	in a big crunch , would there be more mass than at the big bang ?
0	conformal group in two dimensions	gauge fields in polyakov 's treatment of renormalization for nonlinear sigma model
0	rigorous definition of frame of reference	lagrange l4 l5 points and perifocal plane
0	fluid dynamics : bernoulli air tunnel	where does the excess energy emitted by a microwave go ?
0	distributions ( e . g . , dirac delta ) : confused and unhappy	why does hydrogen molar heat capacity reach 7/2 r ?
0	how to analyse data that is in four dimension ?	what prevents this magnetic perpetuum mobile from working ?
0	intro to solid state physics	can auxiliary fields be thought of as lagrange multipliers ?
0	quantum dots on the nuclear scale !	force applied in a body moving at high speed
0	semi-conductors	how can heat turn into light
1	was einstein wrong when he said nothing can go faster than the speed of light ?	why is the observable universe so big ?
0	spin wave theory for 1d spin systems	units inside of a dirac delta function
0	is it possible to calcualte the yield-stress of a fluid by measuring the smalles bubble that rises through it ?	a question on smooth 1-manifolds
0	a problem on fluid flow	why photons are emitted because of changes to electron behavior
0	is a non-newtonian gas possible ?	kerr solution for finite collapse time
0	semiclassical exact expression ( in one dimension only )	methods to stabilize and maintain extremely low humidity in a lab environment
0	torque of a winch with pulleys	how does string theory predict gravity ?
0	a spaceship travels from star a to b , but food/fuel and relativity !	thermodynamics - convection current
0	emission and absorption spectra of sun	need an intermediate resistivity part/material
1	according to newton 's third law , why do not action and reaction make equilibrium ?	with newton 's third law , why are things capable of moving ?
0	understanding the bose-fermi dichotomy	how to calculate a firing location from point of impact data ?
0	most useful maths for theoretical and mathematical physics	boundary condition for a floating electrostatic potential
0	2d vector components	if the lhc does not find the higgs boson , what would be the implications for the standard model ?
0	mirror symmetry in spin	water pump with a tap connected at its opening not pumping water when water is drawn from the pump before starting the pump
0	electrostatic charge leakage	moment of weight of leaning beam
1	topology for physicists	best books for mathematical background ?
1	einstein 's cosmic speed limit $c$ challenged by black holes/massive objects	why can not light escape from a classical black hole ?
0	velocity in a turning reference frame	what is the most efficient way to destroy the universe ?
0	torque required to rotate panel on one axis	speed of light that is traveling away from the observer
0	if friction disregard area , why the direction you drag a long object matters ?	aharonov–bohm effect on a non-contractible manifold
0	is it part of special relativity that mass possessing energy is more dense ?	principle of caratheodory and the second law of thermodynamics
0	double-spring mass system	where does the term " boost " come from for rotation-free transformations ?
1	how to study physics as a first year student ?	how to learn physics effectively and efficiently
0	why same formula describing doppler effect in the case of light in different situations ?	what {r , g , b} values would represent a 445nm monochrome lightsource color on a computer monitor ?
0	is that possible to derive landau-fermi liquid theory from microscopic equation ?	relation between photon number and energy
0	$sss$ decay and violation of strangeness	given constant t , why does p affect internal energy ?
0	fourier transformation	pressure in fluids , in particular horizontal pressure
0	auto-refrigeration	confusion between the de broglie wavelength of a particle and wave packets
0	quantum circuit decomposition	momentum operator of a particle in an electromagnetic field
0	polar ice deposits on the moon - dispersed in permafrost loose rubble , or also massive/layered ?	do all impacts create a wave-like disturbance in the medium through which they travel ?
1	blackholes gravity , why it has effect outside the event horizon ?	how does gravity escape a black hole ?
0	how can i find the amplitude ?	field of a parallel plate capacitor
1	space and the size of infinity	is the universe finite or infinite ?
0	what is opposite of electric field ?	quantum curvature
0	what is the physics behind explosion of stars ?	what technological advance would allow lep3 to surpass lep2 ?
0	applications of algebraic topology to physics	does light accelerate or slow down during reflection ?
0	momentum acceleration in space ?	conservation laws vs einsteinian space-time
0	why not accurate masses of elementary particles ?	conditions that the coordinate must satisfy in order to become local inertial
1	how were the crystal lattices of elements determined to perfection ? ( ex:- that of a copper is a cubic lattice )	how can crystal structures be determined using x-ray diffraction ?
0	is there precision experimental evidence for furry 's theorem -- that only even degree vevs are non-zero ?	interchaging boson and fermion on an infinite 1 dimensional line
1	what constitutes displacement current ?	displacement current - how to think of it ?
0	shot noise at high frequencies ( can it really be ideal white noise ? )	can a force applied to a wheel find the fastest way of getting to the other side ?
0	finding particles in the classically forbidden regions	projection of states after measurement
1	how is the universe expanding ?	spacetime expansion and universe expansion ?
1	electrons of conductors free ?	are free electrons in a metal really free
0	how the car keys prevent the shock caused by static electricity	question about matrix integral
0	bondi 's k factor	newton 's third law of motion : an apple resting on the surface of earth
1	about hubble observatory and distant galaxies	why is the observable universe so big ?
1	if the universe is 3d , how is space-time like a " fabric " ?	does the curvature of spacetime theory assume gravity ?
0	why does my door shut faster when the window is open ?	how is meissner effect explained by bcs theory ?
1	why is the speed of light arbitrarily the limit ?	what is so special about speed of light ?
0	what is the speed of electrons in a transistor ?	help with deriving an asymptotic expression
0	link between anomalous dimensions and fractal dimensions	what exactly is electromagnetic radiation ?
1	should i learn classical physics if i want to learn quantum physics ?	what is the math knowledge necessary for starting quantum mechanics ?
0	conservation laws in msugra model	photon escape angle from black hole
0	relationship between polarizability and conductivity	when i connect in series two floating capacitors , one charged and the other not charged , does current flow ?
0	after what speed air friction starts to heat up an object ?	a james clerk maxwell disproof
0	how should i clean a part before installing it in a vacuum system ?	was the firewall paradox resolved ?
1	how can we know that a black hole exists ?	direct observations of a black hole ?
1	does more rain strike a vehicle while moving or while stopped ( or neither ) ?	should you run when under rain ?
0	electric field and magnetic field of guassian beam	quantum symmetries that are not classical symmetries
1	does the big bang need a cause ?	on causality and the big bang theory
0	matrix elements of the electronic molecular hamiltonian between a hartree product and a slater determinant	force from point charge on perfect dipole
0	how many state configurations are possible for $n$ particles in completely different states ?	right hand rule to measure direction of electric field
0	entropy of a black hole can be zero ?	josephson effect - fractional or not
0	physics of the point of contact for a spinning top	computing wavefront deviations for off-axis mirrors
0	is causality a formalised concept in physics ?	about partially polarized light and the degree of polariztion
0	binary star system with one star stationary ?	why does not anomalous dispersion allow faster-than-light propagation ?
0	are there any good reading materials for variational approach in many-body theory ?	given partial derivatives find the state function
0	truck mass & "4th power law"	how can a black hole emit x-rays ?
0	is it possible to obtain higher order corrections to the ideal gas law when one allows realistic phenomena to make their way into the equations ?	ballistic conduction - difference between bosonic and fermionic transport
0	can we build spinorial eigenstates of time reversal symmetry ?	how to measure vector potential such as that of magnetic field ?
0	is electronvolt a mass or an energy unit ?	what is the phase difference of the oscillations of the two prongs of a tuning fork ?
1	why do not we see solar and lunar eclipses often ?	why do not we see solar and lunar eclipses often ?
0	having trouble understanding the work energy principle intuitively	bravais lattice with sublattices : why multiple bands ?
1	what is the role of the speed of light in mass-energy equivalency ?	how does rest mass become energy ?
0	linear acceleration vs angular acceleration equation	what cools bottle of water faster : ice or snow
0	how do kolmogorov scales work in shear thinning fluis ?	what is the difference between virtual object and virtual image ?
0	at what temperature does water become a liquid on mars ? on the asteroids ? and in a vacuum ?	does a pivot exert an additional force , normal to the centripetal force , on an object rotating about it ?
0	is false vacuum bubble nucleation possible in our universe ?	contact force betweeen 2 objects
1	what is the experimental uncertainty of an ensemble measurement ?	multiple measurements of the same quantity - combining uncertainties
0	why is the sky not purple ?	how is quantum mechanics compatible with the speed of light limit ?
0	how bright will an asteroid be ?	using eigenvalues to determine the stability/behaviour of the system
