0	is using water in a charcoal smoker less efficient than not using water ?	what is an equation for two astronomical entities both of 4000 tonnes in weight , colliding ?
0	dimensional analysis of magnetic energy : dimensions of µ0 and h	can virtual particles , in particular gravitons , interfere ?
0	geometric picture behind quantum expanders	hilbert space for density operators ( instead of banach spaces )
0	wilson loops in chern-simons theory with non-compact gauge groups	finding the acceleration at an angle
0	general relativity paradox : holding a string across a gravitational gradient	the divergence in qcd series-- how many are they , and what do they mean ?
1	open-source up-to-date cosmological datasets	are there free data available online from cosmology ( or astrophysics ) experiments that anyone can analyse ?
0	sign in the time-independent schrödinger 's equation	lagrangian mechanics and time derivative on general coordinates
0	force on rope with accelerating mass on pulley	is $f=ma$ an identity ?
0	first order dependency	can quantum weirdness be explained by waves in space ?
0	is there any law that prevents an object with mass to become massless ?	frequencies of matter
0	can a photon be made to orbit a known ( or undiscovered theoretical ) body ?	mathematical derivation of $n ( \lambda ) d\lambda$
1	how is it that the cross product of two vectors is always perpendicular to the given vectors ?	meaning of the direction of the cross product
0	simple derivation of the tension of a cord on a suspended mass	are orbiting planets an example of perpetual motion ?
1	prereqs for the geometry of physics by frankel	physics for mathematicians
0	why dosen't a charged particle radiate energy in circular motion in a uniform magnetic field ?	does recharging a battery at a lower temperature lower its internal resistance ?
0	what is the maximum mass that the airplane can have and still maintain enough lift to fly ?	schrodinger basis kets with time-dependent hamiltonian
0	uniformity in a solenoid	is there any metal having the properties of rubber ?
0	grain of sand attracting the sun ?	error calculation with linear regression
0	what about assessing negative limit of detection for concentration	holstein-primakoff and dyson-maleev representation
0	is the charge of an ion evenly distributed ?	how can a rapid change in the volume of a gas cause changes in its temperature ?
0	one-loop $\phi^4$ theory in $d = 3$	electric dipole moment ( edm ) underlying physics
0	why does cold metal seem colder than cold air ?	how is fermat 's least time principle proven ?
0	the physicality of the photon propagator	space-like killing vector of robertson-walker metric ?
0	what happens to the index of refraction of a lens if placed in water ?	proving $rtln ( a_i ) $ equal to non pv work done by system , where $a_i$ is activity
0	finding coefficients of volumetric expandtion from a know coefficient of linear expandtion	how far can something travel in a straight line ?
0	how does one exert greater force on the ground by jumping ?	is the graviton hypothetical ?
0	leaving a stellar black hole 's orbit	newton 's corpuscular theory
0	wkb approximation to loop diagrams	is there any evidence for the claim that the moon was once part of the earth ?
0	making a cut trough a center of mass , can the masses of the pieces be equal ?	how do i rearrange de/dt to find an electron 's ' half-life ' due to synchrotron radiation ?
0	questions about thouless-kohmoto-nightingale-den nijs ( tknn ) paper	dirac magnetic monopoles and quark fractional electric charge quantization
0	pressure and volume ( sqa 2011 higher physics q23 )	why can not dark matter be black holes ?
0	calculating phase difference of sound waves	spilling a cup of coffee
1	are quarks and leptons actually fundamental particles ?	what are quarks made of ?
0	nonlocal transport in the quantum spin hall state	vector and scalar potentials of plane wave
0	ball rolling without slipping inside a hollow cylinder	are all points in the universe connected ?
0	are classical field theory and quantum mechanics of a single particle ( nonrelativistic or " classical" ) limits of quantum field theory ?	what is the significance of color changes between em-spectrums ?
0	is it really true that slow-roll inflation is incompatible with string theory ?	how to distinguish female and male voices via fourier analysis ?
0	what is the equation for the scale factor of the universe , a ( t ) , for the best fit of data to the $\lambda cdm$ model of cosmology ?	the motion of a spring
0	why are turns banked ?	is the edge of our hubble sphere within our cosmic event horizon and why ?
1	special relativity textbooks request	textbook on the geometry of special relativity
1	how does gravity effects both time and light if they have no mass	how exactly does time slow down near a black hole ?
0	equilibrum position of an extensible spring	surface uv exposure with cooler star
0	what is the difference between an entangled state , a superposed state and a cat state ?	frames of reference : inertial and accelerated - and jerked , snapped , crackled and popped ?
0	why does $\frac{\partial \mathbf{v}_i}{\partial \dot{q}_j} = \frac{\partial \mathbf{r}_i}{\partial q_j}$ ?	eigenvectors of pauli $\sigma_x$ matrix
1	how does this help an aeroplane to fly ?	what really allows airplanes to fly ?
1	learning roadmap for solid state physics	condensed matter physics for mathematicians
0	write down equations for the electric field and magnetic fields components of a linearly polarized plane wave	online course on theoretical electrodynamics
1	can neutrinos really travel faster than the speed of light ?	superluminal neutrinos
0	ac circuit analysis : why does current have the same frequency as the voltage ?	advantages of high-energy heavy-ion collisions over proton-proton collisions ?
0	does fluctuation-exchange ( flex ) approximation including spin-orbit coupling ( soc ) exist ?	conservation vs non-conservation forms of conservation equations
0	intrigued about a polarizer effect	magnetic needles in elastic media
0	curvature of a cable supporting a suspension bridge in the regime where the mass of the cable is non-negligible	does the alcubierre drive use negative energy to compress space infront of it ?
0	how to explain ( pedagogically ) why there is 4 spacetime dimensions while we see only the 3 spatial dimesions ?	surface tension of n non-mixing fluids
0	computing wavefront deviations for off-axis mirrors	scaling : gravity and friction
0	how frequency generated on water can affect it is flow on camera ?	frequency dependence of permittivity -- why not monotonic ?
0	does pressure drop across pipe affect flow rate ?	what is the likelihood of a long-period comet impact ?
1	what is the source for magnetic energy ?	where do electrons get their ever-lasting circulating energy ?
0	does water have the same surface tension at same temperature but different volume ?	does the lsz reduction method prove gauge-independence in massless gauge theories ?
1	what happens if an atom absorbs a photon of energy higher than first excited state but lower than second excited state ?	specific electron energy gap values $e_{i+1}-e_i$ vs . photons with arbitrary energy $\hbar \omega$
0	after the space shuttle is retired , how will the new sections of iss be launched ?	affine connection notation
0	how does a lightning striking stall a moving car ?	does gravitational lensing violate fermat 's principle that light must travel in straight lines ?
0	an error in gravitation by misner thorne and wheeler ?	how does the focal length of the lens change the distance from the camera to an object ?
0	can a object with constant acceleration change its trajectory ?	word for the star around which an exoplanet orbits:
0	non-conservative behaviour of static electric field	how to introduce the electromagnetic field in quantum field theory ?
0	ship wake height	is weak lensing the statistical effect of microlensing ?
0	equation $h ( q , p ) =e$ is the equation of motion or energy-conservation law ?	what is the meaning of this " let there be light " joke ?
1	does the order of variables matter for a quantum lagrangian in the path integral formula for quantum mechanics ?	why path integral approach may suffer from operator ordering problem ?
0	why can movies get away with 24 frames per second , but games can not ?	can we make any substance that will produce ions at low temprature
0	quantum mechanical effects of an object accelerating near speed of light $c$ ?	classical and semi-classical treatments of the ideal gas
0	what is the meaning of this " let there be light " joke ?	what is the importance of conformal transformations in general relativity ?
0	estimation of accuracy of measurements ?	interpretation of theoretical schrodinger 's cat experiment
0	is there a simple way to derive a t-s diagram from a p-v diagram for arbitrary processes ?	collapse of the free particle wave function
1	does the big bang violate the conservation of energy ?	conservation law of energy and big bang ?
0	quantum commutator	heisenberg 's principle in quantum cryptography
0	interpretation of the wave function in quantum mechanics	why does vibration loosen screws ?
0	if the earth would stop spinning , what would happen ?	why do not most physics programs study the primary sources ?
0	approach of the andromeda galaxy	open string coupling
0	how does the color of fine dispersed metal particles change between silver and black ?	andrew 's experiment
0	question about the klein paradox	question on index notation and metric tensor
0	the density of clouds	doped semiconductors
0	definition and measurment of energy and heat in thermodynamics	should you run when under rain ?
0	the relation between spectral function and band structure	difficulty in understading a part of the book " a brief history of time " ?
0	lifting house with balloons	why were the si base quantities chosen as such ?
0	mechanical work to required battery power	is the earth air-tight , and does that make plastic bags redundant ?
0	mathematical probabilistic interepretation of probability amplitude	how can a car 's engine move the car ?
0	$v = v_1 + v_2$ confusion ? why is my " proof " incorrect ?	why do we think of light as a wave ?
1	book for particles physics	particle physics getting started
0	does an ising lattice that returns to equilibrium create a current by induction ?	difference between $\delta$ , $d$ and $\delta$
0	induced metric on the boundary of a manifold	is the length of the day increasing ?
0	spring constant	was the universe a black hole at the beginning ?
0	what are the physics behind the coriolis effect ?	how does this formula for calculating the " mass sum " in a collision translate to 3d ?
0	how does the internal energy and entropy depend on mass ?	wick rotation and special relativity
0	is this constraint non-holonomic ?	how does the construction of a hydrophone differ from a microphone ?
0	how does a pressure suit work ?	how to calculate the electrostatic force applied on an object that is along the axis of a charged tube 's surface ?
0	what is the importance of joule 's experiment ?	a question from hilbert and courant 's vol ii of methods of mathematical physics ( i might have spotted an error )
0	hamiltonian function for classical hard-sphere elastic collision	how do you represent an equation with four variables ?
0	method of images	how are complex sound waves combined ?
0	energy required to demagnetize a soft iron ?	weird consequence of gauss 's law
1	quantum entanglement and causality	is there such a thing as " action at a distance " ?
1	with newton 's third law , why are things capable of moving ?	why does the cart move ?
0	dynamics of circular motion	mass is a stuff or not ?
0	do all the particles acquire mass in the standard model due to the higgs mechanism only ?	a quanta of time
0	two-level system with spontaneous emission	which " space-time coincidences " are described by a " co-ordinate system in which the gravitational field does not appear " ?
0	why are radiators always placed under windows ?	is there any solution to the potential flow around a square cylinder ?
0	what is the relationship between concentration and refraction rate in a solution ?	what physical quantity has si unit $kg \cdot m$ , ?
0	as the universe ages , will we see more stars or less ?	batting averages of the large hadron collider
0	binding energy and invisible mass	what are the expressions for rotational and translational kinetic energies of a system of point particles ?
0	how 4-vector nature of the value is connected with it is conservation law ?	identity in cft
0	are there good home experiments to get a feel for the behavior of yield-stress liquids ?	can a mechanical systems on hold be switched off , in another way than just letting it do it is thing ?
0	entropy as an arrow of time	hubble 's law and conservation of energy
1	inclusive and exclusive searches	what is the difference between inclusive and exclusive decays ?
0	how much does the earth 's rotation affect a golf ball ?	help with absolute pressure to gauge pressure derivation steps
0	can $m_3$ move upwards and $m_2$ move to the right ?	another faster-than-light question
0	if the wave function can be collapsed , can we collapse the particle function ?	why are not we surrounded by black holes ?
0	time duration for pulse of single electron viewed as a wave	can the cosmological constant explain an accelerated expansion ?
0	lorentz homogeneous group and observables	why can not you hear music well over a telephone line ?
1	was einstein 's cross predicted by einstein 's theories ?	how does gravitational lensing account for einstein 's cross ?
0	validity of a steady state solution of reaction-diffusion equation	understanding what a wakefield describes ?
0	bungee jump physics	can these figures demonstrating the safety of " archery tag " arrows be correct ?
0	does a black hole singularity last essentially no intrinsic time ?	what is the derivation for the exponential energy relation and where does it apply ?
0	what is the role of the vacuum expectation value in symmetry breaking and the generation of mass ?	eigenvalue problem for differential equations in qm
0	are diffeomorphisms a proper subgroup of conformal transformations ?	what sustains the rotation of earth 's core ( faster than surface ) ?
0	voltage in a lossless transmission line	eddy currents in metal implants
0	what is the definition of correlation length for the ising model ?	chern-simons theory
0	adjoint of momentum operator	material strain from spacetime curvature
0	problem of klein-gordon equation	why does diffraction depend on wavelength ?
1	ambiguity in number of basis vectors	hilbert space of harmonic oscillator : countable vs uncountable ?
0	commutator algebra in exponents	to what degree does guitar construction affects the vibration of the strings ?
0	request for reference : brst formalism/transformations	why should the observed probability distributions in quantum mechanics always align with the pointer basis of decoherence ?
0	how to think of the harmonic oscillator equation in terms of " acceleration = gradient"	weather forecasting with coffee bubbles
0	why does space expansion not expand matter ?	what is an approximation of the average number of supernovae every century in the milky way ?
0	possibility for radiation in dark matter that is not interactive with regular matter ?	where did karl schwarzschild derived his solution ?
1	why is the wave function complex ?	about the complex nature of the wave function ?
0	example of two linearly independent , nowhere vanishing vector fields in $\mathbb{r}^{2}$	could it be possible to create a pentane steam engine ?
0	are proton , antiproton , electron , positron the only observed subatomic particles that can freely exist and do not decay , i.e. are stable ?	x-ray diffraction from metals
0	why do not the ladder operators commute ?	a spinning bullet
1	confused about time dilation/length contraction	does the sign of $\delta x$ matter in this time dilation calculation ?
0	a thermodynamic transformation that can be represented by a continuous quasistatic path in its state space may still be irreversible . why ?	correction to period of a pendulum
0	can pauli exclusion be described locally ?	current without voltage ?
1	are photons travelling in future ? are they lifespan 0 ( or close to 0 ) ?	would time freeze if you can travel at the speed of light ?
1	doughnut magnet	what happens to the magnetic field in this case ?
1	effects of magnetic fields on our bodies	effects of a very large magnetic field on the human body
1	can we observe an edge of the universe ?	how would it be to look at the sky if the earth were near the edge of the universe ?
0	solutions of damped oscillator differential equation	topological entanglement entropy for a punctured torus and sphere
0	sums of operators in practice	photons to represent a wave
1	reltivistic action is negative or positive number ?	why lagrangian is negative number ?
0	what is quantum decoherence ?	about the atiyah-segal axioms on topological quantum field theory
0	solutions of nonlinear systems invariant wrt . perturbations ( looking for applications )	orthochronous lorentz transformations are time-preserving and $sl ( 2 , \mathbb{r} ) $
1	string theory- are strings the end ? what are they made of ?	what are the strings in string theory made of ?
0	why is there a hiss sound when water falls on a hot surface ?	calculating the gravitational acceleration inside of a planet
0	why do pressure and chemical potential depend on temperature , instead of having symmetric definitions ?	definitions and usage of covariant , form-invariant , invariant ?
0	solving an indeterminate triangle truss structure ( statics )	how is partial trace simplified ?
0	is it possible to check from the em waves ( basically light rays ) ?	what kind of research will go in nuclear fusion power once the commercial power plant is designed and implemented ?
0	physical interpretation of the integrand of the feynman path integral	can peridynamics give accurate quantitative results ?
1	matlab package : graphical calculus for quantum operations ( esp . linear optics )	matlab package : graphical calculus for quantum operations including beam splitters and polarizing beam splitters
0	the bijective correspondence between a symmetric polynomial and edge excitation of the fractional quantum hall droplet	do nearby gamma ray busts/supernova damage more than just the ozone layer ?
0	why is it easier to glide on sharp ice skates than on dull skates ?	quantum field theory , particle interpretations and path integrals ?
1	why can light ( photons ) bends in a curve through space without mass ?	is light affected by gravity ? why ?
0	doubt in collision	why do the planets orbit the sun ?
0	relation between newtons and kilograms	gravitational inverse-square law
0	wavefronts and phase velocity faster than $c$	force acting on an object ?
0	degree of freedom in 6 dimensional space	how does my hand amplify an fm radio signal ?
0	what is the current state of research in quantum gravity ?	definition of buoyancy
0	do stars of higher metallicity have more planets in highly-inclined pluto-like orbits ?	harold white 's work on the alcubierre warp drive
0	creating/downloading a large galaxy dataset	is the emdrive , or " relativity drive " possible ?
0	does a universe experiencing " heat death " have a temperature ?	visualisation of vortex flows
0	phase shifting using the hilbert transform	general integral to find resistance
0	how does the speed of electrons change around a circuit ?	why does the cosmic censorship conjecture hold so well ?
1	what is the solution of general relativity for our universe ?	how is it possible to come to a conclusion that universe is a result of the big bang while we are not able to observe the entire universe ?
1	space time curvature due to electric charge or magnetic charges	all " forces " as manifestations of properties of space-time
1	understanding field representation of force	electric field lines density
0	a particular case when lagrange equation is equivalent to equation of motion on a riemannian manifold	a question regarding particle trajectories in the symplectic manifold formalism
0	why are stresses of continuum systems described via a tensor ?	is the law of conservation of energy still valid ?
0	how far can a voice carry through the desert at night ?	velocity vs time bounce
0	computing linearized gravitational wave emission from point-like masses	why does hydrogen bubbles gather in anode instead of cathode during electrolysis ?
0	complex potentials , potentials and fields	number theoretical function applied in physics ?
0	graphene moebius strip	is it 11% hotter today than it was yesterday ?
0	what is the first non-vanishing multipole moment of this configuration ?	influence of air resistance in space
0	why does tea rises in the pot but water do not ?	how long must two surfaces be in contact for vacuum weld/cementing to occur ?
0	why is the free energy minimized by the boltzmann distribution ?	why do batteries become weaker
0	what caused simon faithfull 's chair to fall appart ?	are combined masses in space , such as galaxies , considered to be uniform bodies ? *in addition , a related question about force
0	is anti-matter matter going backwards in time ?	charge to mass ratio inversely proportional to curved path radius ?
0	revealing electric field lines through grass seeds in mineral oil	physical motivation for differentiation under the integral
1	a correct explanation for the levitation of a superconductor above a magnet	how do superconducting materials float in magnetic field ?
0	heat contained in compressed gas	confused about the electric field at the surface of a conductor
0	photon spin projection to arbitrary axis	deriving expression for motional emf
0	man on treadmill and energy/mass conservation	how do we deal with gribov ambiguities when calculating in quantum gauge theories ?
0	has there been any serious work in how the world would look if basic physical laws were changed ?	distance at which a 300m asteroid is visible
0	why quantum mechanics as a non-fundamental effective theory ?	close electric field lines in wave guides
1	frames of reference	help me gain an intuitive understanding of lorentz contraction
0	in susy , does ww scattering unitarisation needs the higgs boson ?	how to formulate collapse in polarization subspace of a photon ?
0	doubts about the definition of mass	length contraction and simultaneous length measurements
1	how much time passed for the passenger traveling with at speed-of-light spaceship ?	how long would it take me to travel to a distant star ?
0	can the euler-lagrange equations be derived from an infinitesimal principle of least action ?	why does shape of elements matter in finite elements analysis ?
0	interpretation of dirac equation states	how does one actually compute the amplituhedron ?
1	force and torque question on an isolated system	force applied off center on an object
1	the general relativity from string theory point of view	in what limit does string theory reproduce general relativity ?
1	why do we always see the same side of the moon ?	why does the moon face earth with the same side ?
0	law of gauss . electrostatics	making fire using a filled water bottle
1	confused by renormalization	suggested reading for renormalization ( not only in qft )
0	can a magnetic field hold a state of supercavitation if a magnetic field could be placed inside of the bubble of the supercavitation ?	quantum mechanics : how do the atoms in an electronic circuit enter a smaller orbit on the filament of an incandescent light bulb ?
0	optimizing water boiling	free energy and entropy
0	solar still and how it works	escape velocity problem
0	negative energy/mass bounds on de-sitter spacetime	is " witten 's dog " from a futurama episode an actual physics concept ?
0	black body balloon in vacuum	how can i solve a circuit of resistances with both a voltage and a current-source in between them ?
0	holomorphic factorization in cft$_2$	equivalent definitions of vectors
0	charge residing on an overpolished surface	storing kinetic energy in bonds
0	how many years of expansion occurred during inflation ?	uncertainty in momentum of an excited electron trapped in a box ( 1d ) ?
1	basic question about law of gravitation	radial fall in a newtonian gravitational field
0	how many atoms per light year does light encounter when traversing interstellar space ?	how do you keep a fridge full of food cooler ?
0	electron configurations and $m_{s}$ quantum numbers	toda equations and surface operator
0	how do i extend the lorentz transformation metric to dimensions> 4 ?	why is fractional statistics and non-abelian common for fractional charges ?
0	must string models that describe 4d effective field theories always have d-branes that extend in the 4 non-compact spacetime dimensions ?	if it takes less than a year to accelerate to the speed of light at 1g why will it take the voyager 10,000 years to reach alpha centauri ?
0	is the convective heat coefficient always dependent on heat flux and delta t ?	find the dispersion of the slab ?
0	lethality of sounds and extreme " loudness"	spaghettification of humans near black holes
0	why do all elements above $\require{mhchem}\ce{fe}$ not decay to $\ce{fe}$ ?	normalization of the real klein gordon field in peskin and schroeder chapter 2
0	what is the average total heat incident on earth 's surface each hour ?	what exactly is electromagnetic radiation ?
0	bec in a rotating disc	is the idea of dividing the universe into particles anything more than an untrue convenience ?
0	why can not angular momentum be used in flying vehicles ?	transfer function of an rlc circuit
0	why do we still need to think of gravity as a force ?	the value of newton 's gravitational constant $g$ within an atom
0	angle of inclination	hydrogen as a fuel in sun
