0	dircolors on zsh : unrecognized keywords : multihardlink , reset & capability	add a symbol before any letter
0	exit shell script from a subshell	about the usage of memory in a linux server
0	lightweight x11 alternative available ?	changing the server name
0	fully disable the . desktop file function under gnome ?	shell : how to go to the beginning of line when you are inside a screen ?
0	how do you omit " . /" when running scripts on current directory	is it possible to change the clock frequency of wifi chip ?
0	why is ' kill -9' killing browser as well as server ?	characters not defined into iso14651_t1_pinyin are not sorted properly
0	how is built the initrd of a fresh install [ rhel55 ]	command for counting number of active cron jobs in crontabs
0	nfs server optimization for maximum performance	download pdf files from using curl
1	connect to pseudoterminal ( same user ) from lost session	how can i disown a running process and associate it to a new screen shell ?
0	how do i shutdown the system after a particular process exits	confusion with how to restore corrupt ext3 files if power outage occurs during a file write
0	checking if line in file exist	fstab does not mount after boot of a virtual machine
1	group permission on public_html	permissions : what is the right way to give apache more user permissions ?
0	flush ' tail -f ' buffer ?	continuous testing of a c++ project on github with different linux distros
0	resolution problems with external monitor in elementaryos	backup from remote server
0	what is the difference between . /script and . . /script ?	how to determine which module taints the kernel ?
0	no output from inotifywait | awk	how do i exit or cancel a bad bash command ?
0	how to mirror one more disk on existing filesystem	format ps output without whitespace
0	manually adding static ip not resolved after a while	"history " stops working when run inside bash script
0	sunrise and other astronomical data from the command line	where does zypper install the repository or package signing keys ?
0	building hdf5 with gcc 4.7 and openmpi	opening port 80 but remain secure
0	how to find out the reason a command/code was executed on linux ?	screen - inherit current window 's environment
0	nvidia video card drivers for linux compatibility	how to run a python script in makefile
0	cdc acm does not working in a custom linux kernel	kvm guest installation
0	routing for multiple uplinks/providers	failed to sign csr with the ca root key
0	how do i stop the root user from deleting a file ?	local yum repository with grouplist not working
0	how to install libssl-dev on slackware ?	what is the canonical way to implement order independent options in bash scripts ?
0	connect remote host without password in linux	apply astyle on commited files using svn hooks
1	why is . /filename required to run executable script ?	why do we use " . /" to execute a file ?
0	how to play the result of " mpc search " ?	would my downloaded ubuntu , require an internet conncetion ?
0	dhcpd : any way to check dhcp pool status ?	can’t figure out samba file share permissions as needed .
0	zsh to auto-complete directories in command-line arguments ?	checkinstall on centos
0	searching strings on files	automatically put an alias into ~/ . bashrc or ~/ . zshrc
1	human readable memory sizes in top ?	how to display meminfo in megabytes in top ?
1	open group base specifications , single unix specification and posix	difference between posix , single unix specification , and open group base specifications ?
0	meaning of patching binary files ?	center mutt pager horizontally
1	how do i identify which linux distro is running ?	how can i get distribution name and version number in a simple shell script ?
1	login retrieval in osx	mac os x darwin : how to reset admin password ?
1	how do i simply recover the only file on an empty disk just deleted ?	unix/linux undelete/recover deleted files
0	is the minix 3 license gpl compatible ?	why freeradius service will not work on centos ?
1	how to cancel my job	i do not know how to cancel job
1	ssd seems full , but file system says otherwise	why are there so many different ways to measure disk usage ?
0	mageia - how do i setup a kvm for windows gaming ?	how to control the list of locales which are generated by apt ?
0	how do i increase my iterm ( tmux ) window scrollback ( not the line scrollback )	what do the " apachectl fullstatus " columns mean ?
0	simplest way of getting a bootable linux flash drive + vm in windows	cleaning /dev/md0 filesystem ( raid )
0	chrooted sftp gives " permission denied " error	in which units does tar --checkpoint measure ?
1	computer terminal and virtual console	what is the exact difference between a ' terminal ' , a ' shell ' , a ' tty ' and a ' console ' ?
0	acting on a different display when using ssh	how does a shell ( bash , for example ) expand wildcard patterns ?
1	building from source on linux - mess in installed packages	get list of required libraries when installing something from source
0	how to get larger thumbnails in dolphin	why does du report a size of 0 for some non-empty files on a hfs+ partition ?
0	undefined reference to gzopen64 when building samtools	how can a user restrict their own group rights without being root ?
0	what are . / and . . / directories ?	linux mint mate : disable encrypted volume password dialog
0	cakephp shell as cron permissions issue	shell script certification
0	new sl6 system : no hostname ?	debian installation media with non-free packages ?
0	mysterious automated emails	internet working but not all of lan !
0	fedora gui package installer takes very long ( > 15min ) to start	what happens when i close ( ) a file descriptor ?
0	where did /usr/lib64 go and what is /usr/lib/x86_64-linux-gnu ?	how to detect raid 0 from ubuntu live cd ?
0	regular expressions in a shell	cannot edit crontab as non root user
0	connect two virtualbox virtual machines through ssh	thunar crashes when trying to unmount removable devices
0	how to get background color in emacs ?	plymouth scrolling text
0	what is in the /etc/pki/nssdb database ?	does rsnapshot work on fat32 filesystem ?
0	how to set the cpu freq . in linux ?	equivalent of these commands in the following distros
0	bash environment - pasting strings with " special " characters	how to add public ip to cent os
0	rsa keys demanding nonexistant passphrase	get music from subsonic to run in headless mpd
0	bash script needed to run every second	why does linux heat up my computer ?
0	multi-function capslock without x	how to customize vertical panel in cinnamon menu ?
0	prevent closing of plasma-desktop in awesome wm	how do you bypass or skip the intro message when starting screen ?
0	how to backup and restore oracle 10g express in linux vps ?	is that possible to integrate zip and tar . gz files as directory into the file system
0	possible to find out the sizes of data types ( int , float , double , . . . ) on a system , without writing a c program ?	how to select 30 files and do a bunch of sed commands on them
0	use umts stick as a " dial in " modem - no dataplan required	to not autoremove something
0	sudo permissions by ldap groups via nslcd	changes to files do not show up until the partition is unmounted
0	how do i know which process created a file ?	unplug ac causes anacron to stop . no resumumption if cron . daily had already started ?
0	recommended procedure to create a user/group during rpm install	debugging a solaris network issue
1	logic behind deleting files where user does not have right to write	why can rm remove read-only files ?
0	pptp : allow remote clients to communicate with each other	swap on video ram in a vm
0	how do i start a virtual machine in background upon osx system start ?	difference between cp -r and cp -a
0	the common practice to share file for all users on the same machine ?	qt program not invoked by cron
0	where is the error page location of squid proxy server ?	set memory allocation for applications in ubuntu
0	multiple unix sessions	host not found trying to restrict access to yahoo . com in elinks using squid
0	what is the currently recommended way to install node . js on debian ?	programming an atmel board with a usb to serial converter , in eclipse
0	fatal : no bootable medium found ! system halted	deleting all files in a folder except files x , y , and z
0	why does /var/log/wtmp becomes so huge ? how to inspect wtmp files ?	frequent connection aborts with arch-linux
0	does tar -x extract to current directory or does it extract to the source of the archive ?	sort files into directories named by prefix of file
1	accessing files hidden by mounted drive	access to original contents of mount point
0	editing the *bookmark list* buffer on emacs	sd card interpreted as wrong size
0	“no postgresql user name specified” - possible concurrency issues ?	would anyone like to help me start a wikipedia page " list of rolling release linux distribustions " ?
0	create files that both www-data and myuser can edit	linux vps configuration
1	find out exact cpu model , mainboard , ram / server model ?	getting information on a machine 's hardware in linux
0	creating ssh terminal wrapper	mouse and keyboard not working in qemu emulation of beagleboard with latest angstrom image
0	configure uml to generate core file	how does xdg-open do its work
0	upgrading debian squeeze to wheezy - should updatedb . conf be kept or replaced ?	zone_normal and it is association with kernel/user-pages ?
0	book on linux os design ?	config setting for linux kernel compilation
0	kernel modules : . o vs . ko	strange screen ghosting issue with gnome 3.8.4 on fedora 19
1	color matching but print other lines too	convince grep to output all lines , not just those with matches
0	redirecting only stderr to a pipe	how well does alien work for converting packages ?
0	develop / debug c / c++ on ubuntu ?	how to turn off smooth scrolling in kde4
0	java nullpointer exception for sencha cmd	is ext2 suitable for daily use on a desktop or laptop ?
0	centos boot problem	"ps/2 generic mouse " gets lost . how to reload without reboot ?
0	copy/paste does not always work from firefox to terminal	fpath in zsh : functions and site-functions
0	how do free software companies make money ?	how to fetch and process mail in order to execute commands ?
0	scanner works in laptop , not in desktop	no ibus choices in input method tab
0	add autocompletion for custom script	how to rotate video ?
0	dns works half of the time in oracle virtualbox and i can not even maintain /etc/hosts file	problem with installation of camera drivers
0	automatically dim the backlight of a secondary monitor on mac	how to decompress content of various archive types with one command
0	is there any substitute for `lspci` ?	my laptop fans drive me crazy on linux and much less battery
0	applications that would benefit having a 64bit os on a 64bit cpu with maximum of 4gb ram	transition to linux
0	how can i tell grub i want to reboot into windows—before i reboot ?	configure ssh keys for production and dr server
0	given keys in ~/ . ssh/authorized_keys format , can you determine key strength easily ?	pci passthrough with xen
0	iptables : recent module	how to find which processes are taking all the memory ?
0	how to move the existing mount point from /usr/local to /usr in ubuntu 11.04 ?	only output errors / warnings when compile kernel ?
1	how to export a subset of a ' less ' output	write lines to a file from less
0	why mutt keeps asking for imap username and password ?	attempting to detect acceptable ldap base dn defaults for various directory servers in a bash script
0	linux : how to get all login logs from my system	how do i get knoppix to bypass checking the hard drive for itself ?
1	reading and searching long man pages	can i get individual man pages for the bash builtin commands ?
0	htop gives blank screen	luks change encryption key
0	why vnc performance seems to have dropped over the years ?	how do i time how long my pg_restore takes in the command line ?
0	how to setup svn over vpn ?	cpu is free , yet bash script not utilizing all cpu resources
0	qtcreator debugger shows when trying to view the contents of std::map	why " sshd bad prime description " errors ?
0	reliable external wifi adapter for backtrack	how to create a v . imrc
0	where to find the source code for ps ?	how well will the amd radeon hd 7950 gpu perform on linux ?
0	reserve ports for modem	deleted user is still an option in gnome login in debian 6
0	difference between /dev and /sys/class ?	swap to ram , or not
0	sorting by date	suspending my laptop breaks ethernet over firewire , are there commands which can fix it ?
0	dual boot windows xp/debian , i can not boot windows	how to stop g++ linking/including old system headers/libs from /usr/* ?
0	kvm : network partially lost for the host , guests are fine	using pidof with sh -c
0	how to remove a single line from history ?	mapping in gvim : no response
1	file permissions mode ending in @ or +	what does the @ mean in ls -l ?
0	can not get dbus data for automatic statuschange of pidgin	iptables . . . blocking a range without flooding ipset set with ips
1	what is diffrence between "$var " and "${var}"	$var vs ${var} and to quote or not to quote
0	graphics and wireless driver problems on crunchbang	how can i " relink " a lot of broken symlinks ?
1	how do i know which kernel version will have a bug fix i need ?	given a git patch id , how to find out which kernel release contains it ?
0	does vsftpd support plain ftp ?	how can i set the time in centos so that resetting the os does not revert to its default value ?
1	variable substitution in sed	how can i use variables when doing a sed ?
0	coloring the output of conky-cli in dwm	compiling c/c++ code by way of including preprocessor build instructions in an actual c/c++ source file
0	how to alter stored procedure in a mysql database using the linux command prompt ?	how long should it take to generate 300 bytes of entropy on a vps ?
0	rsync timed out	problem with raid5
0	why is grep -o -w not giving me the expected output on mac os x ?	source code of original netscape navigator
0	setting up a gateway between two subnets on the same physical network	inconsistent input redirection behavior
1	how to move a window from one window manager to another running wm ?	reattach to lost x11 session
0	reverse a chmod command on a directory	escape closing parentheses from url with firefox -remote
0	terminal transparency , imagemagick , and x11 root window problem	how to sync multiple palm pda devices ?
1	write a file in /var/lib/sysnews/	redirecting stdout to a file you do not have write permission on
1	how to find the device is connected to which usb hub in linux os ?	how can i uniquely identify which device is on usb `hub 6-0:1.0: port 2` ?
1	how can i clean out duplicate entries from my path ?	remove duplicate $path entries with awk command
0	with ssh x11 forwarding ( `ssh -x` ) , get `can not open display` trying to run x applications	mdadm inconsistencies when run programmatically
1	what are the difference between man1 , man2 , man3 . . . folders ?	what do the numbers in a man page mean ?
0	why does this variable have no value even though it is set in . bashrc ?	linux mint root app theming breaks when changing controls
1	create an alias that runs a command with string replacement from arguments	how to pass parameters to an alias ?
0	turning off gnome 's function key mapping	undo file removed by rm commend on mac terminal
0	how can i recover damaged file from overwritten ext4 partition ?	which process scheduler is my linux system using ?
0	is it possible to " fork " stdout to two different locations ?	is the crunchbang openbox autostart script simply a bash script
1	what is the difference between $@ and $*	what is the difference between $* and $@ ?
0	why freeradius service will not work on centos ?	where is config file of ibus stored ?
0	how to search xterm console history ?	is there any way to play these videos in linux ?
1	redhat find process memory usage	correctly determining memory usage in linux
0	is it possible to mount an nfs partition with a label ?	how to load kernel module in chromium os ?
0	running uuidd automatically on startup on ubuntu 13.10 server ?	can not ssh to github from a remote machine : what should i do ?
0	merge csv files with conditions	illustrate the difference of two squares via the command line
0	how do i use an if-else query based on the day of the week ?	"error setting up gummiboot-efi " on archboot uefi install
0	what is the difference between a windowing system and a window manager ?	how to find files with a certain subpath ?
0	how to control desktop applications over ssh	file attributes does not exist in linux ?
0	git and remote security with encfs	how does " rm " on a ntfs filesystem differs from windows ' own implementation ?
0	dns cache for wget	lxde stuck on login
0	how to repartition pendrive again ?	find greatest last-modified files of /dira/file , /dirb/file
0	how to compare two rfs directories with `diff` ?	mounting an mtp enabled device on ubuntu 12.04.3 lts 32-bit
0	linux max threads count	map workspace switch to mouse buttons in cinnamon
0	why 2tb external hdd is recognized as 800 gb only in ubuntu 8.10	diff -r only for certain file types
0	how to stop a daemon from starting up on boot-up in debian	establish openvpn tunnel in bash script
0	install kernel headers without overwriting old headers	find . -size -1gb in centos
0	can gpl software be bought by a company and still released as gpl ?	is it possible to set a whole hard disk ( partition ) as iscsi target ?
0	ruby on rails missing thor	zathura : how do i add a keybind for exec ?
0	understanding irqs usage	du : only show folders at depth
0	installing crontab using bash script	how to choose luks encryption when installing rhel 6 ?
0	convert display to monochorme	flag a package as being configured on debian even if it is not
0	how to separate numerical values from identifiers	bash one liner to change configuration parameters
0	comm not working to find unique words to file1 from two files	how can i save the last command to a file ?
1	change name of em1 to eth0 in fedora 19 ?	how can i change the default " ens33" network device to old " eth0" on fedora 19 ?
0	kernel memory allocator patch	rsync time comparison - what is the precision of the modified times comparison
0	where is the fork ( ) on the fork bomb : ( ) { :|: & } ; : ?	multiple-boot from iso files does not show os menu
1	how to change the working directory of invoking shell using a script ?	changing current working dir with a script
0	nas device failed and i am attempting to get data back - help !	what does the -z flag mean here
0	x stuck when using opengl	can i change the shell used to run gui applications from a desktop manager ?
0	manage only a section of a config file with puppet ( multiline file_line )	merging files by rows
0	display zsh brace expansion	permissions for apache and ftpd users
0	how do keyboard input and text output work ?	gedit opening an " unsaved document " on opening files with mouse
1	deleting many files except one type	deleting all files in a folder except files x , y , and z
0	exit status on core dump	how do i disable wireless on mint 14 ?
0	format of /etc/hosts on linux ( different from windows ? )	setting up bind9 - lsb-base not in sources
0	how can i replace text in the last non-blank line ?	what is the difference between building from source and using an install package ?
0	why is not sda1 showing up in dev and how can i fix that ?	bash : slice of positional parameters
0	how do i disable the left ctrl on ubuntu 13.10 ?	focusrite scarlett on linux input mapping ?
1	how exactly do i create a sed script and use it to edit a file ?	the way to use `/usr/bin/env sed -f ` in shebang ?
1	how linux know the type of the file it is dealing with ?	file extensions and association with programs in linux
1	how to create an alias that takes an argument in kornshell	is it possible to use a parameter within an alias command
0	refresh env variables after editing bashrc file	adding values of the column that have the same data id ?
0	can someone recommend a linux distro for purposes of just running a dns ?	set default permisson for newly folders and files in linux
0	what is the story behind super cow powers ?	giving more priority to a usb device
0	php exec command has the result 0 even if an error occurs	ioctl : invalid argument for hdio_get_identity
1	pretty tail -f for log files	how to have tail -f show colored output
0	archlinux & openbox - greyish win 95 applications	are there rc logs in arch ?
1	where is avisplit ?	how to find out which ( not installed ) package a file belongs to ?
0	mounting an mtp enabled device on ubuntu 12.04.3 lts 32-bit	a set of libraries like ncurses in a shell script
0	archive files and directories before transfer	where does backtick and single quote come from when denoting commands e.g. `prog ' ?
0	automatically save bash command history in screen session	bash script is trying to execute a variable
0	file extensions and association with programs in linux	booting a newly compiled linux kernel
0	pasting x selection ( not clipboard contents ) with keyboard	phrase express equivalent for linux ?
0	encrypt multiple files at once	changing network config during centos netinstall
1	( standard_in ) 1: parse error	why is variable interpolation not working for variable assignment ( for bash ) ?
0	openldap backup restore	dns troubleshoot . campus domain does not resolve when using campus network
0	linux icon naming conventions	configure wireless network from the command line
0	how do get an html file to open in preferred html application from cmdline on linux ?	host cpu does not scale frequency when kvm guest needs it
0	how to know ip camera address	what is the rtsbpp-polling process doing ?
0	simple script to setenv tcsh or export bash	can vmlinux be used instead of uimage ?
0	why service accounts in linux and unix systems ?	how to get a list of images in a a prticular folder ?
0	how to properly install python packages ?	using an already established ssh channel
0	stopping ubuntu to offer update	how to get lighter ( more white ) themes for xfce ?
0	command like `column -t` that instead keeps separators in output	monitor connected via displayport to dvi adapter will not sleep properly
0	what is the proper solution to a web server trying to write to a directory ?	limit a text file to 100mb
1	how to make " notify-send " work from daemon application	can i launch a graphical program on another user 's desktop as root ?
0	getting capabilities of my cd/dvd drive when wodim --devices does not work	we need a " c " list that contains all the elements of " a " , but does not have any of " b"
0	how to report " sed " in-place changes	shell script - syntax error near unexpected token `else'
0	adding a site to apache2 ubuntu linux	network manager stuck at stage 5 of 5 ?
0	how to tell mutt not to wait for an attachment program to return ?	why is the root directory on a web server put by default in "/var/www " ?
0	ssh fails for an unix server due to dual layer of authentication	better string escaping for hg
0	how to get a list all the " aliases " of a file ( including of type directory ) efficiently ?	how do i get the difference between two timestamps ?
0	just installed opensuse 11.3 , and after 5 seconds , my keyboard goes to sleep for 1-2 characters ?	unable to install backtrack 5
0	shell script - reading from standard input versus a file	is dpkg available for cygwin ?
1	what was superuser password set ?	is there a root password on os x and ubuntu ?
1	which tasks/commands can not be executed with user gid=0 but not uid=0 on linux	what does it mean to be in group 0 ?
0	is there a web browser for linux that implements the trident engine ( internet explorer ) ?	automated sftp upload with curl
1	/usr/ucb/cc : language optional software package not installed	/usr/ucb/cc : language optional software package not installed
0	what is the difference between reboot , init 6 and shutdown -r now ?	ssh + nohup does not work
0	create a tunnel to a local server	home key not working in terminal
1	kernel can not find /dev/sda file during boot	kernel compilation error
1	how to create nested directory in a single command ?	recursive mkdir
1	is there a way to escape a process in bash with out quitting it ?	how can i pause/resume rsync
0	after yum update is it a good idea to restart the server ?	how to resolve a . so dependency
0	how do i decrease font size in eclipse ( linux mint )	how to deny rdesktop access to others ?
0	disable mail notification on login	why can not i enable transmission on freenas 9.2 ? i keep getting an error
0	`mpirun -np n`: what if `n` is larger than my physical cores ?	unreferenced inodes on ec2 linux instance
0	what software should i use to create a hpc ( high performance compute ) cluster with centos 6.5 vms locally ?	how to find the true disk usage on my linux box ?
0	what screensaver should i use under xfce ?	how do you write test cases for a web server that uses posix sockets ?
1	how to remove the last character from every line in a text file	remove last character from line
0	change default position of dialog windows kde 4.10	remapping keys in vim 's " directory view"
0	clone whole partition or hard drive to a sparse file	how to find out a process gets end ?
0	auto de-crypt all luks partitions in debian	how to make options mandatory in ksh script
0	how to install libc6 from unstable on debian	enigmail : automatic display of photo id
0	how to find out what process is writing to stdout ?	slow nfs , nfsstat -c : what is authrefrsh ( aka newcreds ? ) field about in detail ?
0	set up network with static ip and wpa_supplicant on debian	why does ctrl-d ( eof ) exit the shell ?
0	how to send keystrokes ( f5 ) from terminal to a process ?	select yeah-tcp like congestion control algorithm to configure kernel
