0	what could cause a nas mount to respond slowly ?	postgres : authenticate as postgres user in non-interactive script
0	do not halt the boot if an fstab mounting fails	mount compressed tar file and update it
0	how can i clear the list of recently accessed documents in fedora ?	mailx attachment behaviour between rhl 5 and rhl 6
0	use sed to replace line of text with new line including variable	trigger udev rules from systemd
0	cannot succesfully run apt-get -f install	how should i start x after ssh'ing into a remote box ?
0	add-apt-repository raises a python error	qemu : how to access host via sftp
0	merge floppy images in raspbian	how do i get ' realpath ' to find my symbolic link ?
1	less or more - which to use when ?	is not less just more ?
0	incorrect output from cp , rm , and so on	print dialog crashes , any workaround ?
1	what is the difference between "/sbin/nologin " and "/bin/false " ?	what is the difference between /sbin/nologin and /bin/false
1	root user can not do everything ?	redirecting stdout to a file you do not have write permission on
1	hard links versus symbolic links : which one is faster / smaller ?	why do hard links exist ?
0	why my linux does not detect usb storages at runtime ?	slitaz , usb stick , unable to mount iso or to find a filesystem on it rootfs . gz
0	comprehensive /etc/auto . disks script for autofs that takes into consideration all mounted disks , including ntfs and fat32 ?	how to solve this memory issue gracefully ?
0	bad substitution error in zsh shell	`dd` to specific location
1	copy sas file from prior version directory to new version directory	how to copy datasets from prior version directory to latest version directory
0	server returning ' not found ' for "www.host.com" but not "host.com"	for what are disk signatures being used for by gnu/linux ( distributions ) / grub ?
0	zsh %m prompt escape not working as documented under debian linux	different behavior of mktemp ubuntu 12.02 / mint 9 isadora
0	how to start to use httpd with socket activation ( systemd ) ?	bash_profile stops after file call
0	how do i find out what file apache is serving when a port is hit ?	/proc/config . gz is of 0 bytes
0	remove particular characters from a variable using bash	features that linux kernel has and windows does not ?
0	how to customize a backend running job completion message ?	auto de-crypt all luks partitions in debian
0	what is difference between posix and bash and other shell scripts ?	add ubuntu to arch linux dual boot , keeping syslinux , without grub
0	how to recover a file from a tcpdump ?	how to set visudo to use a different editor than the default on fedora ?
0	who is got the other end of this unix socketpair ?	testing , from a script , if audio devices are in silent ?
0	increase space of /usr directory in cent os	what is the utility of piping to `/dev/null` ?
1	how to download files from a remote linux ( ubuntu ) server ?	copying files from unix to windows ?
0	tunneling ssh through multiple machines ( for socks )	change column with awk scriting
0	set terminal title within expect script	change screen resolution of xenserver console for a centos vm
0	remove usb flash-drive write-protection	command line linux distro for i386 and 128mb ram
0	how to make tightvnc listen for incoming connections on port 5900 ?	installed library packages cannot be found on openwrt
1	what is the point of the `yes` command ?	the " yes " command
0	create reinstallable os iso of rhel with custom software	xbindkeys and messed up outputs
0	how to enable crash reports/core dumps/stack trace logging globally ?	monitoring progress/liveness of background jobs
0	copying records into another file based on condition	clear command in konsole
0	lfs-7.5 chapter 6.9 `make check` fails	openbsd anoncvs find out which " tree " i am using
1	how to find heap memory of a running process ?	how do i read from /proc/$pid/mem under linux ?
0	what is the diference between comparison inside if using two or a single equal ( = )	opensuse 11.4 very slow on 8 gb ram i5 processor
0	where is my tablet 's memory card mounted on laptop ?	can not ssh into any server
0	difference between eval and alias commands	meaning of backslash
0	ssh to machines in new subnet - connection timeout	how can i find out how many lines a text file contains without viewing it ?
0	long ( est ) security update support for stable gnu/linux distributions ?	cups - no document types are supported ?
0	how to check the operating system of a server remotely ?	how to get centos 6.5 gui ?
0	how to find out hard disk first & last sector id 's ?	bind9 -- how to find which programs are making which dns lookups ?
0	is there a way to express : `--link` or fall back to ordinary copy in cp ( from gnu coreutils ) ?	output of the " last " command
1	how to adapt a linux like fedora , ubuntu etc . to make my own linux distro ?	how do you properly fork a linux distro ?
0	how can i extract the numbers in the file using sed or any other tool ?	how to determine what instructions a process is executing ?
0	does public and private key remain the same for a user or system ?	how do i find the relevant command for something in linux ?
0	how to start x program on local display ?	how to install my application
0	shell prompt customization ?	where can path to thunderbird be set in ubuntu 10.04
0	less '+> ' /path/to/file	can ssh passwords be sniffed out over wi-fi ?
0	how to rsync only new files	how can i configure /etc/hosts file to point to apache web server ?
0	reply on same interface as incoming ?	can the menu of emacs still be accessible in terminal ?
0	watch command alias expansion	how to forbid the execution of /bin/rm -f * ?
1	how does -k flag work in sort command ?	trying to sort on two fields , second then first
1	how to set environment variable java_home that will be saved on exit ?	how do i set a user environment variable ? ( permanently , not session )
0	is a restart of cron or crond necessary after each new schedule addition or modification ?	alt+tab on fluxbox
0	bash script user promt for prefered directory	mystery of binary files
0	check if a file or folder has been patched already	deleted /tmp accidently
0	an obscure autotools error with epson iscan project	vim : use string from search in replace command
0	pptpd dead but subsys locked ? on cent os	how to use iphone internet tethering via usb with ubuntu 10.04
0	how to uninstall java from sco openserver 5.0.6 ?	mysql : connecting to mysql from : 127.0.0.1 + telling ip tables to allow only 127.0.0.1 for mysql port : logic vs common sense
1	id command does not show all user 's groups	i added a user to a group , but group permissions on files still have no effect
0	what is the exact behaviour of the command : ip address change ?	how to remote linux desktop with audio support
0	whose password should i enter ?	is knowing linux required to learn unix
0	error : can not open display : ( null ) after some time	can we run firefox and nightly simultaneously ?
0	adding a time stamp when moving a file in bash	why does root get permission denied when accessing fuse directory ?
0	shell script to delete all files which are older	is it safe to pipe the stdout of a to b in parallel
0	need advice for tools to use in everyday workflow	error restoring virtual machine
0	shell script to produce duplicate output with increments	how to get wine to work in proxychains ?
0	in my dell r310 server , i would like to install centos , but for raid1 what special care i need ?	opensuse , not running the cron job
0	multiple acls in squid proxy	sshd service is not being started : centos 6.5
1	ubuntu directory permissions - sticky bit - prevent deletion of a file	is there any way to prevent deletion of certain files from user owned directory ?
0	xfce and xscreensaver does not seem to consider keyboard activity " activity " - how change ?	connect psftp between unix and windows server
0	really strange fat32 file listing problem	how to unmount a formerly chroot'd filesystem ?
0	printing pdf with not embedded truetype font ( cups / lpr )	got " syntax error near unexpected end of file " in bash script
0	in `while ifs= read . . ` , why does ifs have no effect ?	serial over lan redirection stops at os boot
0	how does one sync videos from banshee to 7th gen itouch	zip everything in current directory
0	is there a way to see which process invoked a shell script ?	installing usr 5422 on ubuntu 12.04
0	power consumption monitoring problem	what do the " apachectl fullstatus " columns mean ?
0	chromium omnibar not showing search suggestions ?	how to transfer port in virtual box
0	how to get mouse click position ?	is the filesystem hierarchy standard a unix standard or a gnu/linux standard ?
0	linux routing tables	how to find debian packages that would free up the most space
0	suspend linux ( mint ) with external hard drive plugged in	cd and ls in the same call
0	why does vim only activate my highlight configuration after i source my . vimrc manually ?	querying microsoft sql server 2008 from linux
0	how can i dump the contents of a filesystem 's superblock ?	default value for so_rcvtimeo option on solaris
0	my postfix installation is sending out spam ; how to stop it ?	divide a variable by a number ?
0	ubuntu : unable to copy file to dir created under same credentials	how to feed the results of date command into grep to filter results of another command
0	how to know if /dev/sdx is a connected usb or hdd ?	how to copy a public key to your server
0	how can i get wireless and ethernet to work with ubuntu ?	scp refuses to do anything but print usage
0	how to copy between two remote hosts using tar piped into ssh from remote server when behind a firewall ?	changing column separators in a file
0	how to mount usb stick on debian sid ?	how to get the actual keyboard device given the output of /proc/bus/input/devices ?
0	bootloader configuration with gpt , raid1 , and lvm	can not get past efi to install rhel on hp itanium server
0	what is the basic difference between arch and gentoo linux ?	variable definition changes in bash
0	how to prevent xdotool from locking the current window after a script ?	execute command when file changes
0	on debian in fluxbox , gtkpod has no write permission , but does in gnome	where does demo code usually go when installed with package manager .
1	deal with file names with "-" as beginning on linux	how do i delete a file whose name begins with "-" ( hyphen a.k.a. dash or minus ) ?
0	unable to install rpm packages in gnome3 ( opensuse 12.1 )	allow world access to directory under 0750 directory
0	why do inode-based file systems not need reboot after updating library versions ?	is it a bad idea to not have a swap partition on an embedded linux setup ?
0	qemu package not available for rhel 64 bit	performance implications of enabling sadc to collect system activity information
0	resolve all ip addresses in command output using standard command line tools	which bash will expand {1 . . $var} in the same way that zsh does
1	out-of-the-box centos in virtualbox ( nat ) : network is unreachable	centos no network interface after installation in virtualbox
0	adding spacing around text in conky ?	how to install caffeine on scientific linux 6.3
0	what type of linux would need fewer updates ?	cat /dev/null > file . log does not truncate large file in darwin
0	is it safe to use a bash script to create a daemon ?	compgen : ignoring case
1	logging and controlling changes to the system	how to keep track of changes in /etc/
0	how to realign a disk on logical volume with minimum to zero down time	can not access http contents , but https and ssh are fine
1	what disk is a file / directory stored on ?	what file system is my file on ?
0	how to set an alias for a specific file or directory ?	merge csv files by first column
1	remove accidentally extracted files	how to de-unzip , de-tar -xvf -- de-unarchive in a messy folder ?
0	how to install a specific video driver on fedora ?	rehashing /etc/shadow . can i force nis users to change password ?
0	how to mount a dd-image which was created via fmem ( memory dump tool )	vim - buffer names in the cmd line area
0	how do i tell if a wine application uses hardware or software rendering ?	give a warning when something is about to be deleted ( by root )
0	how to configure polkit with kde ?	why i have two /dev/sdx entries with a single disk ?
0	how are directories managed in the filesystem ?	displaying seconds as days/hours/mins/seconds ?
1	129 mb used space shown in the sd card even after formatting it with mkfs . ext4	ext4: how to account for the filesystem space ?
1	what is the fastest way to process line by line in bash ?	how to loop over the lines of a file ?
1	this file must be edited with the ' visudo ' command . ?	why do we need to use visudo instead of directly modifying the sudoers file ?
1	bash : run command in background and capture pid	how to get the pid of the last executed command in shell script ?
0	install pdflatex via ssh on amazon ec2 instance	install system to disk on chip
0	aix 's sed - in place editing	find action not working for specific search
0	delete files that exist in the source with rsync	extend workspace on kali using vmware
0	how can i tell why a process is waiting ?	contradictory information from " top"
0	what modules in the linux source code take care of hot-pluggability ?	how to sort with a delimiter that is several characters long ?
0	how can i get a specific line from a file ?	a virtual file containing the concatenation of other files
0	getting " bad init string " when dialing with wvdial	how to print find match as well as run an -exec
0	xinitrc : starting xterm with tmux causes all windows to share same geometry	some puzzles of how to close file descriptors on sh or bash
0	how to disable messages in unix if mesg and chgrp not allowed ?	how can i return a specific error code at this point in my tcl script ?
0	cw and . does not work as expected in vim on character deletion	match word containing characters beyond a-za-z
0	i get the error " mysqld dead but pid file exists"	command line prediction
1	how do i use sftp to get a directory and all its contents ?	using sftp to transfer a directory ?
0	graphics messed up and unusable applications after gnome shell restart	driver install , kernel source not found
0	can not cat a file or make a directory : contradictory output ?	lvm2 can not wake up suspended logical volume
0	debian 7: add repository for gcc-4.8 and g++-4.8	sharing folders in virtual box
0	how do i prevent ssh remote login from breaking dbus ?	language agnostic configuration file format
0	gnuplot and process-substitution	multiply certain numbers in a text -file by certain constant
0	how to do " if variable a has pattern ' abc ' do x , otherwise do y " ( in 1 line )	yum is not working
0	how to change the default filemanager of the cinnamon desktop ?	how do i use implicit ftp over tls
0	problem installing archlinux on lvm on a luks setup via archboot	custom highlighting for gtksourceview not working
0	how to login as root from bash and do stuff	make xargs pass as first parameter
0	moving folders used wrong syntax and lost them	start-stop-daemon not working as expected , no pid file was written
0	attempting to update amazon route53 using a script , but domain is not being updated	mod_python will not " . /configure " because it can not determine httpd version
0	centos kernel version 2.6.32-431 . el6 . x86_64 bugs	how to convert pdf to ebook format
0	how to install linux mint 17 on ssd and have home on hdd	how to debug csh scripts ?
0	find and replace different columns using awk	find file read it and search for specific identifier
0	tmux split panes in the same window	start x in debian wheezy
1	cycle through one command 's output and use in another command	how to loop over the lines of a file ?
1	log in to multiple remote servers and execute a script	automatically run commands over ssh on many servers
1	what is the difference between ' . ' and ' source ' in shells ?	running script with " . " and with " source "
0	how to install jdk and eclips in linux mint 15 ?	debian/watch for fedora
1	how to pan the terminal beyond desktop window to view all output on watch ?	how can i scroll within the output of my watch command ?
1	upstart script produces folder with question mark at the end . why ?	bash/korn shell script edited on windows throws error ' . . . ^m : not found'
0	how to debug random reboots , with no kernel panic , of an embedded system ?	d-link di-624 h/w ver . d : flashing openwrt
0	memory ussage for tcp or named pipe message buffers ?	as what user is an sshfs mounted folder being accessed ?
0	how to safely reverse dns lookup on ip in a shell script	overheating results in system shutdown
1	store passwords of linux users in plain text - on purpose	how to make user passwords shown as a clear text in linux ?
1	how implement patch for change a arbitrary governor in linux	implementing patch for changing a cpu frequency governor
0	turning off default video output with xrandr when external monitor is connected	install a different version of maven from the one provided by ubuntu
0	how to find which files contain mentions of a wildcard image name ?	laptop does not power off after it has been suspended to ram
0	minicom and xbee module - no feedback	how to extend second centos 5 partition in vmware
0	error using yum in centos 6	linux mint 16: skype uses 100% of cpu core
0	linux : how to auto-configure ip routing based upon ping results	how to uninstall nginx ( installed from source ) ?
0	postfix error : relay access denied	how to iterate over two sets of iterables in a shell script ?
0	is it ' possible ' to transfer a vm to the metal ?	no write access to $home directory
0	confuse about user:group what is the best for /var/www , and crontab user ?	installing xbmc and x server on freebsd
0	equivalent of newusers for groups	how to auto-sync with a plugged-in usb mass storage device ?
0	how can i made a debian ports like repo ?	detect which interface traffic to an ip address goes through
0	how to copy multi-page text from the terminal into the clipboard ?	turn off autohide feature of gnome shell bottom panel
0	omxplayer on different screen	where can i find out how to write a shell script that is as portable as possible ?
1	restore deleted mysql directory in linux	recovering accidentally deleted files
0	how to configure exim to forward all incoming mail to new server ?	reset load averages ?
0	how to add nfs options flag to anaconda ?	how do i add a local user to a box that uses ldap authenticaiton ?
0	sed - find string and append	how to achieve fast user switching with multiple graphics adapters , prevent virtual terminal switch ?
1	wrong permission to /etc folder	wrongly set chmod / 777 . problems ?
0	w/libdbus ( 985 ) : failed to start message bus : failed to open "/etc/dbus . conf": permission denied	iptable rule to ssh over the internet
0	remove all `at` jobs	no room on ep ring ?
1	bash variables in for loop range	in bash , is it possible to use an integer variable in the loop control of a for loop ?
0	can the menu of emacs still be accessible in terminal ?	route vpn gateway traffic via tun0 instead of normal gateway
0	openvpn uses wrong ip-address	command not working in shell script , but works on command line
0	copying linux install from non-raid/x86 to raid/x86-64	what is the right way to shutdown arch linux through dbus interface ?
0	amixer - how to change recording channel ?	gpg asks for password even with --passphrase
0	inserting favorites into shell console	grub2 and kernel vga= parameter
0	is `ln` atomic and reliable on nfs ? could nfs replace gfs in this use case ?	change value of usb " max_sectors " for an entire family of devices
0	dhcpd on interface with multiple address and link labels ( aliases )	how can i identify the variant of unix/linux from a shell ?
0	verifying a ssl certificate 's fingerprint ?	set up a portable development environment
0	unable to open openmpi ? terminal / osx 10.9.1	system freezes when browsing internet
0	add applications to launcher	what package managers do popular unix distributions use ?
1	javac takes over 200% cpu on rhel6 ?	top output : cpu usage > 100%
1	cp with a single argument containing wildcards	what does `mv . /*` without specifying destination do ?
0	how to make a path world-readable ?	using sed , how can i replace a line containing a pattern with contents from another file ?
1	remove whitespace and parentheses in filenames with sed	how can i rename multiple files by removing a character or string ?
0	good ways to host or distribute my patch for the linux kernel mailing list	will a account get locked while logging in ftp mode to a remote server whose password has already expired in unix
1	none of the dot-files is sourced when running bash via ssh , part ii	dot file not sourced when running a command via ssh
0	selinux policy to authorize some users to start / stop certain services	can i delete the mbr from grub ?
0	moving stuff off of ssd to hdd after installation . using mount --bind ? livecd ?	what are the ways of making your own linux distro ?
0	where is the bugtracker for `ifconfig` located ?	can i get individual man pages for the bash builtin commands ?
0	wheezy not accepting commands	how can i determine the cause of cf card corruption ?
0	how do i convert a kernel . config file from 32-bit to 64-bit ?	tool in unix to subtract dates
1	seeking command-line example for adding images to mp3 files	searching for a command line tagging tool for mp3 and ogg that supports pictures
0	change directory with -d in shell script	openssh hangs after login without showing login prompt
0	extract part of the first line of a file	move /var to different partition
0	linux mint not detecting microsd card	apache authorization for the allowed users ?
0	how do i pass a comand-line program a list of files from a directory ?	where is config_apm in kernel - 2.6.38.8
0	what is the default permission of folder /var ?	trouble with postfix install ( timing out from client )
1	note-taking and outlining using vi : on startup , highlight tags and display tags in a preview window	vi : on startup , highlight tags and display tags in a preview window
0	unmet dependencies and sub-process /usr/bin/dpkg returned an error code ( 1 ) error in debian	difference between 3 commands which are used to execute shell script ?
0	what is the gnu/linux equivalent of bsd 's " route get . . . " ?	setting up vga passthrough on ubuntu with kvm : error no iommu_group for device qemu-system-x86_64
0	accidentally overwrote boot sector of encrypted drive : any way to recover data ?	how to create symlink dynamically for dynamically created file in a folder
0	email configuration in cent os	difference between virtual interfaces with ifconfig and iproute2
0	why my $path is not inherited by the invoked bash ?	balance outgoing traffic
0	using regex in ls and mv	ubuntu networking : can not connect to lan
0	wifi broadcom 4313 with proprietary driver ( ubuntu ) randomly stops connecting to wireless networks	freebsd 9 sound driver
0	php file permissions for development machine	what is the difference between `terminator -e ranger` and ranger from terminal ?
0	can i start my main desktop graphical session remotely ?	how to upgrade local server with local upgrade server
0	delete file at specified time non-interactively	slitaz , usb stick , unable to mount iso or to find a filesystem on it rootfs . gz
0	clear unused space with zeros ( btrfs )	how to assign result of sed to variable
0	raspbian migrating to bigger sd card	how do i configure syslinux to boot immediately
1	how to generate kernel crash dumps ?	how to enable crash reports/core dumps/stack trace logging globally ?
0	linux : alternative of install_name_tool of mac in centos	single process accessible temporary file
0	best parameters for ext4 filesystem to handle virtualbox disk images	asterisk , gsm-fxo gateway example of usage
0	lspci machine-readable format ( -vmm ) does not show a kernel module/driver line	can i `yum search` for an architecture other than my own ?
1	mv * folder ( avoiding ' cannot move ' error )	"mkdir foo ; svn mv * foo"
0	what is the proper solution to a web server trying to write to a directory ?	can ping debian vm via ip but not via hostname
0	$origin directive in ipv6 zone files	vga and dvi , set default kernel console to one
0	using fstab file when mounting filesystem	/opt/nvidia-smi from nvidia-drivers pack outputs " failed to load nvidia kernel module"
0	create a cronjob to run php script	what is a framebuffer device and is it required to obtain a higher resolution ?
0	how to fix " login : no shell : no such file or directory " when i can not even login ?	how to diagnose/troubleshoot bogus applets in cinnamon ?
0	xml parsing using xmllint and customizing the output	anyone know the meaning of yy ?
1	what command line tools are available for testing web service ?	automating web requests using curl ?
0	how to get rows between lines ?	finding all " essential " packages with apt
0	audiowerk 8 drivers for linux	i opened a port with iptables but still doesnt work
0	device is mounting as read only ( can copy files as root )	get tmux scroll buffer contents
0	how to exclude all files except specific files with duplicity ?	is it stable to use epel and rpmforge in the same time ?
0	what font is this ?	diff head of files
0	moving a root directory to a separate partition	disable forwardx11timeout without forwardx11trusted in openssh client ?
0	no sound since i first pressed " mute " on my keyboard	shutdown from login prompt in tty
0	uninstall mysql server without removing or breaking any client functionality	explain ev in /proc/bus/input/devices data
0	debian wheezy and perl modules installed into /root not system	full disk encryption with dm-crypt ( without luks )
1	how to create a new user with restricted network access	how to restrict internet access for a particular user on the lan using iptables in linux
