0	what causes mutt to fail in this way	why my dconf-editor has fewer options in elementary os luna than supposed to ?
0	top show high cpu on process but idle on load average	convert formatted dates to seconds since the epoch
1	`sort` disregards question mark	is gnu coreutils sort broken ?
1	wireshark : could not run /usr/sbin/dumpcap in child process	i added a user to a group , but group permissions on files still have no effect
1	use xargs input in eval command	xargs loop with input variable for use in multi-command
1	how to recover files i deleted now by running rm * ?	recovering accidentally deleted files
0	difference between unix os types	pretty print mails from mutt ?
0	keyboard is disabling	how to manually install a cpp library
0	moving from innodb to tokudb	changing bash keyboard shortcuts
1	package management	how to automatically install packages ?
0	suspend-to-ram fails on gentoo with i915	set up nginx to serve files from subdirectories
0	rebinding/disabling ctrl+alt+f#	install g++ when having gcc ( c only ) -- rh6
0	hosting multiple websites on webmin	ubuntu + extract filesystem . squashfs for editing
0	how to login from remote server to my own pc ?	how to update broadcom driver in arch linux ?
0	how can i hide the command list in alpine ?	files have the same inode but they do not link to each other
0	cannot get realtek r8168 ethernet card up	parted not recognizing my current partition on external disk . how to fix without losing data ?
1	alias for a command using ! ! to recall the last command	how can i `alias sudo ! ! ` ?
0	is star faster than gnu and bsd tar ?	cpufreq-set -g performance does not work on arch linux
0	insert new line after non matching pattern	iptables redirect outside requests to 127.0.0.1
1	recursively delete all files with a given extension	how do i recursively delete directories with wildcard ?
0	confused about pam configuration stanza and the roles of the control-flag parameters	attaching two network cards two different drivers
1	disable mail notification on login	disable mail check on login ?
0	what is resume= used for in my grub boot settings ?	stdin : is not in tty
0	what does ` ( backquote/backtick ) mean in bash ?	ffmpeg installation on linux rehel/centos 6 . x
0	touch : cannot touch `foo': no such file or directory	is ' some_program <some_file ' faster than ' cat some_file | some_program ' ?
1	ssh connection establishment too slow	how to speed my too-slow ssh login ?
0	vimperator status bar not working	running thousands of curl background processes in parallel in bash script
0	wdfs mount problem	how can i switch window managers in gnome 3 ?
0	extend sda3 partition in opensuse ?	how to list all styles in zsh
1	distribution for eldery people	what linux is best suited for people new to computers ?
0	what is the ^m character called ?	literally grep the only word in a line
1	how to know how long a process has been running ?	how to check how long a process has been running ?
0	effectivity of shred on different file systems	udev rule for assigning known symlinks for identical usb serial devices
0	system calls in linux	i am failing to build virtualbox driver for linux 2.6.38
0	cp --backup=numbered for folders	how to build lc tool in linux ?
0	vim multiple windows / hide	redirect stdout over ssh
0	i try to setup zabbix server on centos 6 ( close system ) but can find zabbix-server binary file after run rpm install rpm package	debian sheevaplug internet not working
0	pipe in a shell script	launchy : hot keys will not work in xmonad
1	tmux key-bind like to use the windows/super for my meta key in tmux without x	how do i bind the tmux prefix to a super ?
0	what are the two head . s files in linux source ?	does the gateway have to be on the subnet ?
0	difference between useradd -b and useradd -d	how do i correlate /dev/sd devices to the hardware they represent ?
0	disable keyboard shortcuts in thunderbird	mouse cursor disappearing after running gnome-settings-daemon in openbox
0	does `ntpd` set hardware clock ?	in which file is hostname alias persistent , if not /etc/hosts ?
0	what is the algorithm that the `iw` command uses for choosing an access point for a given wifi network ?	disable transparent hugepages
0	how to have a chroot system mount shared with its host ?	route vpn through proxy
1	how can i display octal notation of permissions with ls - and can octal represent all permissions ?	convert ls -l output format to chmod format
1	is possible to change x server without kill client ?	reattach to lost x11 session
0	download one html page with all needed graphics and linked pdf/zip files	dhcp ip lease attempt failed over ethernet and dhcp with netctl
0	listing with `ls` and regular expression	printer " filter failed " errors -- 2 bizarre workarounds
0	why only one active group at a time ?	how to set default tabs only for cat ?
0	how do i know if a partition is ext2 , ext3 , or ext4 ?	what is the most complete ms word alternative ?
0	why does variable expansion without $ work in expressions ?	centos kernel version 2.6.32-431 . el6 . x86_64 bugs
0	what is the :0 terminal in the who command 's output ?	make a bootable cd without iso file but from a cd
0	writing basic systemd service files	how to resize a virtualbox hdd image
0	multiple lan interfaces on one vm rather than multiple vm	how to write a startup dependency on internet availability ?
0	how to control keyboard backlight using hotkeys	os x virtualization for software development
1	rsync and take name/path changes into account	any way to sync directory structure when the files are already on both sides ?
0	what does this hard disk error message mean : “current pending sector count …” ?	where does xfce4-notes store data ?
0	how to call a method of configuring the result of which is active until the first reboot ?	where should i keep personal files so they are safe across system re-installs ?
1	sticky alias command	in bash , when to alias , when to script , and when to write a function ?
0	how can i blank the desktop via the command line ?	/etc/crontab what does " test -x " stand for
1	how to move a window from one window manager to another running wm ?	reattach to lost x11 session
0	how to use encrypted password in shell script aix	i am wondering about cups security . what can i do ?
1	what is the equivalent of apt-file in portage , if any ?	how to find which package provides a file ?
0	locale definition with french republican calendar	how to install cinnamon with slim on arch linux ?
0	how to forward one port to another ( on the same machine ) ?	how to rebuild glibc on arch linux ?
0	how to change places of two data fields/ columns in linux	gedit cannot save in shared folder ( virtualbox )
0	how do i shut down ports remotely without shutting myself out ?	what is the difference between @ and * when referencing bash array values ?
0	lxc and deployment of web application code	batch renaming of files
0	what is the correct repository to add for `debuginfo-install glibc` for rhel 6 ?	htop : show processes of all users except root
0	add arguments when completing a command name	can inotify be used to watch for a specific file to be created without monitoring the entire directory ?
0	where can i find the source code of libgio ?	what does this dd command do exactly ?
0	unable to run darkice on raspberry pi	why can not users besides root create files in a samba share ?
1	what is the '+' in find command for ?	find -exec + vs find | xargs . which one to choose ?
0	grub video memory settings ?	weird ssh/scp progress meter behavior
0	teamviewer is deleted every time , when i install updates for debian	what does this process stat indicates ?
0	set persistent permissions for /var/log/boot . log	how can i control bash 's brace expansion to do the right thing ( which zsh does automatically ) ?
0	fedora auto suspend	how can i use my own snippets by using yasnippet in emacs ?
0	learning the unix/linux kernel	how to know if a process is attached to a tap interface ?
0	sanitize apache access log files ?	how to fix xclock command not found error on oracle linxu 6.4 ?
0	file manager multifunction on openbox	ubuntu x86 10.10 terminal
0	command to hide everything except viewport in terminal window ?	how can i pause in a shell script ?
0	usb 3.0 host controller suddenly stopped working	set tmux status line color based on hostname
0	how to give user root permissions ?	changing /var in running system
0	are all system call error numbers unique ?	how to create an alias for opening a directory on mac
0	creating a shell script that parses and redirects number into next command ?	executing a command after eth0 is available , but before dhcp client
0	bash : is it safe to eval $bash_command ?	why does root get permission denied when accessing fuse directory ?
0	ubuntu 13.04 with linuxlive usb creator and persistance forgets desktop background and keyboard layout	under mint 12 and the latest version of the enlightenment window manager the battery monitor gadget does not report correctly
0	add $home/bin to path for a single user in debian wheezy with lxde	permissions do not restrict access to nfs mount
0	is there a more elegant way to count words and assign that count to variables ?	arping equivalent for ipv6
0	git commit from within a makefile	alsa/asoc : how to correctly load devices/drivers ?
0	how to check if a partition is mounted as ' noexec ' ?	looking at the content of a character device 's file
0	glusterfs & mercurial do not like each other	`kill -s term` works , `kill -s abrt` gets " operation not permitted"
1	edit a command ?	how to make bash put prompt on a new line after cat command ?
1	how to empty a log file ?	empty the contents of a file
0	how to remove n number of lines from a file using sed command ?	nscd uses 100% cpu
0	adjust font size in multi-head setup with different resolutions	file descriptor problem with looping bash script
0	how to automatically apply changes in a folder to another ?	how to permanently remove all mono related package ( libs , apps , etc . )
0	backreferencing with sed	how to remove/rename file which contains special character eg . "-x " using command line
0	failed to open netctl@ . service configuration file	the simplest method to count lines matching specific patterns , including '0' if line is not found ?
1	how to prevent the auto creation of the " desktop " folder ?	which application should i blame for compulsively creating a directory again and again ?
0	is it ' possible ' to transfer a vm to the metal ?	script for emulating windows [ win ] + [ arrow ] keyboard shortcut
0	`openssl`: subject alternative name	oscommerce hacked
0	how do you set the path in a non-shell environment ( kde ) ?	how to set secure permissions for multiple users and multiple websites ?
0	do not have write permission in partition	rxvt and inconsolata ( a font )
0	. /configure , how to provide a different executable during the checking phase	the cursor to a match , edit , the cursor to the next match , edit -- like in a directory ?
1	color ps1 based on previous command output	bash : display exit status in prompt:
0	how does udev create /dev/sr* ? ( or : which rule does create /dev/sr* ? )	crashplan migrate backup from windows to linux ?
0	wheezy : how to actually blacklist ehci_hcd ?	linux md raid : /dev/md0 vs . /dev/md/0
1	list windows shared folders ( samba ) available in the local network ?	how to get list of computers similar to what is shown under " network " in windows
0	view pdf file in terminal	user-specific virtual machines in virtualbox
0	block specific user to send mail	cronjob for automatic db backup to date prefixed file
0	problem with small bash script	postfix cannot find a mysql shared library
0	when a member of multiple groups , how do i set the default group for newly created files ?	copying clipboard-content to file automatically and continiously ?
1	how can i log who creates a directory ?	is it possible to find out what program or script created a given file ?
1	how to determine the filesystem of an unmounted device ?	how to show the filesystem type via the terminal ?
0	openvpn bridge . can not access machines on local network	blank lines of unknown origin when running vim after tput clear
1	command in a variable	use a shell variable to execute a comand
0	"kill the biggest process " button	minecraft server daily restart script
1	what are the numbers after program names in linux/gnu documentation ?	what do the numbers in a man page mean ?
0	how to display meminfo in megabytes in top ?	explain ev in /proc/bus/input/devices data
0	ssh and character encoding	x window opened from screen
0	how would one detect if external command exists in a script ?	all about ssh proxycommand
1	how to start only one application on booting in rhel 6 ?	debian based system , only one gui program , nothing else
0	which process/program create/write the file which i/o is redirected to ?	how to clean up dual esp partition mess
0	"ls -lh " not following the link but " ls -lh linktofile " following it	why is this osx/bsd/gnu sed workaround not working
0	lm-sensors : run specific commands when temperature goes above/below limits	using command line ( linux ) how do i enable the bluetooth adapter ?
0	specify identity file ( id_rsa ) with rsync	how to find out if ubuntu is using dhcp ( ubuntu 12.04 lts gui )
0	how can i change the default arguments to gcc when i run make " filename"	service red5 restart failed
1	how to find out when an application was installed and when the applications/libraries it depends on are installed ?	list packages by installation date
1	what is ssh port forwarding and what is the difference between ssh local and remote port forwarding	how does reverse ssh tunneling work ?
0	bash function output to pipe	what makes a distribution gnu and are there linux distributions , that are not gnu ?
0	change password of a user in /etc/shadow	sinhala unicode ( wijesekara keyboard ) in ibus on ubuntu 14.04 not working
0	why do only some terminals get a pts	gentoo : how to update from one portage only ?
0	discovering metadata about a pdf	change colors in console/virtual terminal
1	how to detect what is causing entries in the " last " cmd 's output ?	why does `last` show '{' and '|' in the tty field ?
0	udhcpc starting before phy is up	download the complete linux kernel collection
0	how to find out the content of a xml file using unix sed/awk ?	possible sftp connection behind a router that is impossible to open any public ports except some standart ports like http ?
0	how to install yoono-desktop-1.8.43 . tar . bz2 in linux	mount -a locks up my script if any of many remote drives are offline
1	input output redirection in bash	what is > > symbol and > & in unix/linux ?
0	atheros ethernet driver	difference between sudo -i and sudo su
0	how to inject data at the beginning of a child process 's stdin ?	sphinx search shutting down after `fatal : accept ( ) failed : too many open files`
0	with nis users , how to find out which users are currently logged in ?	how do i ssh into my samba file server ?
0	downgrading packages with pacman	how do i enable &> /dev/null by default for all sh/bash commands ?
0	linux user security	run gnome-mag on kali linux
1	redhat find process memory usage	real memory usage
0	e763 with vim and spell checker	`mv` has failed because of insufficient disk space , what now ?
0	looking for simple photo organizing software for linux	redirect packets from ppp0 interface to ethernet interface in linux
0	how to stop mod4-p from switching the display ?	how to identify and remove invisible whitespace characters on gedit ?
0	remove notifications icon or make notifications fade after a while	how to turn my linux laptop into wireless repeater ?
1	in bash , how can i erase an alias without logout ?	remove alias from current session
0	how can you trim mp3 files using `ffmpeg` ?	prevent java to escalate cpu usage on slackware64 ?
0	battery issues on a lenovo ideapad z460 running ubuntu 13.10	how to get the authentication status from the last pam module run
0	solaris 10 installation on kvm constantly reboot	increasing command line resolution centos 6.4 virtualbox
0	discovering possible raid configuration of a bunch of disks	what do '+b#' packages versions mean in debian ?
0	can mouse wheel scrolling work in a /usr/bin/screen session ?	best way to back up a system in its entirety ?
0	start-stop-daemon will not start my python script as service	problem with permissions when sharing a mounted filesystem
0	start several fish shells in different directories ?	unable to mount smb share in fedora 14 through nautilus connect to server
0	fedora 16 yakuake keybinding failure ( retracts but will not dropdown )	how do i mount an xfs partition via /etc/fstab and non-root users can r/w to it ?
1	umask base permissions on usb drive	cannot delete a file - permission denied - why ?
0	rerunning the same command with a different parameter	how to get exact file size and file name ?
0	how to tweet using terminal ?	for + array + args
0	using tmux on boot up of linux centos	why does sftp hide the log from stdout ?
0	network disabled	fedora 14 graphics issue
0	what is keeping wayland from overthrowing x in linux ?	stream grep from subprogram , not tail file
0	help in setting up internal bluetooth card on linux 2.6.38	for loop in bash scripting
0	parallelize a bash for loop	cannot connect to ssh from crontab
0	randomly draw a certain number of lines from a data file	download the file from either of two machines using scp ?
0	espeak showing some warnings and input output error	mv a file without breaking a symlink to that file
0	opensuse version of arandr	how to provide a customized function ' complete ' to readline of socat
0	listen a power-button event in python ( no acpi )	how can i delete a folder with lots of subfolders fast ?
0	which usb slot is 2.0 or 3.0 ? how do i know ?	logrotate error " error : error opening /home/web/logs/dev . log . 10: no such file or directory"
0	what is internal 1 and internal 2 ip in freebsd , what is external 1 and external 2 ip in freebsd	full dd copy from hdd to hdd
0	gives access to root user for a period of time	checking & installing files in yum
0	setting permissions with ftp	what causes various signals to be sent ?
0	dual-monitor bugs during resolution setting	mounting multiple devices at a single mount point on linux
1	distro for low-ram with most recent package versions	low-ram linux distro specifically for serving static sites
1	use grep to find all files in a directory with two strings	how to search files where two different words exist ?
0	achieving hexdump-like format , that includes binary strings , on the command line ?	how to download a file using just bash and nothing else ( no curl , wget , perl , etc . )
0	what does -fnoninteractive mean in a call to debconf-communicate ?	failed dependencies
0	learning linux for intermediate user	how to find files ending with ~ and pyc ?
0	does sed write to the file or give a sample output	open source mysql performance tool
0	how to add an ip range to known_hosts ?	xmodmap hanging the system for 20 secs and not sticking
0	practical use for moving file descriptors	how to reverse-match a string in the vim programming language ?
0	firefox process dies after ssh log out on remote machine	determine which process is taking most of disk bandwidth ?
0	how to add all binaries to bash tab completion for some command ?	writing a usb driver from scratch
0	looking for " camera mouse " for linux	cryptsetup luksopen only accepts password via ssh
0	copy file over existing ssh session ?	problem with configure and build php 5.2 on redhat 5
0	why is kernel boot starting too late	is there a way to tell logrotate to ignore open files ?
0	what is the difference between "* . pl " and * . pl in grep ? why does quoting change the result ?	vim syntax highlight certain lines
0	how to terminate tmux session and processes it spawned	bash tabcomplete file names for environmental variable values
0	retrieving fasta sequences using bed file information from locally installed file	simplest way to comment/uncomment certain lines using command line
0	issue on created folder permissions : temporary flag	most " effective " archive to convert to
0	downgrade php 5.4 -> 5.3 on centos 5.10	battery monitor for lxde in arch linux
1	what are some options for lightweight distros , specifically for virtulization ?	which *nix distro is most lightweight for running virtual machines ?
1	what is the ` character or symbol called and what is its significance outside of se code formatting ?	what does ` ( backquote/backtick ) mean in bash ?
0	how to filteri by asterisk or similar expression by rsync in zsh	how does this sed command work ?
0	how to add an ip to hostname file	show status lines of vim and tmux on the same line
0	about the . file and . /directory confusion	where can i find documentation or source code for udev properties ?
0	mount with cifs fails but destination is still accessible with sftp	how can i use just one unified clipboard ? ( even for intellij 's " copy path" )
0	/etc/cron . daily/foo : send email to a particular user instead of root ?	how can i get tlsv1.2 support in apache on rhel6/centos/sl6 ?
1	using regex in locate	regex matching with " locate"
0	on debian testing : how to get a recent iceweasel release ( non-esr ) version without updating to unstable ?	how to change hard disk spin-down time on my wd mybook live ?
1	how to remove a specific string from file name	batch renaming files
0	ksh : cp only based on file size	skype not found on oneiric 64 , but it is right there
1	how to use arguments with ' find -exec ' ?	append line to many files
0	php on centos 6 not working	boot into chroot directory leaves the root partition read-only
0	how to read environment variables of a process	how to change permissions of multiple files found with find command ?
0	the receiving of returns by nagios from script through nrpe	add text to end of every line
0	is it possible to have total no . of blocks taken by same files be different on two pcs ?	how to remove only the content of directories ?
0	is there a way to manipulate lines in logcheck rules before sending ?	exiting a '&pattern ' search in less
0	which unix tool for pixel-art -generation ?	what makes fsck so slow on big filesystems ?
0	how to make duplicates with different names from a single file ?	why does installing debian from dvd download many packages ?
0	how do i determine where dns requests fail in the tcp stack ?	setting kde to crop the laptop 's screen to match external vga device 's ratio
1	renaming files according to pattern	batch renaming files
0	can not reach dns through wireless router	print row contain maximum and minimum value
0	create a command for a linux executable file	rsync from mac ext hd to vps works but not vps to mac
1	converting linux into a router- traffic from eth0:0 to eth0	how do i route traffic between eth0:0 and eth0
0	local client/server communication using tun interfaces	\n prints an n instead of a newline when using sed in maxosx
0	crazy layout with gnome 3 in mint 14	how to force crontab to check for changed files
0	different layouts and specific key mapping for different keyboards	systemd : cause a script to execute *after* networking has started ?
1	why there are multiple folders for executable files in linux ?	/usr/bin vs /usr/local/bin on linux
0	difference between device file and device drivers	port forward to vpn client ?
1	pasting the content of xclip onto gedit	copy file to xclip and paste to firefox
0	how would a script know when running locale-gen is necessary ?	security drawbacks of disabling tty password check
1	how to get exit status from the command before the last	get exit status of process that is piped to another
0	running vlc from a cronjob : how to get a dbus connection ?	reason for the inability of root to send a fatal signal to pid 1/init
1	how to assign words with spaces as a whole name to variable in shell script ?	why does my shell script choke on whitespace or other special characters ?
0	safely convert unicode strings to printable characters	how to install octave in scientific linux 6.5 ?
0	can i make a symlink point to different locations on different machines ?	how to record the actual running time of a program with other programs running ?
1	how can i make a process i start during an ssh session run after the session has ended ?	keep ssh sessions running after disconnection
0	how can i resolve local ips to hostnames ?	chaining && and || in the shell
0	correct owner , group and permissions when mounting an image file	scp wildcard not working in zsh
0	file not displayed using vi but visible with command ls -l cd*	bundle my scripts to make an installer in unix ?
0	/etc/rc*: why does this command stop nfs services from starting at boot ?	integer expression expected error in line 27
0	trying to compare a variable that is multiline in a if comparison	libreoffice 4.2 ppa archive size ?
0	tightvnc server on debian closes the connection when i open a program	how to parse this output and put it into an array ?
0	how to find out the right string syntax for my bash ?	extracting lines around keys from a file
0	how to fix " login : no shell : no such file or directory " when i can not even login ?	configuring networked printer to archive print jobs
0	did all of the requests for comments directly affect the design of unix networks ?	continuous testing of a c++ project on github with different linux distros
0	different access rights for different groups for a folder on linux	compiling freertos on ubuntu
0	what is the status of hidpi support in xfce ?	need help setting up networking for kvm on gentoo with exit to wifi adaṕter
0	how to make a script run at boot time in debian wheezy ?	different behaviour of systemctl suspend when executed via i3 wm key binding
0	pass flags to xargs	get cpu utilization stats from c program
0	right settings of vsftpd ?	search for a string inside all files inside a war
