1	why does halt not turn the machine off ?	what is the difference between halt and shutdown commands ?
1	mysql different database location	mysql database no space available
0	move line in joe 's own editor	man folders and manpath
0	how do i limit the number of getty processes started ?	histtimeformat modification . in /etc/bash . rc or /etc/profile ?
1	how to setup kiosk type functionality in linux mint cinnamon ?	debian based system , only one gui program , nothing else
0	are there alternatives for `dd` ?	how to use 32 bit compiled shared object ( . so ) file on 64 bit rhel ?
0	how to download files with wget where the page makes you wait for download ?	how to interpret an octal or hex dump of a binary file ?
0	openldap error while adding an acl	is there any way to play gpu accelerated video without x ?
0	sending raw video stream over network to an encoder	xfdesktop ( xfce4 ) broken ? ( can not set wallpaper )
0	wrong behavior of xargs	lost mouse pointer in xserver
0	on openbsd , how do i recompile openssl with md2 support ?	distro for a startup ?
0	what is the interface scope ( global vs . link ) used for ?	stdout , stderr and logging using the script command
0	selective stripping on raid-0 with mdadm	unable to ssh into google cloud server after reboot
1	convert the permissions in `ls -l` output to octal	convert ls -l output format to chmod format
0	upgrading curl in centos 5.6	jetty repositories for debian lenny 5.0 ?
1	why ln -s creates relative broken links ?	create a symbolic link relative to the current directory
0	file manager multifunction on openbox	"kernel panic - not syncing " after building centos-6/elrepo 3.10.19 kernel from source
0	will i be able to use old fashion interface in gnome 3 ?	"tar ( child ) : cannot connect to https : resolve failed " when installing bitmask
0	how to allow to run su instantly after i added the user to the appropriate group	shell script for auto-touching files
0	should openvpn point to point tunnels be on different ports ?	replace words in file using sed command
0	double rm verification in zsh	is using shorthand quick substitution of history expansion problematic ?
0	how to detect what display is active/has input focus ?	can a linux distro be closed source ?
0	scp wildcard not working in zsh	downgrade php 5.4 -> 5.3 on centos 5.10
0	error:while updating	why is not there a truly unified package manager for linux ?
1	choose a terminal emulator from java	what is the most portable method of launching a terminal emulator ?
0	/dev/null-like automatic trash directory for file moves ?	kubuntu does not reconnect to wifi after waking up from sleep
0	what happens when we type a simple command on shell ?	is there a update manager whitout gnome dependencies for xfce ?
0	using "&&" is not effective for curl submit form ( do not execute second line if first line fails )	trying to connect to gateway in static ip network
0	having xwin start by default on system boot	adding custom compose key sequences
0	how to convert a zimage into uimage for booting with u-boot	easy way to use hardware mixing ?
0	how to migrate between two keyrings in gnome-keyring	is it possible to source again . bashrc and . zshrc and remove functions once inside them without restarting ?
0	samba and active directory limitations	i need to zip all the folders available in a path
0	how to list files sorted by modification date recursively ( no stat command available ! )	tool to watch latest software releases from upstream ?
0	what does " command1 -> command2" indicate in results from my ls -al ?	exporting logical volume to mac for use as time machine drive
1	why do i get dropped into a grub rescue console ?	how can i fix/install/reinstall grub ?
0	directory/file naming conventions when storing media collection on linux	how to undelete/restore the deleted files in ubuntu linux
1	how to avoid unnecessary deletion and recopying of moved folders when using rsync ?	any way to sync directory structure when the files are already on both sides ?
0	when i schedule a command with ' at ' , can i change where the output is mailed to ?	xdelta3 fails to decode on block device
1	pwd resolving symbolic links	pwd without symlinks
0	how do i disable a keyboard shortcut in gnome-shell ?	edac ( error detection and correction ) infrastructure in linux kernel
1	remotely control an xorg session	open a window on a remote x display ( why " cannot open display" ) ?
0	determining lvm extent numbers for given file	reinstall grub from livecd
1	must parse ls -al output and get file or directory name	output only file names ( with spaces ) in ls -al
0	how to create a git repo using nginx ?	when a process will go to ' d ' state ?
1	utilizing a newer standalone glibc	is there an easy method for installing binary builds of glibc ?
0	nfsv3 with kerberos " unmatched host " error	why am i getting an attributeerror when i try to use pyjamas desktop on fedora 15 ?
1	where can i find out how to write a shell script that is as portable as possible ?	resources for portable shell programming
0	play last few seconds of mp3	in bash shell , how to insert the previous line inside the current line ?
0	create an alias that runs a command with string replacement from arguments	looking for a java class in a set of jars with find , unzip , grep
1	kernel can not find /dev/sda file during boot	kernel compilation error
1	trigger action each time a file is modified	can a bash script be hooked to a file ?
0	how to setup gparted video mode in oracle virtualbox ?	how to list similar lines ?
0	mark occurrences of keyword with a different color	cannot open slime-helper . el
0	activate wifi on runlevel 3 startup	grep : count total number of occurrences
0	installing yum packages by pattern	file command database and identifying text files
1	how to sed and put back the part of the match ?	how can i replace text after a specific word using sed ?
0	how to stop bash replacing commands in history with asterisks ? ( ‘*’ )	apache cgi proxy returning 502 bad gateway on fedora
1	emptying a file for root user does not work	redirecting stdout to a file you do not have write permission on
0	why does sigusr1 cause process to be terminated ?	testing c++ code with bash commands
0	how to change the xorg gamma/brightness ?	how to i change gnome 3.8 top bar font ?
1	is there a way to run process parallelly in the loop of a bash script	parallelizing a for loop
0	bash script to convert all *flac to * . mp3 with ffmpeg ?	sending email without including an origin ip address in headers
1	route a particular process over another gateway	redirect traffic through vpn on an as needed basis
0	combining 2 different cut outputs in a single command ?	reverse grepping
0	make : i686-linux-gcc : command not found	how to add a user to sudoers file ?
0	how do i compare a file with a floppy image and the actual floppy 's content ?	emacs on minix 3 ?
0	best parameters for ext4 filesystem to handle virtualbox disk images	why bash unable to find command even if $path is specified properly ?
1	what exactly are linux kernel headers ?	what does a kernel source tree contain ? is this related to linux kernel headers ?
0	find not recursive when file at top	cannot install libevent on centos 6.5
0	editor for markdown tables	how to detect what display is active/has input focus ?
0	comparing files in unix columnwise	why does ` ! 45` get replaced with `top` ?
1	/usr/ucb/cc : language optional software package not installed	/usr/ucb/cc : language optional software package not installed
0	how to make sure that i use the latest version of bash ?	do i need root ( admin ) permissions to run userspace ' perf ' tool ? ( perf events are enabled in linux kernel )
0	how should man pages be installed ?	in crontab is it possible to specify a user from a variable ?
1	unix useradd - audit list of users added to system	local account creation date
1	how can the order of execution in the shell as it relates to redirection be upset about 1 time out of a 1000 on my system ?	why does the command shuf file > file leave an empty file ?
0	kensington orbital scroll wheel two consecutive button press 5 when scrolling	printing evaluated prompt placeholders to screen
0	problems using ntfs file system with kali linux	what could be the use case of changing modified time of a file to the future ?
0	scp between two servers with different pem files	rpm build error : d : may free score board ( ( nil ) )
0	what is the difference between ulog and nflog ?	device mounted read/write , but can not delete files
0	make script executable from vi/vim	kill user processess on logout
0	can a mounted encrypted filesystem be safe from root ?	how to set up mousebutton4 on teamspeak
0	download manager for linux	openbox menu . xml : keyboard accelerators possible ?
1	routing based on source ip - a continue	routing based on source ip
0	how to build lc tool in linux ?	how can i record the sound from multible sources with gtk-recordmydesktop ?
0	active directory domain with samba or other tool	how to count the number of words and print the lines that match exactly a given pattern ?
0	how can i get a count of files in a directory using the command line ?	making the spotify linux client ( for debian ) run on rhel
1	execute bit on directories , but not files	how to apply recursively chmod directories without affecting files ?
0	exit vim more quickly	groff to ps conversion
1	can you explain me about following make file of " lc " tool	how to build lc tool in linux ?
0	is there a way to detect null bytes ( ␀ , nul , \0 ) in sed ?	how to get brightness keys working inside openbox session ?
0	boot halts if time if reset	how to set mss manually for ipv6 in linux ?
0	outputting last modification date to another file ?	how to maximize the use of computer performance core i7
0	install centos in a virtualbox to a compact flash and use it on a mini pc	edid information
0	ram and flash directories in embedded system based on linux	public key authentification does not pass , why ?
0	what does aux mean in `ps aux` ?	can connect from rpi to laptop , but not other way around
0	how can i disable the x-server on fedora 17 ?	why bash encapsulates syntax error both with grave accent and with an apostrophe ?
1	server does not accept public key for ssh login without password	why am i still getting a password prompt with ssh with public key authentication ?
0	how to specify which interface an application uses ?	graphical login of a local user remotely
0	where is filename stored on a filesystem ?	my echo command does not accept switches ( echo -n or echo -e )
0	how does file descriptor re-assigment work ?	using awk to parse aix 's lsuser output in stanza format
0	wifi-hardware seems not to be enabled	are ubuntu ppa repositories usable on debian wheezy ?
0	how can i exclude proftp authentication failure messages from logwatch ?	rescue value from second last line
0	undo iptables modification	recursively rename subdirectories that match a regex
0	logrotate error " error : error opening /home/web/logs/dev . log . 10: no such file or directory"	disable gnu indent backup files
0	red hat linux command line character underscore problem	autofs home directories with passwordless logins
0	how to use tshark to do this task	download packages for different distribution with apt
0	is there a way to monitor progress of a btrfs rebalance ?	store newly self-built installation , with old binary-installed installation
0	can i see in history output from which directory i had actually issued a command ?	gnu screen and vi - visualization issues
0	highlighting text in shell	what is and how to use ps1 \#
0	optimal linux distro to install to sd card to use as usb-bootloader for pc ?	adding a new interface on pfsense [ esxi 5 . x ]
1	what is the difference between " command directory " and " command directory/" ?	when should i use a trailing slash on a directory ?
0	append variable string to itself	debian sid /etc/debian_version
0	is it safe to leave a enc folder mounted ?	are there widespread filesystems which represent directories with structures optimized for fast lookup ?
0	connect to the internet on a vpn connected server without internet	how can i solve segmetation fault on ns2.35
0	can not access to samba4.1 shares on gentoo box	how to ignore " certificate is not yet valid " errors
1	what is the difference between interactive shells , login shells , non-login shell and their use cases ?	difference between login shell and non-login shell ?
0	how to see the commands executed in another shell ?	why can linux show a file name containing character '/' ?
0	solaris " clean " group files ( or for that matter any text file )	transpose several columns ( of varying lengths ) into rows
0	home folder unintentionally exposed while using samba shares	qemu no boot device found !
0	how do i preserve the history file of cygwin bash across independent sessions ?	automate installation of virtualbox guest additions via command-line
0	setting tab width in c++ output in bash	how to reorder a large number of columns ?
0	log from tcp port breaking messages on characters other than newline	change screen " hardstatus " color dynamically
1	how to recover a sd card ?	how to recover data from a bad sd card ?
0	redirecting loopback traffic through a router	how to sort files based on the json property value inside the file ?
0	remove branch from all submodules	js indentation on emacs
0	how to forward one port to another ( on the same machine ) ?	why `sed` does not return exit status if regex does not matched ?
1	parameters of script	how do i handle switches in a shell script ?
0	how can i alter the appearance of " qt::ibeamcursor " in retext ?	why i sometimes see " init : version 2.88 reloading " in the console ?
0	perform floating point arithmetic in shell script variable definitions	find a particular nesting of directory names , e.g. . . . /project/dir1/dir2
0	starting jackd after using other audio	changing cifs permissions on freenas ?
0	ls command output to file	pam-auth-update does not display prompt screen or log any failure
0	how to set default tabs only for cat ?	connect to a vpn from a linux virtual machine
0	can not boot slackware after installation . liloconfig not found	online remount btrfs of root filesystem with different subvolume ( snapshot )
1	mapping single key ( such as ' f1' ) to multiple keys ( such as ' ctrl+c' ) in gnome	binding single key ( such as ' f1' ) to multiple keys ( such as ' ctrl+c' ) in gnome
0	is there a pbuilder-like environment for redhat ?	cannot type keyword symbols in linuxmint
1	trying to search inside chmod with command	find all commands with wh , find by part of keyword in man page
0	spamassassin blacklist_subject not translating utf8 characters	prompt user for sentence and store it without being disturbed by spaces
0	how to disable live shell session command history under aix 5-6 ?	ethtool get permanent mac address returns all 0 's
0	why does dig take much longer than dns query time ?	how can i prevent ffmpeg intermmittent faulure with `avc : nal size` error ?
0	outputting common lines from 2 files and uncommon lines from both the files in one output file	what are the differences between various vm software ?
0	how to check will my computer is going to reboot ( or shutting down ) ?	can i create a software raid 1 with one device
0	bash script returns " command not found " when outside the source folder	recover deleted files on raspberry pi ?
0	partition table is corrupted after using testdisk	how can i use bash as my login shell when my sysadmin refuses to let me change it
0	mass mv on files and changing filenames	how do you implement layout with the autostarting of applications in the i3 window manager ?
0	how to write a column of consecutive integers in vim over existing text ?	virtual machines on different x servers
0	bash is not finding a program even though it is on my path	tar : short read
0	modify /etc/xdg/lxsession/lxde/autostart before boot	adding postgres bins to path : should i `export` ?
0	additional keybinding combination to copy text to clipboard	slight change to command to compile c++ program causes error
0	how to change partitioning ?	share config among ssh aliases
0	how can i make vim a full fledged ide	using mjpg stream as a webcam source
0	iptables : rules for tftp server	perl + combine exec command with perl one liner line
0	how can i put some comment in yum installation list ?	can i install a distro booted from a drive to the same drive ?
0	splitting stdin to different outputs in bash	scrollability of text when using tmux ?
0	how can i force the ip address & hostname to only be exposed as domain . com on a tomcat server ?	how to edit command line in full screen editor in zsh ?
0	automatically save bash command history in screen session	call a script if a zenity window is minimized , resized or moved
1	scp automation in production environment	shell script - how to scp into remote server and download files and protect password
0	unable to boot vm : error 13: invalid or unsupported executable format	build kernel with multi_v7_defconfig setting
0	using exec in find over ssh from shell script	increment look back value within a configuration file daily +1
0	how to make my tmux which starts via crontab @reboot use bash ?	return to directory location prior to cd-ing to home directory
0	understanding the buddy allocator	stereo capture with v4l2
1	program for making a complete iso-image of damaged dvd by multiple readings ?	how to rip a scratched dvd-video ? ( a " cdparanoia for dvds" )
0	why uninstalling openjdk automatically triggers an installation of the alternatives on zypper opensuse ?	how to download opensuse 12.1 throught `wget -c` ?
1	how to recover : deleted accidently important files	undelete files from local fileserver
0	previous login notification	libvirtd not suspending guests
0	reading from /dev/random does not produce any data	grub with two hard drives
0	get network under network-manager 's management	administratively spread several thunderbird per-recipient rules for some users ?
0	how can i kill a process whose parent is init ?	how can i dump the contents of a filesystem 's superblock ?
0	how to uninstall boost 1.49 and install boost 1.54 in ubuntu ?	how do i keep my display output from toggling by itself ?
0	how install xfce > = 4.10 from backports repository in debian	destination ip mangle table
1	getting expr : syntax error on index	why does my shell script choke on whitespace or other special characters ?
0	how to prevent a qt/gtk app ( calibre ) from using colors defined in . xresources ?	advanced ntfs partition file recovery techniques for damaged drives ( io errors ) ?
0	how to create a folder which will change its contents’ ownership to what the folder has ?	getting output from vivopay-serial converter
0	uefi and puppy linux	why are these xrandr commands not working ?
1	can linux systems on multiple virtual machines share the same swap partition ?	are there any side effects when two distros share a swap partition ?
1	linux network stops when transferring files	how to diagnose faulty ( onboard ) network adapter
0	where does top / gnome-system-monitor get its information about cpu usage ?	how to install liquidsoap & airtime on centos 6.5 ?
1	purpose of hard link and soft link	what is the difference between symbolic and hard links ?
0	rhel time changes automatically	is openbox a non-reparenting window manager ?
1	executable not visible when run with sudo	what environment do i get with sudo ?
0	sendmail configuration with user mapping on solaris	can not run certain fullscreen applications
0	do parentheses really put the command in a subshell ?	why is not gnu/linux sus v3+ compliant ?
0	usb hard drive boot problem	in virtual machine manager , is there a way to add disk space to an existing disk ?
0	rsync from multiple folders to one	crunchbang - install option not working
0	how can i cd into a directory as root ?	command line join of password protected wireless networks in ubuntu , arch linux , or other distros ?
1	ls * . * gives : "* . *: no such file or directory " message	cannot expand asterisk without proper permission
1	zsh autcomplete not updating path executables	rebuild auto-complete index ( or whatever it is called ) and binaries in $path cache in zsh
0	should i disable hyperthreading when concerned about performance of single-threaded applications ?	cgroups - memory subsystem
0	why can not i have a folder and a file with the same name ?	help to understand iptables forward chain with dnat
0	linux distribution for the amd geode lx 800 ( i586 )	for output weird
0	how can i manipulate the content of a file , by duplicating and changing some parts ?	why does not my bash script recognize aliases ?
0	send a specific signal to an external usb keyboard ? or , how do i fix fdopen ( ) ?	swap ( exchange ) two big files in limited environment
0	how to configure a computer as a hotspot ?	symlinks and permissions in backup archives
0	user access permissions	how to find files not of a certain type ?
0	sudo does not work in chroot	pipe not picking up stdout
0	how can i keep color codes with grep input ?	what is the inverse of idle in /proc/stat ?
0	remove gpt - default back to mbr	auto-update on scientific-linux 6.1 64bit
0	unknown btrfs error , partition will not mount	disabling hibernation in debian testing ( lxde )
0	how to stop application from being suspended by ctrl+z ?	launch iceweasel ( firefox ) window undecorated
0	configure wget to not clobber good data with empty data	what is the best way to convert crlf to lf and the viceversa for c++ files in my project
0	stuck at " make install"	ssh tunnel to vnc on a windows 7 system . error : tunnel device open failed
0	log if no network	how can i use awk to extract url 's from a html file ?
1	extract a single file from a tar file and put it to another directory	search for a file inside a tar . gz file without extracting it and copy the result to another folder
0	how do i set the user of php-fpm to be php-user instead of www-data ?	why does not setuid not work ?
0	why is redirecting stderr to /dev/null done this way ?	would it be possible to not have the network link cycled on loading the kernel module ?
0	difference between alias in zsh and alias in bash	how to resolve upgrading problem in ubuntu 13.10 ?
1	expansion of * , # , % - what do they mean ?	how do ${0##*/} and ${0%/*} work ?
0	how do i extract the content of quoted strings from the output of a command ?	booting from usb fails as i try to install elementary os on my pc
0	how to create ico file with more then one image	openbsd anoncvs find out which " tree " i am using
1	where can i find the official file hierarchy standard for unix ?	resources to learn linux architecture in detail ?
1	how to make compose work in gtk and qt apps ?	use the system compose database in gtk applications
0	does ksplice work with updates from repos ?	wget a file , logging the output and showing the output on prompt
0	proprietary ati driver on linux not working with glut	changing android files in root directory
0	how to use domainkeys and dkim both with exim on freebsd server machine	why does my one instance of vlc have many processes ?
1	what does "--" mean in linux/unix command line ?	what does "--" ( double-dash ) mean ? ( also known as " bare double dash" )
0	locked out of server with ssh - anything i can do ?	strace works for some builtin commands
0	execute a command on user logon	devices get renamed when sata disk attached
1	quotes exercise - how to do ssh inside ssh whilst running sql inside second ssh ?	quoting in ssh $host $foo and ssh $host " sudo su user -c $foo " type constructs
1	how to set environment variable java_home that will be saved on exit ?	how do i set a user environment variable ? ( permanently , not session )
0	how to delete old packages installed by pacman in arch linux ?	how to bind usb device under a static name ?
0	reinstall xorg with yum - fedora 18	rsync --delete deleted most files in the destination directory , why ?
0	do we need to chmod a shell script before it can be rsh	is it possible to install windows and linux on the same partition ?
0	run a process to particular/dedicated pid only	linux distribution geared towards developers
0	no password prompt when using rsync remotely ?	how to avoid overwriting existing files while using tar command ?
1	how to find files ending with ~ and pyc ?	how to use find to remove * . py~ and * . pyc files at once ?
0	ssh connection does not work while browsers do	debian/xfce virtualbox guest on a mac : how to use home and end keys ?
1	sort only on the second column	trying to sort on two fields , second then first
0	is it possible to obtain os x versions of unix tools on modern linux distributions ( like ubuntu or redhat ) ?	openswan connecting to multiple right subnets not working
1	how to remove all white spaces just between brackets [ ] using bash ?	replace text between brackets
0	problem updating to kde 4.9.1	what are the main differences between bsd and gnu/linux userland ?
0	how to connect to mysql only once ?	unix command to find files read by specific user
0	kswapd0 takes 99% to 100% cpu in rhel 6.3	how to restore gnupg key after reinstall ?
0	how to prevent cron emailing on termination	linux , disable /dev/fd0 ( floppy )
0	how to print unicode glyph names for input string ?	snapshot large changing files
0	setting a network hostname does not work	kde clipboard - dictionary integration
1	contradictory information from " top"	why does top report the incorrect cpu usage ?
1	how to put a command 's result into a variable ?	storing output of command in shell variable
0	difficulties to establish a ppp connection to a gsm provider	how can i switch window managers in gnome 3 ?
0	run wc and display only the word count	what are the effects of increasing hard and soft limits for ldap user
0	linux tools to treat files as sets and perform set operations on them	installing java into ubuntu 10.04 firefox/chrome
