0	change openvpn client , can i use the same server configurations using scp ?	how to slice a text file into several files of 100 lines each ?
0	how to move a file without preserving permissions	free video editing software for linux with audio tracks auto matching
1	combing head and tail in a single call via pipe	command to display first few and last few lines of a file
0	which scheduling algorithm is used in linux ?	alsa driver update in client machine without make
0	questions about kernel releases	non-ascii characters handled incorrectly on command line
0	alsamixer - deleted the alsa* from /bin - need to recover	when should i create a new volume group instead of a new logical volume ?
0	how do i create a gui application launcher for xfce4-terminal with fish but inheriting the environment variables from bash ?	how creating forcefsck file triggers file system check on reboot ?
0	which services should be disabled ?	freebsd and windows show different times
0	changing file time using touch	bash ping to return ' alive ' ip addresses
0	configuring org-mode to open pdfs with evince	convert json numbers to strings in the shell
0	setup ntp client with embedded device	$bashpid and $$ differ in some cases
0	fedora 18: unable to connect to a wlan network	colorize bash console color
0	wait for autossh connection to complete	why are spin locks good choices in linux kernel design instead of something more common in userland code , such as semaphore or mutex ?
1	run script when file is created	how to run a command when a directory 's contents are updated ?
0	graphics fuzzy in ubuntu 12.10	what is commit=0 for ext4 ? does mdadm not support it ?
0	mapping between logical and physical block device names	do vmpeak & vmhwm have any measurement periods ?
0	what distributions have rolling releases ?	awk : expanding first field along the column
0	arch linux on virtualbox internet connection issue on virtualbox	which folder should i write to for my intermediate files , as a dev ?
0	can only get one network to be accessible from outside	failed to start ldap server centos 6.5
0	yum does not work on rhel 6.3	arch linux installation , " could not create filesystems"
1	setting environment variable as a function of another env variable	how to defer variable expansion
1	why do we use double hyphen in " tar --anchored " and single hyphen in " tar -b " ?	single dashes `-` for single-character options , but double dashes `--` for words ?
1	how do i create a linux distro ?	how do you properly fork a linux distro ?
0	how can i get `cacafire` to show up in the original gnome-terminal , instead of a separate window ?	how can i solve the error in svn mailer . py ?
0	is it possible to mount an nfs partition with a label ?	how to find tty from which a particular cmd " scp " is executed
0	google compute engine with multiple ssh users , debian	ssmtp : cannot open mail:25
0	hugin 2012 build fail on gentoo	mozilla sync server and mysql auth
0	arch-linux : xmonad configuration	why do new terminals in awesome spawn with shlvl> 1 ?
0	what does the line $ ( rpm -e %fedora ) mean ?	firefox not rendering some pages well
0	ssh tunnel through middleman server - how to connect in one step ( using key pair ) ?	how to hibernate in debian jessie
0	bash adds extra single quotes	intercept incoming tcp/ip packets on linux and perform nat
0	automatic cleanup of bash history	zoneminder compiling error : " missing binary operator before token " ( ""
0	shortcut for tabn & tabp in vim/vi	tcpdump and https
0	shell script to merge properties file ( sed/awk/comm/diff ) for rpm upgrade	low sound volume on lenovo laptop under fedora
0	how to dump the icon of a running x program ?	indentifying a linux container
0	changing resolution : with x and without x	did this tutorial block pings to my server ?
0	add users from dat file	zsh : is it worth the switch from bash ? is it the time ?
0	how can i examine the contents of /etc/localtime ?	"safe mode " on linux ?
0	convert djvu to pdf	specifying tmux command-prompt line
0	parsing arbitrary natural language dates under bsd	can not connect wirelessly to internet in crunchbang 10
0	run 64 bit app on 32 bit system ( ubuntu )	wireless troubles with netgear wna1100
0	how to change highlight color in calibre ebook reader	how rename directories tree entry by entry
0	how to set password for users in aix using single line command ?	installing openssl shared libraries on centos 6.5
0	xterminal dosen't pass key-strokes to emacs	bash not reading $terminfo on login ( over ssh )
1	linux rename file beginning with "--"	how do i delete a file whose name begins with "-" ( hyphen a.k.a. dash or minus ) ?
0	how to run two virtual x11 screens on a single monitor ?	naming process in init scripts
0	mac osx vs linux unix-ness	how to install mumbojumbo games on mint ?
0	install opencv-2.4-9 on centos 6.5 with cuda 5.5 support	insert newlines with vim
1	why bash increment : `n=0 ; ( ( n++ ) ) ; ` return error ?	why does a=0 ; let a++ return exit code 1 ?
1	restore overwritten /usr/local/bin	recovering accidentally deleted files
0	csh : is there a prompt outside of $prompt ?	accents not working on libreoffice . how to report bug
0	permission change to exclusively all folders ( or . extension files )	which gui svn client allows searching through history ?
0	in which units does tar --checkpoint measure ?	sed one-liner to replace word-medial capitals
0	phpstorm only runs on gnome or kde	how to install multiple glibc on fedora
0	locate enscript reported non-printable chars	what is the difference between /etc and /usr/local/etc
0	how can i list the info for an array of /dev/disks using bash expansion or substitution ?	how to make traceroute trace beyond 30 hops ?
1	working of the [ 0-9 ]	working of rm/ls with [ 0-9 ]
0	locked myself out of amazon ec2 ssh - this service allows sftp connections only	hard drive/device partition naming convention in linux
0	try to disable console output , console=null does not work	apf firewall & ipset
0	can not get upstart service to honor capabilities ( 7 )	script to search inside non-root and tmp directories
0	how to prepare a headless machine ?	lsusb outputs " illegal instruction " - why ?
1	find -exec {} vs . find -exec '{}'	gnu find and masking the {} for some shells - which ?
1	tail display whole file and then only changes	tail -f but suck in content of the file first ( aka `cat -f` )
1	how to take ' password ' like input in shell script ?	reading passwords without showing on screen in bash scripts
1	copy files without changing owner	unable to preserve ownership in a copy but able with a move ?
0	trying to install spotify with libssl1.0.0	gcc : -pthread : no such file or directory
0	ssh do not connect even with publickeys installed	bash script loses readonly value after first time thru loop
0	which book would you recommend to gain enough foundation to learn linux well enough to be a lead developer ?	under aix , how can i get the full path of a program bound to a port ?
1	writing scripts that use different commands in different shells	determine shell in script during runtime
0	delete all folders containing files which match pattern	changing suspend order on opensuse 12.2
0	is there a linux tool for defragging ntfs partitions ?	ssh proxy laptop
0	how to create a user with given password on suse from command line ?	how to make dns resolve faster
0	which linux distro resembles hp-ux ?	redhat enterprise linux 4.7 - ping problem
0	occasional rsync error code 12 " connection reset by peer ( 104 ) " from cron task that runs every 20 minutes	how to sum output of awk or other expression with xargs
0	how to control thinkpad_acpi via procfs , rhel 6.4	create multisession iso image to burn on a remote cd
1	critical memory	`free`: output format
0	what is the fastest ( cpu time ) way to get my current git branch ?	linux : how can i view all uuids for all available disks on my system ?
0	how to catch a signal in command line ?	how to create alias to kill processes running on a tcp/ip port ?
0	luks - changing passphrase with /dev/mapper/fedora-root	what is the difference between lilo and grub ?
0	is it possible to configure applications to use different network interfaces differently ? if yes , how ?	easiest way to mount google cloud storage in centos
0	is there a keyboard shortcut to make a window occupy half the screen ?	/home/user : change directory failed error
0	how to set cst timezone w/o daylight period ?	show older or newer history items with the history command in zsh
0	how do i find my raspberry pi on a big lan ?	how to handle a mass rpmbuild for a new distribution ?
1	how to find the full path of a file from my desktop in centos ?	how to unpack a downloaded tar . bz2 archive ?
1	what process created this window with no pid associated ?	what process created this x11 window ?
0	how can i print a2ps a file --portrait without being all squished ?	how do i enable sound in fedora 17 ?
0	sudo testing for credentials	does using ctrl+c instead of esc to exit insert mode break anything in vi ?
0	which distributions maintain a kernel package with grsecurity support	where is upstart jobs pid held
0	no valid sudoers sources	how are gnome shell extensions supposed to be managed ?
0	upgrade gnome 3.4 to 3.8 in debian 7	what does " cannot make/remove an entry for the specified session " mean ?
0	why do some letters or escape sequences not render correctly in urxvt ?	debian does not detect serial pci card after reboot
0	how to install node . js in centos 5.10 with python 2.4 ?	is it possible to trigger oom-killer on forced swapping ?
1	how to get lighter ( more white ) themes for xfce ?	what is a " theme " in xfce ?
0	kill an unresponsive ssh session without closing the terminal	skyping ( video ) on linux
1	is there something wrong with df output ?	ext4: how to account for the filesystem space ?
0	knowing if a directory is modified	why do you need sudo for " sudo su root " ?
0	count tabs per line in text file with utils	turning off default video output with xrandr when external monitor is connected
0	name resolution issues in ubuntu 10.04	creating a private network for internal vms
0	my ping command does not seem to ever finish . does that mean it is suceeeding ?	ubuntu 11.10 sftp chroot jail problem
0	can i fix bad blocks on my hard disk with a single command ?	using radeon on muxless system with multiple x servers
1	where to put generated certicate for user	failed to sign csr with the ca root key
0	why bash unable to find command even if $path is specified properly ?	why does memtotal in /proc/meminfo change ?
0	can a process running in a linux container communicate with another process running on the host os via ipc ?	lxc : have rootfs mounted without nosuid
0	why do i get this ' erase is backspace ' message after i do a reset in xterm ?	how would you create a user with the home_dir field in /etc/passwd completely blank ?
1	how does sudo really work ?	how do the internals of sudo work ?
1	capture error of ls to file	redirect grep error output to file
0	cancel and resume a duplicity backup	bash array does not store correctly
0	how to unprotect excel sheets in linux ( debian/squeeze )	how to start/stop transmission at given times ?
0	select lines using ranges in vim ?	creating a bash script that will execute a program and if it exits without crashing , will run it again
0	why does not yum list anything ?	problem in secure copying ( scp ) filenames with spaces
1	-bash : syntax error near unexpected token ` ; '	bash : syntax error near unexpected token `}'
1	what does "--" mean in linux/unix command line ?	what does "--" ( double-dash ) mean ? ( also known as " bare double dash" )
0	can i lock the root account during an install of debian gnu/linux 6 " squeeze " ?	compling kute traffic generator 1.4 on fedora core 5
0	xrandr call makes it forget about secondary display	what will ¬ do in bash ?
0	is it impossible to run as `root` if the machine is not rooted ?	is there a standard way to have a program start when a user logs in on linux ?
0	gpg-agent asks for a passphrase , but ssh private key doesn’t have one	please recommend a gui telnet client
0	using usb hub for keyboard and mouse in multiseat	check if interface eth0 is up ( configured )
0	"safe mode " on linux ?	cron to delete particular file ( s ) from a specific directory
0	what does the windows flag in the linux logo of kernel 3.11 mean ?	certificate errors trying to create a virtualenv on old ubuntu
0	linux distrib with apache and mysql pre installed	test effective permissions of file for user
1	alias for a command using ! ! to recall the last command	how can i `alias sudo ! ! ` ?
1	extract name of file without extension in shell script	how to rename multiple files by removing the extension ?
0	ide and pci bus commands	gawk with gawkextlib
1	use an usb tethered phone as network adapter	how do you access internet in rhel 5 using android smartphone usb lan ?
0	how to read ntfs drives in linux ( rhel 6 ) ?	how to clean up my desktop ?
0	what is up with this ' gnome ' package ?	tracing executable without read permissions
0	linux mint default physical screen before login	how to suspend and resume processes like bash does
0	why for loop does not raise " argument too long " error ?	addition with ' sed'
0	sshfs localforward without config file	apache cgi proxy returning 502 bad gateway on fedora
0	directory is not opening with cd command	network goes down when lan cable plugged in
0	application does not see environmental variables	cannot install fedora 18
0	logrotate does not rotate logs	listing script 's file dependencies
0	scp wildcard not working in zsh	building linux from scratch stuck , incompatible sed version ?
0	removing redirection operator does not change output . why ?	how do i reset a usb device using a script ?
0	disabling anti-aliasing in fonts . conf causes random color	ktorrent : moving data in a shell script
0	can i change root password by sudo , without su ?	halt , poweroff , shutdown , reboot do not require root ?
0	system call invokation methods in new kernel	why am i getting an attributeerror when i try to use pyjamas desktop on fedora 15 ?
0	how to permanently change both stdout and stderr color to grey ?	how to configure the ks . cfg file in order to fit it under pxe server
0	altgr key combinations through qtnx	read and confirm shell script before piping from curl to sh ( curl -s [ url ] | sh )
0	how to reduce chrome 's virtual memory usage ?	number comparisons in busybox ash
0	how to use " unusable " sectors outside defined partition boundaries	lvmetad hangs on startup
1	how to tell if ssh'd into machine ?	how can i detect if the shell is controlled from ssh ?
0	lvm + luks + ssd + gentoo -- making it all work together	installing guest additions on virtualbox 4.10 - host : opensuse 11.3 64 bit , guest : slackware 13.37 32 bit
0	how to ssh on multiple ipaddress and get the output and error on the local *nix machine ?	changing the defaut file manager in gnome 2 ( sl6 )
0	can two hosts have the same ip address in /etc/hosts ?	what linux utility can split a large file into a multi-file archive that can be opened on windows ?
1	how do i redirect output from tailf & grep to a file	piping from grep to awk not working
0	use an alias with watch command	why does my tcsh prompt change after cd ?
0	why the inconsistency with using cat vs . echo piped to this sed command ?	what is the difference between @ and * when referencing bash array values ?
0	how to start an application as gnome would by command line ?	edit cups web interface
0	adt bundle not installed in ubuntu 12.04	how can i create a direct 8khz audio pipe in ubuntu ?
0	'setfacl ' permissions do not apply to directories created by git clone ?	what is the udev rule to allow specific thumb drive vendors ?
1	udev rules to identify a usb storage media ?	triggering an action when a specific volume is connected
1	hard link for directories	why hard links not allowed to directories in unix/linux
0	resize non-lvm ext4 root partition	bash : pair up two series of files
0	how to get find -exec to call a shell script ?	omit the target dir from find results
0	how to install rpm package on angstrom	how to remove a specific character in a string but only if there are no numbers in that line in linux
0	laptop running ~30° hotter than normal ; cpu/load is reportedly normal . what could cause this and how can i diagnose it ?	sphinx search shutting down after `fatal : accept ( ) failed : too many open files`
0	zaurus and mapping keyboards	what is the utility of the : command in shell scripting , given that it explicitly does nothing ?
0	how to get the job id ?	creating a ram disk on linux
0	not allowed to read a file for some reason	bash_history : comment out dangerous commands : `#`
0	torrent with gui for gnome on centos 6 ?	fragmentation and ext4
1	how to set environment variables from a shell script ?	how can i make variables " exported " in a bash script stick around ?
0	iptables reset on reboot , how do i tell what is causing this	how can i have activity in a dropbox folder logged ?
0	ubuntu : sudo find / -type d -exec chmod -rf a-wr {} \ ; the user can not login	nice a process and set it to rt
1	file manager that shows bit rate for mp3 files ( part 2 )	file manager that shows bit rate for mp3 files
0	moving a root directory to a separate partition	compare two strings in a shell script
0	uninstall mysql server without removing or breaking any client functionality	gnome update-notifier does not show updates when user not in sudo group ( debian squeeze )
0	automatically copy pdf . plugin to chromium . app	user mode linux compile fails
0	check for failure of piped command	raid mount not happening automatically
0	what linux tool will tell me if all the mounted disks share roughly the same bandwidth ?	network copy file with low overhead
0	reloading the $path from the gui terminal	how can i automatically create a document that allows me to compare a list of 4 . png files side-by-side ?
0	how can i zoom/magnify cinnamon desktop using the mouse wheel ?	why does not the sudo command need the root password ?
0	how do i get absolute path from using find unix command	cannot modify files in my home directory
0	gtk::socket and gtk::plug unexpected behaviour under gnome and fvwm2	"grep breaks , causing the boot process to hang forever"
0	use encrypted /home in fresh debian created in mint	/long/path/to/{multiple , files} syntax ?
0	difference between sudo -i and sudo su	how do i give global access to a file in a private folder ?
0	`/srv/stevedore/` vs `/var/stevedore/` for data files for new application ?	difference between /dev and /sys/class ?
0	user access permissions	variable substitution with an exclamation mark in bash
1	are zombie processes something i should be concerned about ?	is there any impact of reaping zombie processes ?
0	java on freebsd	linux user interface programming ? ( esp . for python and fortran )
0	find a particular nesting of directory names , e.g. . . . /project/dir1/dir2	compiling freertos on ubuntu
1	multiple renaming files	how to clean up file extensions ?
0	how can i list the top io consuming files ?	ssh bash jail session
0	dhclient exits with status 0 but still no address	"short read block " error trying to boot rhel
0	piped search queries in vim or less	screen turns on automatically ( xset dpms force off )
0	masterpdfeditor use black theme for pdf pages	unable to build pygobject with jhbuild
0	how to stop cache instance from shell script	how do i find new drivers for my laptop in rhel ws 6.4 ?
0	virtual box for centos pae	ksh features incorporated into zsh ?
0	emacs paste into search ( c-s ) field ?	how can i embed a console app 's output into my x11 desktop ?
0	how can i write a sed script to delete numbers from a line ?	how do i fill my password automatically from . bash_profile when running command as sudo ?
0	delete a system user account if daemon is no longer needed ?	copying a file that is written at the same time
0	working with rar files	using syslog from a kernel module
0	efi boot to linux on a macbook pro	making a duplicate of a path in unix
0	can i unzip and merge sorted text files in a single operation ?	how to remove a newline character in a particular line through perl ?
0	connecting to wifi network through command line	monitor mode wifi only seeing broadcast packets
0	what is the progress regarding improving system performance/responsiveness during high disk i/o ?	reverse rysnc with multiple sources
0	what after exec ( ) in ls command . is the parent process printing the output to the console or the child ?	backup luks ( cryptsetup command ) partition or volume
0	launch application as root user in gnome	get list of linux files recursively and direct output to file
0	submitting jobs with sequential completion	authenticating with x11vnc : what is the difference between -auth and -rfbauth ?
0	format usb drive	how to ssh to a server using another server with key from the second server ?
1	how do you install grub2 on a usb stick ?	installing grub 2 on a usb flash drive
1	total ram used by a program with `ps` ?	measuring ram usage of a program
0	crontab and dst disagreement with different timezone	recover partially formatted hard drive
1	grab text from detached screen	gnu screen : print a detached session to stdout
0	how do i create web pages in my home directory and have the web server serve them in my web browser ?	xmonad is not changing layouts
0	cat corrupts serial port data	what is the difference between if and [ [ in bash ?
0	disable login for useradd	shell function definition: why is there a space after the opening brace ?
0	in new users 's home directory create sub-directory with a specific group and permissions	add monitor to linux tty framebuffer
1	i have to calculate values from two files and store the result in output file	i have to calculate values from two files and store the result in another file -- using shell
0	does freebsd support network virtualization like crossbow ?	using grep to find first two numbers of ip addresses ?
0	elan touchscreen on ubuntu 14.04 and debian 7.6	is there an easy way to check which program wrote to /var/log/messages ?
0	'ip addr ' command shows ' up ' even there is no address associated with that interface	where is the environment string actual stored ?
1	using bash "&" operator with " ; " delineator ?	how can one run multiple programs in the background with single command ?
1	lockfile-progs utilities usage	check for process if same is running
0	recursive rename files and directories	"ps " command does not return to prompt
0	sourcing scripts with a for loop for different variables	filezilla : gnutls error when using ftpes
0	remotely work on red hat box	gparted live cd can not resize a partition ?
1	why is it a bad idea to run as root ?	concern about logging in as root overrated ?
1	how can i add sudo permission for copying ?	how to run a specific program as root without a password prompt ?
1	what does a high load with an empty top mean ?	why would there be a load of 5 if there are zero processes in the runq ?
1	backing up to dvd	splitting large directory tree into specified-size chunks ?
0	how to start line with command from output of another command	openbsd w/ kde 3.5 - no text in menus or any gui 's
1	how to empty a log file ?	empty the contents of a file
0	why is this apt-cache dumpavail with overrides not working ?	free reporting huge amount of used memory
1	why all the text is invisible in intellij ?	java does not show menu text
0	relation between unity on ubuntu and unity game engine ?	i am failing to build docbook-utils
0	installing openssl shared libraries on centos 6.5	rvm posix error on arm beagle bone black
1	how does < < work and what is it called ?	correct textual name for < <
1	why is install-recommends default true ?	apt installing more packages than specified as dependencies
0	starts logging when the limits are hit	install java , tomcat7 or tomcat6 on rhel5 centos5
1	how to install linux ( backbox ) and windows on the same computer ?	what should i do before dual-booting windows 7 and debian on efi ?
0	remap keypad keys to modifiers	run a command before services are started
0	can not analyze output from squid and varnish	what does hierarchy support do in cgroup ?
1	configuring , compiling and installing a custom linux kernel	how to build a custom kernel ?
0	push local git repo to server via ssh	exclude directory in find
0	multiple renaming files	diff the output of the last two commands
0	can " grub-emu " make any changes to my system ?	what is the required ports to be opened on the firewall ?
1	tar backup to remote server	can i pipe stdout on one server to stdin on another server ?
0	grep : show all the file up to the match	ssh-add complains : could not open a connection to your authentication agent
0	how do i use curl to download content from sourceforge ?	ignore blank keys in coreutils sort
0	xinerama configuration on opensuse	why did removing iptables " break " my network access ?
0	is there bdiff ( 1 ) in linux ?	unatended script execution in ubuntu terminal
0	tightvnc configuration - software version check	xfce4 open panelmenu via shortcut
0	mysql 5.1.73 in oracle linux : which is the correct mysql configuration file ?	zpool status hangs forever
0	can i get vim-stlye ( hjkl ) navigation for gnu info ?	bash function to find a directory recursively
0	why the order of wildcard results might be different when used from the terminal or from perl ?	reject ssh connections made from proxies
0	create new temporary directory	can not boot system with systemd version above 208
0	tab spacing in vim	bash string concatenation used to build parameter list
1	where can i find more information about /dev/pts/* , /dev/ptmx , tty and pseudo terminals	what are the responsibilities of each pseudo-terminal ( pty ) component ( software , master side , slave side ) ?
