0	disable random memory address generation in my programs	what is linux for vms dcl " on error " ?
0	how to create a virtual file that is coupled to a program , e.g. to a ` . gz` file via `gzip` ?	how to install aurora ( firefox ) on debian ?
1	what is the difference between a terminal and a console in unix ?	what is the exact difference between a ' terminal ' , a ' shell ' , a ' tty ' and a ' console ' ?
0	installing fedora from usb key	compiling a kernel module with some options
1	can you specify an enclosure for cut ?	is there a robust command line tool for processing csv files ?
0	fast way to randomize hd ?	prompt user for sentence and store it without being disturbed by spaces
0	why does fstab use uuid instead of the actual file system name ?	what are the definitions of addrtype in iptables ?
0	precautions to be taken while make oldconfig	how to recover a ' lost ' screen session ?
0	give read-only access to specific folders ?	will suspension or hibernation of os suspend running programs ?
0	arch linux terminal not starting	where to find this specific source ( centos 2.6.18-53 . el5pae )
0	how to mount aufs file system on boot in archlinux ?	what is the difference between ' . ' and ' source ' in shells ?
0	setting the topcolors environment variable	external drive not being recognized
0	running fetchmail with socks proxy	what alternative backends does sudo support and how is it configured ?
0	what does it mean by cold cache and warm cache concept ?	where do uncaught local emails go ?
0	how to modify the output of tcpdump to be human-readable ?	touchpad scrolling lost when switching between physical and virtual tty
1	how to set the tmout in putty	how to make putty to not break my session after some time ?
0	how do i access a login through ssh when there is no password set ?	boot process hangs , can start with " single " + startx
0	how to send ntp request ?	port forward to vpn client ?
1	batch renaming of files	batch renaming files
0	how do i disable the touchpad while i am typing ?	improving tcp performance over a gigabit network
1	why does `cat`ing a file into itself erase it ?	io redirection and the head command
1	linux for a writer , running on a pentium ii	linux for low-end hardware and internet browsing
0	tsocks does not redirect connection	how to associate using aireplay-ng [ reaver ] ?
0	netatalk virtual users using ftppasswd ( not found ) on debian wheezy	user space to kernel space transition
0	install key 3g huawei e1752 in debian	running chsh does not change shell
0	networkmanager issues in arch linux	using root to mkdir in another users home directory
0	file permissions when mixing command line and server	ssh login hook ?
0	g722 in gstreamer is not available or its need to be activated ? how do i do that ?	how can i get this proprietary low-vision camera working in linux ?
0	how do i use cut to separate by multiple whitespace ?	change terminal prompt ubuntu
0	how would one detect if external command exists in a script ?	what does a kernel source tree contain ? is this related to linux kernel headers ?
0	control + l not clearing screen	flac correctness using md5 placed in streaminfo
0	how do you configure package management system ( yum ) for mongodb	how can i run growisofs via sudo ?
0	online course that covers unix/linux systems programming	cups compilation fails on cygwin
0	java version for tomcat	can an arbitrary process read data coming to/from a network port ? how ?
0	local , regular file causes `stat` or `ls -l` to hang	setting svn permissions with davsvnauthz
0	windows remote desktop login failed with ubuntu server 12.4	chinese characters instead of latin being written to file
1	handling an option-like filename in the shell	how do i delete a file whose name begins with "-" ( hyphen a.k.a. dash or minus ) ?
1	archives used for software packaging and distribution	what are the different software packaging formats and which distributions support them as part of base install ?
0	fstab not mounting a disk on boot	debian : how to delay configuration when installing/upgrading ?
0	why do not i get a gnome gui when i install red hat ?	alternatives to hud
0	uefi and puppy linux	how to configure kate to always use 2 spaces for tabulation ?
0	ui toolkit + programming language to develop linux applications	is it possible to have a bashrc for a usergroup ?
1	limit cpu/ram usage per user ?	how to limit resource usage to save cpu+ram for a certain process ?
1	the amount of time since the system was last booted	how long system has been awake / running / since restart
0	what is an easy way to see whether a mount point has been made shared ?	what are the numbers after program names in linux/gnu documentation ?
0	total commander " compare content " like alternative ?	run a sudo ( or startup ) python script from cron on a raspberry pi ?
1	is it possible to modify the colors in bash ?	can i configure my shell to print stderr and stdout in different colors ?
0	linux command line that will fail if any standard out is produced	selecting a managed switch with linux , for use in mesh network project ( batman-adv )
1	setting environment variable as a function of another env variable	how to defer variable expansion
1	how to detect command interpreter from within a shell script	how to test what shell i am using in a terminal ?
0	configure autocomplete for the first argument , leave the others alone	is there a bash file that will be always sourced in interactive mode no matter if it is login or non-login ?
0	editing images with sips does not work without being executed directly from terminal ?	sudo not preserving ps1
0	how to make edid	i want to understand buildroot - the 3 compression config options ( kernel , initramfs & rootfs )
0	grep to extract substrings in a string	using find , exec , sed to manipulate strings as args to another program
0	understanding -regex with gnu find	how to browse file from sudoer account from guest account ?
0	recovering files using extundelete	what are the key differences between $env_var and `env_var` ?
0	"tar : unrecognized option --warning " during ' apt-get install'	altering the default boot option on centos
0	ubuntu make fails with no such file or directory /lib/modules/3.4.0/build	how exactly is a linux desktop/device/display expressed in a terminal ?
0	what are good document organization utilities ?	centos connected to internet but not updates
0	equivalent of memmove on files : copy a range of bytes to an earlier position	fluxbox borderwith on focused maximized windows
0	how to install node . js in centos 5.10 with python 2.4 ?	why do mono applications only start from their own directory ?
0	how to rename files and directory with * . ~1~ suffix to original name ?	how to reset the password on a kurobox pro nas appliance
0	scheduled task on reboot	lightdm shows a black screen in my arch guest vm
0	how can i access files of an smb share if i have the ip ?	ssh -x foo@host then su bar then run x app with local display , while bar also logged in ?
0	fedora make command broken , kernel mismatch	do i have to swap ip sets , or can i add/remove on the fly ?
0	what happens the most , context switches or mode switches ?	running commands on remote linux server using ssh
0	centos vfs cannot open root device	using awk , how to get desired output from multiple file sources
0	nfs keeps randomly crashing , breaks mount on other clients	how to split such a string into array in bash
0	"kill the biggest process " button	can not yum wine from repo - no package wine available
0	swapoff fails when overcommit_memory==2	how to optimize arch linux boot time ?
0	check outgoing network traffic	make gaim ( pidgin ) wait longer before starting new logfile for idle chat ?
1	bash : how to get different color for the command line and its output ?	how do i stop a bash shell ps1 color to stop at the end of the command ?
0	fix broken apt : insserv : service killprocs has to be enabled to start service single	why does my mapping of to :by not work in gvim ?
1	how do i run a command if my server wakes up from hibernate ?	how can i run an hdparm command after boot and resume on fedora 19 ?
1	how long use of linux ?	finding computer uptime from first day until now
0	advanced usage/command of shell	convert a folder of images into a multi-page pdf file usind command line tools ?
0	what is a superblock , inode , dentry and a file ?	how can i retrieve screen unlock times in gnome on later red hat variants ?
0	debian sid /etc/debian_version	beaglebone black device tree for lcd4 cape
0	chromakey -video-editing in unix ?	why is apache2 showing up a defunct in the process list ?
0	openvz bridged networked adapters will not work from sample configs	is it possible to `tail -f /dev/vcs` ?
0	copying specific text from one file into a schema	how can one run multiple programs in the background with single command ?
1	is it possible to display a graphical application on another host/user	can i launch a graphical program on another user 's desktop as root ?
0	what are the user interface subsystems , their components and responsibilities ?	why is exim4 listening on port 25 ?
0	backuppc can not finish backup	alert when a process exits
0	how to open the clonezilla initrd . img ?	why does the skype incoming call window disappear in awesome wm ?
0	nvidia update problem on debian 7 stable	cobbler+kickstart $basearch problems
0	establishing i/o patterns for an application	installing a new openbsd kernel " safely": why does `make install` go through these extra hoops ?
0	is it possible to set per-user permissions in linux ?	interesting numbers when apache benchmarking
0	mysql failing randomly	utf-8 locale missing on nexenta
0	how to estimate server 's network connection quality with traceroute ?	ip of localhost
0	error : /etc/sudoers not working - ownership wrong	bash : accessing function call stack in trap function
0	piping output to text file within a for loop	while setting up sftp between *nix servers , is the intial handshake optional ?
1	xorg . conf to only use part of screen	set xorg to use only part of the screen
0	where to put `setxkbmap` command in xfce ?	simple shell script to log disk space
1	batch rename a few files	batch renaming files
1	is setting up fstab like this dangerous ?	what does the noload option do in fstab ?
0	switching from user to root and revers ( freebsd )	what is the syntax for passing the output of a command to xargs ?
1	is there a backup tool that recognized renamed/moved files/directories ?	any way to sync directory structure when the files are already on both sides ?
0	installing linux/netbsd on an old sky digibox ?	ifconfig : more different device items than physical nics/sockets
0	not see file networkmanager . conf in folder /etc/networkmanager/	smtp/pop server only for internal e-mails on hosted domain
0	how can i detect if the shell is controlled from ssh ?	can ssh-agent work from a remote bash script ?
0	/dev/tcp not present in linux	can it harm if i shutdown without closing applications ?
0	what is the difference between path and ld_library_path ?	how to install multiple glibc on fedora
1	reading linux distribution name from filesystem or command	how can i get distribution name and version number in a simple shell script ?
1	in bash how can i change the color of my command prompt ?	how to customize . bashrc to configure command prompt ?
0	how to change the default program for a specific file extension system-wise in kde or xfce ?	how can the output of ldd be checked to see of they exist on a different system or not ?
1	find where a bash command is defined or sourced from ?	how to use `which` on an aliased command ?
0	lightweight custom linux build	problem with mount namespaces under fedora
0	how to get rid of special characters in the output of make on centos	how does suse linux 's support for btrfs differ from ubuntu and fedora 's ?
0	how to prevent cron emailing on termination	how to force a file location in equivs-build
0	cannot recognize iso in fedora core 1 ( yarrow ) in vmware view player	how to suspend from gnome3 using systemd
0	how can i manage my crontab effectively to avoid issue by multiple updates by multiple users ?	delay debian wifi networking auto-connect until after x and other applications are started
0	multiple concurrent ssh sessions from different clients but with the same user/password	/etc/init . d/ script starts during loads and crash the system
1	what means the " integer argument " in system call descriptions ?	what do the numbers in a man page mean ?
0	need a programmers advice on *x display manager , window manager and composit manager combination	how to start teamspeak 3 on boot , ubuntu server 12.04
0	kali linux dual boot with win 8 64 bit is not working	how to interpret an octal or hex dump of a binary file ?
1	how do i access a flash drive that has been ejected without physically plugging it out and back in ?	how to reconnect a logically disconnected usb device ?
1	memory usage in linux	limit memory usage for a single linux process
0	kde apps look ugly over ssh	how to run gvim in a single instance
0	how to change font colors in terminal ?	which ubuntu gui should i install ?
0	how to add new elements to path for daemons ( or other best practices ) ?	low resolution options disappeared after selecting a higher one
0	how achieve variable indirection ( refer to a variable whose name is stored in another variable ) in tcsh	what happens if i do an improper shutdown of lubuntu 13.10 ?
0	monitor history of usb flash drives	bind 's path to ' named . pid ' looks a bit weird after a not-so-smooth package installation
0	why do we need an expiration period ?	execute command in remote active terminal
1	coloring shell command and output differrently	customizing bash shell : bold/color the command
0	gnome : show full path in nautilus	find not working right
0	unable to access page with https	how to delete virtualbox networking rule ?
0	fixing permissions on a buffalo nas ( xfs via smb )	how to deal with freebsd 's move to pkgconf ?
0	convenient way to upload a file to a server 's application directory ?	packets do not cross ip tables postrouting when originating from an external ip
1	human readable memory sizes in top ?	how to display meminfo in megabytes in top ?
0	do i need to encapsulate awk variables in quotes in order to sanitize them ?	best way to search my shell 's history
0	ssh key for http	rm -rf failing if deleting in parallel
0	mailing output of cron	anded conditional using regexp and variables
0	launch background processes in one group and later kill them all	evolution keeps disappearing ?
0	how to take down a static network interface when not connected ?	dual-booting windows 7 and mint 14 with " something else " option
0	why does installing to /usr/bin automatically install to /usr/bin/x11 ?	what command line to use to set up double commander 's " run in terminal " feature to use xfce terminal ?
1	is there an alternative to the `which` command ?	determining the path of an executable
0	what is the ' working directory ' when cron executes a job	postfix relay multiple domains with multiple origins
0	a single key on keyboard produces extra keypresses for each simultaneously pressed key	is there a difference between setting an environment variable to the empty string and unsetting it ?
1	how to notice log file changes with linux standard tools ?	can a bash script be hooked to a file ?
0	could i disable ext4 's journaling safely in bbwc ?	os x : how to keep the computer from sleeping during a ssh session
0	how do i setup two or more ipv6 address on one nic in freebsd ?	what is the difference between stdin and arguments passed to command ?
1	accidently created a file called -x , how can i delete it ?	how do i delete a file whose name begins with "-" ( hyphen a.k.a. dash or minus ) ?
1	how to find duplicate files with identical content and identical or different names	howto find duplicate files on disk
0	shortcut to minimize all windows ?	how can i find the number of files on a filesystem ?
0	are there any gui 's for linux that does not use x11 ?	packet analyzer to intercept and filter incoming traffic before any client app
0	achieving full resolution with powervr sgx454 on ubuntu 12.04	downloading file through ssh with a " proxy " machine inbetween
1	zip a directory that name start with `-`	what does "--" ( double-dash ) mean ? ( also known as " bare double dash" )
0	is there a way to combine a file with crontab ?	automatically put an alias into ~/ . bashrc or ~/ . zshrc
0	setting up nginx on fedora 19	deleting all files in a folder except files x , y , and z
0	how do i set the password of a new user after the account has already been created ?	bash script which can direct stdin stream to program
1	how do i use this . ttf file as my terminal font ?	use or convert . ttf font for console use in freebsd
0	how to limit number off ssh login attempts per time interval	set the mac address for vlan device
0	change directory and list files	qtiplot installation on slackware
0	ralink rt5370 wireless usb dongle not working	easy incremental backups to an external hard drive
0	why does bash readline sometimes try to parse the second word of a command out of context ?	what information about a process is retrievable after it is terminated ?
0	how does one get rid of screen flickering	inconsistent field separator behaviour of space in awk
0	installing rhel6.5 by swapping rpms	is there a way to kick kswapd and make it swap out pages ?
0	cannot create symbolic link on centos 5.6 - file exists error	how to make cd-quality wav files using avconv ?
0	print command not found	how to set the resolution in text consoles ( troubleshoot when any `vga= . . . ` fails )
0	is it safe to write to linux partition from windows ?	how to delete a specific line and the following blank line using gnu sed ?
0	multigateway routing for specific src port	how would you migrate from a windows ad to a linux ldap server ?
0	what editor can be used to provide highlighting for mallard project files ?	hight iowait while the wmb/s is low
0	debian wireless networking configuration	why does [ a-z ] asterisk match numbers ?
0	best way to work through / display a tree of images sorted by size	cut a string- catch : there is file with same name as string in the same path
0	launching a sudo gui from desktop	does quiesce exist for linux ?
0	does linux have ways to cache io with memory	which media to use for backing up data of my laptop ?
1	how can i use iptables to block certain processes from accessing the network ?	block network access of a process ?
0	apache 70007 and 70014 errors	increasing kernel memory size
0	trying to set date on a linux based machine from another machine	have network always wait for a network connection ?
0	changing the partition of a linux	mail dispatcher agent : could not access the outbox folder ( unknow error . ( failed to fetch the resource collection . ) )
0	trying to load file to device via serial to usb adapter	remove blank lines in awk display
0	adding key bindings for " fn " + " control " key in openbox	how to give all privilege rights to user ubuntu 12.04
0	my . xsession and . xinitrc files are not executing	can iptables be used to monitor tcp timeouts/resets system-wide ?
1	how exactly do i create a sed script and use it to edit a file ?	the way to use `/usr/bin/env sed -f ` in shebang ?
0	grep file from file	editing /etc/init . d/rc . local to run after login tty processes
0	what permissions should i set for an executable i am likely to share ?	linux hardware : apple magic track pad alternatives
0	'altinstall ' python-devel ; can not install psycopg2 on centos	how to maximize the use of computer performance core i7
0	create a file as a different user and group	linux centos 5.5 not connecting to network
0	pulseaudio over network - change output on-the-fly	execute remote programs and completely detaching it
0	find files given an exact filename with mdfind	change google chrome flash plugin
0	munin not showing text	shell script to merge properties file ( sed/awk/comm/diff ) for rpm upgrade
1	how can i create a empty file whose name begins with a dash ?	how do i delete a file whose name begins with "-" ( hyphen a.k.a. dash or minus ) ?
0	how does gcc handle file permissions ?	generate man page in realtime ?
1	hidden password is being displayed when invoking the su command ?	how do you keep the password hidden when invoked during the su command ?
0	invoking shell script with -option and parameters	seeing ssh debug messages in terminal/console
0	convert a tab-delimited file to use newlines	get current output
0	read and parse xml input via tcp	delete key does not remove selected files
0	iptables allow ntp time server	disable screen outputting " [ screen is terminating ] "
0	can awk use field identifiers also for shell strings ( variables ) ?	every package " has no installation candidate"
1	could you share a link to a good catalogue of linux distros to choose ?	how do you choose a distribution ?
0	ssh : " connection closed by remote host " randomly while working on an interactive session	any reason not to use luks on a backup drive ?
0	how to setup svn over vpn ?	split stdin by lines
0	kinit returns error salt type 3 unsupported on freebsd 9.1-release install	mencoder install issue
0	should i install npm in kubuntu ?	linuxmint15: suspend to ram not working
0	how to add my own created certificate authority to system trusted repositories	reading from a file and changing its pattern into an array ?
1	how to copy files from one machine to another using ssh	ssh easily copy file to local system
0	can not increase partition size with gparted ?	standard terminal font aspect ratio
0	grub : " missing operating system"	no sound on debian vm
0	chroot " jail " - what is it and how do i use it ?	manually run a cron job / simulate running cron job ?
0	making a tty9 on a openvz ve	load module from the boot menu
0	is there a way to access google drive spreadsheet ?	linux mint 15 no audio with nvidia mcp51
0	adding a program on start-up by using lsbinitscripts	get ssh server key fingerprint
0	dhclient cannot get address from home router	how to prevent the linux kernel from waking a secondary hdd from sleep
0	is it not possible to store my local websites in my dropbox folder ?	# ! /bin/bash - no such file or directory
0	raspberry pi wireless usb stick	how to tweak linux to run reliably on flash memory ?
1	routing application through different network interfaces	dual network connection
0	restart does not shutdown first on debian squeeze	single dashes `-` for single-character options , but double dashes `--` for words ?
0	backing up chroots for host reinstall	can not ssh via password to a remote server
0	how to inline expand wildcard in bash ?	recursively copy apache openmeetings within red5 folder on linux
0	virtualbox : find windows host dns name on debian guest	solaris " clean " group files ( or for that matter any text file )
0	suddenly changing users	why/how does " uptime " show cpu load > 1 ?
0	are rpms valid across platforms ?	location of the " disk identifier"
0	what is the need for `fakeroot` command in linux	can shared-mime-info associate a mime type to a desktop applications ?
1	how to cd into a directory with the name "-" ?	how do you enter a directory that is name is only a minus ?
0	how to remove multiple newlines at eof ?	how to fix " cannot retrieve repository metadata " when installing centos 6.5 from kickstart over ftp ?
0	can one make a bootable device with several distros of linux ?	on why touch , mv , etc . , will not create subdirectories " as needed"
0	midnight commander : settings for mcview not honored	solaris11: alternative to xvm hypervisor ?
1	how to copy a long textfile to clipboard on gnome-terminal ?	how do i send stdin to the clipboard ?
0	can not launch snort on centos 6.3	vim -n mode : where to use it ?
0	how to link file urls ?	gentoo : how to update from one portage only ?
0	how to associate a script at boot time to a specific run level ?	nfsroot freezing every once in a while presumably due to network glitch
0	any good lvm tutorial ?	alternate option field
1	write a file in /var/lib/sysnews/	how do you process an entire command as sudo that involves redirecting or piping ?
0	what is the difference between the drivers r8169 and r8168 ?	how to get system configuration information without dmidecode
0	how to watch pgrep ?	how to fix " login : no shell : no such file or directory " when i can not even login ?
0	why did bash print " bash : cd : write error : success " ?	linux : create list of text with multiple operators
1	renaming files in sequential order	renaming multiple files increment order
1	why does fstrim trim all of the free space on my mdraid mirror after a reboot ?	fstrim trims more than half of partition size even though partition mounted with discard
0	maximising windows in dual-monitor setup	"nopage " method for isa vs pci
0	does wine support . wma playback through mci ?	[ mntent ] : line 15 in /etc/fstab is bad
0	start notification-daemon as a service	can you change mail accounts by recipient in mutt ?
0	how can i list all the dependencies necessary to install php-soap ?	in bash shell , how to insert the previous line inside the current line ?
0	one host , two virtual machines that cannot ping each other . how to solve	copy/move whole folder but with certain extentions
1	how to limit the disk space for any user ?	managing disk space on servers
0	how to make a program which run from shell still live after close terminal ?	why is linux commonly used as operating system for supercomputers ?
0	what is the difference between a linux package and a linux module ?	can i avoid enter key in cp -i ?
0	how to traverse a file and extract words using their index ?	current spotify track in dwm status bar
1	disk space shows up as used but not on `du`	why is there a discrepancy in disk usage reported by df and du ?
